product_name,price_int,price_dec,seller
Women's Champion Original Canvas Sneaker,23,70,
Women's CloudSteppers Sillian Paz Slip-On Loafer,31,79,
Men's Santa Cruz Loafer,30,99,
Womens Classics Black/Black Canvas 10002472,30,00,TOMS
Women's Traveltime Mule,23,99,
Women's Classics,21,99,TOMS
"001001B07-BLK, Women, Classics Black Canvas 8.5",42,10,TOMS
Women's Classics Glitter Espadrille Pumps,32,49,TOMS
Unisex Classic (Checkerboard ) Slip-On Skate Shoe,24,15,
Classic Women's Shoes,19,99,TOMS
Performance Women's Go Walk Slip-On Walking Shoe,29,95,
Sport Women's D'Lites Slip-On Mule Sneaker,27,99,
D Lites Womens Gray Textile Athletic Slip On Training Shoes 6.5,34,88,
Women's Ashland Bubble Slip-On,22,19,
"Women's Classic Canvas Slip-On,Ash,7 M US",29,99,TOMS
Men's Classic Canvas Slip-On,19,99,TOMS
Seasonal Classics Women's Slip on Shoes,22,09,TOMS
Men's Alpargata Canvas Black Ankle-High Flat Shoe - 8M,44,98,TOMS
Shoes Women's Tracer Slip On White Sole Shoes,11,02,
Women's Microburst One up Fashion Sneaker,29,95,
"Women's Sillian Bella Mary Jane Flat,",24,90,
"Women's Sillian Paz,",50,99,
Women's Windham Slip-On Flat,19,99,
Women's Cruiser Slip-on Shoe,42,15,
Top-Sider Women's Angelfish 2-Eye Oat Slip-On Loafer,59,95,Sperry
Women's Donna Hemp Flat,32,97,
Women's Cheyn Madi Loafer,29,99,
Women's Keli Professional Shoe,34,99,
Women's Emslie Warren,43,28,
Women's Bluefish Boat Shoe,49,99,
"Women's Bluefish Boat Shoe,Black,6 M US",79,99,
Women's Natural Comfort Walking Flat Loafer,15,99,VenusCelia
Women's Ashland Spin Q Slip-on Loafer,42,18,
Women's Pair O Dice Flat,11,08,
BOBS from Women's Highlights Flexpadrille Wedge,19,95,
Nohea Mesh Shoe - Men's,59,50,
Women's Leather Loafers Flats Casual Round Toe Moccasins Wild Breathable Driving Shoes,7,99,Fashion brand best show
"Women's Classic Canvas Slip-on (6 B(M) US, Ash)",33,50,TOMS
Women's Leather Casual Loafer Shoes,10,39,Kunsto
"Sk8-Hi Unisex Casual High-Top Skate Shoes, Comfortable and Durable in Signature Waffle Rubber Sole",24,96,
Women's May Marigold Slip-on Loafer,24,14,
Women's Ashland Lane Q Slip-on Loafer,30,48,
Women's Tulip 139 Flat,71,95,
Women's Donna Daily Slip-on Loafer,29,97,
Women's Ansley Moccasin,80,00,
Women's Splendid Midi Perf Slip-On,103,21,Vionic
BOBS Women's Plush-Wag Party Flat,25,49,
"Kids' 10009918 Alpargata - K,",13,99,TOMS
Women's Donna Daily Slip-on Loafer,29,97,
Women's Ansley Moccasin,80,00,
Women's Splendid Midi Perf Slip-On,103,21,Vionic
BOBS Women's Plush-Wag Party Flat,25,49,
"Kids' 10009918 Alpargata - K,",13,99,TOMS
Women's Midi,43,99,Vionic
Women's Classic II Penny Loafer,41,59,
Women's Deconstructed Alpargata Blue Cinderella Slip-On Shoe,28,95,TOMS
for Work Women's Gozard Slip Resistant Walking Shoe,42,48,
Men's Gamefish 3-Eye Boat Shoe,44,99,
Gamefish 3-Eye Knit Boat Shoe,75,00,
Gamefish 3-Eye Knit Boat Shoe,60,99,
Women's Classic Flats Memory Foam Cushioned Soft Daily Slip-on Casual Sneaker Flat Shoes,13,99,
Women's Authentic Original Two-Eye Boat Shoe,19,99,
Women's YOU Inspire Slip-on Shoe,34,99,
"Women's Kinzie Light Loafer Flat,",29,98,
Women's Comfortable Soft Round Toe Flat Slip-on Fashion Loafer Shoes,16,99,
Women's Casual Hollow Out Loafer Flat Shoes,19,99,UJoowalk
Women's Bikers-Pedestrian Moccasin 48930,15,94,
Unisex Classic Slip-On Black/Black VN000EYEBKA,42,50,
Womens Ennore,34,99,
Women's Saban Slip-On Loafer,24,50,
Women's Jungle Moc Slip On,61,39,
Women's debra Slip-On,49,00,
Women's Cloudfoam Lite Racer Slip-on,34,99,
Women's Leather Casual Cut Out Loafers Flat Slip-on Shoes,17,99,KEESKY
Womens Pehuea Slip on,47,98,
Women's Kilty Suede Moccasin,29,99,
Women's Kaci Full-Grain Slip On Shoe,62,99,
"Women's Cheyn Marie Slip-On Loafer,",28,74,
Women’s Casual Leather Loafers Driving Moccasins Flats Shoes,16,99,LabatoStyle
Women's Slip-on Loafers Flat Casual Driving Shoes,16,99,Jabasic
Women's Reggae Fest Willows Flat,31,99,
Women's Bocca Loafer,34,38,
Womens Walu II Canvas Loafer,19,94,
Women's Everlay Iris Flat,54,60,
Propet Women's Tour Walker Strap Sneaker,20,35,
Women's Tali Bow Ballet Flat,63,00,
Sperry Mens Lanyard 2-Eye,49,95,
Performance Women's On-The-Go Flagship Slip-On Boat Shoe,18,88,
Women's Renova Slip-On,91,84,Timberland PRO
Women's Casual Slip On Loafer Pointed Toe Cut Out Slip On Office Casual Dressy Ankle Boot,16,99,Blivener
Women's Parties-Mate Oxford Shoes,29,33,
Women's Rewind Slip-on,34,99,
Men's Marice Canvas Loafer,44,96,
Women's Carrin Platform Espadrille Slip-On Sneaker,21,64,
"Women's Everlay Heidi Slip-On Loafer,",31,12,
Women's Keesha Luca Slip-On Loafer,39,98,
Women's Channing Ann Slip-On Loafer,20,99,
Women's Poppy Corduroy Sandal,49,48,TOMS
Performance Women's Go Step Lite-Determined Loafer Flat,23,98,
Unisex Classic Slip-On (Perf Leather) Skate Shoe,44,99,
Classic Red Canvas 001001B07 Womens,30,00,TOMS
Women's Jocolin Vista Boat Shoe,39,97,
"Women's Jocolin Vista Boat Shoe,",64,95,
Women's Songfish Chambray Boat Shoe,44,98,
"Women's Songfish Indigo Stripe Boat Shoe, Navy, 5 M US",89,95,
Women's Milana Loafer Flat,27,09,
Women's Go Walk Lite-Daisy Loafer,20,01,
Women's Linden Slip-on,119,95,Vionic
Women's Meredith Clog,19,99,SoftWalk
Women Platform Slip On Loafers Comfort Suede Moccasins Wide Low Top Wedge Shoes,29,99,HKR
Unisex Era 59 Skate Shoes,28,00,
Propet Women's TravelActiv Slip-On Fashion Sneaker,17,33,
Women's Libby Slip On,29,95,Nurse Mates
Women's Dream Slip-On,24,99,Airwalk
Women's Seaport Penny Loafer,69,99,
Women's Gracelin Mara Flat,41,99,
Women's Whitney Penny Loafer,46,74,
Womens Soft Leather Slip On Loafers Casual Flat Moccasins,9,99,NineCiFun
Women's Carolynn Loafer Flat,48,37,
Women's Champion Original Leather Slip-On Sneaker,22,99,
Women's Leather Loafers Moccasins Wild Driving Casual Flats Oxfords Breathable Shoes,7,99,Amaxuan
Women's Melanie Slip-on Fashion Sneaker,75,24,
Women's Cahill Loafer Flat,49,95,
Womens Canvas Slip on Fashion Sneaker Skate Shoe,21,99,UJoowalk
Women's Encore Nova Slip On Shoe,69,94,
BOBS from Women's Luxe Fashion Slip-On Flat,23,98,
RL Perla 82 Canvas Lace up Flat Slip On Boat Comfy Round Toe Sneaker Tennis Shoe,8,99,R&L
Womens Soft Leather Comfort Driving Loafers Shoes,20,99,Lucksender
Women's Loraine Loafer,114,90,
Women's Clarissa Slip-on Shoe,18,90,
Womens Leather Cowhide Casual Lace up Flat Driving Loafers,15,99,Serene
Women's Mules Slip-on Shoes Leather Clogs Flats Wallking Slipper,16,59,Labato
Women's Gracelin Gemma Flat,36,70,
Women's CloudSteppers Sillian Jetay Flat,17,69,
Women's Liliana Loafer Flat,67,99,
Women's Emiline Slip-on Loafer,20,17,
"Women's Emiline Loafer,Black Nubuck/Snake Print,US 6 N",84,85,
Womens Casual Slip-On Loafer Pointed Toe Cut Out Slip on Office Casual Dressy Ankle Boot,28,95,FISACE
Women's Soft Comfort Leather Loafers Slip On Driving Walking Flats Shoes,8,99,vaganana
Women's Keli Professional,44,00,
Top-Sider Men's Gold Authentic Original Boat Shoe,49,09,Sperry
"Womens Superbendy Ballerinas Loafer Flat,",48,90,
Women's Diverse Flat,14,99,
Unstructured Women's Un.Loop Slip-On Shoe,36,90,
"Women's A/O 2-Eye Boat Shoe,",29,99,
Women's Classic Flats Memory Foam Cushioned Elastic Gore Soft Canvas Daily Slip-On Casual Sneaker Flat Shoes,13,99,
Top-Sider Women's Angelfish Boat Shoe,76,64,Sperry
Women's Kayla Clog,29,98,
Women's Koifish Mesh Boat Shoe,39,95,
Women's Flurry Moc,29,99,Airwalk
Fantiny Women's Genuine Leather Loafers Casual Moccasin Driving Shoes Indoor Flat Slip-On Slippers,13,99,
Men's Classic Canvas Slip On,33,50,TOMS
Women's Feather Loafer Flat,31,48,
Women's Bikers Lane Penny Loafer,20,00,
Women's Fashion Casual Slip-on Loafers Classic Sneakers,12,99,Sofree
"Women's Illie Clog,",39,95,
Women's Core Canvas Classics,38,38,TOMS
Penny Loafers for Women: Vegan Leather Slip-On Comfortable Driving Moccasins Flats,22,99,JENN ARDOR
Women's Fiona Flat,29,96,
"Women's Fiona Flat (6 B(M) US, Natural 2)",69,95,
Women's Raisie Eletta Penny Loafer,45,21,
Fantiny Women’s Classics Canvas Shoes Memory Foam Insole Flats Loafers Slip on Casual Shoes,13,99,
Fantiny Women's Classics Canvas Shoes Memory Foam Insole Flats Loafers Slip on Casual Shoes,15,99,
Fantiny Women's Classics Canvas Shoes Memory Foam Insole Flats Loafers Slip on Casual Shoes,15,99,
Women's Microburst Topnotch Sneaker,34,27,
Women's flat Flexy,33,99,
Women's Stretch Plus Lace-Up Sneaker,13,62,
H95 Women's Uberknit Slip-On Ballerinas,53,86,
Women's Gwen Rain Shoe,22,60,
Womens Chelsea Cap Toe Slide Flats,39,99,
Women's Farrell Moccasin,29,84,
B.O.C - Womens - Peggy,44,97,B.O.C.
Peggy Black Tooled Clog 9.5 B(M) US,49,95,B.O.C.
"Women's Koifish Boat Shoe,",53,84,
TOMS Women's Deia Fashion Boot,20,00,TOMS Kids
Forever Women's Diana-81 Ballet Loafer-Flats Shoes,12,98,Forever Link
Women's Candra Blush Flat,38,69,
Womens Olive Open Toe Loafers,49,99,
Women Basic Glitter Mesh Flat Slip on Shoes,15,98,Walstar
Women's Cheyn Wale Loafer,33,39,
Women's Espadrilles Flats Original Slip On Loafer Shoes Classic Canvas Comfort Alpargatas,29,99,Tengyu
"Women's Seager - Stat - Scalloped Collar, Engineered Skech-Knit Slip-on - Classic Fit Loafer,",24,56,
Women's Dove,59,23,Nurse Mates
Women's Nolan Tailored Slip-on Pump,58,21,
Women's Fall New Flat Flower Pattern Shoes,24,99,Mordenmiss
Women's Warren Sneaker,42,99,
Women's Kandi Slip-on Loafer,27,43,
Sunset Women's Oxford,31,99,TOMS
Women's Donna Distressed Flat,39,95,
Women's Shoe Slip on Sneaker Canvas Flat,19,89,Ollio
Women's Go Walk Lite-Queenly Loafer,11,93,
Women's Majorca Peep Toe Mid Calf Boot,49,22,TOMS
"Sperry Women's, Rosefish Slip on Boat Shoe",50,00,
Women's Seasonal Classics Flat,18,00,TOMS
Women's Vienna Loafer,47,53,
Women’s Fashion Platform Sneakers Suede Slip On Loafers Shoes Comfort Suede Comfortable Wedges for Women 35-42,28,99,Rainrop
Women's Genuine Leather Made in Brazil Greenwich Loafer,39,00,Driver Club USA
EASY21 Women Canvas Lace up Shoe Fashion Casual Comfort Sneakers,9,99,Blue Berry
Casual Women's Genuine Leather Penny Loafers Driving Moccasins Slip-On Boat Flats Shoes,30,99,SUNROLAN
Casual Women's Penny Loafers Genuine Leather Moccasins Slip-On Boat Flats Driving Shoes,22,99,SUNROLAN
Canvas Shoes for Women Slip on Sneakers for Women Driving Shoes for Women Casual Summer Slip on Womens Loafers Flats,21,99,Camel
"Women's Catniss,",19,98,
Women's Lulia Wedge Pump,27,92,
Women's Donna Paige Flat,41,99,
Women's Kelli Suede Flat,47,00,TOMS
Women's East Village Loafer,58,75,Marc Joseph New York
Anna Women's Slick Ligh Weight Comfort Slip On Quilted Fashion Sneakers,12,33,Anna Home Collection
Women's Bridget Flat,34,37,
Street Women's Double up Fashion Sneaker,34,99,
Women's Go Walk Lite-Sweet Pea Loafer Flat,29,00,
Women's Alena Moccasin,95,95,
Men's Cabrillo Space-Dye Ankle-High Canvas Fashion Sneaker,52,98,TOMS
Womens Fashion Casual Slip On Low Heeled Mules Loafer Flat Slides Sandals Shoes,19,99,Mila Lady
Women's Closed Toe Elastic Side White Rubber Sole Loafer Slip On,5,75,MVE Shoes
Unisex Checkerboard Slip-On Black/Off White Check VN000EYEBWW Skate Shoes,48,43,
Women's Canvas Slip-On Shoes with Padded Insole,8,90,EasySteps
| Women's Tassel Slip On Comfortable Pointy Toe Oxford Loafer | Faux Suede Espadrille Casual Flats,14,99,Guilty Heart
Women's Everlay Dairyn Slip-On Loafer,37,73,
"Women's Carryon Loafer Flat,",30,67,NATURAL SOUL
Womens Leather Casual Loafers Slip-ONS Driving Flats Shoes,15,99,Labato
Women's Classic Handsewn Suede Leather Driving Moccasins Penny Loafers Casual Slip On Fashion Boat Shoes,29,99,V.J
Comfort Plus Women's Colby Loafer,29,99,Predictions
Women's Norah Slip On,44,99,Earth Origins
Women's Leather Casual Loafer Flat Shoes(Buy One size down),11,07,Kunsto
Women's Marice Canvas Slip On,44,96,
Womens Faux Suede Loafer Smoking Shoes Flats 3 Colors,7,99,Shoes8teen
Women's Pair O Dice Leather Loafer Flat,43,99,
Men's Moccasin Slipper,49,84,Old Friend
Propet Women's W3851 Wash & Wear Slip-On,30,73,
Women's Jungle Moc Waterproof Slip-On Shoe,84,97,
Women's Channing Slip-On Loafer,33,63,
Women's Debra,68,24,
Women's Everlay Luna Slip-on Loafer,27,84,
Women's Azella Theoni Slip-On Loafer,19,95,
"Women's Casa Loafers Sneaker,",59,95,
Women's Casual Walking Shoe - Easy Everyday Fashion Slip on,18,68,Premier Standard
Women's Hadden Flat,26,19,
Women's Cush N Foot Slipper,19,59,
Women's Leather Loafers Casual Round Toe Moccasins Wild Driving Flats Shoes,7,99,Fashion Brand Best Show
Womens Joleen Loafer,64,95,
Women's Gem Wedge Pump,32,48,
Women's Tarah Grace Penny Loafer,94,90,
Women's Dawned Loafer,34,99,Dr. Scholl's Shoes
Women's Siesta Loafers & Slip-Ons Shoe,49,99,SAS
Women's Casual Canvas Boat Shoe,9,50,
Womens Hollow Out Casual Leather Driving Flat Loafers Shoes,16,99,Z-joyee
Women's Betunia Loafer,10,35,
Unisex Chef Shoes Non-Slip Safety Shoes Oil Water Resistant Casual Flat Shoes,22,99,INiceslipper
Women's Casual Hollow Loafer Canvas Flats Shoes,17,99,Paris Hill
Women's Blair 5 Fashion Sneaker,93,38,
Women's Breathable Natural Walking Flat Loafer,15,99,VenusCelia
Women's Jutti Mule Suede Flat,50,00,TOMS
Women's Lilliana Loafer,44,55,Calvin Klein Jeans
Women's Carmel Sneaker Disney,44,90,TOMS
Womens Casual Bowknot Moccasins Driving Loafers Slip on Flat Shoes,9,99,Meeshine
Women's Canvas Slip-On,30,00,TOMS
Simple Women's Slip On Leather Loafer,59,49,SAS
"Women's, Simple Slip on Loafer Black 5 M",136,95,SAS
Women's Over Drive Slip-On Loafer,22,77,
Women's Cypress Hill Loafer,25,00,Marc Joseph New York
Nohea Lole - Men's,67,99,
Men's Payton Suede Sneaker,42,98,TOMS
Women's Featherl Loafer Flat,89,95,
"Women's, Pier Side Slip on Shoes",27,89,Sperry
Women's Penny Loafers Slip On Flats Comfort Driving Office Loafer Shoes,29,99,JENN ARDOR
Women's Channing Essa Slip-on Loafer,45,19,
Women's Comfort Slip-on Loafer Driving Shoes,19,99,Hawkwell
Women's Comfort Slip-on Loafer Driving Shoes,16,99,Hawkwell
Women's Newport,49,36,
Rockport Women's Paulette Flat,44,99,Cobb Hill
Women's Kilty Suede Softsole Moccasin,32,18,
Women's Glee Slip On,30,00,
Women's Sneakers Slip-on Walking Memory Foam Shoes,16,99,
Women's Hudley Loafer,29,99,
Women's Superskate Loafer,49,95,
Women's Thunderbird II Mocassin,32,95,
Women's Patricia Loafer,41,72,
Womens Buckle Slip On Loafer Casual Low Flats Square Toe Shoes,15,99,Meeshine
Unisex Slip-On Platform Slip-On,48,00,
Women's Solo Mule,14,99,
Womens Loafers and Slip Ons Tassel Flat Ankle Booties Low Heel Faux Suede Pointed Toe Casual Boots,18,98,LAICIGO
Women's Liz Loafer,30,44,
"Women's Liz Loafer,Bone,11.5 N",88,95,
"Women's Liz Loafer,Red,11.5 N",88,95,
Women's Thunderbird Softsole Moccasin,33,83,
Women's Viana Driving Style Loafer,10,64,
Women's Fashion Slip On Glitter Comfortable Sneakers Flat Shoes,19,99,Sofree
"Men's 3"" Heel Pimp Shoe. Mens.",33,44,
Women's Trend Setter Slip-On Loafer,17,99,
Women's Leona Slip-on Loafer,32,84,
"Women's Caddell Denali Slip-On Loafer,",19,21,
Women's Classic Genuine Leather Penny Loafers Driving Moccasins Casual Slip On Boat Shoes Fashion Comfort Flats,36,99,ARTISURE
Women's Grasp Chime Loafer,50,40,
Women's Donna Crochet Loafer Flat,49,95,
"Leather Slipper, Women's Oxford Slipper Vintage Slip-Ons Colorful Flower Backless Loafer Shoes",66,98,gracosy
Loafers Women Comfort Casual Slip on Low Heel Cowhide Leather Flat Shoes,49,99,ONEENO
Women's Farrow Wedge Pump,18,00,
Women's Go Walk Lite-15412 Loafer Flat,16,99,
Tulip Perf Slip-On,73,90,
Women's Leather Loafers Casual Flats Driving Moccasins Indoor Shoes Slip-On Slippers,7,99,Temofon
Women's Bear's Hug Travel Canvas Slip-on Shoe Grayish-Green,59,99,UIN
Women's Sierra Slip-On,39,99,
Women's Loraine Loafer,49,99,
"Women's Cameo Loafer Flat,",26,36,
Women's Comfortable Bow Point Toe Flat Pumps Slip On Shoes,18,99,Meeshine
Women's Brisk Blaine Slip-on,89,95,Vionic
Women's Go Walk Lite-15385 Loafer,25,55,
Women's Floral Comfort Walking Flat Loafer,15,99,VenusCelia
Womens Barrado,40,99,
Women Leather Loafers Casual Moccasin Driving Indoor Flat Slip-on Shoes,9,99,Adibosy
Women's Livie Slip-on Loafer,90,49,
Women's Leisa Carly Clog,55,25,
Women's Sacha Moto Shootie Western Boot,116,71,
Women's Casual Slip-On Flats Moccasins Driving Leather Loafer Shoes,9,99,STAINLIZARD
Women's Renova PROfessional Slip-On Clog,92,95,Timberland PRO
Propet Women's Washable Walker Sneaker,13,98,
Women's Keesha Cora Penny Loafer,31,24,
"Women's Keesha Cora I Penny Loafer,",31,74,
Propet Women's Travelwalker II Shoe,12,46,
"Women's Avalon Loafer,",59,95,TOMS
Women’s Casual Leather Loafers Driving Moccasins Flats Shoes,8,99,LINGTOM
Street Women's Double up-Shiny Dancer Fashion Sneaker,39,97,
Women's Fulton Moccasin,84,99,MICHAEL Michael Kors
Women's Chrissy Driving Moc,29,99,dexflex Comfort
Ez Flex 3.0 Swift Motion Womens Slip On Sneakers,21,73,
The Original MuckBoots Adult Muckster Slip-On Shoe,39,69,
Women's Romi Smoking Slipper,45,49,Vionic
Women's Crave Quilted Slip-On,29,99,Brash
Women Loafers Leather Oxford Slip On Walking Flats Anti-Skid Boat Shoes,15,99,RVROVIC
Women's Original Dali Slipper,33,60,Soludos
Women's Katherine Leather Driving Style Loafer,66,99,
"Women's Isabelle Flat,",18,17,
Women's Hope Roxanne Loafer,56,25,
Women Classic Tie Driver Moccasins Boat Shoes Slip On Flats Loafers,19,99,Jabasic
Women's Sneaker Casual Fashion Loafer Slip-On Espadrille Flat Canvas Shoes,12,99,LaRosa
"Women's Everlay Dixey Slip-On Loafer,",21,74,
Espadrille Sneakers for Women: Hollow Canvas Casual Flats Classic Slip-On Comfortable Shoes,15,99,Casuel
Casual Women's Suede Leather Driving Moccasins Slip-On Penny Loafers Boat Shoes Flats,9,99,SUNROLAN
Proven Pain Relief Orthopedic Diabetic Chelsea Womens Slip On Shoes,129,95,Orthofeet
Womens Moccasin Indoor/Outdoor Microfiber Slipper,19,99,Seranoma
JOLIN-02 Women's Fringe Moccasin Flat Heel Zipper Under Knee High Boots,26,84,Refresh
Women's Dassie MJ Slip-On,56,26,
Men's Slip-on Loafer Performance Sport Active Fashion Cushion Sneaker RX400/RX300,19,98,Tesla
Women's Leather Loafer Shoes Slip On,9,31,Kunsto
Women's Khloe Moccasin,48,00,
Men's Braided Lace Loafers,46,58,SWIMS
Women's Faux Suede Comfort Slip-on Penny Loafer Flat Shoes,23,99,Greatonu
Spring Step Women's Burbank Shoe,69,56,L'Artiste by Spring Step
Women's Rumi Mule,22,40,
Women's Comfort Walking Casual Flat Loafer,15,99,VenusCelia
Women's Comfort Walking Office Flat Loafer,15,99,VenusCelia
Women's Dameo Swing Driving Style Loafer,29,98,
"Women's, Danelly Molly Slip on Shoes",39,95,
Propet Women's Vista Strap Sneaker,28,87,
Women's Everlay Cape Loafer,41,09,
Women's Dree Me Cruiser Flat,10,63,
Top-Sider Women's Shoresider Boat Shoe,39,95,Sperry
Women's Clemente Polyester Slip-On,43,22,TOMS
Womens Canvas Slip On Flat Casual Sneaker Platform Fashion Low Top Shoes,19,78,Renben
Womens Mesa,64,99,Vionic
Women's Leather Casual Loafers Driving Moccasin Flats Slip-On Slipper Shoes,15,99,Labato
Women's Leather Casual Loafers Driving Moccasin Flats Slip-On Slipper Shoes,15,99,Labato
Women's Leather Casual Loafers Driving Moccasin Flats Slip-On Slipper Shoes,15,99,Labato
Women's Leather Casual Loafers Driving Moccasin Flats Slip-On Slipper Shoes,15,99,Labato
Women's Leather Casual Loafers Driving Moccasin Flats Slip-On Slipper Shoes,16,99,Labato
Women's Leather Casual Loafers Driving Moccasin Flats Slip-On Slipper Shoes,16,99,Labato
Women's Leather Casual Loafers Driving Moccasin Flats Slip-On Slipper Shoes,16,99,Labato
Women's Leather Casual Loafers Driving Moccasin Flats Slip-On Slipper Shoes,16,99,Labato
Women's Leather Casual Loafers Driving Moccasin Flats Slip-On Slipper Shoes,16,99,Labato
Women's Leather Casual Loafers Driving Moccasin Flats Slip-On Slipper Shoes,16,99,Labato
Women's Leather Casual Loafers Driving Moccasin Flats Slip-On Slipper Shoes,16,99,Labato
Women's Leather Casual Loafers Driving Moccasin Flats Slip-On Slipper Shoes,16,99,Labato
Women's Leather Casual Loafers Driving Moccasin Flats Slip-On Slipper Shoes,16,99,Labato
Women's Leather Casual Loafers Driving Moccasin Flats Slip-On Slipper Shoes,16,99,Labato
Women's Leather Casual Loafers Driving Moccasin Flats Slip-On Slipper Shoes,15,99,Labato
Women's Leather Casual Loafers Driving Moccasin Flats Slip-On Slipper Shoes,16,99,Labato
Women's Leather Casual Loafers Driving Moccasin Flats Slip-On Slipper Shoes,16,99,Labato
Women's Leather Casual Loafers Driving Moccasin Flats Slip-On Slipper Shoes,15,99,Labato
Women's Leather Casual Loafers Driving Moccasin Flats Slip-On Slipper Shoes,16,99,Labato
Women's Leather Casual Loafers Driving Moccasin Flats Slip-On Slipper Shoes,15,99,Labato
Women's Leather Casual Loafers Driving Moccasin Flats Slip-On Slipper Shoes,16,99,Labato
Women's Leather Casual Loafers Driving Moccasin Flats Slip-On Slipper Shoes,16,99,Labato
Women's Leather Casual Loafers Driving Moccasin Flats Slip-On Slipper Shoes,16,99,Labato
Women's Leather Casual Loafers Driving Moccasin Flats Slip-On Slipper Shoes,16,99,Labato
Women's Leather Casual Loafers Driving Moccasin Flats Slip-On Slipper Shoes,16,99,Labato
Women's Leather Casual Loafers Driving Moccasin Flats Slip-On Slipper Shoes,15,99,Labato
Women's Leather Casual Loafers Driving Moccasin Flats Slip-On Slipper Shoes,15,99,Labato
Women's Leather Casual Loafers Driving Moccasin Flats Slip-On Slipper Shoes,15,99,Labato
Women's Leather Casual Loafers Driving Moccasin Flats Slip-On Slipper Shoes,16,99,Labato
Women's Leather Casual Loafers Driving Moccasin Flats Slip-On Slipper Shoes,15,99,Labato
Women's Leather Casual Loafers Driving Moccasin Flats Slip-On Slipper Shoes,16,99,Labato
Women's Leather Casual Loafers Driving Moccasin Flats Slip-On Slipper Shoes,16,99,Labato
Women's Leather Casual Loafers Driving Moccasin Flats Slip-On Slipper Shoes,15,99,Labato
Women's Leather Casual Loafers Driving Moccasin Flats Slip-On Slipper Shoes,16,99,Labato
Women's Leather Casual Loafers Driving Moccasin Flats Slip-On Slipper Shoes,16,99,Labato
Women's Leather Casual Loafers Driving Moccasin Flats Slip-On Slipper Shoes,16,99,Labato
Women's Leather Casual Loafers Driving Moccasin Flats Slip-On Slipper Shoes,15,99,Labato
Women's Leather Casual Loafers Driving Moccasin Flats Slip-On Slipper Shoes,16,99,Labato
Women's Leather Casual Loafers Driving Moccasin Flats Slip-On Slipper Shoes,16,99,Labato
Women's Leather Casual Loafers Driving Moccasin Flats Slip-On Slipper Shoes,16,99,Labato
Women's Leather Casual Loafers Driving Moccasin Flats Slip-On Slipper Shoes,16,99,Labato
Women's Leather Casual Loafers Driving Moccasin Flats Slip-On Slipper Shoes,16,99,Labato
Women's Leather Casual Loafers Driving Moccasin Flats Slip-On Slipper Shoes,15,99,Labato
Women's Leather Casual Loafers Driving Moccasin Flats Slip-On Slipper Shoes,15,99,Labato
Women's Leather Casual Loafers Driving Moccasin Flats Slip-On Slipper Shoes,15,99,Labato
Women's Leather Casual Loafers Driving Moccasin Flats Slip-On Slipper Shoes,15,99,Labato
Women's Leather Casual Loafers Driving Moccasin Flats Slip-On Slipper Shoes,15,99,Labato
Women's Leather Casual Loafers Driving Moccasin Flats Slip-On Slipper Shoes,15,99,Labato
Women's Leather Casual Loafers Driving Moccasin Flats Slip-On Slipper Shoes,16,99,Labato
Women's Leather Casual Loafers Driving Moccasin Flats Slip-On Slipper Shoes,16,99,Labato
Women's Leather Casual Loafers Driving Moccasin Flats Slip-On Slipper Shoes,15,99,Labato
Women's Leather Casual Loafers Driving Moccasin Flats Slip-On Slipper Shoes,15,99,Labato
"Women's Casual Lace Up Slip ONS Leather Penny Loafers Moccasins Ballet Flats Shoes (Pink, 6 (B) M US)",16,99,Labato Style
Women's Leather Casual Loafers Driving Moccasin Flats Slip-On Slipper Shoes,16,99,Labato
Women's Leather Casual Loafers Driving Moccasin Flats Slip-On Slipper Shoes,16,99,Labato
Women's Leather Casual Loafers Driving Moccasin Flats Slip-On Slipper Shoes,16,99,Labato
Women's Leather Casual Loafers Driving Moccasin Flats Slip-On Slipper Shoes,16,99,Labato
Women's Leather Casual Loafers Driving Moccasin Flats Slip-On Slipper Shoes,15,99,Labato
Women's Leather Casual Loafers Driving Moccasin Flats Slip-On Slipper Shoes,15,99,Labato
Women's Leather Casual Loafers Driving Moccasin Flats Slip-On Slipper Shoes,16,99,Labato
Women's Leather Casual Loafers Driving Moccasin Flats Slip-On Slipper Shoes,16,99,Labato
Women's Leather Casual Loafers Driving Moccasin Flats Slip-On Slipper Shoes,16,99,Labato
Women's Leather Casual Loafers Driving Moccasin Flats Slip-On Slipper Shoes,15,99,Labato
Womens Odonna,32,99,
Top-Sider Women's Barrelfish Boat Shoe,40,48,Sperry
Bobs Highlights Sand Sparkle Women's Slip on,34,99,
Women's Jalaina Odell Pump,59,87,
Women's Hollow Leather Backless Lazy Loafers Flats Slip On Mules Shoes Walking Slipper,14,99,VILOCY
Women's Grand Street Driving Style Loafer,49,00,Marc Joseph New York
Marc Joseph NY Women's Fashion Shoes Grand Street Brown Grainy Buckle Loafer Size 8 (More Size/Colors Available),69,00,Marc Joseph New York
Marc Joseph NY Women's Fashion Shoes Grand Street Brown Grainy Buckle Loafer Size 7 (More Size/Colors Available),69,00,Marc Joseph New York
Mirjam 11 Women's Pump,53,31,
Women's Platform Smoking Slipper,44,99,Soludos
Australia Women's Dakota Slipper,63,85,
Women’s Leather Loafers Casual Shoes Moccasins Wild Breathable Flat Indoor Slip on Slippers,13,99,RT Group
Thermoskin Night Time Relief for Plantar Fasciitis Plantar FXT,13,39,SoftWalk
Women's Ella Suede Bootie,34,95,TOMS
Women's Slip-On Loafer Shoes Casual Driving Leather Flat Moccasin Shoes,8,99,Z-joyee
Women's Leather Slip-on Loafers Moccasins Casual Flat Driving Boat Shoes with Memory Foam Insole,9,99,BTDREAM
71-22809 Women's Wynn Open Back Mule Shoe,39,98,
Women's Valent Slip-on Loafer,59,99,
