product_name,price_int,price_dec,seller
Lamo Women's Aussie Moccasin & Toe Warmer Bundle,36,00,"Lamo, USA"
"Womens Mackerel Moc Canvas Slip On Sneaker (Charcoal, 8)",44,99,Not Rated
Liv R1474 Shoes,95,94,Remonte
Women's Headsail Patent Leather Boat Shoes in Charcoal,29,00,
Women's Salya738 Nubuck Penny Loafer Ballerina Flat,12,99,
Women's Torres Casual Microfiber Loafer Shoes,75,00,UIN
"Carefree Canvas Slip-Ons, White, Size 6 (Wide)",12,99,Carol Wright Gifts
"Slip-On Loafer,Women's Rainbow Weave Vintage Leather Loafer,Soft Flat Casual Loafer,Walking Shoes",59,98,Socofy
Women's Katherine Ceil Slip-On Loafer,48,00,
"Twist7 Slip On Sneakers, Light Natural",27,99,
Women's A/O Vida Boat Shoe Driftwood 7.5 M US,94,95,
Womens Round Toe Embroidered Flats Backless Slipper Shoes,19,99,Chickle
Sky-1 women's Elastic Fabric casualb knit Weave woven braid slip on comfort shoes,12,01,
Women's Monk Straps Slip on Loafers Shoes,18,00,Latasa
Lady¡¯s Loafers Flat Moccasins Tassel Boat Shoes,27,50,Smilun
"TOMS Women's Classic Slip-On (10 B(M) US, (Steel-Grey))",48,95,TOMS Kids
"Air Max Tavas FB GS Kids Sneaker Yellow 845112 700, Size:40",84,46,
Women's Octavia Loafers,83,25,
Women's Go Step Lite Glitz Slip ONS Charcoal 6.5 B(M) US,32,99,
Womens Classics Slip ONS Navy Freetown Star Womens 6,49,95,TOMS
Women Uniform Shoes Med Heels Loafers JK Round Toe School Students Shoes,48,99,KikoPro
Girls' Knows The Whitney Court Shoes Leder Footwearstyle Keywords School Uniform,229,01,
Women's Cute Bowtie Cowhide Leather Moccasin Flats Waterproof Dress Loafers Shoes,22,99,HiEase
Women's Moccasin Driving Shoes Cowhide Casual Lace-Up Loafers Flats Slip-on Slippers Shoes,5,99,Susanny
Women's Driving Loafers Cut Out Cowhide Leather Flats Shoes,22,89,Hecater
Women's Phoenix Slip-On 9 B(M) US Navy,39,95,Beacon
Women's Classic Penny Loafers Suede Pointed Toe Flat Slip-On Casual Dress Loafer Oxfords Shoes,44,89,GIY
Women's Victoria Slip-On,164,85,Drew Shoe
Women's Terra Ballet Flat,128,00,
Womens Chunky Heel Platform Loafers Shoes with Tassel,39,99,Lucksender
"Perforated Flat, White, Size 7-1/2 (Wide)",19,99,Carol Wright Gifts
Sequin and Faux Suede Moccasin With Bow Faux Fur Lining Slippers,10,51,LA Gear
Casual Loafer Shoes with Chunky Heel Large Size Chic Shoes with 2-colors for Fashion Women,28,99,SJJH
Womens Vergil Square Toe Loafers,42,99,
Women's Alice,44,98,
Women's Floral Prints Wedgeheel Sports Mother Shoes Casual Walking Work Shoes Loafers Slip-Ons,23,32,Maybest
Women's Roamer Slip-on Black Size 8.5 S,168,95,SAS
Women's flip Flops Flat Shoes Bowknot Bohemia Leisure Sandals Peep-Toe Thongs Shoes,10,99,Fheaven
"Women's Jenn Mini Loafer,Black,11 N US",108,59,
Women's Flat Pointy Toe Low Cut Leather Loafers,27,99,SFNLD
"Women's Liz Loafer,Light Tan Tonal,8.5 N",88,95,
Women's Galway Perforated Gigi Blue Nubuck Shoe,44,99,Rockport Cobb Hill Collection
Women's Tessa Flat Driver,167,63,Skylar Blake
Women Bowknot Casual Loafers Shoes Soft Pointed Flat Shoes,7,99,Fheaven
Women's Casual Round Toe Slip-on Wide Width Work Boat Shoes Wedge Leather Loafers,31,90,Summerwhisper
"Women's, Simple Slip on Loafer Black Croco 9 N",136,95,SAS
"Women's Canvas Slip-On,Black,7.5 M",41,63,TOMS
Women's Black Slip On Casual Shoe,54,99,Genuine Grip
"Women's Classic Canvas Slip-On,Ash,7 M US",44,98,TOMS
"by Italian Shoemakers 300 Womens Leather Perforated Comfort Clogs (Beige,10,Medium)",29,99,Damianis
Women's Margy Slip-on Loafer,59,00,
Women Loafers Shoes Bowknot Creepers,13,48,Dear Time
Loafers Slip on Woman 7 US/ 37 EU Pink Leather,175,00,MOMA
Women's Slip on Wedges Loafers Shoes,29,00,Charm Foot
Womens Casual Wild Breathable Flat Low Top Round Toe Rubber Sole Slip On Loafer Shoes,39,99,Hoxekle
Women's Smooth Leather Moccasin,49,30,
Women's Espadrillas Vidorreta in glitter black fabric. 4cm rubber raffia and rubber wrap. Made in Spain,88,00,Vidorreta
Low-Cut Flats Lace Shoes Casual Sneaker Round Head Genuine Leather Sports Loafer,26,79,OUCHI®
Women's Mossy Oak Loafers Winter Brush,14,99,
Women's Jensen Stretch Smooth Slip-On Sneaker,45,00,
Studded Slip-On Loafers Women Glitter Low Top Flats Fashion Casual DolphinGirl Shoes Prime,69,99,DolphinBanana
Women's Pinch Grand Tassel Penny Loafer,69,00,
Cobb Hill Rockport Womens Paulette Black Slip-On - 6.5 XW,99,95,Rockport Cobb Hill Collection
Women's Kara Loafer Suede Stone Shoes,89,95,
Women Slip On Loafers Shoes,31,89,FANIMILA
Canvas Shoe,8,99,Carol Wright Gifts
Women's Promise Slip-On Loafer,45,00,
Women Flats loafers Ankle Strap Buckle Pointed Toe Slip on wide Suede Casual Shoes Spring Summer Office Work Shoes,29,98,Younsuer
Womens Low Wedge Heel Slip On Tassled Brogue Loafers,22,83,Shelikes
"Womens, Angelfish Boat Shoe Dark Grey 10 M",89,25,Sperry
Women's 10009299 Silver Crochet Glitter Alpargata Flat,42,90,TOMS
"Women's, Simple Slip on Loafer Black Croco 8 S",136,95,SAS
Women's Comfort Slip On Flat Shoes,29,89,TAOFFEN
Womens Bowknot Korean Version Low Heels Low Top Square Toe Suede Slip On Loafer Shoes,39,99,Hoxekle
Women's Phoenix Slip-On 9 2A(N) US White,39,95,Beacon
Women's New Handmade Sewing Flower Moccasins Leather Loafer Flats Shoes,39,90,FENIKUSU
B.O.C Womens liily Closed Toe Slide Flats,60,99,B.O.C.
B&C Paradise Womens/Ladies Vibrant Espadrille Shoes,15,70,B and C
Womens Marsha Closed Toe Espadrille Flats,44,58,André Assous
Women's 1D5226 BZJ F0009 Leather Loafers,480,00,
"Womens Vero Leather Closed Toe Loafers, Pewter Leather, Size 7.0",39,98,Marc Fisher
Women's Hottoddy Leather Loafer,60,02,
"Women's Jerez 578-7399CL, Onyx, 41 (US Women's 10.5-11) B-Medium",154,95,
"Women's, Simple Slip on Loafer Wine 8 N",136,95,SAS
Womens Mackerel Fabric Closed Toe Boat Shoes,31,96,Not Rated
Women's Leather 2 Button Moccasins 3000W,102,97,Taos Moccasins
Camo women's Casual slip-on military fabric camouflage canvas metal star flat boats Black 6.5,6,85,ANNA
New Womens Comfort Loafers Slip On Leather Shoes Red,27,99,Red
Women's Noney Synthetic Slip-Ons,15,52,
Propet Women's Washable Walker Suede Shoe & Oxy Cleaner Bundle,79,95,
Women's Ruby-Biodegradeable Flat,39,47,
Women's Cove Palms (Relaxology) Ankle Bootie,36,51,
Women's Buckle Patent Leather Low Heel Fashion Casual Shoes,28,00,Carolbar
"Women's Canvas Slip-On,Black,6 M",44,39,TOMS
"Women's, Simple Slip on Loafer Wine 10 N",136,95,SAS
Women's Slip on Flat Loafers Shoes,34,00,Latasa
Womens Wedge Platform Loafer Breathable Fashion Mid Top Outdoor Comfort Casual Shoes,48,99,CYBLING
Women's Casual Slip On Chunky Heel Loafers Shoes,28,00,Show Shine
New Corkys Womens Sidewalk Flats Silver/Grey 6,54,55,Corkys Footwear
Women Flats Slip On Comfort Shoes,14,53,DATEWORK
A2 by Aerosoles Women's Solar Panel,28,69,
Unique Debora Custom Fashion Women's Sneakers Unusual Loafers Slip-on Canvas Shoes,29,99,Artsadd
"Women's Genuine Leather 1.18"" Platform Espadrilles Loafers Shoes 4.5-7.5",53,99,A-BUYBEA
Gal-P Women's Slip On 7 B(M) US Camel,59,95,
JENN Women's Slip On 7.5 3A US Black,92,95,
Women's Buckle Retro Comfort Casual Low Heels Shoes,29,00,Carolbar
Women's Angelfish Cheetah Boat Shoe,73,32,
Enfold Womens Full Slippers,44,89,PADDERS
Ladies Indian Bollywood Bridal Shoes Heels Sandals Slip Ons Khussa Juti,40,00,Step n Style
"Women's Alpargata Canvas Espadrille, Size: 6.5 B(M) US, Color: Peacock",37,80,TOMS
EL Viajero N275 Women Loafers & Slip ONS,129,90,El Naturalista
Womens Greta Closed Toe Loafers,129,99,
Women's Elara Casual Shoes,49,95,
Women's Foster Flat,59,99,
FIC Abby Women Wide Width Leather Flat for Casual Or Fancy Attire (Size & Measurement Guides),48,95,Peerage
Women's Monk-strap Slip on Platform Shoes,32,00,Latasa
Women's Alloway Crystal Bow Black Loafer 5 B - Medium,130,00,
"Women's Liz Loafer,White,7.5 S",88,95,
Salya-637 Embroidered Kitty Cat Loafer Flat LIGHT BLUE (6.5),17,53,
Women Loafers Flatform Pumps,31,99,Cular Acci
Women Vintage Embroidered Mule Shoes Backless Flat Slip on Loafer Slipper Spring,24,99,Funbase
Women Spider Embroidered Mule Shoes Backless Flat Slip on Loafer Slipper Spring,24,99,Funbase
"Women Lace-up Shoes Blue, (Marine/Pazifik/Schwa) L5224-14",53,58,
Women's A/O Woven Boat Shoe,69,90,
Women's Ryann Claudine Slip-On Loafer,48,98,
Women's Bow Slip On Chunky Shoes,28,80,Latasa
New Womens WM Warm Fur Lined Winter Moccasin Flats Shoes,12,99,J'aime Aldo
Womens Paloma White Nappa EU 40 W,89,99,
BOBS from Womens Plush Lite,23,18,
Etta 2005-560 Blk 3D Stargazer SZ 39 EU,344,95,
"Women's Canvas Slip-On,Black On Black,9 M",47,97,TOMS
Womens ELISS Leather Loafers,59,99,
Women's Jean Embroidered Mules,90,99,
Womens Zelda Slip-On,56,05,
TASH FOLDS FEMALE ADULT WORKING GIRL-PATENT 100% PU LEATHER FOLDABLE FLAT,26,99,Tash Limited
Women Slip On Loafers Shoes,29,89,KemeKiss
"Women's Classic Slip-On (8 B(M) US/38-39 EUR, Black on Black Canvas)",42,42,TOMS
Buddha Face Over Mandala Indian Round Pattern Women's Slip-On Loafer Shoes Canvas Fashion Sneakers,29,99,InterestPrint
Classic Women's Leather Casual Cut Out Loafers Flat Slip-On Shoes,29,99,xiaoyang
Classic Women's Casual Leather Mother Loafers Boat Shoes Driving Footwear for Woman,29,99,xiaoyang
Womens Soft Comfortable Synthetic Driving Walking Moccasins Loafers Boat Shoes,21,99,LL STUDIO
Women Tassel Embroidered Mule Shoes Backless Flat Slip on Loafer Slipper Spring,24,99,Funbase
Women's Fulton Moccasin Glitter Flats,240,00,MICHAEL Michael Kors
Women's Reelfun Sneaker,80,00,
Womens Peony Embroidery Wedge Casual Travel Walking Shoes,27,99,Soficy
Cobb Hill Rockport Womens Paulette Black Slip-On - 8.5 XW,99,95,Rockport Cobb Hill Collection
Women's Vionna Loafers Shoes,32,03,
French Sole Flutter,99,99,French Sole FS/NY
Womens Girls Lovers Fashion Casual Canvas Shoes Slip On Flats Platform Sneakers,12,86,Gaorui
Fashion Sneakers Flats Pineapples and Tropical Leave Women's Classic Slip-on Canvas Shoes Loafers,22,99,D-Story
Ladies Women Satin Wedding Bridal Khussa Jutti Salwar Kameez Flat Shoes,38,95,Step n Style
Women's Cobb Hill Paulette Navy 9.5 EE US,99,95,Rockport Cobb Hill Collection
Women's Ballet Shoe Cute Casual Comfort Flat,15,99,Haironline
Women's Classy Casual Fashion Studded Loafer Slip On Shoe - Black,38,99,Pazzle
Women's Jute Aztec Printed Espadrille Slip-on Sandal Slippers,29,99,LLP
Harriett Women's Flats & Oxfords,24,99,ALDO
Women's Girl's Loafers Slip On Wedge Sandals Ethnic Sandals Flats Footwear,4,99,INDCROWN
Women's Adult Angel Steps Jewel,24,99,AmeriMark
"Women's Jenn Mini Loafer,Dark Grey,9 S US",165,00,
Womens Ginger Fabric Closed Toe Loafers,52,99,Comfortiva
Gal-P Women's Slip On 8.5 B(M) US Black,79,95,
Damen-Slipper Weiß 942304-3,30,78,
Sanuk Womens Sandals - Ric Rac Row,47,96,
Women's Tassel Moccasin Flat Shoes Non-Slip Rubber Sole Driving Penny Loafers Shoes,37,99,T-JULY
Women's Noney Metallic Slip-Ons,22,97,
"Womens Emilia Leather Closed Toe, Red, Size 11.0",105,90,L'Artiste by Spring Step
Women's Zoe Leather Flat Shoe,17,99,Isaac Mizrahi Live!
"Comfort Loafers, Burgundy, Size 8 (Wide)",19,99,Carol Wright Gifts
Stylish Polka-dots Print Women's Slip on Mesh Trail Running Shoes,28,99,FOR U DESIGNS
Women's Cameo Loafer II,62,95,
Women's Bluefish Micro Dot Boat Shoe,89,99,
Top-Sider Women's Angelfish Slip-On Loafer,128,00,Sperry
"Women's Ash Loafer,Black Kid,10.5 S",93,00,
Freedom Square Toe Women US 9.5 N/S Ivory Loafer,89,95,Array
Women's Style Kendal Leather Slip-On Shoe,109,80,
Women's Spring Step Essenza Slip-ON Shoe | Color Black | Women's Polished Leather Slip-on,59,99,SPRING STEP Shoes
Women's Florence-E Oxblood Loafer 10M,16,99,
Women's Songfish Sparkle Canvas Linen Loafer,89,00,Sperry
Propet Women's Vista Strap Shoe & Oxy Cleaner Bundle,94,95,
Women's Chic Rhinestone Chunky Low Heel Loafers Shoes,24,00,Charm Foot
"Women Shoes,Woopower Casual Pointed Flats Toe Slip on Loafers Working Shoes",13,99,Woopower
Women's Fashion Buckle Flats Shoes Concealed Low Wedge Heels Casual Loafers Size 4-11,28,99,HiEase
Genuine Leather Women's Round Toe Low Chunky Heel Elastic Handmade Comfort Ankle Booties,107,90,Nine Seven
HALLMARK Women's Chain-Trim Loafer Slate Suede US 6 M,169,99,
Stylish Leather Women Driving Shoes Lady Loafers,39,69,Meblvs
Women's Popular Round Toe Thick Sole Slip On Flat Sneakers Platform Loafers Shoes,31,97,
Women's Mocassin Carla,120,00,Laura Moretti
"Women's Casual Solid Cowhide Leather Wedge Loafer Driving Shoes Slip On Pump (Orange,40)",20,50,Abertina
Lace-up Flat Synthetic Leather Casual Oxford Flats Fashion Galaxy Star Print Shoes,35,99,Bigcardesigns
Me Too Women's Yale Flats,65,00,S&S
Women's Tuuli Slip-On Loafer,125,83,
Women's L15 Slip-On Shoes,94,95,
Women's Odessa Black,42,96,
Women's Henna Summer Tote Cotton,35,88,
Womens Casual Suede Penny Loafer Slip-on Walking Flat Shoes,18,99,CCZZ
Womens Camille,49,99,
Women's Wishbone Loafer Slip-On Loafer,40,00,
Women's Run Softly Wedge Espadrille,99,00,The FLEXX
L`amour Des Pieds Womens Beziers Black Slip-On - 8.5 M,110,00,L'amour Des Pieds
Women's Brattleboro Leather Trainers,77,99,
"Women's Canvas Slip-On,Black On Black,9.5 M",42,79,TOMS
"Women's, Twin Slip on Shoes Black 9.5 S",158,95,SAS
"Women's Hw06265-025,",89,83,
Women's Sanford Moccasin,79,99,
Large Size Women Fashion Summer Flat Loafers Ballet Slip On Casual Soft Shoes Mother Shoes,19,99,MAKEGSI
Women Low Heel Thick Bottom Slip On Casual Moccasins Synthetic Flats Comfort Loafer Shoes,35,99,T-JULY
"Women's Gloria Slip On,Mocha,9 S",92,95,
Green Loafers,15,00,Yepme
Ladies / Womens 100% Leather Casual / Formal Slip On Summer / Holiday / Boat Shoes,48,99,Absolute Footwear
Camo women's Casual slip-on military fabric camouflage canvas metal star flat boats Black 7,7,50,ANNA
Women's Cute Hollow-out Slip on Chunky Loafers Shoes,27,00,Latasa
women's Leather loafers- shoes,160,00,Waldläufer
"Women's Canvas Slip-On,Black On Black,10 M",47,70,TOMS
Women Slip On Sneakers Loafers Comfort Platform Moccasins Synthetic Penny Flats Shoes,46,99,T-JULY
Midge Women's Slip On,54,95,
"Women's Cannes Brown Slip On Loafers (11 W, Brown)",71,07,
Womens Flatform Slip-on Sneaker,94,99,Kennel & Schmenger
YRU LOWF FU CK Embroidered Faux Patent Trim Slip On Velvet Loafer Flat Men,29,00,Y.R.U.
Women's Trendy Comfy Slip On Flat Loafers,28,97,
"Womens Eveline Closed Toe Loafers, Brown, Size 7.5",53,99,
Women's Stylish Color Block Square Toe Thick Sole Platform Slip On Loafer Shoes,33,97,
Womens Ninolo,162,99,
Susanna Women US 11 Blue Loafer,79,00,
Womens Racer Sporty Shoe,59,99,
Women's Panto Loafer,39,84,
Damen-Schnürer - K Beige 950854-8,131,94,Waldläufer
Womens Val,129,99,Michael Kors
"Women's Classic Canvas Slip-On Shoe (35-36 M EU/5 B(M) US, Black/White)",47,99,TOMS
IF13 Women's Classic Elastic Panel Slip On Stitched Fashion Sneaker,39,99,
Women's Un.Cap Loafer,119,90,
Women's Pehuea Grenadine/Grenadine Sneaker 7 B (M),79,95,
Damen-Slipper - H Schwarz 942157-1,119,94,Waldläufer
Women's Petra Vintage Luggage True Glove,250,00,
Debut Women's Slip-On,129,95,Munro
Women's Casual Round Toe Low Cut Snake Pattern Lace Up Flat Sneakers,34,99,SFNLD
Women's Floral Beaded Round Toe Slip On Thick Sole Casual Platform Loafers Shoes,34,97,
Foil Faux Suede Moccasin with Faux Fur Lining Slippers,13,99,LA Gear
Low-top Stitch Synthetic Leather Platform Sneakers Shoes,40,98,Maxstar
Womens Casual Walking Slip On Shoes Hollow Lightweight Loafer Flats Sneakers,27,99,Kagains
Women's Keisha Tuxedo Slip On,37,68,Marc Fisher LTD
RKH207 Women's Waltz Latte Flat Sport Loafer,109,00,4EurSole
"TOMS Womens Jutti Flats (37-38 M EU/7 B(M) US, Steel/Grey)",49,00,TOMS Kids
Women Slip On Casual Flat Shoes,9,46,Dear Time
RKH199 Women's Waltz Latte Flat Sport Loafer,109,00,4EurSole
Optimal Women's Leather Driving Slip-On Soft Sole Loafers Boat Shoes,19,07,Optimal Product
Women's Classic Casual Shoe,45,97,TOMS
Boss-01 Women's Round Toe Moccasin Golden Buckle Suede Slip on Flat Shoes,14,99,Belladia
Women's Avalon Boot,69,99,
Women's Comfy Round Toe Closed Flats Shoes Low Top Slip On Work Loafers,25,96,
Addison Luxe,69,99,True Ivy
"Perforated Flat, Color Navy, Size 6 (Wide), Navy, Size 6 (Wide)",19,99,Carol Wright Gifts
Breathable Women Shoes Lace Multicolor Loafers Wedges Lose Weight Creepers Platform Shoes,19,29,Maybest
Women's Fashion Ballet Loafers Flats Lace up Pointed Toe Classic Dress Loafer Casual Dance Shoes,35,99,GIY
Women's Fashion Mid Chunky Heel Slip on Comfort Loafers Shoes,29,00,Latasa
"Loafers for Women, Slip-On Buckle Strap Square Toe Casual Penny Loafer Shoes Pump Heeled Sandals",42,89,GIY
Surprising Day Summer hollow out Women Genuine Leather Mother Shoes Moccasins Soft Leisure Flats Female Driving Flat Loafers bid size 34-44,29,06,Surprising Day loafers-shoes
Surprising Day Summer Hollow Out Women Genuine Leather Mother Shoes Moccasins Soft Leisure Flats Female Driving Flat Loafers bid Size 34-44 Blue 4,29,06,Surprising Day loafers-shoes
Surprising Day Summer Hollow Out Women Genuine Leather Mother Shoes Moccasins Soft Leisure Flats Female Driving Flat Loafers bid Size 34-44 White 4.5,29,06,Surprising Day loafers-shoes
"Womens Classic Canvas Slip On Casual Shoes, White, US 5.5",63,34,TOMS
Womens Genuine Leather Casual Loafers Soft Sole Work Flat Shoes for Mothers Nurses Maternity,17,99,fereshte
Women's Bowknot Loafers Shoes Fashion Casual Lightweight Non-Slip Moccasin Flat Shoes,39,99,T-JULY
Women's May Ivy Croco Wedge Dress Shoe Brown 7 M US,54,99,
Women's Meredith Sport Black/Silver Loafer,119,95,SoftWalk
Women Slip On PU Mid Heel Shoes,13,03,Dear Time
Women's Stylish Tassels Round Toe Low Top Slip On Loafers Sneakers With Heels,34,96,
Women's Color Matching Thick Heel Platform Loafers Shoes,28,50,Show Shine
"Women's Gloria Slip On,Black,7 S",76,82,
Valley Lounge Women US 9.5 Nude Loafer,65,98,
"Women's Leana Loafer Flat, Navy Combo, 9.0 N US",92,95,
"Women's Leana Loafer Flat, Navy Combo, 9.5 N US",92,95,
"Adam Tucker Women's Yale 8,Black Velluto Nubuck,US 5 M",59,99,
Bilbao Espadrilles,9,90,JOE N JOYCE
"Marseille-02 Women's Lovely Bow Loafer, Color:BLACK, Size:7",21,89,Nature Breeze
Women's May Poppy,58,99,
Women's Florence-E Black Loafer 9 M,16,89,
Womens L.Slipper NUBIA/Black,119,23,
Womens Petaa Leather Closed Toe Loafers,39,99,Giani Bernini
Slippers For Women Womens Flats Shoes Black Loafers Slip On Pointed Toe Womans Slip-Ons Girls Mule,49,99,Mavirs
Women's Galway Woven Loafer Black Leather Shoe,39,99,Rockport Cobb Hill Collection
"Women's Jadine Loafer Flat,",248,00,
"Women's Ash Loafer,Navy Kid,11 S",93,00,
Women's Kelly-18 Laser Cut Smoking Slip on Flats Shoes,9,99,Blue Berry
Women's Donna,49,95,Peace Moccasins by Old Friend
World Women Mules Shoes Slide Slipper Loafer Flats Embroidery Shoes - Black,21,99,HYL
"Women's Canvas Slip-On,Black,9.5 M",47,79,TOMS
Propet Women's Vista Shoe & Oxy Cleaner Bundle,94,95,
Beststore VAO New Women's Flats Shoes Women Loafers Ladies Shoes Slip On Flats 9 Color Leather Shoes Footwear F9113W,34,47,Beststore VAO Fashion-Sneakers
Cobb Hill Rockport Womens Paulette Bark Slip-On - 8.5 XW,99,95,Rockport Cobb Hill Collection
Women's Zoey Flat,54,77,
Women's Maggie Leather Sandal,10,99,Isaac Mizrahi Live!
Gemma-20 Women Mule Oxford Slide Slip On Flat Loafer Shoe Slipper Sequin Sparkle Black,19,99,Bella Marie
REGENT-11! Women's Bow Velvet Slip On Loafers Flats,23,00,
Women's Donna Deco Flat,52,97,
Comfort Lace up Shoes Fly,164,99,Wolky
Women's Jenn Croco Loafer,19,99,
Women's Slip Ons Leisure Sneakers,27,99,TONGPU
Women's Blair 7 Black Loafer 9 M,195,00,
Womens Verdict Green Charcoal Suede,47,99,
Women's Trendy Checkered Slip on Flat Round Toe Low Top Platform Comfy Loafers Skateboard Shoes,30,97,
Women's Minnetonka Mocassin (#118) | Color Brown | Women's Hardsole Woven Tassel Moccasin,69,09,Minnetonka Shoes
Women's Walking Flat Driving Light Moccasin Indoor Flexible Driving Loafers Leather Lace Up Slip-On Slippers,19,99,Durio
Shoes Corgi Mom Welsh Corgi? Slip-on Canvas Loafer For Women,45,90,HUANGDAISY
Marc Fisher Womens EMMY6 Velvet Low Top Lace Up Fashion Sneakers,49,99,Marc Fisher LTD
Unique Debora Custom Stylish Women's Shoes Sneakers Outsole Canvas Unusual Loafers,29,99,Artsadd
Moon Beams - Ladies Moccasin Slipper,9,53,MOONBEAMS
Women's Leather Moccasins with Fringe,22,90,Moonwalker
Women's Comfortable Slip Ons Loafer Shoes For Ladies,29,99,TONGPU
"Women's Allison Slip-On,Mocha Kid,11 S US",79,00,
Womens/Ladies Natalia Wedge Heel Brogues,75,70,ANA LUBLIN
Women's Beatrix,55,20,Splendid
"Women's Leana Loafer,Dark Taupe,12 S US",115,00,
Women's Florence-E Black Loafer 9.5 M,16,89,
Propet Women's Robin Slip-On Shoes,48,95,
Women's Red&Black Check Canvas Casual Slipper Red&Black,59,99,UIN
Women's Woven Elastic Flats Shoes,49,99,Yuanli
Fansela(TM) Women's Rhinestone Colorant PU Leather Breathable Mesh Flats Shoes,26,99,Fansela
Girl's Lenny Mid (Little Kid/Big Kid) Light Mauve Corduroy 5.5 M US Big Kid,46,51,TOMS Kids
"Women's Gloria Slip On,Navy,7 N",92,95,
Womens Slipper Lake/Pacific,169,18,
Women's Whip,39,00,
Pelosi Sandstone Skin Slim-Fit Flexible TPU Protective Case Smooth Surface for Oneplus Three/OnePlus 3T,3,40,Sikye
Women's Black on Black Canvas Classic ALPRG 10002472 (Size: 5.5),34,99,TOMS
"Women's Ingalls Congo Slip-On Shoes, Grey, 8.5 B(M)US",43,99,
Vintage Women's Breathable Mesh Sneaker Running Shoes,28,99,FOR U DESIGNS
Rockport Women's Revmist Mule,76,95,Cobb Hill
Dahanyi Stylish Fashion Women Flats Loafers Animal Bird Print Slip On Shoes For Women Casual Ladies Nice Flat-Bottomed Shoes,43,33,Dahanyi fashion-sneakers
Women Buckle Pointed Toe Zip Up Stiletto Mid High Heels Dress Ankle Booties,14,88,Gaorui
2018Women Fashion Vintage Retro British Style Buckle Patent Leather Single Flat Shoes,9,99,Elevin(TM)
Women's Suede Black Lexi Loafer Size 37 EU / 6 US,299,00,
Women's Abbott Slip-On Loafer,215,76,
Women's Tanner,54,47,SoftWalk
Men Women Classic Canvas Casual Slip-On Shoe,39,00,Caranda
Women's Perforated Elastic White Rubber Sole Slip On Loafer,29,99,
"Womens Vero Leather Closed Toe Loafers, Pewter Leather, Size 9.0",39,99,Marc Fisher
D-Story Custom Sneaker Diamonds skull Women Unusual Slip-on Canvas Shoes (Model 019),29,99,Canvas Shoes
Women's Vice Flat Loafer Slide Slip On Shoe,19,95,Gc Shoes
"Women's Candra Glare Flat,Gold Metallic Full Grain Leather,US 6.5 M",94,95,
Womens/Ladies Apron Saddle Summer Casual Shoes,21,20,Boulevard
Unisex Patent Wingtip Mondo Creeper Slip-On Loafer,49,99,
HALLMARK Women's Chain-Trim Loafer Slate Suede US 7 M,179,99,
Cinderella Womens Leather Slip-On White Loafer Flats Walking Driving Moccasin Shoes,22,99,SUNROLAN
Barkley Black Punched Nubuck Suede Slip On Cap Toe Loafer,44,99,
Women's Buckles Casual Platform Thick Heel Loafers Shoes,26,50,Show Shine
Women's Crest Vibe Washed Linen Black Oxford,60,00,
Womens Advantage,100,00,
Women's Zest Silver Metallic Tumbled Leather 10 B US,39,99,
Women's Liberty Black Leather Loafer 10 W,68,95,
Loafers Flats Shoes Leather Moccasins Women Slip on Platform Sneakers Comfort,25,49,Hishoes
Women's Guedes Knit Loafer Fashion Shoes,75,00,UIN
Genuine Leather Women's Pointed Toe Stiletto Heel Studded Party Handmade Classy Ankle Booties,112,90,Nine Seven
"Women's Falmouth Camp Moc, Brown, 9 D US",99,95,
Women's Rozie Serape Beads,50,00,
Women's Quilted Metal Logo Loafers Shoes,195,00,
Women's Business Penny Loafers Classic Square Toe Slip-On Dress Casual Block Heel Loafer Oxford Shoes,47,99,GIY
"Women's Canvas Slip-On,Black On Black,8 M",44,98,TOMS
Lauren Janis Women's Slip-On Sneakers Red Size 5,26,48,
"Women's, Bluefish 2 Eye Boat Casual Gray/Black 5 M",39,98,Sperry
Women's Summer Slip On Shoe,,,
Women's Flat Height Increasing Loafer Shoes,79,99,MINIVOG
[Newest] Women's Flats Slippers Round Head Breathable Fashion Casual Sandals,28,49,OUCHI®
Women's Cambridge Penny Loafer,49,99,
Low Blocked Heel British Style Womens Casual Loafer Shoes,97,99,MINIVOG
"Women's Grand Street Loafer, Pewter Grainy, 10 M US",79,00,Marc Joseph New York
Casual Shoes Womens Slip On Pacific 10 Periwinkle 679P,54,95,
Australia Womens Marrah Slipper,72,95,
Women's Napoles Brown Loafer 6.5 M,15,99,
Women's Pointed-Toe Chunky Slip On Shoes,32,00,Latasa
L175114 - L175114,169,99,
"Women's Canvas Slip-On (12 B(M) US / 42-43 EUR, Ash)",55,23,TOMS
Womens Della Slip-On,73,85,Azura
Unisex Era 59 (C&P) True White/Black Skate Shoes 5M Men's/6.5M Women's,34,99,
Womens Girls Canvas Shoes Casual Slip-On Shoes Platform Shoes,12,65,BININBOX
Women Oxfords Shoes Retro Tassel Loafer Casual Shoes Wing Tip Slip-On Flat Shoes,41,99,GIY
Women Hollow Indoor Outdoor Slip-On Flat Heel Slippers,34,29,Kyle Walsh Pa
Genuine Leather Women's Pointy Toe Stiletto Heel Zip Handmade Buckle Mid Calf Boots,110,90,Nine Seven
"Women's Jenn Loafer,Pewter,8 S US",92,72,
Suede Moccasin Flat with Fringe and Tire Tread Sole,49,90,Allagiulia
Women Slip On Moccasin Loafers Shoes,12,87,Dear Time
Women's Marice RES Fashion Sneaker,67,00,
Cute Cat Casual Slip-on Canvas Women's Fashion Sneakers Shoes,39,99,InterestPrint
Caterina-4 women's espadrille glitter strips reva slip on flats,8,99,BETANI
Garland Womens Summer Shoes,14,95,Divaz
Women's Chunky Heel Slip on Monk Strap Loafers Shoes,26,00,Latasa
Andrea Women's Shoes Anatomic Black Sheepskin Leather & Metallic Breathable Loafer,54,99,Dr. Scholl's Shoes
"Women's Back Less Platform Slip On - Fashion Slip on Sneakers - Loafer Slip On (9, Red)",79,95,BOBERCK
Women's Loafers Classic Casual Canvas Slip On Fashion Shoes Sneakers Flats Sugar Skull,29,99,InterestPrint
"Women's Genuine Leather Loafers Casual Moccasin Driving Shoes Indoor Flat Slip-On Slippers,M913,Blue,39",16,99,
Women's Suede Loafers Flats Comfy Student Ladies Shoes,23,99,XIUWU
Women's Pointed Toe Faux Fur Retro Low Heel Loafers,29,00,Carolbar
