product_name,price_int,price_dec,seller
Women's Pointy Toe Flat Slip On Leather Loafer Sneakers,39,99,SFNLD
Andre Assous Women's Jessi Penny Loafer,85,49,André Assous
Women's Montanagc Boat Shoe,31,99,
Women's Peggy Bee Loafers Shoes,64,95,
Women's - Classic Fabric Slip-ONS,14,90,
Women's Deedee Loafer,158,00,
"Women's Classics Comfort Casual Loafers Shoe Flats (8.5, Navy)",9,95,Chasing Peace
Myrna Flat 2015 - Womens,44,99,
by Kenneth Cole Women's Iso Block Slip-On Flat,69,99,
"Women's Classics (5.5 B(M) US, Birch/Camo)",79,90,TOMS
Propet Women's Washable Walker Evolution Sneakers & Oxy Cleaner Bundle,69,95,"Propet, USA"
Nohea Nubuck Shoe - Women's Black/Tan 7.5,109,90,
"Women's Canvas Slip-On,Black on Black,8.5 M",45,76,TOMS
Women's Lovers Painted Canvas Slip On Shoe Red,59,99,UIN
New Womens London-4 Suede Smoking Moccasins Slip On Flats Loafers Shoes,9,99,J'aime Aldo
Sandals for Women - Ladies Women Flats Hollow Out Shoes Round Toe Platform Flat Heel Slip on Casual Shoes,9,99,Fheaven
Women Leather Casual Lace-up Loafers Comfortable Driving Moccasins Shoes,36,99,Clarsunny
Women's Essence Loafers - Kimberly,165,00,
Womens Hollow Out Casual Leather Driving Flat Loafers Shoes,29,99,satisfied
Women's Loafers Casual Slip On Flats Abstract Burgundy Striped Space Dye,22,99,InterestPrint
Women's Fashion Satin Pointy Toe Slide Sandals Kitten Heels Mules Shoes,29,99,eleganceoo
Ladies Training Shoes Sneakers Outdoor Walking Sneakers,29,99,unyielding1
Women's Water Shoes Athletic Sport Lightweight Walking Shoes,29,99,MOREMOO
Womens Lightweight Sport Tennis Shoes Walking Sneakers Athletic Running Shoes,29,99,Bon Soir
Propet Women's Washable Walker Shoe & Oxy Cleaner Bundle,79,95,
Women's Giada Tassel Platform Slip-On Loafer,141,82,
Women Casual Bohemia Multicolor Ballet Slip On Flats Pointed Toe Loafer Flats,6,99,Fheaven
Women's Genuine Leather Loafers Casual Moccasin Driving Shoes Boat Indoor Flat Slip-On Slippers,18,99,Otamise
Summer Women Shoes Dull Polish Open Toe Buckle Strap Platform High Heel Wedge Sandals,15,69,Fheaven (TM)
Women's Square Toe Mid Heel Chunky Loafers Shoes,29,00,Charm Foot
Women's Flower Slip On Loafers Shoes Round Toe Casual Driving Moccasins Flat Ballet Boat Shoes,37,99,Btrada
Women's Debra,116,59,
"Loafer Flats Women Leather, Casual Slip-on Moccasins Driving Pumps 5 Colors",16,90,ACE SHOCK
"Womens Vero Leather Closed Toe Loafers, Blue, Size 6.5",42,99,Marc Fisher
Women's Felucca Slip-On,36,54,
Sandals For Womens -Clearance Sale ，Farjing Women Fish Mouth Platform High Heels Wedges Sandals Buckle Slope Sandals,11,99,Farjing
"Elegant Women's Black Plain Canvas Slip-on Flat Shoes, Espadrille Loafers",0,98,J.J.
music skull Loafers Casual Shoes for Men Women,22,99,InterestPrint
Crochet Slip-On,14,99,Carol Wright Gifts
Women's Zipdown Synthetic Loafer,31,69,
"Women's LIAT Sandals,Natural,39 M EU",89,95,Eric Michael
Antigua Women's Slip On,42,99,ARRAY
Women's Sweet Ruffles Pointed Toe Concise Ruffle Frill Dress Loafer Flats,29,69,DecoStain
Women's Fashion Slip-On Mules Pointed Toe Backless Clogs Slide Sandals Loafer Flats Dress Shoes,46,99,Btrada
"Women's Classics Comfort Casual Loafers Shoe Flats (9, Black)",12,95,Chasing Peace
Women's Adult Margie II from Angel Steps,24,99,AngelSteps
Women's Sweet Leisure Patent Leather Tassel Shoes Block Low Heel Penny Loafers,34,79,Kaloosh
Khussa Shoes Jootis Ethnic Mojari Handmade Pakistani Salwar Kameez Juti,38,95,Step n Style
Sugar Skull Canvas Women's Slip On Fashion Shoes Sneaker,29,99,InterestPrint
Women's The Heart Sneaker,56,00,Katy Perry
Women's Honor Ashby Loafer Champagne 7.5W,106,19,Vionic
Women Loafer Round Toe Espadrilles Comfortable Hemp Bottom Women Shoes Slip On,31,99,edv0d2v266
"Earthies Women's, Lindi Slip on Flats Biscuit 6 M",38,87,
"Flats Loafers Women,Casual Hollow Flowered Print Breathable Ballet Shoes",38,79,GilesJones
Women's Newport Espadrille,45,00,Since 1903 by Beacon
Women's Fergi Slip-on Loafer,31,22,Bos. & Co.
Women's Opanka Slip-On Walking Shoe,59,99,
Punjabi Jutti Flat Shoes Wedding Shoes Khussa Shoes Mojari Saree Jooti,32,00,Step n Style
"Womens Canvas Flat Shoes,Pink Dot Slip On Loafers Girls Classic Casual Fashion Sneakers Flats",29,99,InterestPrint
Women's Buckle Moccasins Slip On Loafer Flat Shoes,16,99,fisca
Woman's Shoes Cow Leather Flat Big Size 35-42 Oxford Shoes Women Loafers 2018 Casual Shoe Summer Shoes,23,75,Kenavinca
"Women's Barrelfish Boat Shoe, Grey - 5.5 B(M) US",45,63,
Gem,67,97,
"Women's Classics Comfort Casual Loafers Shoe Flats (7, Black)",9,95,Chasing Peace
Womens Hollow Out Leather Dress Loafers Casual Penny Flat Driving Slip on Loafer Shoes,10,42,Mewoocue
Womens Denim Slip on Flats With Canvas Toe Cap and Matching Pyramid Studs- Assorted Colors,6,99,G.C Womans Tech
Apollo Chukka (Embroidered),29,95,native
Women's D'Lites - A New Leaf Gray/White 11 B US,69,88,
Women's Debra Slip-On Loafer,145,00,
Women's Bright Sky Penny Loafers,54,95,
FootThrills Women's Midtown Slip-on Shoes,79,99,Foot Thrills
Women's Celia Moccasin,66,00,
M&F Western Women's Moccasin Slippers Pink/Mossy Oak Slipper MD (US Women's 7-8) M,29,00,Blazin Roxx
Swift Womens Floral Summer Shoes,14,95,Divaz
Womens Sloan,19,99,Not Rated
Womens Olive,120,00,
Women's Canvas Lace Flats Slip On Shoes Hipster Vegan Espadrilles,8,00,Enimay
"Women's Donna Hemp Flat (38 M EU/7 B(M) US, Black)",50,99,
Women's Harput Shadow Loafers,470,00,Dorateymur
Women's Gypsy Rae Slip-On Loafer,24,99,
Women's Mila Canvas Fashion Sneaker,16,99,
Women's Tirana Loafer,59,99,
Womens Olive,36,00,M4D3
Men's Moccasin,75,02,
Women's Dressy Pointed Toe Slip On Loafers Sneakers Low Heels Platform Shoes,34,96,
Women's Rolo Loafers,675,00,
"Women's Classics Comfort Casual Loafers Shoe Flats (8.5, Black)",12,95,Chasing Peace
Ladies Toning Rocker Shoes Womens Mesh Slip On Wedges Platform Walking,34,99,IINFINE
Footprints by Birkenstock Tirano Leather Shoe,59,99,Birkenstock
Women's Peach Painted Canvas Shoes Pink,59,99,UIN
Women's Elana-LB Slip-On Loafer,44,99,
Womens Pumps Ankle Strap Big Bow Pointed Toe Plus Size Stilettos Shoes Non-Slip,22,19,Fheaven
"Leather Slipper, Women's Slip-On Sandal Oxford Casual Mule Clog Comfort Walking Flat Loafer Shoes",69,98,gracosy
Women's Canvas Rope Slip On Easy Flat Vacation Shoes,11,18,Charles Albert
Women's Western Round Toe Platform Mid Heel Loafer Shoes,28,00,Charm Foot
Easy Spirit PIERS Black/Char 9.5,30,54,
Women's 10009721 Navy Painted Stripe Alpargata Flat,29,89,TOMS
Women's Leather Jutti Shoes,38,95,Step n Style
Charlene Women's Faux Leather Slip-On Loafer Flats Scalloped House Moccasin Shoes,32,58,SUNROLAN
Propet Womens Jasmine in Brownie/Black Size 7.5 C/D US,54,99,
"Causal Leather Loafers Women's Flat Driving Laces Slip-on Mocassins Shoes, Brown 10.5 (44)",16,99,LINGTOM
Unisex 3 in 1 Rome Shoes Light Outdoor Walking Sock-Like Sneakers Jogging Shoes,44,98,UB-ONEMIX
Han's Ladies WZ14007W Slip & Oil Resistant Restaurant Work Shoes for Women,14,99,Ferro Aldo
Van Eli Kimi Women's Slip On,59,99,
"Soft Silicone Rubber Gel Phone Cover 3D Cartoon Cute Bears Protective Skin For iPhone 6/6s,iPhone 7 Plus",3,29,Sikye
Women's Nimah Patent Loafer Flat,64,76,
Women's Real Leather Loafers Handmade Soft Comfortable Flat Loafers Handmade Casual Shoes,52,00,Duberess
Decoration Espadrilles Women Shoes Slip-On Loafer,16,99,U-lite
Women's Nalo Shoe,22,99,
Women's Center Peace Flat,64,79,
Women's Sintra Canvas Geometry Graph Painted Flats Shoe Black&White,69,99,UIN
Espirit Women ballerina boat pleated glitter bow knot & toe box Faux suede flats,6,99,VODA
Women's Jagger,59,98,
Women's Marilyn Loafer,153,56,ara
Womens Rolo,675,00,
Fashion Sneakers Flats Tie Dye Mandala Women's Classic Slip-on Canvas Shoes Loafers,22,99,D-Story
"Women's Back Less Platform Slip On - Fashion Slip on Sneakers - Loafer Slip On (9, Black)",79,95,BOBERCK
Women's Lelle3 Loafer Flat,130,00,
Women's Suede Bow Flat Sandals Open Toe Buckle Sandals,10,29,Fheaven
Pehuea Leather - Womens Casual Shoes Bronze/Dk Java - 10,100,00,
YRU Shoes Luna Cute Kitty Slip On Loafer Flat,24,00,Y.R.U.
Sunniva Patent Womens Leather Deck / Boat Shoes,43,07,
Women Sandals Flip Flop | Fashion Rhinestone Wedges Shoes | Crystal High Heels Shoes | Toe Ring Flat Sandals Summer,13,99,Fheaven
Women's Loafers Classic Casual Canvas Slip On Fashion Shoes Sneakers Flats Pineapple Fruit,22,99,InterestPrint
Women's Platform Tennis Comfortable High Heel Wedges Lightweight Fitness Walking Sneakers Shoes,34,66,BeautyOriginal
Womens Classic Flats Memory Foam Slip on Canvas Shoes Outdoor Sneaker Lazy Shoes,27,99,Coloranimal
Women's Razzi-s Slip-on Loafer,73,54,
Women's - Paisley Flats,14,90,
Women's Zaans Comfort Microfiber Fashion Shoe,78,00,UIN
Gamefish 3-Eye Knit Boat Shoe,54,99,
Women's Tofino Slip On,294,90,
"Women's Classics Comfort Casual Loafers Shoe Flats (7.5, Navy)",12,95,Chasing Peace
Womens Casual Slip On Stretchable Comfortable Flat Fashion Sneaker Loafer,14,95,Lia
Women's Comfort Slip-On Casual Leisure Soft Indoor Outdoor Sneaker Shoes,12,86,Amiley
Women's Fashion Leather Sneakers Comfort Platform Flats Slip-On Loafers Shoes,19,88,PASLTER
Hush Puppies Women's Jordyn Slip-on Loafer,29,99,
Authentic Original Vida Boat Shoe,52,99,
Womens Buckle Slip on Loafer Casual Low Flats Square Toe Shoes5PD-003,32,99,LIURUIJIA
"Loafers Women, Slip On Round Toe Basic Moccasins Shoes, Women Casual Flats",32,88,York Zhu
Fashion Sneakers Flats Cocker Spaniel Women's Classic Slip-on Canvas Shoes Loafers,22,99,D-Story
Womens Slip On Moccasin Loafer Comfort Flat,14,99,Wells Collection
Women's Omara Loafers,39,63,
Womens Bowed Loafer,177,99,Gravati
Women's Shoes 2018 New Running Shoes Women's Lightweight Breathable mesh Shoes,39,99,excellent.c
Pehuea Vivid Blue/Vivid Blue Womens Slip-On Size 9M,56,00,
Marigold Khaki/Chocolate Loafers US 6,69,99,
"Women Flats Shoes Slip On Comfort Shoes Flat Shoes Loafers (US:8( RU/EU/CN:39), Hot Pink)",10,89,Fheaven
"Women's 10002472 Canvas Alpargata Flat, Black, 8 M US",33,50,TOMS
Women's Tammy Flat,28,55,
"Women's SHLIM LTHR AF Formal Shoe,",31,86,
Women's Amica Slip On Loafer,176,32,
"Women's Cruiser Slip-on Shoe, Cappuccino, 6.5 B US",89,95,
Cruiser Chukka Women's Boot,89,95,
Rose Petals Women's Esther Slip-On Loafer,66,92,Rose Petals by Walking Cradles
Gravity Defyer Women's Women's Ballistic White/Silver/Pink Synthetic Leather/Mesh 10.5 Medium,29,14,SoftWalk
The Jolie Flat,45,97,Comfortview
Leather Loafer,9,99,Carol Wright Gifts
Woven Comfort Sneakers,24,99,Dream Products
Women's Horsebit Slide-on Mule - Slip On Loafer Slides Shoes,29,99,Luxury
Womens Leather Casual Flat Loafer Slip-On Slippers Driving Shoes,19,99,Clarsunny
Women's Laurel Spark Loafers,24,96,
Baylee Flat,34,99,Comfortview
Women's Leather Slip-On Loafers Outdoor Indoor Shoes (FBA),19,99,VLLY
"VISCATA Malgrat 2"" Rafia, Slip-On, Closed Toe, Mule Wedge Espadrilles Made in Spain",149,99,
Womens Flat Shoes | Pointed Toe Suede Shoes | Ladise Casual Low Heel Shallow Shoes,9,99,Inkach
Womens Florette Slipper,49,99,Wanted
Women's Fashion Shoes Lexington Golf Tan Grainy with Patent Kilt Moccassin Size 8,195,00,Marc Joseph New York
womens Low shoes cigar/loam/antique,107,94,Dorndorf/Remonte
Hybrid Stand Cover Rubber Impact Case Cover for Alcatel A30 Fierce（2017,4,00,Sikye
Women's Leather loafers Round Toe Flats Casual Slip On Boat Shoes,15,99,CUNZHAI
Women's Retro Leather Soft Slipper Loafers Flat Shoes,29,99,Minibee
"Women's Superstar Slipon W, Footwear White/Footwear White/CORE Black, 7.5 US",132,00,
Women Men Awesome 3-in-1 Lightweight Athletic Rome Sneaker Shoes,49,98,MT-onemix
"Women's Coil Ivy Water Canvas Slip-On Loafer,",41,99,
Forever Link Jimmi-06 Women's Slip-On Lace Moccasin Style Loafers,21,99,Coshare
Van Eli Nimbus Women's Slip On,99,95,
Barrelfish Animal Print Boat Shoe,62,00,
Girl's Lenny Mid (Little Kid/Big Kid) Light Mauve Corduroy 13.5 US Little Kid,46,51,TOMS Kids
Women's Black Retro Fashion Loafers Round Toe Slip on Flat Outdoor Slippers with Furry and Buckle Blue Velvet 10 B(M) US,48,99,ENMAYER
Women's Vulc N Vent Boat Canvas Shoe,43,01,
Elegant Women's Casual Faux Suede Beige Moccasin Loafers,3,95,Comfncy
Women's Leather Health Care Slip-On Loafers Nurse Shoes,12,90,Moonwalker
Women's Adel1 Slip-On,149,95,ara
"Women's Platform Slip On Loafers Leather Moccasins Wide Low Top Wedge Shoes (Khaki, US:6)",26,49,Fiaya
Women's Suede Leather Comfort Bowknot Slip-on Flats Loafer Driving Shoes,27,99,SUNROLAN
Women's Loafer Shoes Genuine Leather Casual Slip on Boat Shoes Flats,68,00,OZZEG
Women's Antonecia Metallic Slip-On Loafer,19,91,
"Women's Glitter Slip-on, Silver 5",74,95,TOMS
Summer Floral Sandals Women Platform Wedge Waterproof Slippers Shoes Dress Sandals,12,69,Fheaven
Audra - Black Suede Pointed Toe Loafer,89,00,
"Loafers Shoes Women, Metal Buckle Slip on Round Toe Shoes",30,88,York Zhu
Penelope Espadrille White,20,00,Savi
Van - Suede Loafer,235,00,275 Central
"Women's Jazzy Leopard Print, Loafer Flats, Shoes",14,99,AVON
Women's Mallory Ornamented Loafer,40,74,
Genette Arc Womens Heeled Loafers,119,95,
Loafers for Women Shoes Leather - 2018 Summer Slip on Loafers Ladies Comfy,16,99,Earsoon
Women's E76063 Slip-on Loafer,705,18,
Womens Kalika Slip-On,61,95,
Women's Santana-C Loafer Flat,82,99,
"Earthies Women's Lindi Perforated Flat,Bright Red Soft Buck,US 8.5 M",39,80,
Propet Women's Ladybug Shoe & Oxy Cleaner Bundle,79,95,
Women's Lovely Style Fashion Casual Loafer Flats Espadrille Shoes,19,99,LaRosa
Occupational Womens/Ladies Sure Track Slip On Work Shoes,75,95,
Women Bohemia Sequins Beach Sandals Wedge Platform Thongs Slippers Flip Flops,2,02,Bookear Sandals
Pisa Womens Casual Slip On Shoes,40,08,
Womens Emalin Casual Faux Leather Comfort-Sole Loafers,14,99,Brinley Co
"Marvel Exclusive (Women 12/Mens 10.5, Slip-on Marvel 7261)",114,99,
Women's Leather Loafers Shoes Driving Casual Slip-On Boat Flats,26,88,Otamise
Women's Nayla Loafers Shoes,19,51,Hardy
Genuine Suede Beaded Moccasins,7,99,Carol Wright Gifts
Women's - Fabric Slip-ONS,14,90,
Women's Sunset MLB Cardinals Boat Shoe,24,40,
Women's - Studded Flats,14,90,
Women's Latrice Dress Pump,98,40,Kate Spade New York
Women's Grant Flat,43,14,
"Mesh Casual Shoes,Walking Loafers for Women Breathable Lightweight Slip-On Soft Sole Elastic Shoe",29,98,Gracosy
Women's Honor Ashby Loafer Tan Leopard 8.5W,139,95,Vionic
Womens Opal Low Top Slip On Fashion Sneakers,23,20,Bar III
"Women's Leana Loafer Flat, Navy Combo, 10.5 N US",92,95,
Women's Buckle Casual Comfort Low Heel Loafers Shoes,26,00,Carolbar
Womens Peonies Embroidery Frog Buckle Casual Flats Loafer Shoes,19,99,AvaCostume
Flat Women Shoes Linen Canvas Slip On Loafers Memory Foam Gel Insoles OBJI-S,25,99,
"Women's Pehuea Slip On Shoes, Teal/Teal, 7 B(M) US",68,50,
"Womens Shoes Joy Loafer, Cognac Croc",59,49,SAS
Women's Stacey Bow Sneakers,70,80,
Women's Penny Loafers Flat Tassel Low Heel Sqaure Toe Leather Slip On Casual Shoes Black,8,99,Cicime
Women's Pinch Campus Penny Loafer,69,99,
Women's Blueberry,24,12,
Women's French Floral Embroidery Slide Slip-on Loafer,16,22,
Womens Trenoly Mesh Crossover Strap Mesh Overlay Slip-On Shoes,24,99,Not Rated
"Women's Classics Comfort Casual Loafers Shoe Flats (7.5, Black)",9,95,Chasing Peace
Womens Soft Leather Slip On Loafers Casual Flat Moccasins Shoes,13,99,DUOYANGJIASHA
"Women's Donna Hemp Flat (37 M EU/6 B(M) US, Black)",53,95,
Women's Backless Slip On Flower Decor Slide Slipper Loafer Flats,24,99,Urban Heels
Womens Carryon Loafers 6.5 Black,39,50,
Women's AS-Heloise Loafer,105,99,
Unisex Shoes Dachshund Pattern Casual Canvas Loafers For Bia kids Girl Or Men,35,68,HUANGDAISY
A2 by Aerosoles Women's Sleigh Ride Slip-On Loafer,51,06,
Unstructured Un.Brew,84,90,
Women's Sports-fan Comfortalbe slip-on Loafers Shoes,29,00,Charm Foot
"Women's Slip on Loafer Flat Canvas Sneakers Square Toe Shoes Pink Fluffy Llama,Alpaca",22,99,InterestPrint
Cathryn Women's Boots,69,99,BareTraps
Women's Dotty Flat,53,00,
The Hadlee Flat,48,99,Comfortview
Women Summer Breathable Woven Shoes Handmade Elastic Flat Slip On Shoes,23,30,Wanyesta
"Womens Audra Pointed Toe Dress Loafers Green 9.5 Medium (B,M)",59,99,
Lauren Ralph Lauren Women's Pia Loafer,85,98,
Women's Leather Casual Loafer Flat Shoes Moccasins,8,99,Cicime
"Women's Canvas Slip-On,Black,9 M",41,70,TOMS
Women's Loafers Casual Slip On Flats,22,99,InterestPrint
Women's Classic White Pull On Leather Work Utility Nurse Shoes Loafer Flats,31,50,mewow
"Women's Classics Comfort Casual Loafers Shoe Flats (7, Gray)",14,95,Chasing Peace
"Women's, Dyna KV7505 Slip on Shoes",64,98,Kanna
Womens Fashion Chunky Heels Patent Leather Loafer Shoes with Bowknot,33,99,Lucksender
Women's Daisy Mocassins Flats Shoes Slip On Leather Loafers Indoor Slippers,7,99,Enimay
Women's Breathable Woven Walking Shoes Lightweight Slip-on Loafers Flat Shoes,14,88,fereshte
Women's Casual Bow Tie Flats Slip On Comfort Mid Heel Moccasins Pumps Loafers Creepers Sneakers Platform Shoes,15,51,Maybest
Womens Genuine Leather Made in Brazil Weave Loafer,59,00,Marc Joseph New York
Women's - Fabric Slip-ONS,14,90,
Women's Celeste Slip-On,92,06,
Women's Meryl Slip-On Loafer,103,49,
Panapana Women PVC Jelly Glitter Lug Sole Loafer HC25,77,99,
Women's Royal Cap Toe Loafer W4D-3601,159,95,
Women's Loafers Classic Casual Canvas Slip On Shoes Sneakers Flats,22,99,InterestPrint
Women's Casual Lace-up Loafers Hollow Flat Shoes Summer Slippers,16,99,Blivener
Girl's Lenny Mid (Little Kid/Big Kid) Light Mauve Corduroy 12 M US Little Kid,46,51,TOMS Kids
Ladies Hairy Brown Driving Moccasins,99,95,Twisted X
"Women's, 493X7 Slip on Shoes",104,95,
Women's Winter Snow Boots Waterproof Insulated Outdoor Shoes,29,99,Dreamcity
Womens Kimberly Knit Sport Loafers,13,35,IMNYC Isaac Mizrahi
Women's Fleece Lined Loafers Flats Slip on Shoes,14,00,Hounds
Women's Rochelle Slip 316 1 Caw Fashion Sneaker,41,99,
Slip On Leather Loafers Summer Women Moccasin,10,69,Dear Time
Women's Burke with Crystals Sneaker,50,30,
by Kenneth Cole Women's Its So Fun Flat,103,99,
Women's Cute Round Toe Low Cut Elastic Slip On Sneakers Platform Loafers Shoes,32,99,SFNLD
Women's Leather Jooti Khussa Mojari Shoes,38,95,Step n Style
Women's Koi Fashion Sneaker,57,99,Penny Loves Kenny
Women's Spinnaker,95,00,
Classic Navy Canvas 001001B07 Womens 6.5,39,79,TOMS
Womens Arnold Sp3 Shoe,69,99,Flexus
Clearance Women Wedge Heels Ruffle Strap Sandals Peep Toe Buckle Strap Sandals Pumps Shoes,14,99,Fheaven (TM)
Women's Ladies Unlined Driving Moc Moccasin,39,99,Cloud Nine Sheepskin
Women's Comfort Elastic Woven Slip On Loafer Shoes,17,99,Alexis Leroy
Leather Loafers for Women Slip On Casual Soft Flat for Women,9,99,Shoexy
Women's Leather Casual Loafers Slip-On Slippers Moccasin Driving Flat Shoes,9,49,PhiFA
Women's Isabel Flat,35,99,
Unisex comfort Leather Fashion Soft Flat Faux Slip-on Loafers Casual Walking Shoes,14,00,Academyus
Womens Lana,725,00,
Women Metallic Leatherette Pointy Toe Slip On Loafer HF38,22,19,Alrisco
Paula Women's Slip On,37,99,ARRAY
D-Story Custom Sneaker Watercolor Flower Women Unusual Slip-on Canvas Shoes,29,99,Canvas Shoes
Women's Go Step Lite Glitz Slip ONS Charcoal 7 B(M) US,32,99,
Women's Rock On Air Comfort Slip-On Flat,28,00,
"Women's East END Loafer,",35,99,
Women's Loafers Casual Canvas Slip On Flats,22,99,InterestPrint
Women's Fabrina Loafer,178,97,
Womens Fielding,219,00,Michael Kors
Women's Amber Loafer Flat,79,69,Kelsi Dagger Brooklyn
Women's Braga Earthies Black Crinkled Patent Loafer,32,27,
Andrea Comfort Women's Casual Loafer with White Rubber Sole Colors,52,99,Dr. Scholl's Shoes
Casual Driving Shoe Women's Shoes Beard Striped Sneakers Flat White Shoes,9,99,Fheaven (TM)
Women's Penny Loafers Flats Low Heel Bow Tassel Slip On Formal Work Dress Shoes,18,99,Jiu du
"Women's Babette Loafer Flat,",44,99,
Women's Classic Canvas Red Slip-on Shoe - 7.5 B(M) US,48,51,TOMS
Women Lace Up Working Loafer Work Shoe All Day Comfortable Walking Everyday Office Shoe,47,99,Haricon
Womens Pointy Toe Checked Slingback Loafer with Ruffle Accent,39,90,AnnaKastle
Women's Mary Loafer Flat,71,95,
Laceless Low Top Womens Slip On,81,77,Mustang
Women Casual Black Oxford Shoes For Women Flats Comfortable Slip On Women Shoes Red Rhinestone 9,59,24,Dormery Shoes
Solstice MLB Women's Oxford,59,95,
Women's Stella Suede Slip-On Loafer,129,96,French Sole FS/NY
Women's Harper Slip-On Loafer,72,95,
Fashion Sneakers Flats Women's Classic Slip-On Canvas Shoes Loafers,22,99,D-Story
Tom's Women's Classic Canvas Slip-on (Natural),33,50,TOMS
Women's Gwyneth Slip-On Loafer,27,71,Dune London
Unique Debora Custom Casual Women's Slip-On Loafer Low Top Walking Shoes,54,99,Artsadd
Women's Color Lump Canvas Casual Slipper Multicolor,59,99,UIN
Women's Mochi,32,66,
Women Fashion Lightweight Soft Breathable Manual Suture Shoes Casual Leather Lace-up Loafers,51,76,Sun Lorence
Top-Sider Women's Authentic Original 2-Eye Loafers & Slip-Ons Shoe,74,90,Sperry
Women's Loafers Classic Casual Canvas Slip On Fashion Shoes Sneakers Flats Retro American Flag,22,99,InterestPrint
Women's Woven Classics Red Woven Loafer 12 B (M),52,00,TOMS
Women's Heartbreaker Flat,14,99,
"Earth Womens Taye Slip-On Shoe (8 B(M) US, Frost Grey)",54,95,Earth Origins
"Women's Donna Hemp Flat (36 M EU/5 B(M) US, Natural)",69,95,
Women's Eve (Kid Suede) Loafer Flat,127,37,
Women's Believer Synthetic Loafer,51,51,
Women's Foxy Espadrille,24,99,Nomad
FIC Rose Women Wide Width Step in Loafer (Nurse Styles),54,95,24 Hour Comfort
Women's Bella Espadrille Flat Loafer,67,99,
"Leather Soft Shoes, Women's Fashion Hollow Breathable Stitching Lace Up Flat Casual Outdoor Shoes",56,98,Socofy
Women's Noshu Flat,79,99,
Women’s Casual Pointy Toe Pumps Slip-On Comfy Low Heels Loafers Dress Shoes,39,99,Odetina
Women’s Leather Lace-up Casual Shoes Flat Driving Loafers,9,99,MORNISN
Croc Toe PT Casuals Women's Slip On,63,99,ALL BLACK
"Women's Liz Loafer,Black Cherry,12 N US",89,95,
Women's Trendy Round Toe Elastic Slip-on Low Heel Casual Walking Loafers Shoes,28,39,Passionow
Women's Color Glaze Breathale Lycra Walking Shoes Multicolor,78,00,UIN
Womens TW74,25,99,
Women's Brogue Karl Lagerfeld Open Toe Loafer Slide,103,77,
Stylish Breathable Mesh Comfortable Slip On Women & Men Galaxy Running Shoes,25,99,FOR U DESIGNS
Comfort Women's Genuine Textured Leather Mid Wedge,54,90,Andrea Shoes
Women's Emmaline Naplak Slip-on Loafer,263,68,
SHL Girls Women's Loafer Cartoon Print Canvas Slip On Shoes Casual Breathable Flat Sandals Shoes,9,99,Sunshinehomely
Women's Slip On Loafer Flat Canvas Sneakers Square Toe Shoes Pattern Dog Poodle Gray Pink,22,99,InterestPrint
Office Lady Women Pointed Toe Classic Slip On Business Casual Flat Shoes,6,99,FTXJ
Women's HayliespT8 Loafer Flat,42,38,
Matt and NAT Women's Vegan Ivy Loafer,95,00,Matt & Nat
"Earthies Women's Lindi Perforated Flat,Bright Red Soft Buck,US 9.5 M",39,95,
Women's Cassie 04 Slip-On Loafer,135,00,Romika
"Women's Flats Shoes, Round Toe Flats Summer Sandals Casual Slip On Loafer Comfort Leather Shoes",59,99,gracosy
"Clearance! Women Shoes,Flats Shoes Genuine Leather Shoes Cutout Loafers Slip On Ballet",11,89,Fitfulvan
Heather Suede 40MM Espadrilles Wedges in Leccio,298,00,
"Women's Grand Street Loafer, Pewter Grainy, 8.5 M US",69,00,Marc Joseph New York
"Women's Zitah,",59,99,
x Fusion Kawaii Espadrille Slip-on Loafer Pineapple Made in Spain,39,99,Dorothy Mambo
Ginger Washable Sneaker Black/Grey,47,95,Comfortiva
Womens Fashion Plaid Striped Kitten Heel Dress Pump - Pointed Toe Metal Buckle Penny Loafers Shoes,38,89,Btrada
Women's Gael Loafers Shoes,36,97,
Women's Almond Flat,23,17,
"Women's Classics Comfort Casual Loafers Shoe Canvas Slip-On Flats (6.5, Tan)",14,95,Chasing Peace
Women Flat Velvet Khussa Shoes Punjabi Jutti Traditional Mojari Loafer Pumps,38,95,Step n Style
"Single Shoes,Sikye Comfort Leisure Work Outside Flat Shoes Slip On Shoes Low Heel",9,30,Sikye
Classics Burlap Casual Shoes,39,84,TOMS
Women's Classic Flats Casual Comfortable Flat Slip-On Loafer Sneaker Shoes Zebra Striped,22,99,InterestPrint
Womens Donna Palma Shoes,53,11,
Women's Guyana Microfiber Slip-On Shoes,78,00,UIN
Women Synthetic Slip On Low Height Loafer Regent-04 (Silver),19,99,
Cute Bowknot Comfort Boat Shoes Non-Slip Rubber Sole Driving Penny Loafer Shoes For Women,35,99,T-JULY
"Women's Pehuea Slip On Shoes, Vivid Blue/Vivid Blue, 8.5 B(M) US",56,00,
"LG V30, Hard PC Soft Silicone Impact Resisant Hybrid Case Cover LG V30",3,99,Sikye
Women's Total Motion Smoking Slipper Ballet Flat,51,69,
Women's Eden Loafers,104,83,
Women's Studded Moccasin,44,95,
Womens Faye Gored Vamp Slip On Shoes,17,48,
RKH229 Women's Comfort 4ever T-Strap Shoe,125,70,4EurSole
Women's Loafers Slip on Low Wedge Heels Works Footwear Casual Shoes,22,99,VASHOP
Women's Chic Bows Low Top Low Heel Loafers Shoes,28,00,Show Shine
"Women's Grand Street Loafer, Pewter Grainy, 6.5 M US",79,00,Marc Joseph New York
Women's Classic Loafers Casual Flat Suede Walking Shoes Round Toe Cute Bow Slip on Sneaker Shoes,9,99,MORNISN
Women's Tassel Slip on Loafers Shoes,16,00,Latasa
"Women's Classics Comfort Casual Loafers Shoe Flats (11, Navy)",12,95,Chasing Peace
Steffi 57 Womens Casual Slip On Shoes,56,52,Josef Seibel
Topsider Women's Songfish Sparkle 2 Eye Boat Shoe Grey 6 M US,89,95,Sperry
"Women's Classics Comfort Casual Loafers Shoe Flats (10, Black)",9,95,Chasing Peace
Women's Natal Flat,25,00,
Women Summer Wedge Sandals Solid Flock Peep Toe Cross Sandals Flatform Shoes Non Slip,13,99,Fheaven
"Women's Classic Canvas Slip-On,Ash 9",45,99,TOMS
Gamefish 3-Eye Knit Boat Shoe,70,00,
"Women's Carm01j1 Slip-On Loafer,",30,00,
