product_name,price_int,price_dec,seller
Womens Anemone,46,99,
Women's Heartbreaker Loafer,23,92,
Womens Heartbreaker Closed Toe Ballet Flats,17,49,
Women's Wren,250,00,
Women's Stella Woven Slip On Shoe Pewter Bronze,49,99,Zee Alexis
Zenobia Women Loafer Slip on Moccasins Driving Shoes,24,99,Ashley A Collection
Women's Honor Ashby Loafer Natural Snake 7.5M,74,78,Vionic
Women's Moccasin Slip-On Loafer,35,99,
Women's Fringe Bootie Moccasin with Memory Foam,99,95,SoftMoc
Women's Bows Retro Cuff Chunky Mid Heel Platform Loafers Shoes,28,00,Carolbar
Women Shoes Faux Suede Slip On Comfort Penny Loafer Flats,24,99,MaxMuxun
Women's Elimental Slip-On Loafer,16,14,
Women's 7 Seas Sport Boating Shoe,54,99,
Women's Genuine Leather Driving Shoes Slip-on Boat Loafer Moccasin Shoes Flats,39,99,XIN BU
Womens - Garcia,59,97,
"Women's, Strand Key Slip on Boat Shoes",34,98,Sperry
Womens Comfort Casual Flat Leather Work Walking Moccasin Shoes Loafers Flats,18,99,WenHong
Women's Ginevra Ballet Flat,50,39,
Women's Tbio in Granite popa Leather - Black/White Embossed - Size 38 M,254,90,
Women's Walden Shine Glitzy Slip Loafer Flat,27,82,
Women's Lisa-W,49,99,Apex
"Loafers Flat Women,Casual Embroidery Flower Hollow Low Heel Fisherman Shoes",32,99,GilesJones
Women's Rain Down 2 Metallic Mule Slip on Loafer Flat,18,80,
Women's Honor Ashby Loafer Red 7M,69,99,Vionic
"Womens Mable Closed Toe Loafers, Navy, Size 7.0",47,99,
Women's Mable Ballet Flat,21,79,
Gamefish 3-Eye Knit Boat Shoe,70,00,
Konfetti Womens Snowflake Slipper Sock Swedish Moccasin,36,95,
Women's Gold Plated Slide on Slip on Mule Loafer Flats Shoes by,15,99,LUSTHAVE
Women's Adora Flat,14,83,SoftWalk
TOMS Disney Snow White Luca Girls' Toddler-Youth Slip On 12 M US Little Kid Blue,54,95,TOMS Kids
Womens Bowl,87,99,
"Sneakers For Women And Men, HOT SALE !! Farjing Lightweight Athletic Running Shoes Breathable Sport Fitness Jogging...",23,29,Farjing
Women's Spinnaker Oxford,15,99,
Womens Dion,97,99,
Women's Buzzy Driving Style Loafer,86,39,Roper
Women's Rio Suede Sneaker,99,95,TOMS
Women's Honor Ashby Loafer Khaki 6.5W,89,99,Vionic
Womens Wrap ColorLite Perforated Loafer Shoe,26,99,
"Women's, Gael Bobtail Slip on Shoes",34,69,
Women's Toledo Printed Comfort Slip-On Shoe Yellow,69,99,UIN
Women's Dressy Low Heels Slip On Faux Suede Oxfords With Bows,31,99,Easemax
Womens acajou,44,99,
"Women's Canvas Slip-On,Navy Canvas,10 M",39,79,TOMS
Women's Moccasin,52,50,RJ's Fuzzies
"Women's Lisette Loafer Flat,",99,00,
Shoes For Womens -Clearance Sale ，Farjing Women Flat Thick Bottom Shoes Slip On Ankle Boots Casual Platform Sport...,11,99,Farjing
Women's Lourie Sneaker,98,95,Nanette Nanette Lepore
Women's Bala Oxford,42,46,
Cushionology Fallon Lace Up Court,29,99,Foot Petals
"Women's Gita Slip-On Loafer,",22,49,
Women's 44.169,70,99,Gabor
Women's Walu Wild Graphic Loafer,15,00,
Women's Comfort Leopard Print Flat Loafer Shoes,26,00,Charm Foot
Women's Embroider Espadrilles Flat Shoes Slip-On Loafers,25,00,Ryamag
Women's Weslir Fabric Loafer Flat,54,82,
Women's Frances Textured Leather Strap,58,99,
Intrepid Womens Plaid/Dark Tan Boat Shoes,37,17,
Women's Avi-Aura Loafer Flat,21,99,
Women's Honor Ashby Loafer Tan Leopard 8W,139,95,Vionic
Women's Vilma Loafer Flat,15,00,Brinley Co
Womens Casual Luxury Leather Driving Classic Moccasins Slip-on Loafers Boat Shoes Flats,42,99,Goeao
Beach Comb Leather Shoe,59,49,Diba True
Women's Aimee Elastic Slip-On Loafer,78,98,
Women's Style Kavala Leather Slip-On Shoe,89,99,
Women's Cute Tassels Waterproof Loafers School Teens Girls Oxfords Dress Flats Shoes Size 4-11,29,99,HiEase
Women's Nantucket Loafer 8 Argento Metallic,59,99,
Women's Truflex W Slip On Shoes,39,99,
Women's Casual Flat Leather Tassel Loafers Driving Shoes,29,01,Minibee
Women's Ilda Slip-on Loafer,118,99,
Women's Toni Tassel Loafer,76,45,
Summit by Women's Braxton,74,58,
Sandals For Womens -Clearance Sale ，Farjing Fashion Women Peep Toe Hanging beads Buckle Strap High Heels Wedge Slope Sandals,11,99,Farjing
Women's Believer Synthetic Loafer,22,49,
Womens Carryon Loafers 8.5 Black,39,50,
Women's Cameroon Embossed Loafer Sneaker,128,84,KAANAS
Women's Lupe Slip-on Loafer,47,98,
"Marvel Exclusive (Women 6/Mens 4.5, Slip-on Marvel 7261)",129,99,
"BCBG Generation Women's Justine Crystal D MS/CRYS Loafer Flat,",35,99,
Girl's Luca Disney Princesses (Little Kid/Big Kid) Pink Sleeping Beauty Printed Canvas 12.5 M US Little Kid,51,10,TOMS Kids
Womens Porter Leather Closed Toe Mules,50,38,
Flats Shoes Women's Natural Comfort Walking Flat Driving Moccasins,14,89,Comfity
Non-Slip Breathable Women Casual Mules Shoes Slippers Summer Ladies Loafer Canvas Shoes Slides,29,99,PRETTYHOMEL
Women Thick Sole Pumps Shoes,29,96,CarziCuzin
Women's Bingo Slip-on Loafer,59,99,
Girl's Luca Disney Princesses (Little Kid/Big Kid) Blue Snow White Printed Canvas 13.5 M US Little Kid M,53,74,TOMS Kids
Women's Jake Flat,18,27,
Shenn Women's Comfort Casual Slip On Leather Loafer Flats,29,59,Generic
Women's Leather Floral Loafers Flats Shoes Slip-ONS,12,99,Fangsto
Women's Cypress Slip-on,40,99,
"Women's Tifferson Loafer,",328,00,
Women's Cowhide Glove Shoes Ballet Flat Loafer,35,00,Mordenmiss
Arielle Flats,34,99,Comfortview
Women's Rhodes,19,95,Jellypop
Women's Savor-Singular Slip-On Loafer,19,76,
Women's Canvas Slip-On,33,50,TOMS
Women's Keaton Slip-On Champagne Chunky Glitter/Metallic Nappa 8 M US M,99,00,MICHAEL Michael Kors
Women's Keaton Slip-On Champagne Chunky Glitter/Metallic Nappa 9.5 M US M,99,00,MICHAEL Michael Kors
Women's Keaton Slip-On Champagne Chunky Glitter/Metallic Nappa 9 M US M,99,00,MICHAEL Michael Kors
Women's Keaton Slip-On Champagne Chunky Glitter/Metallic Nappa 8.5 M US M,89,94,MICHAEL Michael Kors
Women's Keaton Slip-On Champagne Chunky Glitter/Metallic Nappa 7.5 M US M,99,00,MICHAEL Michael Kors
Women's Keaton Slip-On Champagne Chunky Glitter/Metallic Nappa 7 M US M,99,00,MICHAEL Michael Kors
Women's Keaton Slip-On Champagne Chunky Glitter/Metallic Nappa 6.5 M US M,99,00,MICHAEL Michael Kors
Women's Keaton Slip-On Champagne Chunky Glitter/Metallic Nappa 10 M US M,99,00,MICHAEL Michael Kors
Women's Keaton Slip-On Champagne Chunky Glitter/Metallic Nappa 6 M US M,99,00,MICHAEL Michael Kors
Womens Bari W0S-4681C1,153,00,
Moby-07 Womens Flat Shoe with Gold Embellishment,12,93,
Women's Loafers Classic Casual Canvas Slip On Fashion Shoes Sneakers Flats,22,99,InterestPrint
Women's Leather Casual Loafer Shoes Slip-On Flats With Flower,32,99,Soojun
Novelty Design Women Canvas Slip On Shoes Loafer Shoe for Summer,27,99,Instantarts
Women's Fringe Maple Tan Moose Hide Leather Moccasin Shoes,72,95,Bastien Industries
Glee Black Womens Slip-On Size 8M,58,99,
Women's Anna Painted Canvas Slip-On Shoes Fashion Travel Shoes,59,99,UIN
Women's Showcase Loafer Flat,31,86,
Women's Porto Knit Comfort Color Walking Shoes,69,99,UIN
Women's Analise Clever Loafer,52,08,
"Hand Knit Sneakers, Women Colorful Rocker Sole Shoes Handmade Knit Shake Shoes Slip ONS Sneakers",19,99,Dometool
Women's Go Step Lite-Streak Walking Shoe,38,11,
Women's Oxford Shoe Slip-On Leather Low Heel - Vintage Loafers Gilrs- Flat …,18,99,JUDY
WDM0106 Women’s Driving Moccasins,89,99,Twisted X
Womens Tisha Closed Toe Slide Flats,26,99,
Women's Leather Loafers Moccasins Black,425,00,Tod's
Women Loafers Slip On Tassel Platform Sneakers Comfort Suede Driving Moccasins Shoes Low Top Wedge Shoes,32,99,LeoVera
Women's Front Cutout Slip-On Low Block Heel Loafer,19,90,Cambridge Select
Women's Marta,349,95,Pas De Rouge
Women's Bobs Plush-Jacquardy Party,39,99,
Women's Casual Leather Mother Loafers Boat Shoes Driving Footwear for Woman,17,99,Always Pretty
Women's Harper Kiltie Tie Ballet Flat,35,98,
"Boots For Women, HOT SALE !! Farjing Vintage Style Flat Booties Soft Shoes Set Of Feet Ankle Boots Middle Boots",10,99,Farjing
Womens C1115 Slip-on Sneaker,157,99,
Women's Rome Slip-On Loafer,36,34,
Women's Pointed-toe Slip on Loafers Shoes,28,00,Latasa
Women's Vegan Penny Loafer,105,00,Ahimsa
Women's Zain Slip-on Loafer,18,38,
Women's Vallaint Leather Loafer Flat,28,30,
Women's Leather Backless Lazy Loafers Flats Slip On Mules Walking Slipper Shoes,19,99,Bumud
Women's Analise Clever Loafer,59,71,
Eden - Women's Bow Knot Adorned Loafers - Suede Leather Comfortable Flat Slip-On Shoes,59,95,PIC/PAY
Classic Slip On Loafer Women's Comfortable Low Flats - Casual Penny Loafer Comfort Walking Shoe,22,00,
Propet Women's Onalee Shoe & Oxy Cleaner Bundle,64,95,
Women's Oksana Loafer,59,95,
Women's Braiden Slip-On Loafer Pump,85,00,
Gamefish 3-Eye Knit Boat Shoe,109,10,
Women's 10009729 Tan/Gold Starfish Alpargata Flat,27,50,TOMS
Women's Turquoise/Leopard Driving Moccasins - Wdm0058,52,97,Twisted X
"Women's Spring Floral Fling Flat, Multicolored",18,99,AVON CUSHION WALK
Women's Trixie Loafer,59,99,
"Women's Natural Soul, Forsure Slip-on Shoes BROWN",33,99,NATURAL SOUL
Amrisa Flats,29,99,Comfortview
Womens Yulene Oxford,119,99,
Women's Real Leather Soft Comfortable Flat Loafers Handmade Casual Shoes,32,00,Duberess
Womens Hawk,119,95,
Women's Ta-Relative Loafer,89,00,
"400 Dollar Italian All Leather Womens Sophisticated Flat, Erin",69,99,JAY KAPLAN
MIA Women's Niles Loafer Flat,20,05,MIA Amore
Cushionolgy Finley Twin Gore Slip-on,29,99,Foot Petals
Women's Leather Platform Slip on Loafers Comfort Moccasins Low Top Casual Shoes,29,99,Ruiatoo
Women's Rainbow Platform Smoking Slipper Flat,46,45,Soludos
Women's Slip On Stretch Platform Creeper Loafer,23,76,DbDk
Womens Leather Slip on Flat Oxfords Shoes Fringe Low Heel Loafers Shoes,28,99,Meeshine
"Women's Richard Suede Sandal,",53,79,
Women's Sailaway 2 Fray Boat Shoe,60,88,
Shark Fish Blue Classic Women's Canvas Slip-Ons Loafer Shoes Sneaker,58,56,seventtynine
Womens Carryon Loafers 8 Navy,39,50,
Women's Polyurethane Suede Flats Slip On Loafers Driving Moccasins Soft Walk Boat Shoes,7,99,SUNROLAN
Fashion Sneakers Flats Sea Wave Women's Classic Slip-On Canvas Shoes Loafers,22,99,D-Story
Women's Casual Rhinestone Slip On Loafer/Slip On Flats,23,99,Italina
Girl's Luca Disney Princesses (Little Kid/Big Kid) Blue Cinderella Printed Canvas 13.5 M US Little Kid,51,10,TOMS Kids
Women's Farley Studded Open Toe Slide Sandal,160,00,
Dr. Scholl's Women's Fresno Moccasin Loafer,25,00,Dr. Scholl's Shoes
"Lorna Snake Embossed Penny Loafer, Black/Black, 5.5 M US",14,50,
Women's Fay Embellished Slide Smoking Loafer,12,31,
Women's Azur Cora Nubuck Boat Shoe,36,00,
Booties For Womens Clearance Sale ，Farjing Women Boots Flat Low Hidden Wedges Cutout Ankle Boots Casual Shoes Cute Booties,12,99,Farjing
Prospect Park Women's Easy Slip-On 2-Way-Strap,79,99,Orthofeet
"Women's, Daydream Slip on Shoe",29,99,
Women's Right Nina - K200441 White Natural 38 B EU,97,99,
FIC Agatha Women Adjustable Wide Width Dress Loafer for All Occasions (Measurement Chart),74,95,24 Hour Comfort
Women's TA-Paulina Loafer,29,19,
Women's Suede Slip-on Driving Moccasins Loafers Flat Shoes,14,99,fereshte
Women's Midge Flat,11,23,
Ladies Canvas Slip-On Loafer - Farasion,7,99,FARASION
Deerstags Women's Birch Moccasin,14,99,
"Women's Aminah Loafer Flat,",100,00,
"Women Flats, Concise Loafers Ballet Flats Slip-On Pointed Toe Buckle Shoes",38,79,Owen Moll
Whiz Women's Slip On,59,95,Bellini
Women's Fringe Moose Hide Leather with Heavy Oil Tan Sole Earthing Ankle Moccasins,98,95,Bastien Industries
Women's Iqushion Ergonomic Flip - Flops & Travel Sunscreen Spray Bundle,36,00,
Unisex Stylish Cute Cat Dog Owl Animal Pattern Mesh Comfortable Slip On Running Shoes,25,99,FOR U DESIGNS
Womens Square Toe Retro Fashion Loafers,28,00,Carolbar
Sport Brittany Women's Oxford,74,80,
Women's Linda-W,49,99,Apex
Women's Liteside Slip-on Loafer,27,86,
Women's Faux Leather Lace Up Boat Shoes Slip On Loafers,16,99,Ollio
TOMS Disney Snow White Luca Girls' Toddler-Youth Slip On 2 M US Little Kid Blue,54,95,TOMS Kids
Goat Suede Slip-on 3707 - Tom's-like shoe with Cork Orthotics,80,00,OTZ Shoes
Fheaven (TM))) Women Slip On Dress Pump Casual Low Block Heel Solid Fashion Loafer Single Party Shoes,10,99,Fheaven (TM)
Women Tassel Suede Moccasin Flats Non-Slip Sole Casual Shoes Slip on Loafers,10,99,Fheaven (TM)
EnlleviiD Women Slip-on Suede Driving Moccasins Platform Loafers Comfort Walking Work Shoes,35,89,EnllerviiD
Women's Hudley2 Loafer,98,95,
Leni-3,15,99,Circus by Sam Edelman
Womens Bari W0S-4679,94,99,
Women's Casual Lace up Loafers Hand-Sewn Flat Suede Shoes,24,96,Fmshutp
Genuine Leather Women Soft Flats Casual Loafers Slip On Comfort Shoes,18,59,Vivident
Women's Adult Tori,19,99,AmeriMark
Andrea Women's Shoes Cushion Anatomic Loafer Mid Wedge Wine Genuine Leather,53,90,Dr. Scholl's Shoes
Ladies / Womens Suede Sheepskin Moccasins / Slippers with Rubber Sole,29,99,ABSOLUTE FOOTWEAR
Keaton Slip on Sneakers,178,52,MICHAEL Michael Kors
Womens Keaton Slip-on,129,00,MICHAEL Michael Kors
Women's Pointed Toe Embroidered Tiger Mule Loafer Slipper,24,16,Elegant Footwear
Women's Juhi Perforated Slip On,57,49,
Women Cute Lips Fashion Sneaker Cosplay Glitter Slip-On Loafer Casual Shoes Costume Footwear,39,99,DolphinBanana
Women's Daelyn Summit Slip-On Loafer,25,00,
Women's Casual Tassel Loafers Slip On Nurse Shoes Driving Flat,18,99,Minibee
Women's Tf Chaya Slipon Shoes,89,99,
Women's Leather Khussa Flat Sandals Loafer Jaipuri Jutti Shoes,36,95,Step n Style
"Rockport Women's Cobb Hill Galway Perf Gigi Loafer,Grey Leather,US 9 M",44,99,Rockport Cobb Hill Collection
Women's University Classic Stripe Shoe,68,95,TOMS
"Spring Step Pro Women's Belo Antibacterial Textile, Rubber Loafers",9,95,Spring Step Professional
Women's Loafers Classi Slip On Shoes Flats,22,99,InterestPrint
Women's BEV Pumps Shoes,14,76,
"Women's, Ashland Blush Slip on Shoes",39,99,
Women's Honor Ashby Loafer Champagne 9M,70,00,Vionic
Clearance Sale Shoes For Women，Farjing Fashion Women Air Cushion Round Head Breathable Leisure Sports Shoes Shake Shoes,14,59,Farjing
Vinny Loafer Shoes CS0717,298,00,
"Women's Mac Slip On Mule Fashion Sneaker, Backless Flat Casual Walking Shoes, Laceless Loafer",24,99,
Earth Womens Violet Slip-On,29,99,Kalso Earth Shoes
Womens Marcela 14 Suede Closed Toe Loafers,33,24,Adam Tucker
Women's Yellowtail Slip on Shoes,57,83,Xtratuf
TOMS Women Classic Slip On,36,66,TOMS's
"Women's Canvas Slip-On,Navy Canvas,8 B(M) US",54,99,TOMS's
Women's Memory Fanelli Mesh Classic,29,99,
Topsider Women's Songfish Sparkle 2 Eye Boat Shoe Grey 9 M US,89,95,Sperry
Womens Flintia,49,87,1.STATE
Women Casual Comfortable Loafers Shoes Women Lace up Oxfords Shoes Black,35,96,York Zhu
Women's Ellis Slip On Casual Loafers,35,60,
Women's Therese Slip-on Loafer,51,98,
Women's Gemma Flats Shoes,45,99,
Women's Nuwlywed Slip-on Loafer,44,48,
Women's Harlan Loafer Flat,35,99,
Women's Lace-Up Canvas Casual Loafer Slip On Flats Shoes,14,32,Maybest
"Women Flats Shoes, Fashion Canvas Stripe Slip on Loafers",35,69,York Zhu
Footwear Womens Women's Touch Sneaker,111,05,
Women's Polley Mary Jane Flat,44,99,
Shoe 700323-03N Black Kanoni,160,00,
Womens Embroidery Classics Casual Shoes Strappy Wedges,26,99,AvaCostume
Birdie Women's Slip On,57,99,Bellini
Womens Comfort Sole Faux Suede Square Toe Loafers,14,99,Brinley Co
Women's Square Toe Wedding Evening Party Shiny Sequins Loafer Flats,26,00,Carolbar
Women's Oak Pure Color Canvas Slip On Shoe Off-White,59,99,UIN
"Women's Koifish Herringbone Tweed Boat Shoe,",67,50,
"Women's Natural Soul, Forsure Slip-on Shoes BROWN 8 W",33,99,NATURAL SOUL
Glee Black Womens Slip-On Size 7M,47,20,
"Platform Sneakers Women Mesh, Wedges Mid-Heel Casual Work Loafer Shoes 4 Colors Size 5-9.5",21,90,ACE SHOCK
"Women's Fashion Tassel Pointed Toe Ballet Flats Casual Slip-on Loafers, Girl's Walking Shoes",34,99,Btrada
Renova sox Women,52,02,Hey Dude
Women's True Blue Slip-On Loafer,27,63,
Haori Comfort Leather Lace Wedge,99,95,Akaishi
Women's Stylish Comfort Platform Wedge Heels Loafers Party Work Dress Flat Shoes,34,69,DecoStain
Womens Caroline Leather Square Toe Loafers,65,99,MICHAEL Michael Kors
Women's Kana Slipper,79,99,
Classics Flat Casual Loafer Soft Daily Go Walking Slip-On Driving Sneaker Girl's Women's Shoes Black,14,99,ALBBG
Women's Oni Fabric Loafer Flat,32,99,
Women's Sounds of Nature Painted Canvas Slip-on Shoe Blue,59,99,UIN
Womens Lolita Slip-On,59,85,
Fheaven (TM))) Women Wedge Shoes Round Toe Lace-up Canvas Boots Casual Booties Shoes,20,99,Fheaven (TM)
Women's Jean Loafer Flat,68,40,
Girl's Luca Disney Princesses (Little Kid/Big Kid) Blue Snow White Printed Canvas 6 M US Big Kid M,54,95,TOMS Kids
Women's N5302 Dolce Black/Coral Loafer Flat,129,90,El Naturalista
"Women's Classic Canvas Slip-On,Ash 8.5",40,55,TOMS
Pescao Low Top Canvas Slip-On WNS 9,70,00,Bucketfeet
Propet Women's TravelActiv Woven Shoe & Oxy Cleaner Bundle,64,95,
Women's Leather Loafers Moccasins Heaven Black,425,00,Tod's
Women' Soft Faux Leather Moccasin Loafer Slip On Shoes (Miss-07/Vivi-04),9,99,Shoelace
Women's Un.Maple Slip-On Loafer,51,15,
Womens 41757 Mariah 57,62,50,
Pescao Low Top Canvas Slip-On WNS 6,70,00,Bucketfeet
SUNBATHE' Women's Moccasin,39,99,
Dainzuy Women's Slip-On Mesh Walking Shoes Nurse Shoes Casual Moccasin Loafers Driving Shoes Plus Size,7,99,Dainzuy Women's Shoes
Ladies Hooey Loopers,69,95,Twisted X
"Flats Loafers Women,Classic Suede Moccasins Platform Sneakers Slip On Wedge Shoes",45,59,GilesJones
Cleo | Women's Ankle Strap Gladiator Sandal Handcrafted Flat Suede Comfortable Huarache,41,21,PIC/PAY
Womens Tionna,39,99,
Fashion Sneakers Flats Women's Classic Slip-On Canvas Shoes Loafers,22,99,D-Story
Boy's Alpargata (Little Kid/Big Kid) Cement Micro Corduroy/Synthetic Leather 4 M US Big Kid,42,00,TOMS Kids
Women's Leather Casual Slip on Flowers Flats Loafers Cozy Slipper Walking Driving Soft Peas Moccasins,23,99,DoraTasia
L`Artiste Womens Greentea Slip-On,119,94,L'ARTISTE
Women's Leather Loafers Driving Flats Casual Lace Ups Boat Shoes Slip On,19,79,CUNZHAI
Women's Loafers Classic Casual Canvas Slip On Fashion Shoes Sneakers Flats Skull Pink Flowers,22,99,InterestPrint
Women's Slip-On Stretch Driving Loafer Comfort Flat Shoe,25,28,Refresh Footwear
Womens Gaea,40,50,
"Women's Women's Crepetray Slip on Loafer, White, 42 Medium EU (11-11.5 US)",104,64,
Larissa Womens Lace Up Oxfords,39,10,
Women's Style Sideway Leather Slip-On Shoe,79,95,
Women's Petula Viola Flat,57,90,
"""Reyes Slip-Ons Black/Lunar 8.5 M",104,95,Klogs USA
Audio Women's Slip On,124,95,
Women's RAMORE Loafer,48,97,
Dinah Women's Loafers - Classic Elegant Loafer,29,40,PIC/PAY
Shoes Women's Hunny Babe No-Lace Wing Tip Casual Oxford Shoe,19,99,Wanted
Women's Beatrix Loafer Flat,91,90,Splendid
"Women's Trulia Loafer,",125,00,
"Women's Loafers, Round Toe Leather Moccasins",44,00,AUSLAND
Women's Studded Grommet Slip-on Espadrille Flats,7,18,Bella Marie
"Women's, Estelle Slip ons",114,94,Eric Michael
Women's Shore Thing Sandal,69,99,The FLEXX
"Air Max Tavas FB GS Kids Sneaker Yellow 845112 700, Size:38.5",69,95,
for Work Women's Resistant slip Flat,45,00,
Women's Sunset MLB Cubs Boat Shoe,59,95,
Active Breathe Easy-Untroubled Women's Slip On,58,88,
Women's Mimix Romp Casual Slip-On,49,99,
"Women's Kelsey,Black,10 W US",65,43,
Varsity Letter Women's Slip On,46,99,
Womens A1342,77,99,
Women's Slip Resistant Work Loafers Casual Walking Shoes Flats Comfortable Leather Slip-On Arch Support,18,99,Ball-Band
Loafers for Women Mules Shoes Square Buckle Backless Slip On Loafers White Black Green Yellow Slippers Size 5.5-10.5,28,99,Eithy
Women Pointy Toe Slip on Flat Sneaker Oxford Boat Shoe,118,98,Bradley Swansonkk
Unisex Relief Full-Length Orthotic No Color XL12,34,95,Vionic
"Women's On the GO Breezy Boat Shoe, Light Blue",42,85,
"Women's Classic Canvas Slip-On,Ash,6.5 M US",40,01,TOMS
"Earthies Women's, Lindi Slip on Flats Biscuit 7.5 M",34,80,
Beez Mules Women | Black/Metal Studs,29,89,
"Women's Onosha Satin Sneaker,",35,08,
Women's Beaded Kilty Moccasin,52,99,
Women's Kaymann Smoking Exotic Tuxedo Loafer,13,00,
Women's Verona Woven Travel Walking Shoes,75,00,UIN
Women's Taylor Slip-On Loafer,39,99,
ROBINSR Women's Leather Slip Resistant Shoe,50,43,
Women's Keaton Slip-On Flat,34,99,
Women's Be Together Painted Travel Canvas Shoe Yellow,59,99,UIN
Gomera Women Flats Shoes Sandals,254,90,
"Blue Striped Loafers - Comfortable, Non Slip Shoes",16,99,The Paragon
Womens Bowed Velukid Slip-On Loafer,177,99,Gravati
Women Fashion Pointed Toe Ballet PU Flats Casual Walking/Working/Party/Dress Shoes Slip-on Loafers,29,99,Btrada
Women's Milton Boat Shoe,39,99,
Paulas Women's Leather Casual Flat Loafer Shoes,44,08,
Women’s Handmade Soft Sole Leather Loafers Shoes Casual Comfortable Slip-on,53,99,URVA
Women's Trend Cozy Lace Up Work Shoes Casual Flat Sneakers,29,99,Mordenmiss
Checked Canvas Women Espadrilles,17,99,Alexis Leroy
OVERMAL 2018 Womens Flat soft Fluffy Faux Fur Flat Slipper Flip Flop Sandals Shoes,12,14,OVERMAL Shoes
Womens Vero 2 Fabric Closed Toe Loafers,38,99,Marc Fisher
Women's Shanghai Mule,44,99,
Women's Poco Dress Pump,112,50,
Women's Lilac Loafers,99,33,Drew Shoe
Women Leatherette Round Toe Slip On Clog BH36 - White,27,89,Refresh
Women Patent Leather Penny Loafers Comfort Slip On Flat Dress Shoes,29,99,HKR
Earth Womens Tayberry Washed Gold Slip-On - 6,49,99,Kalso Earth Shoes
Women's Honor Ashby Loafer Natural Snake 8.5W,74,95,Vionic
Womens Cynthia Leather Closed Toe Loafers,74,98,
Women's Jump Painted Canvas Shoes Multicolor,59,99,UIN
Women's Janis,49,00,
Naturalizer for Sure C2222p1201 Oxford Pu,33,99,NATURAL SOUL
Women's Long Drive Loafer,59,99,
"Earthies Women's, Lindi Slip on Flats Off White 9 M",39,80,
Womens Quebec,555,00,
"Flat Backless Loafer / Mule, Rose Floral Embroidered Patch, Women Slipper",29,99,Paprika
Women's a/o 2-Eye Weathered Worn,33,29,
Women's Zanna Perforated Calf Slip-on Loafer,141,66,
Propet Women's Robin Shoe,40,95,
Bridget Women Drving Loafer Boat Shoes Slip on Moccasins Flats,24,99,Mila Lady
Ranet Mules,34,99,Comfortview
Womens Engineer Combat,229,00,
Women's Nohea Nubuck Dark Java/Tan 8 B - Medium,109,95,
Barrelfish Animal Print Boat Shoe,90,00,
Women's Sunset MLB Blue Jays Boat Shoe,31,11,
Women's Premium Working,29,99,
The Lizabeth Flat,45,97,Comfortview
Womens Laurel Reef Core,20,99,Sperry
Since 1903 by Beacon Women's Phoenix Espadrille,39,95,Beacon
Women's Phoenix Slip-On 6.5 B(M) US Navy,39,95,Beacon
Helle Fashion Comfort Women's Laima Leather Stretch Upper Loafer,49,05,
"Women's LIGHTSOUT Fabric Loafer,",24,99,
Women's Moni 29 Synthetic Casual,19,87,Pierre Dumas
Women's Honor Ashby Loafer Tan Leopard 9W,81,87,Vionic
Women's Winnie Slip-On,69,87,Aravon
Women's Padma Loafer,44,92,Patricia Nash
Women's Cadiz Knit Casual Slipper,72,00,UIN
Women's Loafers Leather Slip On Casual Flats Moccasin Driving Shoes,19,99,XIVO
Womens Carryon Loafers 7.5 Black,39,50,
Women's Whistle Loafer,43,08,SoftWalk
"Women's Harlyn,",24,99,
Women's Honor Ashby Loafer Black 7W,102,94,Vionic
Valerie Women's Slip-On,129,95,
Womens Stitched Fuzzy,29,99,
Women's Karry Too Loafer,139,63,Kate Spade New York
Women's Hardy Oxford,12,26,
"ZTE Zmax Pro Z981, Shockproof Transparent Clear Hard Air Hybrid Case Cover for ZTE Zmax Pro Z981",3,90,Sikye
Womens Ladies Backless Loafer Mule Shoes With Faux Fur linings and Buckle (See More Colors and Sizes),24,64,Sara Z
Womens Cross Vamp Driver,37,99,Massimo Matteo
Shoes for Women Womens Flats Moccasins Loafers Slip-On Flat Walking,15,98,Comfity
Women's Fashion Snake Pattern Slip on Loafer Flat Sneaker Casual Shoes,24,99,Ruiatoo
Women's Suzy Loafer Flat,58,45,
Women's Classic Casual Shoe,46,95,TOMS
Womens X Moko Kobayashi - Reindeer Moccasin Grey Size 10,34,19,
Pehuea Vivid Blue/Vivid Blue Womens Slip-On Size 8M,55,36,
Womens Casual Tassel Suede Leather Driving Penny Loafers Moccasins Slip-on Casual Flats,19,99,Minishion
Womens TW05 Slip-On,30,04,
Women's Glick Castine Slip-on Loafer,94,89,
Andrea Women's Shoes Cushion Anatomic Loafer Mid Wedge Soft Textile Sheepskin Genuine Leather,53,90,Dr. Scholl's Shoes
Women's Comfy Simple Low Cut Flat Loafers,27,97,
Women's Saturday Moccasin,24,50,
Jalo Tortoise Vaneli Loafer,69,99,
Women's Honor Ashby Loafer Tan Leopard 9.5M,89,99,Vionic
Easy Spirit PIERS Black/Char 6.5,30,54,
Regan 2 Womens Slip On Glitter Patent Loafers,19,99,Foever
Brown Heeled Loafers for Women Slip on Round Toe Leather Women's Shoes Slip-on Loafers,34,00,B-Unique
"Women's SAS, Sunny Slip on Skimmers",99,99,SAS
Women's Haller Slip-On,42,00,
Women's Glick Bayview Loafers Shoes,89,95,
"Women's Women's Crepetray Slip on Loafer, White, 37 Medium EU (6-6.5 US)",90,14,
Kelly 74383 - Vachetta Apricot,105,00,sixtyseven
Ingalls Congo Women's Slip-On,43,99,
Women's Gracie-41 Nubuck Slip on Pointy Toe Dress Flats Shoes,12,99,
SureGrip Women's Palmetto Navy Slip-Resistant Casual Shoe,29,99,Keuka
Clearance Sale Shoes For Women，Farjing Fashion women Flat Bottom Non-slip Bottom Strap Leisure Sneakers Peas Shoes,14,99,Farjing
Women's Genuine Leather Fashion Sneakers Comfort Platform Flats Slip-On Loafers Shoes,13,99,SUNROLAN
Women's Dockside Ariaprene Boat Shoe,37,99,
Nohea Nubuck Shoe - Women's Dark Java/Tan 7.5,109,95,
Women Loafers Flat Slip On Meesh Linen Moccasins with Embossing,11,55,Dreamyth
Women's Oriole Penny Loafer,46,69,French Sole FS/NY
Women's Ankle Flat Sole Clear Jelly Martin Rain Boots,34,99,LYLIFE
Womens Garda W6S-2545CL,124,95,
Women's Studio Grand Fashion Sneaker Trainer Shoes,49,99,
Andrea Women's Comfort Shoes Black Squares Textile & Shiny Pointe Breathable Loafer,53,99,Dr. Scholl's Shoes
Women's Wickham,44,95,PATRIZIA
