,product_name,seller,price,category
2812,"Womens Abstract Lines Print Stiletto Platform High Heel Pumps,LF30435",SHOW STORY,34.99,pumps
2813,Women's Martina2 Pump,,99.0,pumps
2814,Women's Rakit Dress Pump,,19.99,pumps
2815,Womens High Heel PVC Pumps | 10cm Pointed Cap Toe Transparent PVC Stilettos | Wedding Dress Event Pumps Shoes,Eldof,19.99,pumps
2816,Women's Esmme Suede Dress Pump,,45.01,pumps
2817,Women's Round Toe Glitter Faux Pearl Mid Heel Dress Pump,Bella Marie,24.74,pumps
2818,Women's Mcwayfalls Dress Pump,,27.99,pumps
2819,Women's Ursula D'Orsay Pump,SJP by Sarah Jessica Parker,97.77,pumps
2820,Women Stiletto Pumps Patent Solid Wedding Party High Heel Shoes Pointed Toe Heels,TAOFFEN,18.98,pumps
2821,Women's Classic Round Toe Kitten Heel Dress Pump,Cambridge Select,24.95,pumps
2822,Women's Adult Juniper synthetic,AngelSteps,22.99,pumps
2823,Jessica Simpson Divella Black Leather Platform Cunky Heel Sexy Dress Sandals,Jessica Simpson Dress,74.99,pumps
2824,"Ladies Standard/Smooth-Competitive Dancer Ballroom Shoes,CD6017",Very Fine Shoes,80.0,pumps
2825,Womens Mandalay,,34.29,pumps
2826,Women's Besalu Lace-Up Heel Shoe,,55.82,pumps
2827,Women's Annya Mid 4 Dress Pump,,96.68,pumps
2828,Women High Heel Pumps Peep Toe Lace Bridal Wedding Shoes,ElegantPark,35.95,pumps
2829,Women's Gabrielle Leather Dress Pump,,62.99,pumps
2830,Women's Annya Mid 4 Dress Pump,,96.68,pumps
2831,Women High Heel Pumps Peep Toe Lace Bridal Wedding Shoes,ElegantPark,35.95,pumps
2832,Women's Gabrielle Leather Dress Pump,,62.99,pumps
2833,Women's Comfort Craving Pilot Path Pump,,34.01,pumps
2834,Women's Dava Dress Pump,,56.36,pumps
2835,Women's Aaron Pump,Daya by Zendaya,29.96,pumps
2836,Women's Mayeff Fabric Pump,,44.99,pumps
2837,Stunning Women's Sandal,,82.99,pumps
2838,Women's Pointed Toe Pumps 10cm Classic Stiletto Heel Suede Shoes,Sammitop,29.88,pumps
2839,Women's Cleary Pump,,53.33,pumps
2840,Womens Cyndi-92 Heels Work Occasion Close Toe Pumps,Delicacy,29.95,pumps
2841,Women's Malinda Peep Toe Pump,dexflex Comfort,15.0,pumps
2842,Women's Magenta Pump,,59.06,pumps
2843,"Women's, Elba W3M-5681 Low Heel Pumps",,139.9,pumps
2844,Women's Pet Dress Pump,SJP by Sarah Jessica Parker,159.99,pumps
2845,"Retro T-Strap D-orsay Button Bow Pointed Toe Exquisite Pearl Heel Dress Pump,LF60411",SHOW STORY,34.99,pumps
2846,Womens Comfort Slip On Pointed Toe Dress Low Kitten Heel Daily Pump Wedding Shoes,peloxhide,39.5,pumps
2847,Women's Val Dress Pump,,45.0,pumps
2848,Blossom Women's Kinko Almond Toe D'Orsay Stiletto Heel Two Tone Pump Shoes,DeBlossom,17.95,pumps
2849,Women's Astoria9x9 Suede Pump,,49.99,pumps
2850,Women Shoes Point Toe Kitten Heels Slingback Dress Pumps,MaxMuxun,19.99,pumps
2851,Women's Yaralla Wedge Pump,,20.0,pumps
2852,Women's Skylar Pump,Penny Loves Kenny,36.05,pumps
2853,Emiliana Women's Pump,,27.99,pumps
2854,J. Renee Women's Emiliana Black/Pewter 12 W (C),,53.99,pumps
2855,Closed Toe Heels Women's Designer Shoes Italian Style Well Constructed Ladies Fancy Shoes,Dolce Nome,69.0,pumps
2856,"Women's Odear Pump,",,68.95,pumps
2857,MW460 Women's Satin Bowtie Closed Toe Mid Heel Navy Wedding Shoes For Bride,Wedopus,47.99,pumps
2858,Women's Devoted Platform Pump,Fioni,29.99,pumps
2859,Women's Ereena Pump,,40.0,pumps
2860,Women's Tess Dress Pump,L.K. Bennett,197.98,pumps
2861,Womens Dedalo,,59.99,pumps
2862,Women's Latasha Pump,,110.0,pumps
2863,Women's Mystique Dress Pump,,139.95,pumps
2864,Retro Kimmy-21 Mary Jane Teardrop Cutout T-Strap Low Pump Heel,Chase & Chloe,19.9,pumps
2865,Women's Valiant Dress Pump,,15.31,pumps
2866,Women's Orlando Dress Pump,,18.12,pumps
2867,Women's Jade Sandal,Jane and the Shoe,35.99,pumps
2868,Chocolaticas High Heels Tropic Women's Mary Jane Pump,Hot Chocolate Design,94.99,pumps
2869,Women's Nyke Pump,,43.12,pumps
2870,Women's Kitten Heels Dress Pumps Office Work Shoes,SAMSAY,29.6,pumps
2871,Women's Brooks (Suede) Pump,,239.64,pumps
2872,Lustacious Women's Classic Pointy Toe Half D'Orsay High Heel Dress Pumps,Delicious,21.6,pumps
2873,Women's Wedge Heel Dress Shoes,Show Shine,28.0,pumps
2874,Womens Deva,,54.99,pumps
2875,Women's Everina Suede Dress Pump,,86.7,pumps
2876,"Women's Angel Ii Pump,",,25.77,pumps
2877,Women's Fashion High Heel Dress Pump Shoes,InterestPrint,39.99,pumps
2878,Women's Fashion High Heel Dress Pump Shoes,InterestPrint,39.99,pumps
2879,Women's Palma Ii Pump,,245.0,pumps
2880,Women's Classic Pointed Toe Slip-On Stiletto High Heel Pump,Cambridge Select,26.68,pumps
2881,Womens teriann,,40.05,pumps
2882,Women's HIgh Heels Mary-jane Classic Round-toe Pumps Stiletto Dress Heels with Buckle Closure,OLIVIA K,14.99,pumps
2883,Women's Relax-6 Vegan Leather Slip-On Loafer,Pierre Dumas,15.73,pumps
2884,Women's Lorrie Velvet Pump,,49.99,pumps
2885,Women's Floria Wedge Pump,,19.29,pumps
2886,Women's Vivian Pump,Kate Spade New York,228.0,pumps
2887,"Women's Lisa Peep Toe Demi Wedge with Elastic Straps Pump,",,107.24,pumps
2888,Women's Pointed Toe Patent Stiletto High Heel Pump,FOREVER VOGUE,38.88,pumps
2889,Women's Platform Wedding Reception Block High Heels Pumps Shoes,Carolbar,26.0,pumps
2890,Holland-1 Women's D'Orsay Pointed Toe Ankle Tie Stacked Block Heel,Chase & Chloe,11.18,pumps
2891,Women's Pointed Toe Strappy Sandals Studded Slingback Kitten Heel Studs Dress Pumps 5-13 US,Chris-T,50.99,pumps
2892,Women's Patent Low Kitten Heels Pumps Office Lady Comfortable Pointed Toe Dress Pump Shoes,YING LAN,22.99,pumps
2893,Women's Stand Down Wedge Lace-up Pump,,26.99,pumps
2894,Women's Chelsea Platform Pump,,124.99,pumps
2895,Women's Tatiana Synthetic Dress Pump,,32.53,pumps
2896,Women's I'm Yours Slide Pump,,60.36,pumps
2897,Western Ankle High Boots with Tassels Round Toe Block Heel Suede Retro Booties,YDN,64.98,pumps
2898,FIC Priya Women Wide Width Slingback Pump for Dress Or Elegant Affairs (Size & Measurement Guide),Floral,74.95,pumps
2899,Women's Peep Toe High Heels Party Pumps with Platform,AOOAR,31.99,pumps
2900,"Women's ANN-M Pump,",Brinley Co,15.0,pumps
2901,"Women's Majella Dress Pump,",,49.99,pumps
2902,Women's Cajun Dress Pump,,19.98,pumps
2903,Womens Hannley,,24.99,pumps
2904,Women's Silvia High Heel Platform Pump Shoes,DREAM PAIRS,19.99,pumps
2905,Women's Comfort Square Toe Pauline Chunky Wrapped High Heel Dress Pumps Shoes,Jiu du,13.99,pumps
2906,Women's Skylar Pump,Penny Loves Kenny,42.68,pumps
2907,Women's Seven to 7 Ally Pump Platform,,100.88,pumps
2908,Womens Plain Wedge Court Shoes Low Mid High Heel Slip On Pumps Office,KRISP,17.0,pumps
2909,Women's Plus Size Two-Toned Stiletto Pumps,AOOAR,25.59,pumps
2910,Women's Sexy Peep Toe Platform Stiletto Slip on Super High Heel Pumps Party Dress Shoes …,MIUINCY,34.99,pumps
2911,Womens Two-tone Tweed Mary Jane Pumps,Journee Collection,49.99,pumps
2912,Women's Closed Round Toe Buckle Thick Ankle Strap Chunky Platform Wrapped High Heel Pump,Cambridge Select,22.14,pumps
2913,Women's Melina Metallic Pump,,177.99,pumps
2914,Women's Delma Dress Sandal,,70.0,pumps
2915,Women's Bridal Wedding Party New Classic Elegant Versatile High Stiletto Heel Dress Platform Pumps Shoes,Melesh,18.99,pumps
2916,"Women's Sexy Point Toe Pumps,Wedding Dress Shoes,Patent Leather High Heels,Cute Evening Stilettos",MIUINCY,19.99,pumps
2917,Women's YOBE842FLY Pump,,63.65,pumps
2918,Women's Jacklyn Shimmer Metallic Pump,,29.49,pumps
2919,Women's Fatina Kitten Heel Slingback Pump,,26.11,pumps
2920,Women's Vanity-434 Pump,,59.95,pumps
2921,A2 by Women's Track Pad Dress Pump,,38.13,pumps
2922,Women's 213-Anastasia Dress Pump,,32.42,pumps
2923,Women's Kit Josie Kitten Heel Black 7 B(M) US,Vionic,139.95,pumps
2924,"Women's Jade Pump,",,99.0,pumps
2925,Womens Orabella Meg,,80.0,pumps
2926,"Women's Jade Pump,",,99.0,pumps
2927,Womens Orabella Meg,,80.0,pumps
2928,Women's Kitten Heels Pointy Toe Dress Pumps,SAMSAY,14.9,pumps
2929,Women's Total Motion Novalie 3 Strap Dress Pump,,39.98,pumps
2930,Women's Camillo Dress Pump,,22.5,pumps
2931,Open Toe High Heel Dress Chunky Heel Dress Platform Bootie,Shoe Republic,28.99,pumps
2932,Women's Low Heel Pump,,6.88,pumps
2933,Women's Diana Pump,,95.14,pumps
2934,Sport Women's Elisha Fabric Pump,,51.99,pumps
2935,"Women's Suitup Reptile Print Pump,",,89.0,pumps
2936,Women's Diem Dress Pump,,25.39,pumps
2937,Women's Grayce Pump,,74.99,pumps
2938,Women's Peekabow Dress Pump,,238.8,pumps
2939,Women's Cenna Pump,,145.21,pumps
2940,Women's Carri Platform Pump,,39.95,pumps
2941,Womens Fly London Heli Mousse Strappy Platform Wedge Heel Leather Shoes,,94.99,pumps
2942,Women's Daphne Block Heel Pump,,170.0,pumps
2943,Women's Women's Shape 75 Modern Dress Pump,,122.46,pumps
2944,"Women's MASONIE Pump,",Imagine Vince Camuto,65.72,pumps
2945,Women's Pase Pump,Brinley Co,15.0,pumps
2946,Women's Classic Pointy Toe OL Pumps Slip-On Patent Leather Block Heel Dress Shoes,YDN,28.98,pumps
2947,Women's T-Strap Closed Toe Platform High Heel Pump,Bella Marie,30.17,pumps
2948,"PAOLA06 Cinderella Princess Sparkle Crystal Gem Rhinestone Glitter Formal Pumps, Wedding Shoes Dress Heels",Mila Lady,23.99,pumps
2949,Women's Flirt Pump,,29.53,pumps
2950,Women's Rampling Dress Pump,SJP by Sarah Jessica Parker,142.99,pumps
2951,Women's Marquisa Leather Pump,,55.69,pumps
2952,Women's Phoebe Dress Pump,SJP by Sarah Jessica Parker,350.0,pumps
2953,Womens Thin High Heels Ankle Strap Pointed Toe Clear Stiletto Work Pumps Sandals,Syktkmx,22.88,pumps
2954,Women's Pointed-Toe Ankle Tie Stiletto Pump,Wild Diva,27.95,pumps
2955,Women’s Retro Kimmy-67 Bow Front Faux Suede Mary-Jane Pumps,Chase & Chloe,29.95,pumps
2956,Women's Cosette Pump,SJP by Sarah Jessica Parker,214.2,pumps
2957,The Renee Slingback,Comfortview,55.97,pumps
2958,Womens T-strap Round Toe Mary Jane Pumps,Journee Collection,44.99,pumps
2959,Women Pointed Toe Ankle Strap Cuff Low Heel Stiletto Dress D-orsay Dress Pumps,JJF Shoes,21.99,pumps
2960,Women's Patsie Pump,Brinley Co,19.37,pumps
2961,"Womens Val Suede Peep Toe Slingback, Black, Size 9.0",,124.99,pumps
2962,"Women's Daisie-r Pump,",,59.99,pumps
2963,Women's Kady Pump,Pelle Moda,62.99,pumps
2964,Women's Yadi718fly Platform Pump,,75.99,pumps
2965,Women's Candace Slingback Sandal,PATRIZIA,39.95,pumps
2966,Women's Crystall Pump,,55.99,pumps
2967,Women's Hazelle2 Pump,,89.0,pumps
2968,Womens Closed Toe High Heels Pointed Slender Stiletto Pumps,Loslandifen,16.99,pumps
2969,"Women's Quianiya Synthetic Pump,",,99.0,pumps
2970,Womens Naila,,54.99,pumps
2971,Women's Geneva Dress Pump,,24.5,pumps
2972,Women's Opel Dress Pump,Chinese Laundry Kristin Cavallari,29.38,pumps
2973,Women's Delsie Glee Mary Jane Pump,,66.0,pumps
2974,Women's Franci Pump,,24.99,pumps
2975,Shoes Women's Tie-Up Soft Heels Yuko 9,Liliana,29.95,pumps
2976,FIC Nadine Women Wide Width Peep Toe Dress Slingback with Jewels (Size/Measurement Guide Available,Floral,59.95,pumps
2977,Glitter Sparkling Bow Decor High Heel Platform Pumps Bridal Party Shoes,Chicastic,39.99,pumps
2978,Women Latin Ballroom Salsa Ankle Strap Dance Shoes Ladies Character Party Prom Dancing Pump,joocare,19.99,pumps
2979,Women's Scheila Patent Dress Pump,,13.35,pumps
2980,Women's Adelson Pump,,18.39,pumps
2981,Women's Brianyah Suede Dress Pump,,23.09,pumps
2982,Women's Sahar Pump,Marc Fisher,53.4,pumps
2983,Trish Women's Pumps - Round Toe Wedge Pump,PIC/PAY,69.0,pumps
2984,MW396 D'Orsay Open Toe Lace and Satin High Heel Ankle Strap Wedding Shoes Bridal,Wedopus,49.99,pumps
2985,Women's Exor Open-Toe Pump,,345.0,pumps
2986,Women's Pumps Leather Mary Jane Shoes Block Heel Summer Sandals Comfortable Slip on Loafer Flat Handmade Moccasin Shoes,gracosy,51.99,pumps
2987,"Punk Red Black Strappy Platform Stiletto Ankle Bootie Boots,LF80858",SHOW STORY,34.99,pumps
2988,Women's Henrika Fabric Dress Pump,,14.99,pumps
2989,Women's Chloe02/Bpu Platform Pump,,12.26,pumps
2990,Women's High Heel Peep Toe Platform Stiletto Slip on Dress Pump Shoes for Wedding Party …,MIUINCY,34.78,pumps
2991,Cobb Hill Women's Cai43kh,Rockport Cobb Hill Collection,39.99,pumps
2992,Women's Peep Toe Buckle T-Strap Chunky Platform Wedge,Cambridge Select,29.75,pumps
2993,Valerie | Kitten Heel Two Piece Buckle Strap Studded Leather Pump,Linea Paolo,139.95,pumps
2994,Glitter Fabric T-Strap Heels Style Saylor,David's Bridal,39.95,pumps
2995,Women's Mike Pump,Brinley Co,14.99,pumps
2996,Women's Tee06w Platform Pump,,72.95,pumps
2997,Womens Cassian Closed Toe Ankle Strap Mary Jane Pumps,,34.99,pumps
2998,Womens Stilettos Pointed Toe High Heel Pumps Ankle Buckle Strap Party Shoes,Nulibenna,26.99,pumps
2999,Sassy-07 Women's Round Toe High Heel Buckle Upper Crossing Straps Nubuck Pumps,,25.01,pumps
3000,Women's Dre420/B Dress Sandal,,48.95,pumps
3001,Women's Dorothy Flex Pumps,MICHAEL Michael Kors,99.0,pumps
3002,Women's Washington Square Dress Pump,,73.77,pumps
3003,Women's Harlem Pump,,59.84,pumps
3004,Women's Ship Deck Wedge Pump,,47.9,pumps
3005,Women's Melora Gore Captoe Dress Pump,,55.0,pumps
3006,Women's Tali Cap Toe 40 Wedge Pump,,107.21,pumps
3007,Women's Fawn 70 Dress Pump,SJP by Sarah Jessica Parker,105.0,pumps
3008,Women's High Heels Pumps Cow Pattern Printing Slip on Shoes,YCG,41.99,pumps
3009,Women's Candela Dress Pump,,23.53,pumps
3010,Women's Attitude Dress Pump,,79.9,pumps
3011,Women Sexy Peep Toe Ankle Strap Chunky Heels Sandals,Pailan,39.99,pumps
3012,Womens Vintage Party Bridal Wedding Shoes Platform High Heels Pump Ankle Boots with Bow,Maybest,12.86,pumps
3013,Womens - Vanita,Söfft,49.0,pumps
3014,Women's Closed Almond Toe Padded Comfort Insole Mid Heel Dress Pump,Cambridge Select,22.22,pumps
3015,Women Bows Stiletto Pumps,Charm Foot,24.0,pumps
3016,Women's Hettie Pump,,14.56,pumps
3017,Womens Chorde Peep Toe Casual Platform Sandals,Alfani,20.0,pumps
3018,"Womens CHORDE Peep Toe Wedge Pumps, Black, Size 10.5",Alfani,52.99,pumps
3019,Women's Abbington Ankle Strap Pump,,39.0,pumps
3020,Women's Apricot Pump,,88.95,pumps
3021,Women's Leather Pointy Toe Slingback,LE CHÂTEAU,49.97,pumps
3022,Women Studded Pointed Toe Transparent Pumps High Heels Shoes with Cute Bowknot Size 4-15 US,FSJ,66.99,pumps
3023,Women's Slip-On Closed Toe Crystal Rhinestone Platform Stiletto Heel Pump,Cambridge Select,17.87,pumps
3024,Women's Adult Angel Steps Shana,Beacon,29.99,pumps
3025,Women's Layola Pump,,22.99,pumps
3026,Women's Karolina Pump,Kate Spade New York,129.0,pumps
3027,"Women's, Mirjam 11 Slip on Low Heel Pumps",,93.82,pumps
3028,Women's Fashion Sexy Slip On Pointed Toe High Heels Pumps Wedding Party Shoes,Jiu du,25.99,pumps
3029,Women's Ace Pump,,19.5,pumps
3030,Women's Annya Mid 3 Dress Pump,,119.89,pumps
3031,Womens Bows Platform High Heels,Carolbar,27.0,pumps
3032,Bathroom Soap Pump Lotion Pump Soap Dispenser Hammered Metal Pump Dispenser,Pier 1 Imports,19.95,pumps
3033,Women's Tali Luxe 40 Wedge Pump,,103.0,pumps
3034,Women's Abigail Glitter Pumps,Kate Spade New York,98.4,pumps
3035,Women's Proper Pump,,25.66,pumps
3036,Women's Slip-On Classic Closed Round Toe High Heel Dress Pump,Cambridge Select,8.42,pumps
3037,Women's Define II Dress Pump,,25.41,pumps
3038,Lolita Pump,MICHAEL Michael Kors,119.99,pumps
3039,Women's Sexy-20/HP,,48.95,pumps
3040,Women's Malia Dress Pump,,29.99,pumps
3041,Womens Louella,,29.99,pumps
3042,Womens Quincy Pump 45mm,,89.97,pumps
3043,Women's Ronna Pump,Calvin Klein Jeans,119.0,pumps
3044,Women's Career First Impression Ballet Flat,,29.84,pumps
3045,Del Pumps,Comfortview,34.99,pumps
3046,Women's Domina-420 Pump,,47.95,pumps
3047,Women's Del Dress Pump,,98.95,pumps
3048,Women's Lotisha Pump,,39.69,pumps
3049,Women's Hollyn Suede Dress Pump,,44.99,pumps
3050,d Orsay Stiletto Heel w/3 Gold Finish Ankle Straps Yuni49,Glaze,13.3,pumps
3051,Women's Bp310-Jolie Spectator Pump,Bettie Page,49.18,pumps
3052,Women 'Vitas' Platform Pump Shoe,,54.99,pumps
3053,Women's AMU26/B-W Dress Pump,,54.95,pumps
3054,Women's Slip-On Closed Pointed Toe Stretch Slingback Mid Heel Pump,Cambridge Select,25.08,pumps
3055,Women's Metallic Peep Toe Slingback,LE CHÂTEAU,29.97,pumps
3056,Women's Lizabeta Pump,,92.38,pumps
3057,Women Pointed Toe Ankle Strap Cuff D-orsay High Heel Pumps,JJF Shoes,18.5,pumps
3058,"Women's Laney Pump,",,109.19,pumps
3059,Women's Bid2 Pump,French Sole FS/NY,27.95,pumps
3060,Designer Rivet Studded Ankle Cuff High Heel Dress Sandal Pumps,JJF Shoes,15.99,pumps
3061,Women's Chicpump Pump,,109.99,pumps
3062,Women's Luella Dress Pump,,35.57,pumps
3063,Ladies Buckle Chunky Heels Bows Suede Pumps Shoes,AdeeSu,43.99,pumps
3064,Women's Mercer Dress Pump,,80.0,pumps
3065,Women's Rosalie Suede Pump,,55.38,pumps
3066,Women Vintage Round Toe Wavy Block Heels Comfy Suede Slide Pumps Size 4-15 US,FSJ,9.99,pumps
3067,Women's Rehearse Dress Pump,,47.76,pumps
3068,Women's Open Toe Ankle Strap Stiletto High Heels Dress Sandal Pumps,CALICO KIKI,23.99,pumps
3069,Women's Pinot Dress Pump,,181.78,pumps
3070,Women's Rehearse Dress Pump,,47.76,pumps
3071,Women's Open Toe Ankle Strap Stiletto High Heels Dress Sandal Pumps,CALICO KIKI,23.99,pumps
3072,Women's Pinot Dress Pump,,181.78,pumps
3073,Womens Elise Pump,,34.64,pumps
3074,Women's Suede Block Heel Pump,M4D3,119.95,pumps
3075,"Mid Block Heel Dressy Glitter Sling Back Women's Shoes by, Nina",Lady Couture,48.0,pumps
3076,Women's The Lady Pump,Katy Perry,24.12,pumps
3077,Women's TA-Palace Wedge Pump,,40.99,pumps
3078,Women's Tina 17 Dress Pump,Josef Seibel,125.94,pumps
3079,Sport Women's Camrynne Fabric Wedge Pump,,59.66,pumps
3080,Women's Leather Peep Toe Slingback Sandal,LE CHÂTEAU,59.97,pumps
3081,Women's Maiche Cut-Out T-Strap Pumps,,99.95,pumps
3082,Women's Trench-330 D'Orsay Pump,,18.3,pumps
3083,Women's Parker Pump,,76.95,pumps
3084,Women's Lola Pump,,55.24,pumps
3085,Womens Pointed Toe Faux Suede Multi-Strap High Heels,Brinley Co,19.99,pumps
3086,Women's Mahiri Dress Pump,,49.99,pumps
3087,Women's Oath Dress Pump,,22.71,pumps
3088,"Women's V-Carola, Black, 7.5 M US",,225.0,pumps
3089,Women's Carola Dress Pump,,91.22,pumps
3090,Women's Pointed Toe Pumps,Charm Foot,26.0,pumps
3091,"Women's MADLINE Silky Suede Pump,",,87.25,pumps
3092,Womens Espadrille Platform Wedge Heel Peep Toe Ankle Strap Slingback Sandals,Syktkmx,34.88,pumps
3093,AZALEA WANG Pointed Toe Basic Everyday Cheetah Accent High Heel Work Party Club Pumps,AKIRA,39.9,pumps
3094,Women's Toby Dress Pump,,44.99,pumps
3095,Womens Cassidy,,29.99,pumps
3096,Women's Rilley Dress Pump,ALDO,60.99,pumps
3097,Women's Pointed Toe Crisscross Lace-up Ankle Tie Chunky Block Mid Heel Pump,Chase & Chloe,11.58,pumps
3098,Rockport Women's Denise Dress Pump,Cobb Hill,77.76,pumps
3099,Women's Allure Pumps Shoes,,28.6,pumps
3100,Women Comfortable House Shoes Closed Back Lightweight Soft Anti-Slip Indoor/Outdoor Slippers Home/Office Pom Flats Pump,HAOBU,22.49,pumps
3101,Soda Women's Jack Round Toe Classic Leatherette Pump,City Classified,27.2,pumps
3102,Women's Pristina Pump,,98.0,pumps
3103,Women's Bow Pointed-Toe Kitten Heels,Latasa,27.0,pumps
3104,Women's Cute Comfy Patent Leather Round Toe Buckle Strap Platform Heels Dress Wedge Mid Heel Mary-Jane Pumps Shoes,,27.97,pumps
3105,Womens Exhibitor Microsuede Pointed-toe Pumps,STYLUXE,22.75,pumps
3106,Women's Racine,,62.19,pumps
3107,Women's Pointed Toe Cross Strap High Heel Pumps,CALICO KIKI,32.99,pumps
3108,Women's Esavery Wedge Pump,,30.99,pumps
3109,Womens Bronaa Fabric Peep Toe Slingback Classic Pumps,Karen Scott,31.99,pumps
3110,Women Round Toe Slip-On High Chunky Heels Bead Studded Pumps,Pailan,39.99,pumps
3111,Womens Pointed Toe Pumps Slip-on Office Business High Heels 65mm Stiletto Kitten Heel Shoes,Caitlin Pan,49.98,pumps
3112,"Women's JESAMIN Pump,",,126.48,pumps
3113,"Women's IBBY Pump,",,71.65,pumps
3114,Women's Prosper Dress Pump,SJP by Sarah Jessica Parker,122.99,pumps
3115,Women's Closed Toe Chunky Block Low Heel Slingback Pump,Cambridge Select,24.75,pumps
3116,Women's Pascall Pump,,115.35,pumps
3117,Women's Blasiana Bow Point Toe Pumps,,74.99,pumps
3118,Women's Yunus Flat,,41.99,pumps
3119,Women High Heel Peep Toe Rhinestones Slingback Platform Pumps Wedding Evening Dress Shoes,ERIJUNOR,46.99,pumps
3120,Women's Novelle-fy Dress Pump,,24.99,pumps
3121,Women's Noah Pump,,201.48,pumps
3122,MOLLY Women's Open Peep Toe Mid Heel Sandals Pumps Shoes,Spylovebuy,45.0,pumps
3123,Women's Nikole Pump,,59.17,pumps
3124,Women's Ophelia Pump,ara,184.95,pumps
3125,Kailey Women's Casual Slip-On,,109.95,pumps
3126,Women's Amore Dress Pump,,49.95,pumps
3127,Women's Kamaye Platform Dress Sandal,,44.99,pumps
3128,Women's Dalanna Pump,Marc Fisher,19.0,pumps
3129,Women's Latest Dress Pump,,99.99,pumps
3130,Women's Necile Wedge Pump,,27.66,pumps
3131,Women's ISSA Pump,Marc Fisher,17.99,pumps
3132,Sport Tasha Fabric Womens Ankle Strap,,40.76,pumps
3133,Women's Slip On Kitten Heels Pointed Toe Low Heels Office Pumps,Chris-T,43.99,pumps
3134,Women's Denton Pump,,40.53,pumps
3135,Womens Zitah Pointed Toe Classic Pumps,INC International Concepts,43.99,pumps
3136,"Women's Elanore Suede Pump,",,32.99,pumps
3137,Women's Moody Platform Pump,,210.41,pumps
3138,USA Women's Vista Platform Pump,Klogs,45.99,pumps
3139,Women's Karissa Mule,,59.99,pumps
3140,Demonia Women's Creeper-113 Lace-Up,,42.95,pumps
3141,Women's Mariana Pointy Toe Dress Pump,,53.06,pumps
3142,Women's Smitten-10/WB T-Strap Pump,,57.95,pumps
3143,"Peep Toe High Heel Pumps – Party, Formal, Wedding, Bridal, Office Classic Heel – Open Toe Stiletto - Verse by",J. Adams,24.9,pumps
3144,Womens Brown Pointed Toe Pumps Victorian Shoes with 2'' Heels and Lace Up Front,Summitfashions,66.95,pumps
3145,Women's Elenta Synthetic Wedge Pump,,29.99,pumps
3146,by Hush Puppies Women's Mallorie Wedge Pump,,16.46,pumps
3147,Women's Terrie Pump,,40.13,pumps
3148,Bella Luna Myra Sparkle Crystal Gem Rhinestone Glitter Mesh Formal Evening Dress Pumps,JJF Shoes,20.0,pumps
3149,Womens Round Toe Vintage Comfort-Sole Two-Tone Lattice Mary Jane Pumps,Journee Collection,49.99,pumps
3150,Womens Nathalie Flex Suede Pointed Toe D-Orsay Pumps,MICHAEL Michael Kors,67.98,pumps
3151,Soda Women's Jack Nubuck Classic Pump,City Classified,27.86,pumps
3152,"Women's Flats, Pointed Toe Flats Pumps, Patent Leather Flats Pumps, Walking Dress Office Classic Comfortable Flats",Eldof,48.99,pumps
3153,Women's Leasia2 Pump,,69.97,pumps
3154,Women's Tour Dress Pump,,16.35,pumps
3155,Women's Fifi Pump,,119.0,pumps
3156,Women’s Sparkle Strappy Pump High-Heel Evening Platform Sandals Wedding Shoes,YooPrettyz,39.99,pumps
3157,Womens Francis Peep Toe Classic Pumps,,29.99,pumps
3158,Women's Flora Mj Wedge Pump,,18.5,pumps
3159,"Women's Hallden Pump,",,122.66,pumps
3160,Women's Mature Peep Toe Slip-on Platform High Thin Heels Daily Party Stiletto Pumps,DecoStain,35.66,pumps
3161,Women's Ruche Pump,Penny Loves Kenny,36.46,pumps
3162,Women's Brenna Maple Dress Pump,,80.56,pumps
3163,Women's Hastobe Leather Dress Pump,,67.4,pumps
3164,Women's Domina-420 Pump,,47.95,pumps
3165,Women's Local-l Pump,,78.96,pumps
3166,Women's Local-l Pump,,78.96,pumps
3167,Women's FIFTH9x9 Suede Pump,,30.99,pumps
3168,Womens Fly London Cape Beach Leather Summer Holiday Sandal Wedge Heel,,50.11,pumps
3169,Women's Gaggi Pump,,17.59,pumps
3170,Women's Nima Wedge Pump,,30.19,pumps
3171,Women's Pointed Toe High Heel Fashion Mules Shoes,Charm Foot,26.0,pumps
3172,Women's Platform Pumps Shoes,Show Shine,26.0,pumps
3173,Women's Mary Jane Block Stacked Chunky Pumps Heel - Vintage Retro Round Toe with Strap,OLIVIA K,7.99,pumps
3174,Women Flattering Peep Toe Formal Dress Shoes Glossy Patent High Heels Pumps Size 4-15 US,FSJ,54.99,pumps
3175,Women's Expert Fabric,,43.99,pumps
3176,Women's Dolce Pump,,89.0,pumps
3177,Hot Sale Newest Women's Shoes Low Heels Bowknot Suede Thick Heels Casual Pointed Toe Shoes Pump,Fheaven (TM),11.99,pumps
3178,Women's Studded Stiletto 10CM High Heels Rivets Shoes Pointed Toe Slip On Pumps 5-14 US,Chris-T,47.99,pumps
3179,"Women's Capture Pump,",,23.21,pumps
3180,Women's Kyle Dress Pump,Daya by Zendaya,26.24,pumps
3181,Womens Newhart,,157.99,pumps
3182,Womens Corlissa,,24.99,pumps
3183,Women's Chained Dress Pump,,59.99,pumps
3184,"Women's ADYLIA Pump,",ALDO,70.0,pumps
3185,Women's Nina Pump,Brinley Co,12.29,pumps
3186,Women's City_OT Fashion Stilettos Peep Toe Pumps Heels Shoes,DREAM PAIRS,24.99,pumps
3187,Women's Fenris Sling Pump,,79.95,pumps
3188,Women's Adult Sofwear Virginia synthetic,Beacon,32.99,pumps
3189,Satin Wedding Shoes Sexy Women Shoes with Lace Flowers Bridal Shoes High Heel Evening Shoes 4.5 inch RS-2064,LUXVEER,48.6,pumps
3190,Women's Leather Block Heel Slingback Peeptoe Pump,M4D3,130.0,pumps
3191,"Women's Pumps Latin Salsa Tango Practice Ballroom Dance Shoes with 2.2"" Heel Suede Sole Model 1260A",Amor,19.99,pumps
3192,Lala-4 Women's Pointy Toe Pump,Chase & Chloe,14.19,pumps
3193,Women Pumps Pointed Toe High Heel Studded Stiletto Slip On Dress Shoes,FOREVER VOGUE,38.88,pumps
3194,Sport Women's Flouncy Dress Pump,,48.99,pumps
3195,Womens Low Heel Pointed Toe Pumps Casual Retro Leather Mary Jane Shoes,Mostrin,20.99,pumps
3196,Women's Sonia Pump,Kate Spade New York,228.0,pumps
3197,Women's Sto7h65 Dress Pump,,102.36,pumps
3198,Women's Tee06gw Platform Pump,,78.95,pumps
3199,Women's Del High Heel Pump,,88.0,pumps
3200,Gillian Platform Ankle Strap Heels,SYLK,44.99,pumps
3201,"Leopard Heels, Women's Sexy Leopard Printed Shoes Pointy Toe High Heels Slip On Stiletto Pumps for Evening Party",Kmeioo,44.98,pumps
3202,Chase and Chloe Dora-8 Retro Two Tone T-Strap Saddle Oxford Heel Pumps,Sidecca,39.9,pumps
3203,Women's Doris Pump,,45.36,pumps
3204,Women's Adele 236 Gladiator Lace Up Open Toe Strappy Ankle Wrap High Heel Pump,Wild Diva,17.34,pumps
3205,Women's Zappa-H Patent Leather Pumps with Buckle Strap,My Delicious Shoes,12.99,pumps
3206,Womens Talley,,31.15,pumps
3207,Mascara-03 Women's Round Toe Woven Braid Vamp Mary Jane Squeaky Platform Wedge Comfort Shoes,Nature Breeze,29.95,pumps
3208,Women's Abbey Pump,Dyeables,49.36,pumps
3209,Women's Charie Pump,,44.99,pumps
3210,Women's Audrey Dress Pump,L.K. Bennett,255.12,pumps
3211,Women's Smolder Dress Pump,BC Footwear,24.99,pumps
