,product_name,seller,price,category
7678,Women's Ballet Shoe Cute Ribbon Comfortable Multi Color Flat,Ollio,15.99,flats
7679,Women Casual Bohemia Multicolor Ballet Slip On Flats Pointed Toe Loafer Flats,Fheaven,6.99,flats
7680,Women's Deer Ballet Flat,,45.42,flats
7681,Mermaid Women’s Shoes Pointed Toe Spiked Rivets Comfortable Flats,MermaidShoes,34.99,flats
7682,Women's Terrazzo2 Platform,French Sole FS/NY,55.77,flats
7683,Women's Jiggy Coverall Linen,,49.9,flats
7684,Crochet Vamp with Memory Foam Insole Ladies Flat,,16.95,flats
7685,Womens VALORR Canvas Closed Toe Espadrille Flats,Style & Co.,35.0,flats
7686,Women's Inmotion Drive Sneaker,,89.98,flats
7687,Women's W Sukie 21 Ballet Flat,,95.5,flats
7688,Women's Azima Slip On Flat,,160.0,flats
7689,Women's Felucca Slip-On,,36.54,flats
7690,Pointede Toe Criss Cross Strap Classic Ballet Flats Slip On Patent Leather Walking Shoes for Women,UMEXI,49.99,flats
7691,Women's Sequin Mesh Bowknot Flat Shoes,Fashionmore,45.69,flats
7692,Women's Marigold Ballerina Walking Flats Shoes,Ara Colors,44.99,flats
7693,Women's V-Eliza Oxford,,50.88,flats
7694,Japanese Sweet Lolita Block Low Heel Round Toe PU Leahter Mary Jane Shoes,Lorie & Knight,38.0,flats
7695,"Shoes Harlyn Women's Flat, Pale Pink/Burnished/Smooth, 6H M",CLIFFS BY WHITE MOUNTAIN,19.99,flats
7696,Women's Nixie Flats Shoes,Adam Tucker,28.88,flats
7697,3cm Platform Women Shoes Thick Sole Woman Casual Shoes Canvas Shoes,New-Loft,27.2,flats
7698,Women's Sweet Ruffles Pointed Toe Concise Ruffle Frill Dress Loafer Flats,DecoStain,29.69,flats
7699,Women's Nevaeh Mary Janes Casual Flats,,46.65,flats
7700,New Master Women's Rhinestone Mesh Faux Velvet Pointed Toe Flats,Master,28.99,flats
7701,Women's Bow Crystal Rhinestone Slip-On Ballet Flat,Cambridge Select,14.04,flats
7702,Women's Shoe Ballet Gliter Basic Light Comfort Low Heel Flat,Ollio,15.99,flats
7703,Women's Karena Black Suede Flat 37 M,Summit by White Mountain,64.99,flats
7704,Womens HILTA Flat Glaze,,39.97,flats
7705,Women's Honesty Mary Jane Flat,,139.95,flats
7706,Women Casual Multicolor All Seasons Ballet Slip On Flats Loafers Shoes,AOJIAN,5.99,flats
7707,Women Fashion Soft Leather Anti-Skid Casual Flat Shoes Summer Autumn Round Toe Slip-On Lazy Shoes,Yang Sha,26.4,flats
7708,Women Genuine Leather Shoes Casual Slip-On Ballet Women Flats Cut Out Solid Ladies Shoes,Batsomer,32.39,flats
7709,Gem Posey Ballet Flat Teal 8.5W,Vionic,276.0,flats
7710,Womens Women's Afra Pointed Toe Flat,,43.23,flats
7711,Jyden-03 women's slip-on flat boat soft sole spike Studded elastics ballet shoes,Xica,9.99,flats
7712,Women's Pippa 23 Flat,Josef Seibel,115.0,flats
7713,FD76 Women Patent Leatherette Pointy Toe Ballerina Flat FD77 - Nude,,22.19,flats
7714,Women's Colorblocked Pile Flat,,10.49,flats
7715,Women's Total Motion Ballet Flat,,64.9,flats
7716,Women's Effie Flat,,11.99,flats
7717,Women's Yvette,,176.48,flats
7718,Women's Chadler Ballet Flat,,69.99,flats
7719,Women's Pacific City Mary Jane Flat,,61.05,flats
7720,Punjabi Jutti Flat Shoes Wedding Shoes Khussa Shoes Mojari Saree Jooti,Step n Style,32.0,flats
7721,Women's Basic Point Toe Ballet Flats,Walstar,11.99,flats
7722,Women's Comfy Bows Closed Pointed Toe Low Top Slip On Flats Shoes,,31.96,flats
7723,Women's Basic Point Toe Ballet Flats,Walstar,11.99,flats
7724,FH Women Faux Suede Pointy Toe Caged Flat FH21 - Nude,Jubilee,24.59,flats
7725,Women's Notorious Flat,,26.52,flats
7726,Women Fahion Pointed Toe Marry Jane Ballet Flats Ankle Strap Easy Walking Dancing Shoes,XYD,57.79,flats
7727,Women's Fashion Pointed Toe Slip On Dress Comfort Flats Ballerina Shoes,Amarantos,59.99,flats
7728,Women's Evianna Cozy Shoe,,84.95,flats
7729,Women's Sphinx Pointed Toe Flat,,79.0,flats
7730,Women's Wyatt Ballet Flat,French Sole FS/NY,96.14,flats
7731,Women's Carson Concho Ballet Flat,,99.0,flats
7732,Dalena-1 Bow Tie Detail Basic Ballet Flat,Chase & Chloe,19.95,flats
7733,Women's Sizzle Flat,,23.47,flats
7734,Women's Gilmore Ballet Flat,,67.49,flats
7735,London Women's Almond 9.5 US,Earth Origins,47.0,flats
7736,Women's Shlim Sued AF Formal Shoe,,114.92,flats
7737,Women's Out Kitty Mary Jane Flat,,38.77,flats
7738,Women's Long Bay Flat,,39.0,flats
7739,Women's Newcastle Ballet Flat,,134.99,flats
7740,FootThrills Women's Midtown Slip-on Shoes,Foot Thrills,79.99,flats
7741,Women's Canvas Lace Flats Slip On Shoes Hipster Vegan Espadrilles,Enimay,8.0,flats
7742,Women's Shoe Ballet Cute Dress Rose Comfort Flat,Ollio,15.99,flats
7743,Womens Alena 1-1-22124-20,Tamaris,62.99,flats
7744,London Women's Black 12 US,Earth Origins,39.95,flats
7745,Women's Embroidered Lotus Mary Jane Flats Shoes,VenusCelia,16.99,flats
7746,Womens Caren Flat,Butter Shoes,144.0,flats
7747,Women's Haley Toucan Flat,,49.99,flats
7748,Women's - Glossy Pointy Flats,,14.9,flats
7749,Women's Ballet Shoe Comfy Ribbon Cute Down Flat,Ollio,15.99,flats
7750,Women's Basic Point Toe Ballet Flats,Walstar,11.99,flats
7751,Women's Anna01/Spu Ballet Flat,,40.95,flats
7752,Women's Vailee Marble Flat,,64.95,flats
7753,Women's Ballet Shoe Low Heel Enamel Multi Color Flat,Ollio,15.99,flats
7754,Leather Cedro/Croco Flats,Bruno Menegatti,49.9,flats
7755,Round Toe Extra Cushioned Insole Slip On Comfort Dress Flats,Sully's,21.0,flats
7756,Women's Leather Casual Loafers Ballet Slip On Comfort Flat Shoes,SATUKI,32.99,flats
7757,Adames Monaco Jelly Flats Dark Beige Matte (7),Victoria,32.95,flats
7758,Adames Monaco Jelly Flats Black Matte (7),Victoria,32.95,flats
7759,Earthies Clare,,45.0,flats
7760,Women's Leather Flats Shoes,ara,110.95,flats
7761,Footprints by Birkenstock Tirano Leather Shoe,Birkenstock,59.99,flats
7762,Women's Peach Painted Canvas Shoes Pink,UIN,59.99,flats
7763,Womens Judy Flat,Journee Collection,39.99,flats
7764,Bahamas Womens Lightweight Slip-On Canvas Shoe,,18.99,flats
7765,Women Suede Round Toe Slouchy Ballet Flat BD51,,9.99,flats
7766,Womens Pumps Ankle Strap Big Bow Pointed Toe Plus Size Stilettos Shoes Non-Slip,Fheaven,22.19,flats
7767,Women's Canvas Side Bow Slip On Basic Ballet Flat,Charles Albert,17.94,flats
7768,Womens Yoga Prima Sidewalk Surfers Footwear,,14.97,flats
7769,Women’s Ballet Flats Casual Slip On Faux Suede Tassel Fringe Moccasin Shoes,ESSEX GLAM,18.99,flats
7770,The Lilian Flat,Comfortview,50.97,flats
7771,Womens/Ladies Jovanna Phoebe Slip On Plain Shoes,,63.45,flats
7772,Women's 10009721 Navy Painted Stripe Alpargata Flat,TOMS,29.89,flats
7773,"Women's Maxwell Sand Flat,",,225.0,flats
7774,Embroidery Mary Jane Casual Women's Comfortable Flats Walking Shoes,VFDB,16.99,flats
7775,Women's Sammi Woven Mary Jane Shoe Mosaic Multi,Zee Alexis,46.99,flats
7776,Women's Elodie,,169.99,flats
7777,MARLENE Women's Pump,Mark Lemp Classics,94.95,flats
7778,Women's D Modesty Flat,,77.42,flats
7779,Women's Jeweled Monk Strap Flat,Lola Cruz,62.0,flats
7780,Think!! Womens 82060,Think!,235.0,flats
7781,Women's Zusien Mary Jane Flat,ALDO,60.0,flats
7782,Women's D Lola Ballet Flat,,310.99,flats
7783,4271 L18 Womens Mary Jane Flats,,104.95,flats
7784,Adult Orange Glitter Studded Appliques Slip-On Trendy Shoes 6-11 Women,Liyu,11.99,flats
7785,Women's Superquilted Flat,,135.0,flats
7786,Women's - Fabric Pointy Flats,,14.9,flats
7787,Women's Round Toe Distressed Faux Pearl Strappy Ballet Flat,CAPE ROBBIN,8.48,flats
7788,Women's Ingles Elastico Flat,Natural World,11.35,flats
7789,Aquatalia Women's Monica Suede Pointed-Toe Flat,,313.64,flats
7790,Women's Basic Point Toe Ballet Flats,Walstar,11.99,flats
7791,Women's Nalo Shoe,,22.99,flats
7792,'SANIA' Women's Flat,RIALTO,17.49,flats
7793,Women's Center Peace Flat,,64.79,flats
7794,"Women's Flat Shoes, Unique Design Dirty Shoes Round Toe with The Star Pattern",F1rst Rate,29.99,flats
7795,Women's Sintra Canvas Geometry Graph Painted Flats Shoe Black&White,UIN,69.99,flats
7796,Ladies Flat Jutti Ehhnic Handmade Shoe Indian Shoes Saree Slippers Juti,Step n Style,45.0,flats
7797,Lucky Women's Embany,,34.5,flats
7798,Women's Shoes Flats Patent Leather Glitter Black White Yellow Blue Pink,Feilongzaitianba,45.5,flats
7799,Women's Cotton Canvas Casual Slip On Fashion Shoe Flats Espadrilles,Enimay,5.06,flats
7800,Ladies Aqua Shoe,The Wave,10.5,flats
7801,Womens Adoraballerina Perforated Flat Shoes,,99.99,flats
7802,Women's Glamour Flat,,109.99,flats
7803,Women's Lopaz-22 Ballet Flat,Yoki,21.64,flats
7804,Women's Space Love + Jason Wu Ballet Flat,,49.95,flats
7805,Womens LEOMBRUNI Leather Stud & Buckle Flat Shoes Black 260929E,Attilio Giusti,122.0,flats
7806,Women's Nevada 4 Ballet Flat,,55.0,flats
7807,Mia Mesh Womens Slip On Shoes / Flats,,35.07,flats
7808,Fit Flop X Anna Sui Women's Latticed Ballerina Flats,,52.24,flats
7809,Womens Scala,,144.95,flats
7810,Lauren Ralph Lauren Women's Betty Ballet Flat,,59.95,flats
7811,Tara Berry Brushstroke Leopard Ballet Flats,Butterfly Twists,24.99,flats
7812,Women's Pointy Toe Pumps Flat Shoes,Fashionmore,45.58,flats
7813,Women's Round Toe Bowknot Ballet Comfort Slip On Flats Shoes,OCHENTA,17.99,flats
7814,Women's Elegant Pointed Toe Satin Flats Punctuated with Rhinestones Party Court Shoes,Loslandifen,51.99,flats
7815,Women's Bernie Mev Brooke Slip On Bronze (41 M),,19.95,flats
7816,Women's Feature Fest Ballet Flat,,57.95,flats
7817,Propet Women's Suzie Oxford,,36.0,flats
7818,Propet Women's W3721 Opal Sporty Mary Jane,,42.0,flats
7819,Women Flat Shoes Ballet Flats Ankle Strap Leather Shoe Pointed Toe Shoes,Maybest,22.32,flats
7820,Linzi Bria,,55.55,flats
7821,Women's Ballet Shoe Glitter Ribbon Flat,Ollio,15.99,flats
7822,Women's Brandi Black Kid,Munro,169.95,flats
7823,Ellie 016-MILA Womens Comfortable Fashion Adult Flat With Bow,,23.95,flats
7824,Women's Zaans Comfort Microfiber Fashion Shoe,UIN,78.0,flats
7825,Women's Tofino Slip On,,294.9,flats
7826,Versailles,Earthies,49.95,flats
7827,Women's Thomasina Ballet Flat,L.K. Bennett,195.0,flats
7828,Woman Shoes decollet High Heel P805000D/614,Nero Giardini,143.75,flats
7829,Women's Caroline Suede Flat,,60.76,flats
7830,Unisex Era (Mixed Suiting) Skate Shoe (8 B(M) US Women / 6.5 D(M) US Men),,64.95,flats
7831,Women's Pop Charm Ballet Flat,Zaxy,17.94,flats
7832,Women's Omara Loafers,,39.63,flats
7833,Women's Fabiola Ballet Flat,,45.91,flats
7834,Women's Classic Pointed Toe Glitter Dress Ballet Flat,Minisusu,23.99,flats
7835,Women's Leather Spell Color Low-Heeled Shoes Pregnant Shoes Driving Shoes,Zoulee,29.99,flats
7836,New Brieten Women's Cute Bow Mesh Ballet Flat Comfort Shoes,Brieten,26.99,flats
7837,Women's Gz Shopping Black Flat,,63.46,flats
7838,Women's Criss,,65.0,flats
7839,Light Lemon Cream Beaded Wedding Flats Khussa Indian Sari Bridal Shoes,Beachcombers,39.99,flats
7840,Women's Revspa,Cobb Hill,106.83,flats
7841,Women's Embroidered Casual Flats Mary Jane Lace Multi Color,HONGRUIJIA,15.0,flats
7842,Earthies New Women's Essen Flat Navy Printed Suede 8.5,,39.95,flats
7843,Women's Uncross Flat,,84.9,flats
7844,Women's Beachinit Metallic Espadrille,,40.0,flats
7845,Mixed Media Saree Lace Up Tasseled Dorsay Espadrille Flat GC03,BETANI,19.19,flats
7846,Womens Nubuck Stud Pointed Toe Flats,Brinley Co,14.99,flats
7847,Women's Pointed Toe Casual Ballet Flats Driving Shoes,Always Pretty,18.99,flats
7848,"Women's 10002472 Canvas Alpargata Flat, Black, 8 M US",TOMS,33.5,flats
7849,Women's Tammy Flat,,28.55,flats
7850,Women's Pompei Ballet Flat,,98.99,flats
7851,Women's Misfits Skull Flats,,18.0,flats
7852,Mary Jane Canvas Phoenix Embroideried Women Soft Sole Chinese Shoes Casual Flats,Fanwer,18.99,flats
7853,"Womens 28202 Loreta Black,Casual",Flexi,59.0,flats
7854,Women's Banner Lace Flats,Kate Spade New York,155.0,flats
7855,Womens Casual Pointed Toe Slip On Loafers Boat Shoes Ballet Flats Shoes By Focussexy,Focussexy,3.98,flats
7856,Gravity Defyer Women's Women's Ballistic White/Silver/Pink Synthetic Leather/Mesh 10.5 Medium,SoftWalk,29.14,flats
7857,The Jolie Flat,Comfortview,45.97,flats
7858,Women's Classic Suede Pointy Toe Ballet Flat Shoes,Solemate,16.49,flats
7859,Women's Fashion Bow T Strap Buckle Flats Shoes,Show Shine,26.0,flats
7860,Womens Henlee Fabric Cap Toe Ballet Flats,Munro,128.99,flats
7861,Womens Janelle,,39.99,flats
7862,Women's Classic Fun Ballerina Flats,Charles Albert,7.5600000000000005,flats
7863,Women's Flat Shoes wedding bridal flats,Walstar,15.99,flats
7864,"Parkside 12CM PVC/Nappa in Light Khaki/Chalk, Size 6.5M",,99.99,flats
7865,Womens Faux Patent Strappy Buckle Flats,Journee Collection,39.99,flats
7866,Womens Round Toe Transparent Clear Lucite Ankle Strap Ballerina Ballet Flat Shoes,Forever Link,13.99,flats
7867,Pointy Toed Stylish Women Flat by Essie,Gal,7.0,flats
7868,Women's Astrid Flat,,59.9,flats
7869,Japanese Sweet Lolita Shoes Round Toe Low Heel Shiny Gold/Silver Mary Jane Party Shoes,Lorie & Knight,37.9,flats
7870,Dr. Scholl's Women's Glorious Flat,Dr. Scholl's Shoes,49.99,flats
7871,"Women's Ultimate Slip-On, Brown, Size 10.0",,25.49,flats
7872,Women's Calc-S Black Mary Jane Pointed Toe Nubuck Flats Patent Ankle 7.5 D(M) US,Cityclassified,12.99,flats
7873,Women's Telegrapg Leather Ballet Flat,,63.99,flats
7874,Dainzuy Women's Casual Pointed Toe Sole Vogue Low Heel Flats Shoes,Dainzuy Women's Shoes,8.99,flats
7875,Women's Moana Flat,,67.99,flats
7876,Women's Hetty-1 Faux Suede Pinty Toe Slip-on Ballet Flats,Bonnibel,15.95,flats
7877,Women Classic Pointy Toe Ankle Strap D'Orsay Flats Zipper Comfortable Walking Shoes Size 4-15 US,FSJ,55.99,flats
7878,Women's Kimber Ballet Flat,,29.99,flats
7879,Disney Pixar Toy Story Mr. Potato Head Printed Flats,Irregular Choice,145.0,flats
7880,Women's Zeldas Zing Flats Shoes,Poetic Licence,54.62,flats
7881,Womens Flat Shoes | Pointed Toe Suede Shoes | Ladise Casual Low Heel Shallow Shoes,Inkach,9.99,flats
7882,Women's Seana Ballet Flat,,79.99,flats
7883,Women's V519 Flat,Fidji,176.95,flats
7884,Julia-16 women's Casual ballet flat boat slip-on pointed toe soft sole bling shoes,Refresh,8.99,flats
7885,Women's Earth Fest Repurpose Flat,,41.65,flats
7886,Cliffs 'Brentwood' Women's Flat,CLIFFS BY WHITE MOUNTAIN,21.33,flats
7887,Antistress Doris White Multi Sneaker,,88.44,flats
7888,Women's Tobago Flats,,50.0,flats
7889,Womens Mary Jane Shoes With Cone Shape Heel and Charm,,180.12,flats
7890,"Women's Superstar Slipon W, Footwear White/Footwear White/CORE Black, 7.5 US",,132.0,flats
7891,Arcopedico; Women; L15 Red Shine 37,,94.95,flats
7892,"Women's Genuine Suede Jeweled Flat, Black with Silver Jewels",AVON CUSHION WALK,18.99,flats
7893,KAZAKOVA (9 B(M) US),,29.99,flats
7894,Women's Embroidered Froral Mary Jane Flats Shoes,VenusCelia,16.99,flats
7895,Women's Pop-up Pointed Toe Flat,,134.99,flats
7896,Women's Vegan Evanna Cut-Out Flat,Bourgeois Boheme,199.0,flats
7897,Women's Adel1 Slip-On,ara,149.95,flats
7898,"Pointed Toe Flats For Women, Fashion Rivets Studs Comfort Ballet Flats Shoes",VOCOSI,39.98,flats
7899,London Women's Fonteyn Ballet Flat,,110.06,flats
7900,Women's Lilly Fast Metal Size 39M,,294.95,flats
7901,"Women's A301w Mary Jane Flat,",Apex,49.99,flats
7902,Women Quilted Bow Cap Toe Slip On Ballet Flat DD90 - Natural,,11.99,flats
7903,Women's Pointed Toe Simple Styles Genuine Leather Comfortable Ballet Flats Casual Pumps Shoes,queenfoot,65.88,flats
7904,"Women's Glitter Slip-on, Silver 5",TOMS,74.95,flats
7905,Women's Leina Black Flare 42 European,,104.95,flats
7906,Women's Stacey Stud Bow Sneakers,,59.99,flats
7907,Womens Nikki Leather Closed Toe Ballet Flats,Adam Tucker,81.68,flats
7908,Comfortable Slip On Shoes Jelly Flats Casual Footwear for Driving Walking Florals Collection,JA VIE,49.0,flats
7909,Women Patent Pointy Toe Caged Strappy Cutout Flat EE27 - Black,,14.95,flats
7910,Women's Padre Ballet Flat,French Sole FS/NY,103.82,flats
7911,Women's Sarina Ballet Flat,,69.95,flats
7912,Women's Vesper Embellished Beaded Dress/Casual Ballet Flat (11 B),Faye + Valerie,39.99,flats
7913,Women's Total Motion 20mm Lazer Cut Out Ballet Ballet Flat,,60.99,flats
7914,Women's Gale Mary Jane Flat,,87.84,flats
7915,Womens Fashion Gold Flat Shoes Patent Leather - Comfortable Closed Toe Ballet,GottaBe,14.99,flats
7916,Cliffs 'Petto' Women's Flat,CLIFFS BY WHITE MOUNTAIN,18.2,flats
7917,Women's Felice2 Ballet Flat,,63.08,flats
7918,by Cherokee Women's Ballerina Shoe With Memory Foam Black/Multi,Laforst,19.99,flats
7919,Hush Puppies Women's Dana,,22.71,flats
7920,Womens Sophie Black Ballet Flats,Luo Luo,19.95,flats
7921,Women's Wide Toe Espadrille Cross-stitch Mary Jane Shoes,Soojun,23.99,flats
7922,Womens L1 Textile Shoes,,77.25,flats
7923,Women's Satin Smoking Mules Shoes Elegant Flats Shoes,TONGPU,29.9,flats
7924,Women's Lolita Bordeaux Fabric,,68.95,flats
7925,Women's Waitress Style Round-head Lolita Shoes,Partiss,12.99,flats
7926,Women's Badia 20 Flats,,595.0,flats
7927,Ballet Flat for Women Pointy Toe Ankle Straps Buckle Suede Flats Shoes,Dear Time,19.99,flats
7928,Womens aricia Closed Toe Ballet Flats,,46.99,flats
7929,Women's Yelda Flat,,234.9,flats
7930,Occupational Womens/Ladies Sure Track Slip On Work Shoes,,75.95,flats
7931,Doris 06 Women's Slip On,,107.99,flats
7932,Women's CARA Moccasin,,19.99,flats
7933,Women's Abbi Pointed Toe Flat,Kelsi Dagger Brooklyn,30.48,flats
7934,Women's Alicia Ballet Flat,,177.5,flats
7935,Women's Relia Criss-Crossing Straps Casual Shoes Pointed Toe Ankle Tie Ballet Flats Pumps Shoes,Comfity,29.99,flats
7936,Womens Salia,,67.99,flats
7937,Sugar Alto Ballet Flat Faux Suede,,19.99,flats
7938,Womens Dress Wedding Flat Lacemps Round Toe Purple Slip On Lace 9872-19,Vimedea,40.9,flats
7939,Women's Pointed Toe Adjustable Ankle Strap Mary Jane Ballet Flat,IYNX,20.28,flats
7940,Demonia by Women's Daisy-07 Mary-Jane Flat,,43.95,flats
7941,"Beige Blue Ballet Flat for Women,Metal Buckle Round Toe Slip on Flats",York Zhu,33.29,flats
7942,Women's Patent Ballet Flat,Chatties,11.99,flats
7943,Women's Grant Flat,,43.14,flats
7944,Women's Adonis Ballet Flat,,38.12,flats
7945,Women's Comfy Suede Bow Pointy Slip On Flats Work Shoes Wide Width,,32.96,flats
7946,Women Round Toe Bow Tie Perforated Ballet Flat HH88,Alrisco,21.59,flats
7947,Women's Willow Pointed Toe Flat,2 Lips Too,25.36,flats
7948,Women Leatherette Pointy Toe Perforated Mary Jane Flat FI31 - Blue Denim,,21.59,flats
7949,Tiana Women Square Toe Canvas Black Flats,,74.0,flats
7950,Women's Jason Polan Leather Wink Espadrilles,Soludos,82.99,flats
7951,"Women's Flat Shoes,Slip On Flat Round Toe Shallow Shoes Casual Comfortable Ballet Flats",Kinrui,6.99,flats
7952,Women Flats With Round Toe and Buckle/Mary Jane Flats With Plus Size Available,SJJH,20.99,flats
7953,Womens Ladies Mary Jane Ballet Flat Shoes,Sweet Holic,32.9,flats
7954,Women's Stripped Platform Smoking Slipper Flat,Soludos,53.63,flats
7955,Flat Jooti Indian Shoes Phulkari Jutti Salwar Kameez Jutti Saree Jutti,Step n Style,31.95,flats
7956,Womens Elise Pewter Metallic Slip On Ballet Flat Shoes,,49.99,flats
7957,Women's Signmeup Suede Ballet Flat,,55.48,flats
7958,Womens MK Hamilton Ballet,MICHAEL Michael Kors,88.0,flats
7959,Women's Multicolor Elastic Woven Mary Jane Flats Shoes,BIFINI,21.99,flats
7960,Women's Leo Perf 2 Piece Moccasin,,92.98,flats
7961,Women's Fashion Pointy Low Cut Ballet Flats Slip On Boat Shoes,SFNLD,29.99,flats
7962,Shoes Women's Patty Ballet Flat,Wanted,20.84,flats
7963,Women's Basia Leather Flat,Latigo,59.99,flats
7964,Women's Raelin-2 Ballet Flat,,218.85,flats
7965,Women's Craven Leather Ballet Flat,,89.0,flats
7966,Women's Mary Jane Shoes Ballerina Ballet Flats Shoes,Fancyww,35.99,flats
7967,Women Suede Canvas Shoes Stars Platform Ladies Casual Female Trainers Femme Zapatos Mujer,Feilongzaitianba,35.87,flats
7968,Women's Tmd Flat Moc Shoes,,119.95,flats
7969,WOMEN'S ORANE 4 AP IN FLATS IN GREEN 6.0 US,,64.94,flats
7970,Women's x Vivienne Westwood Doll Flats,,145.0,flats
7971,Women's Truethat Leather Loafer,,30.43,flats
7972,Women's Evianna Ease,,41.93,flats
7973,Women's Havana Mary Jane Wedge,,39.3,flats
7974,The Hadlee Flat,Comfortview,48.99,flats
7975,Women Cute Pointed Toe Flats with Bowknot Velvet Low Heels Slip On Comfy Shoes Size 4-15 US,FSJ,55.99,flats
7976,2018 Summer Breathable Women Woven Shoes Handmade Elastic Woven Flat Slip On Blue Gingham Shoes Woman,Kenavinca,22.9,flats
7977,Women's Nadia Pump,,39.97,flats
7978,Women's Zance Suede Ballet Flat,,27.52,flats
7979,Lauren Ralph Lauren Women's Pia Loafer,,85.98,flats
7980,Women's Adrian Pointed Toe Flat,Daya by Zendaya,19.97,flats
7981,Lush Velvet Ballet Flats With Twisted Knot Detail Ankle Strap Slip On Shoes,Steven Ella,9.99,flats
7982,Women's Vegan Leather Memory Foams with Buckle Strap Ballet Flat,Charles Albert,19.6,flats
7983,Women's Oleena Fabric Ballet Flat,,56.06,flats
7984,simply FABRIC footwear Women's Summer,ionic epic,35.0,flats
7985,Women's Nitro Black Flat,,49.99,flats
7986,Women's Jayden Moccasin,,71.66,flats
7987,Women's Petra-Ch Mary Jane Flat,Cobb Hill,95.0,flats
7988,Women's Pointed Toe Flats Cut-Outs Ballet Shoes Slip-on Casual Shoes,Sammitop,19.99,flats
7989,Women Jelly Open Toe Platform Flatform Flat CC83 - Clear,Nature Breeze,21.59,flats
7990,Womens Paisley,Trask,110.99,flats
7991,Women's Sola,,23.09,flats
7992,BOBS from Women's Super Plush Flat,,36.89,flats
7993,BOBS from Women's Bliss 2.0-Big Surprise Flat,,22.2,flats
7994,Women Strap Flat Ponted Toe Zipper Closure Ankle Height with Buckles Adjustment Faux Suede,Sweet eCom,21.99,flats
7995,Gem Posey Ballet Flat Navy 11M,Vionic,89.86,flats
7996,Womens Zion Waterproof,Wolky,28.6,flats
7997,New Women Shoe Handmade Leather Indian Khussa Ballet Saree Flat Wedding,Step n Style,38.95,flats
7998,"Women Ballet Flats Slip-On Leather Shoes, Casual Loafer Moccasins Boat Shoes for Lady",libre comme l'air,15.0,flats
7999,Women's 15-A5001 Ballet Flat,Amiana,19.99,flats
8000,Women's Hey You Guys Cleated Flat,,48.35,flats
8001,by Kenneth Cole Women's Its So Fun Flat,,103.99,flats
8002,American Living Womens Dolores Closed Toe Ballet Flats,American Home Living,30.99,flats
8003,Women's Cr Future Chocolate Flat,,72.63,flats
8004,"Women's Augusta Ballet Flat, Malibu Blue, 10 M US",,64.53,flats
8005,Women's PT Weave Ballet Flat,ALL BLACK,32.0,flats
8006,Geometric Perforated Faux Leather With Bow Trim Ladies Flats,,16.95,flats
8007,Women's Foldable Portable Travel Ballet Flat Comfortable Party Roll up Shoes w/ Matching Carrying Bag,Sibba,13.99,flats
8008,"Ballet Flats Women's Shoes, Best Foldable & Flexible Flats, Slipper Socks, Travel Slippers & Exercise Shoes, Dance Shoes, Yoga Socks, House Shoes, Indoor Slippers, Pink Baroque, Small",Nufoot,9.99,flats
8009,Women's Natasha Star Studded Mules,MICHAEL Michael Kors,116.98,flats
8010,"Women's Classic Slip-On (9 B(M) US / 39-40 EUR, University Ash)",TOMS,68.95,flats
8011,Women Leatherette Pointy Toe Dorsay Gilly Tie Wrap Flat EA62,,8.0,flats
8012,Women's Comfort Casual Round Toe Low Tops Driving Walking Lace Up Flats Skateboard Shoes,,29.97,flats
8013,Womens Vegan Leather Square Toe Elastic Ballet Flats Slip On Shoes,AnnaKastle,29.9,flats
8014,Women's Isabel Flat,,35.99,flats
8015,Women Flats Shoes Glitter Mesh Ballet Flats Slip on Flat Shoes,Walstar,16.99,flats
8016,Unisex comfort Leather Fashion Soft Flat Faux Slip-on Loafers Casual Walking Shoes,Academyus,14.0,flats
8017,Women's Rachel Black Calf Flat,,151.05,flats
8018,Women's Measure Flat,,7.99,flats
8019,Women's Clear Transparent Buckle Strap Rhinestones Decorated Ballerina Ballet Flat Shoes,DEV,7.64,flats
8020,Spring Autumn Casual Flats Shoes Plat Knot Shallow Creepers,Baqijian,35.93,flats
8021,Womens BELLA Flat,ara,40.01,flats
8022,Women Faux Suede Pointy Toe Dorsay Flat GG19,,35.99,flats
8023,Dr. Scholl's Women's Sand Patent Flat Shoes - 8.5 C/D US,Dr. Scholl's Shoes,49.83,flats
8024,Women's Atta Girl Ballet Flat,,59.99,flats
8025,Shoes CATE Women's Flat,CLIFFS BY WHITE MOUNTAIN,37.4,flats
8026,Paula Women's Slip On,ARRAY,37.99,flats
8027,Paula Women's Slip On 9.5 B(M) US Black-Patent,ARRAY,37.99,flats
8028,Paula Women's Slip On 9 B(M) US Nude-Patent,ARRAY,37.99,flats
8029,Women's Croche N960 Flat,El Naturalista,49.99,flats
8030,Women's Caroline Ballerina Ballet Flat,,79.99,flats
8031,Womens Baffle,,42.99,flats
8032,Women's Doris-28 Faux Suede Pointed Toe D'Orsay Flats,Weeboo,15.95,flats
8033,Women's Fluffy Slippers Pearl Mules Tassels Flat Slip-On Shoes,LaRosa,59.99,flats
8034,Kalso Earth Women's Solar 3 Mary Jane Flat,Kalso Earth Shoes,64.9,flats
8035,DbDk Women's Casual Pointed Toe Slip On Rhinestone Fashion Dress Ballet Flat,Db Dk Fashion,8.0,flats
8036,Women's Ag Petula Flat,Andrew Geller,19.99,flats
8037,Women's F-Pop Ballerina (Leather) Flat,,115.01,flats
8038,Rockport Women's Paula CH Flat,Cobb Hill,44.99,flats
8039,Adult Orange Stud Embellished Slip-On Trendy Espadrille Shoes 6-11 Women,Liyu,11.99,flats
8040,"J. Renee Women's Bacton Flat,Red Suede/Patent/Mesh,US 7.5 M",J.Rene�,28.99,flats
8041,Laceless Low Top Womens Slip On,Mustang,81.77,flats
8042,Women's Black Flat Wedding Shoes for Bride Khussa Jutti,Mimi,35.0,flats
8043,Womens Khussa Silk Beaded Flats Shoes,Beachcombers,40.99,flats
8044,"Women's DEA Flat, Navy Suede, 9 S US",,92.95,flats
8045,Dana-12 Women's Classic Comfortable Ballerina Flats Rounded Toe Suede Slip On Flats Tan 6,ANNA,4.18,flats
8046,Women's Larissa Ballet Flat Shoe,Michael Kors,68.6,flats
8047,Fashion Womens Low Heel Mary Jane Flats Shoes,Charm Foot,28.0,flats
8048,Dr. Scholl's Women's Sincerity Flat,Dr. Scholl's Shoes,49.99,flats
8049,Women's Swift-133 Pointed Toe Flat,,24.71,flats
8050,Women's Velour Chantell W/Fur Collar Flat,,12.59,flats
8051,Women's Right Nina K400194 Mary Jane Flat,,119.95,flats
8052,Women's Color Lump Canvas Casual Slipper Multicolor,UIN,59.99,flats
8053,Women Ballet Flats Classy Girls Casual Slip-on Comfort Walking Shoes,Hanglin Trade,37.99,flats
8054,"Womens Serene Flat,Navy,8 N US",,125.0,flats
8055,Lakeside Women US 8 White Flats,BZees,59.99,flats
8056,Women's Sass Bootie,,72.16,flats
8057,TASH FOLDS FEMALE ADULT PRIMA BALLERINA 100% PU LEATHER FOLDABLE FLAT,Tash Limited,24.99,flats
