,product_name,seller,price,category
8275,Women's Kit Josie Kitten Heel Black Suede 8 B(M) US,Vionic,139.95,pumps
8276,Women's Duran Dress Pump,Pelle Moda,57.74,pumps
8277,Women's Stessy R Platform Pump,ALDO,67.13,pumps
8278,Women's Aimee Wedge Pump,,99.95,pumps
8279,Women's Formal Tuesday Pumps Shoes,Cull4U,26.99,pumps
8280,Womens Bows Chunky Heels Square-Toe Urethane Pumps-Shoes,A&N,44.99,pumps
8281,Womens Lena Wedge 75 II Pointed Toe Wedge Pumps,,79.99,pumps
8282,Women's MINA-16 double ankle strap retro inspired low heeled pumps,Chase & Chloe,24.99,pumps
8283,Women's Grove Pump,,23.78,pumps
8284,Walking Cradles Women's Pepper Pumps Shoes,Rose Petals by Walking Cradles,64.0,pumps
8285,Women's High Heel Peep Toe Ankle Strap Buckle Pumps Leopard Bows Sandals,Easemax,29.99,pumps
8286,Women's Winda Dress Pump,,63.61,pumps
8287,"Judy-21S Platform Pumps-Shoes,6.5 B(M) US,Peach-21",,12.87,pumps
8288,Women's Sexy-20/Pppcp,,14.21,pumps
8289,Women's Pointed Toe Bows Chic Sequins Date Low Heel Pumps Shoes,Carolbar,28.0,pumps
8290,Womens Comfort-sole Buckle Detail Wedges,Journee Collection,49.99,pumps
8291,Women's Kennard Leather Pump,,35.99,pumps
8292,Women's Platform Wedges Oxfords Classic Casual Lace Up Mid Heels Wingtips Square Toe Shoes,Cicime,9.98,pumps
8293,Women's Paulette D'Orsay Pump,,129.99,pumps
8294,Women's Sumner Suede Pump,,50.99,pumps
8295,"Round Toe Extra Cushioned Comfort Classic Dress Work Pumps (Silverlgt, 10 B(M) US)",City Classified,21.99,pumps
8296,Ladies Winkle Pinker Buckle Stiletto Imitated Leather Pumps-Shoes,BalaMasa,31.99,pumps
8297,Women's Fashion Solid Color Pointed Toe Mid Chunky Heels Pumps,Latasa,24.0,pumps
8298,"Women's Lynn Dress Shoes,Fuchsia,12 WW US",Annie,34.97,pumps
8299,Jiame Women High Heel Pumps Closed Toe Rhinestones Satin Evening Party Wedding Shoes,M MULGARIA,50.99,pumps
8300,Women's Alexis Dress Pump,,25.52,pumps
8301,D2 Fusions Candy-Colored Faux Suede Platform Pumps Stilettos High Heels-7,JJF Shoes,9.99,pumps
8302,Women's 3.5 Inch High Heel Pointed Closed Toe Slip On Fashion Dress Pump,Enimay,8.0,pumps
8303,"Comfortable Foam Padded Chunky Block Heel Dress Pump, Women's Office Shoe",City Classified,29.0,pumps
8304,Women's Ditte Dress Pump,,65.27,pumps
8305,Women's Sto7h65 Dress Pump,Cobb Hill,18.9,pumps
8306,"Fab Two Tone Cut-Out Mesh Ankle Strap Platform Stiletto Heel Dress Pumps,LF80865",SHOW STORY,34.99,pumps
8307,Women's Kit Josie Kitten Heel Navy 8 W US,Vionic,139.95,pumps
8308,Women's Jiena Dress Pump,,120.36,pumps
8309,Women's Crossroad Suede dress Sandal,,47.59,pumps
8310,Women's 254-Edith,,31.65,pumps
8311,Womens High Heel Pumps Shoes for Women Ankle Wrap Pointy Toe Block Heel Dress Pump Black US 4.5,Dear Time,21.99,pumps
8312,Women's Sweet Faux Suede Chunky Mid Heeled Pearls Pointed Toe Slip On Bridal Pumps Shoes,,35.99,pumps
8313,Women Ankle Strap Kitten Heel Solid Pumps with Buckle Comfortable Shoes,AIYOUMEI,29.99,pumps
8314,Chocolaticas High Heels Marie Antoinette Women's Mary Jane Pump,Hot Chocolate Design,99.99,pumps
8315,Women Pointed Toe Rhinestone Pumps Stilettos High Heel Slip On Satin Wedding Dress Shoes,XYD,72.79,pumps
8316,Women's Bryanne Dress Pump,,32.98,pumps
8317,Womens Addington Bootie,,76.0,pumps
8318,Women's Multicolor High Heel Ankle Strap Pumps Shoes,Charm Foot,28.0,pumps
8319,Pointed Toe Stilettos Sexy Women's high Heels Wedding Shoes Shallow Mouth,FORTUN,39.99,pumps
8320,Women's Karolina Sandal Dress Pump,,101.66,pumps
8321,Women's A-Aziza Blocked Heel Pump,,79.97,pumps
8322,Women's Pointed Toe Kitten Heel Dress Pumps,AOOAR,41.99,pumps
8323,Women's Pointed Toe Slip-On Party High Heels Stilettos Pumps Shoes,Carolbar,28.0,pumps
8324,Women Open Toe Lace up Stiletto Pumps Studded Evening Sandals Prom Dress Shoes High Heels,LizForm,49.99,pumps
8325,Women's Kit Josie Kitten Heel Sand 8.5 W US,Vionic,139.95,pumps
8326,Women's Classic Checkered Dress Block High Heels Pumps Shoes,,34.97,pumps
8327,HC1701 Women Pumps Chunky Heel Mary Jane Closed Toe Lace Bridal Wedding Shoes,ElegantPark,48.99,pumps
8328,Bridal Wedding D'Osray High Heel Pumps Summer women Soft leather Shoes Fashion Style Woman Silver4.5 B(M) US,Laolaooo Shoes,21.64,pumps
8329,Ladies Solid Chunky Heels Buckle Urethane Pumps-Shoes,BalaMasa,38.99,pumps
8330,Lydia-12 Women's Pointy Toe High Heel Faux Leather Sexy Stilettos,,18.99,pumps
8331,Liliana Leeta-3 Black Multi Color Stud Clear Straps Pyramid Stud Open Toe Heels,Michelle Parker,44.99,pumps
8332,Women's Sweet Pionted Toe D'Orsay Ankle Strap High Heels Pumps Shoes,Charm Foot,24.0,pumps
8333,Shoe Republic Velvet D'Orsay Pump w/Wraparound Ankle Strap Vivia,Shoe Republic LA,25.0,pumps
8334,Women's Gradients Patent Leather Pointed Toe Sexy High Heels Pumps Shoes,Carolbar,34.0,pumps
8335,Women's Gianina Wedge Pump,,44.99,pumps
8336,by Kenneth Cole Women's Logan Wedge Pump,,89.99,pumps
8337,Women's Tatiana Metallic Dress Pump,,79.0,pumps
8338,Women's Lucca Pumps,,297.99,pumps
8339,Y120P Womens Kitten Heel Leopard Satin Evening Party Bridal Wedding Sparkle Strappy Crystal Shoes,Minishion,39.99,pumps
8340,Women Chunky High Heel T-Strap with Little Bow Knot Ankle Strap Pump Shoes,SaraIris,33.83,pumps
8341,Women's Closed-Toe Patent Leather Low-Heels Solid Pumps-Shoes,AllhqFashion,31.94,pumps
8342,Lydia-12 Women's Pointy Toe High Heel Faux Leather Sexy Stilettos,,18.99,pumps
8343,Liliana Leeta-3 Black Multi Color Stud Clear Straps Pyramid Stud Open Toe Heels,Michelle Parker,44.99,pumps
8344,Women's Sweet Pionted Toe D'Orsay Ankle Strap High Heels Pumps Shoes,Charm Foot,24.0,pumps
8345,Shoe Republic Velvet D'Orsay Pump w/Wraparound Ankle Strap Vivia,Shoe Republic LA,25.0,pumps
8346,Women's Gradients Patent Leather Pointed Toe Sexy High Heels Pumps Shoes,Carolbar,34.0,pumps
8347,Women's Gianina Wedge Pump,,44.99,pumps
8348,by Kenneth Cole Women's Logan Wedge Pump,,89.99,pumps
8349,Women's Tatiana Metallic Dress Pump,,79.0,pumps
8350,Women's Lucca Pumps,,297.99,pumps
8351,Y120P Womens Kitten Heel Leopard Satin Evening Party Bridal Wedding Sparkle Strappy Crystal Shoes,Minishion,39.99,pumps
8352,Women Chunky High Heel T-Strap with Little Bow Knot Ankle Strap Pump Shoes,SaraIris,33.83,pumps
8353,Women's Closed-Toe Patent Leather Low-Heels Solid Pumps-Shoes,AllhqFashion,31.94,pumps
8354,Women's Tigers Eye Platform,,20.0,pumps
8355,Women's Hallie Fabric Pump,,51.6,pumps
8356,Women's Metal Decorations High Heel Platform Ankle Boots,Show Shine,35.0,pumps
8357,Women's Remo Pump,Thierry Rabotin,399.95,pumps
8358,Womens Bliss Kitten Heel,Butter Shoes,335.0,pumps
8359,"Women's BREANAY Pump,",Indigo Rd.,13.19,pumps
8360,Women's Porcupine Leather Dress Pump,,50.0,pumps
8361,Trillian Women's,,19.5,pumps
8362,Women's Saymyname Suede Dress Pump,,44.62,pumps
8363,Shoe Republic Pointy Toe Stiletto Pump Paltrow,Shoe Republic LA,24.99,pumps
8364,Women Formal & Elegant Stiletto Pumps Slip-on Pointed Toe Shoes Size 1-12.5 US,Smilice,26.99,pumps
8365,Women's Zora Patent Heels,,24.99,pumps
8366,Womens Demin Wedding Dress Pumps Pointed Toe High Heels,Hanxue,42.99,pumps
8367,Womens Eleyou Pointed-Toe 10CM Stiletto Slip-on Pumps Shoes,Calaier,39.99,pumps
8368,CORA | Women's Pointy Toe Mid-Height Leather Slingback,Linea Paolo,129.95,pumps
8369,Women's Celestine Leather Dress Pump,,79.99,pumps
8370,Women's Chic Bows Chunky Heel Pumps Platform Shoes,Show Shine,28.5,pumps
8371,Women Multi Coloured Diamond Slippers Kitten Heel Open Toe Sandals Shoes,Freerun,28.99,pumps
8372,Fabio-S Laser Cut Women's Pumps,My Delicious Shoes,32.99,pumps
8373,Women Elegant Slouch Peep Toe Pumps Glitter High Heels Stilettos Formal Office Shoes Size 4-15 US,FSJ,54.99,pumps
8374,EP11001 Women Mid Heel Ankle Strap Pumps Pointed Toe Rhinestones Satin Bridal Wedding Shoes,ElegantPark,48.95,pumps
8375,Women's Penelope-01 Dress Pump,,29.77,pumps
8376,Christain Black-White-Pink Multi Pump,,250.0,pumps
8377,Women Classic Pointy Toe Pumps Chunky Mid Heels Slingback Sandals Comfortable Shoes Size 4-15 US,FSJ,56.99,pumps
8378,Women's Low Kitten Heel Pointed Toe Dress Pump Shoes Hello Octopus,InterestPrint,39.99,pumps
8379,Women's Crescent Shoe,,49.66,pumps
8380,Women's Faux Suede Vintage Bowknot Casual Pointed Toe Slip On Flats Pumps Loafers Shoes Size 4-10.5,WAROFT,17.99,pumps
8381,Women's Shoes Pointed Toe Studded High Heel Pumps,Arc-en-Ciel007,82.0,pumps
8382,"Women's Circle Heels,Black Polyurethane,7.5 WW",Annie,23.63,pumps
8383,Women's Classic Round Toe Block Heel Pump,City Classified,30.93,pumps
8384,Womens Feel ya Open Toe Ankle Strap Classic Pumps,,88.86,pumps
8385,Women Retro High Heel Party Dress Shoes Block Heel Zip Pumps Shoes With Bow,TAOFFEN,24.99,pumps
8386,Women's Dove Dress Pump,,54.99,pumps
8387,Women's Unique Colors Shoes Pointed Toe Shallow High Heel Stilettos Pumps for Banquet Party,QianZuLian,41.99,pumps
8388,Women's Elegant Burnished Low Cut Dressy High Block Heel Slip On Pointed Toe Party Bridal Pumps Shoes,Aisun,32.97,pumps
8389,"Women's Lovely-401rs Sandal,",Fabulicious,55.15,pumps
8390,"OGSwideshoes Anneliya Black Extra Wide Fit Formal Shoes, C D 3E width",O.G.S. wide shoes,89.9,pumps
8391,New Wedding Women Pumps Platform Shoes Sexy High Heels Cross Tied Ladies Stiletto Heel Red Black,Runnning-sun,15.83,pumps
8392,Women Mesh Pointy Toe Single Sole Stiletto Pump HD64,Alrisco,23.39,pumps
8393,Women's Limi Wedge Pump,,57.99,pumps
8394,by Kenneth Cole Women's Okey Dokey MF Dress Pump,,149.99,pumps
8395,Women's T-Strap Pointed Toe Solid Ankle Strap Buckle High Heels Patent Leather Pumps Evening Dress Shoes,VOCOSI,36.99,pumps
8396,Studded Double Strap Slingback Kitten Heel Leather Pumps,Kaitlyn Pan,113.99,pumps
8397,Women's Frosted Closed-Toe Kitten-Heels Pull-On Solid Pumps-Shoes,WeenFashion,32.99,pumps
8398,"Women's, Tempo Mary Jane Shoes",BZees,33.34,pumps
8399,Womens Small Crocodile Design High Heels Cusp Work Pumps,Loslandifen,32.99,pumps
8400,Women's Winter Leopard Two-tone Ankle Band High Heel Shoe Pump,Ollio,25.99,pumps
8401,Women's Fold Mid Pump,UNITED NUDE,66.7,pumps
8402,Women's Daring Dress Pump,,39.59,pumps
8403,Womens Giona Leather Pointed Toe Slingback Classic Pumps,,168.0,pumps
8404,Women's Pointed Toe High Heels Pumps Work Office Shoes,DecoStain,28.99,pumps
8405,Women's Amela Grand 85mm Dress Pump,,114.99,pumps
8406,Women's Fashion Pointed Toe High Heel Pump Shoes,Charm Foot,26.0,pumps
8407,Women's Platform Pumps,Show Shine,29.0,pumps
8408,Women's Onlee Pump,,27.3,pumps
8409,Javitz - Nude Laser Cut Bowtie Pump,Chelsea Crew,69.99,pumps
8410,Women's Xeena Synthetic Dress Pump,,71.86,pumps
8411,Bordello By Women's Teeze-14 Platform Pump,,59.75,pumps
8412,Women's Mesh AB Rhinestone Round Toe Kitten Heel Pump,De Blossom Collection,9.8,pumps
8413,Women Glitter Rhinestones Studded Pumps Platform Wedge high heel Shoes Silver Red,Gaorui,12.88,pumps
8414,Womens Popsy,,45.99,pumps
8415,PASSION Vintage Inspired Scalloped Peep Toe Pump,Chelsea Crew,44.9,pumps
8416,Womens Crystal Stud Platform High Heels Evening Prom Wedding Dress Pumps,jiandick,56.99,pumps
8417,"Comfort Round Toe Extra Cushioned Comfort Classic Dress Work Pumps (Silverglt, 7.5 B(M) US)",City Classified,21.99,pumps
8418,Nick Of Time Womens Shoes,Irregular Choice,89.99,pumps
8419,Women's Pull-on Low-Heels PU Assorted Color Round Closed Toe Pumps-Shoes,AmoonyFashion,31.99,pumps
8420,Women's Sexy Pointed Toe Ankle Strap D-Orsay Sandals Chunky Heel Pumps Shoes with Pendant,SFNLD,31.99,pumps
8421,Patent Leather Womens Studded Wedge Pumps Ankle Strap,,39.99,pumps
8422,"Women's Sable Pump, Brown Catani",,29.99,pumps
8423,Women's Marley Anil Calf Dress Pump,,288.8,pumps
8424,Women's Fshion Peep Toe Court Shoes,TAOFFEN,33.89,pumps
8425,Women's Foreward Dress Pump,,69.99,pumps
8426,Women's Kit Josie Kitten Heel Navy 8.5 W US,Vionic,139.95,pumps
8427,2232306 Women's Nobuck Leather Peep-Toe Platform Pump,Bruno Menegatti,49.9,pumps
8428,Women's Clara (Kid Suede),,74.38,pumps
8429,Women Block Kitten Heel Pumps Patent Solid Ankle Strap Mid Heels Dress Shoes,COOLCEPT,23.99,pumps
8430,Womens Closed Round Toe High Heel Suede Frosted PU Solid Mary Jane Pumps,VogueZone009,32.98,pumps
8431,Women's Classic Fashion High Heel Dress Pump Shoes,InterestPrint,39.99,pumps
8432,The Maura Pump,Comfortview,55.97,pumps
8433,Women's Peep Toe Stiletto High Heel Plaform Slip On Party Dress Court Shoes,Vitalo,36.99,pumps
8434,Women's Black+Red Leather Latin Dance Shoes Ballroom Dancing Performance Shoes Model 513,Roymall,24.99,pumps
8435,Women's Pointed Toe Kitten Heel Pumps Classic Mid-heel Slip-on Office Dress Shoes,Sammitop,47.99,pumps
8436,Women's Vaile Sandal,,59.97,pumps
8437,"Women?s, Chiffon Mid Heel Pump NAVY 7.5 W",,54.95,pumps
8438,Women's Rhinestone Sparkling Glitter High Heel Platform Dress Pumps Shoes,Bonnibel,19.95,pumps
8439,Women's Mid Heel Pointed Toe Elegant Style Genuine Leather Comfort Dress Pumps Shoes,queenfoot,66.88,pumps
8440,Womens Fantasy Pointed Toe Slingback Dress Heels,,47.64,pumps
8441,Womens Half-3 Dressy Wedge Shoes,Blossom,38.95,pumps
8442,X Disney Mickey Mouse Platform Pump Limited Edition,Irregular Choice,259.0,pumps
8443,Womens Smith Mary Jane,,99.99,pumps
8444,Women's Sexy Leopard Print Platform High Heel Dress Pumps Shoes,Latasa,26.0,pumps
8445,Women's Stand Up Dress Pump,Madeline,17.62,pumps
8446,Womens Barely There Dress Fashion Stiletto Cut Out Open Toe High Heels,Viva,19.99,pumps
8447,Women’s Shoes Wedge High Heel Backstrap Patent Leather Peep ToeHeeled Platform Sandals,Arc-en-Ciel007,88.0,pumps
8448,Lug Sole Peep Toe Platform Heels,shoewhatever,29.99,pumps
8449,Women's Dressy Pointed Toe Low Cut Block High Heels Slip On Pumps Shoes,Mofri,34.99,pumps
8450,Womens Closed Round Toe High Heel Wedge PU Solid Pumps with Metal Buckles and Metal Chain,VogueZone009,28.99,pumps
8451,Women's Kitten Heels Solid Lace Up Soft Material Round Closed Toe Pumps-Shoes,AmoonyFashion,30.99,pumps
8452,Womens Closed Toe Pointed Toe Kitten Heels PU Soft Material Solid Pumps with Sequin,VogueZone009,29.99,pumps
8453,Women's Sweet Solid Round Toe Low Top Lace Up Mid Chunky Heel Pumps,CHFSO,30.98,pumps
8454,"MIUINCYWomen's Sexy Point Toe High Heels,Patent Leather Pumps,Wedding Dress Shoes,Cute Evening Stilettos",MIUINCY,39.99,pumps
8455,Women's Ta-Parlor Pump,,50.99,pumps
8456,Womens Vara CT,,650.0,pumps
8457,Women's Fashion Pointed Toe Low Heel Pump Shoes,Charm Foot,24.0,pumps
8458,Women's Jenna02/b Dress Pump,,42.95,pumps
8459,Womens Elusive Leather Pump Shoe,,39.99,pumps
8460,0112A Women's Bridal Shoes Closed Toe Low Heel comfort Satin Pumps Crystal Wedding Shoes,JIAJIA,39.99,pumps
8461,Penelope-202 Women's platform high heel nubuck double buckle straps side hollow pumps shoes,,19.99,pumps
8462,Women's Pointed Toe Kitten Heel Pearl Patent Leather Wedding Party Dress Pumps,TDA,47.99,pumps
8463,Women Stiletto Pumps Platform Mary Janes High Heel Dress Shoes,COOLCEPT,23.99,pumps
8464,Women's Rashana,,32.99,pumps
8465,Women's Idabell Dress Pump,,53.0,pumps
8466,Women's Mykela Patent Dress Pump,,89.0,pumps
8467,Women's Sexy Sequins High Heel Dress Pumps Shoes,Show Shine,29.0,pumps
8468,Ivory White Pearl Lace Wedding Shoes Bridal Bridesmaid High Heels Platform Pumps,Generic,99.99,pumps
8469,Footwear Women's Nicole D'Orsay Pump,,27.29,pumps
8470,Women's Yanci Pony Hair Pump,,51.97,pumps
8471,Women's Tony Suede Dress Pump,,74.89,pumps
8472,"Women Pumps Elegant Rhinestone High Heels Shoes Sexy Thin Pointed Single Shoes (Black, US:7)",Outsta,31.89,pumps
8473,Women's Buena Dress Pump,,52.99,pumps
8474,Women's Ankle Buckles Chunky Heel Mary Janes Shoes,Show Shine,29.0,pumps
8475,Women's AMU22/B Dress Pump,,48.95,pumps
8476,Women's Low High Heels Pumps World Map Printing Slip on Shoes,YCG,43.99,pumps
8477,Women's Almond Toe Rhinestone Studded Stiletto High Heels Ankle Platform Pumps,shoewhatever,24.99,pumps
8478,Women's Cute Closed Toe Thick Sole Wedge Heel Mary Jane Pumps Shoes,SFNLD,33.99,pumps
8479,Women's Manmade Ritzyy Classic 2-inch Pointed Toe Pump,Herstyle,15.99,pumps
8480,Candy 2 Silver Broach Shimmer Rhinestones Peep Toe Platform Pump,Lauren Lorraine,40.0,pumps
8481,Women's Sexy Pointy Toe Pumps - Low Cut Slip On Wedding Party - Stiletto High Heels Shoes,,29.99,pumps
8482,Women's Sexy Patent Leather Round Toe Low Cute Dress Slip On Heels Platform Stiletto High Heeled Pumps Shoes,,31.97,pumps
8483,Women's Pedell Pump,,79.0,pumps
8484,Womens Bentley Kitten Heel,Butter Shoes,325.0,pumps
8485,"Glam Floral Bow Peep Toe Slingback Stiletto Double Platform Pump,LF80904",SHOW STORY,34.99,pumps
8486,Womens Pointed Toe Sexy High Heel Slip On Stiletto Pumps Wedding Party Plus Size Shoes,Lovirs,39.98,pumps
8487,"Women's Lynn Dress Shoes,Fuchsia,9 W US",Annie,35.94,pumps
8488,Women's Elegant Mid Chunky Heels Slip On Pumps With Bows,,34.96,pumps
8489,Women Chic Elegant Sparkling Sequins Pointed Toe Stiletto Heel Formal Dress Pumps,JJF Shoes,23.5,pumps
8490,Women's Emmeeyy 4-inch Lace-up Heel with Sueded Pointed Toe,Herstyle,18.99,pumps
8491,Womens Pointed Toe Rhinestone Ankle-strap Heels,Journee Collection,49.99,pumps
8492,Nicklenna Closed Pointed Toe Stiletto High Heels Patent Pumps,Herstyle,19.99,pumps
8493,Women's Ilan2-St Dress Pump,Pelle Moda,37.4,pumps
8494,Womens High Heel Point Toe Stiletto Sandals Ankle Strap Court Shoes Size,Fashion Thirsty,22.99,pumps
8495,EP11051 Women's Evening Party Peep Toe High Heel Satin Pumps Bridal Wedding Shoes,ElegantPark,48.99,pumps
8496,Women Chic Stiletto Heel Shoes Pointy Toe with Rockstud Dress Pumps Size 5.5-12 US,Lutalica,49.95,pumps
8497,Women's Robin-46 Round Toe Dressy Mid Heel Pump,De Blossom Collection,9.77,pumps
8498,Womens Chinese Peony Embroidery Wedge High Heels Sneakers Shoes,Raylans,16.66,pumps
8499,Women's Cynthia Fest Slingback Pump,,89.0,pumps
8500,FL48 Women's Ankle Strap Buckle Wrap Chunky High Heel Pumps,Bella Marie,18.53,pumps
8501,Women Peep Toe Block Heel Sandals,Dear Time,15.49,pumps
8502,Women's Slip-on Round Toe Platform Pump,Elegant Footwear,32.94,pumps
8503,Women's Cynthia Fest Slingback Pump,,89.0,pumps
8504,FL48 Women's Ankle Strap Buckle Wrap Chunky High Heel Pumps,Bella Marie,18.53,pumps
8505,Women Peep Toe Block Heel Sandals,Dear Time,15.49,pumps
8506,Women's Slip-on Round Toe Platform Pump,Elegant Footwear,32.94,pumps
8507,Women's Darling Dress Pump,,24.74,pumps
8508,CLASSY Women's Pump,Auditions,43.99,pumps
8509,Womens Flex Kitten Pump,MICHAEL Michael Kors,191.7,pumps
8510,Pointy Toe Corset Lace Up Leg Wrap Stiletto Heel Dress Pumps,Sully's,27.99,pumps
8511,Womens Future Metallic Embellished Dress Heels,Caparros,25.99,pumps
8512,Women's TaylorSays Decklan Heel Black,Taylor Says,74.98,pumps
8513,"Class Round toe Dress Pump (5.5 M US, Black Pu)",Unknown,22.5,pumps
8514,Women's PU Closed-Toe Kitten-Heels Solid Pull-On Pumps-Shoes,AalarDom,28.06,pumps
8515,Women's Delight-665/LPSA/B Platform Pump,,33.95,pumps
8516,Women's Chic Bows Pointed Toe High Heel Pumps Shoes,Charm Foot,34.0,pumps
8517,Women's Dina Wedge Pump,Fergalicious,49.99,pumps
8518,Womens SINOMIN Cutout Pump Black,,29.97,pumps
8519,Charmeuse Pleated Peep Toe Crystal Ornament Style Diana Bridal,David's Bridal,59.95,pumps
8520,Women's Romantico Dress Pump,,58.49,pumps
8521,Women's Shoe D'orsay High Heel Faux Suede Dress Pump,Ollio,26.99,pumps
8522,Women's Chic Sequins Chunky High Heel Pumps Shoes,Charm Foot,29.0,pumps
8523,Women's 7Parachute Dress Pump,,29.99,pumps
8524,Shoes Women's Lindy-1 High Heel Wedges with Straps and Zipper Closure,,21.99,pumps
8525,Womens Genuine Leather Casual Slip On Round Toe Chunky Heel Pump Shoes Office Shoes,Dethan,27.5,pumps
8526,Women's Chelsea Flared-Heel Pump,,89.99,pumps
8527,Footwear Women's Gratian Dress Pump,,49.49,pumps
8528,Women's Pamela Elegant Fabric Dress Shoes,Jacques Levine,32.0,pumps
8529,Womens Braxlie Mesh Faux Pearl Embellished Pumps,Brinley Co,37.99,pumps
8530,JOJO Peep-Toe Lace up Heel - Vintage Mid Heel Pump w Cut Outs - Nude,Chelsea Crew,69.9,pumps
8531,Women's Faux Suede High Heels Dress Pumps,Latasa,24.0,pumps
8532,Women's Slip on Platform Canvas Shoes,Latasa,18.0,pumps
8533,Womens Mary Jane Shoes Concealed Platform High Heels Dress Pumps for Date Dress,Queen Van,48.88,pumps
8534,"Women's Leigh-pl Pump,",,118.5,pumps
8535,Aquatalia Women's Harlee Dolomite Dress Pump,,297.62,pumps
8536,Women's Pointed Toe T Strap Leopard Stilettos High Heels Pumps Party Evening Work Dress Shoes,DecoStain,32.69,pumps
8537,Women's Lena Dress Pump,,49.99,pumps
8538,New Brieten Women's Wedge Heel Instep Strap Elastic Woven Comfort Shoes,Brieten,21.99,pumps
8539,Women's Rivka YS D'Orsay Pump,,37.9,pumps
8540,Women Satin Pointy Toe Slingback Stiletto Pump EI10 - Black,Camille,21.59,pumps
8541,Women's Fashion Suede High Heel Pumps Pointed Toe V Cut Slip On Dress Shoes,XYD,57.79,pumps
8542,Embroidered Mesh Pointed-Toe Pumps Style HURLEY09,David's Bridal,49.95,pumps
8543,Women's Pump-420/r,,22.45,pumps
8544,Women's Pointed Toe High Heel Formal Pumps Shoes,Charm Foot,26.0,pumps
8545,Women's Candy Colors Slip on Business Work Shoes Mid Heels Office Lady Elegant Dress Pumps Shoes Size 4-11,HiEase,24.99,pumps
8546,Women's Wedges Slip On Shoes - Comfort Casual Wedges Shoes - Mid Low Heel Round Toe Wedges Pumps,MVE Shoes,24.99,pumps
8547,Women's Pampered Dress Pump,,39.99,pumps
8548,"Women's Slip-Resistant Pump Dress Shoes,Black Soft Lambskin,7.5 M US",Genuine Grip Footwear,65.9,pumps
8549,"Women's Slip-Resistant Pump Dress Shoes,Black Soft Lambskin,8 M US",Genuine Grip Footwear,64.9,pumps
8550,"Women's Slip-Resistant Pump,Black Soft Lambskin,US 5.5 M",Genuine Grip Footwear,65.9,pumps
8551,Women's Wedges Slip On Shoes - Comfort Casual Wedges Shoes - Mid Low Heel Round Toe Wedges Pumps,MVE Shoes,24.99,pumps
8552,Women's Pampered Dress Pump,,39.99,pumps
8553,"Women's Slip-Resistant Pump Dress Shoes,Black Soft Lambskin,7.5 M US",Genuine Grip Footwear,65.9,pumps
8554,"Women's Slip-Resistant Pump Dress Shoes,Black Soft Lambskin,8 M US",Genuine Grip Footwear,64.9,pumps
8555,"Women's Slip-Resistant Pump,Black Soft Lambskin,US 5.5 M",Genuine Grip Footwear,65.9,pumps
8556,Women Elegant Round Toe Formal Pumps Slip On Office Dress Shoes Chunky Heels Size 4-15 US,FSJ,52.99,pumps
8557,Women's Suede Pointed Toe Metallic Pumps Slip-on Business High Heels Stiletto Shoes,Freerun,33.49,pumps
8558,Women's Shiny Silver/Gold Sequin Pumps Criss-Cross Pearl Ankle Strap Princess Lolita Shoes,Lorie & Knight,45.0,pumps
8559,Leather Moccasins Loafers Soft Ballet Flats Casual Ballerina Pumps Shoes Women,Hishoes,30.99,pumps
8560,Party Stilettos Transparent Bowknot Pumps Pointed Toe High Heels Studs Women,XYD,62.79,pumps
8561,Women's Shawn Fabric Dress Pump,,56.0,pumps
8562,Women's Prima,,87.5,pumps
8563,"KS35 Meaggann Pointed Toe Dress Pumps - Black, 6 US",Karen Scott,69.0,pumps
8564,Women's Color Rivets Transparent Open Toe Kitten Stiletto Heels Slides-Sandals Backless Dress Pumps Shoes,T-JULY,42.99,pumps
8565,Women Round Toe Marry Jane High Chunky Heel Pumps Buckled Rhinestone Studded Dress Shoes,XYD,58.79,pumps
8566,Women's Pumps Platform Open Peep Toe Stilettos High Heels Ribbon Accent Butterfly Dress Fashion Shoes,Elegant Footwear,17.49,pumps
8567,Women's Trendy Beaded Stiletto High Heel Burnished Dressy Buckled Pointed Toe Pumps Shoes With Ankle Strap,,35.97,pumps
8568,Womens Fiffi Open Toe Ankle Strap Classic Pumps,,74.99,pumps
8569,Women's Sharon Dress Pump,,29.99,pumps
8570,3 Inch Heel Black Mary Jane Shoes Pumps,Summitfashions,68.95,pumps
8571,Womens Shoe Republic Savage Vermeer Pointy Toe High Heels Stiletto Pumps Shoes,Shoe Republic,28.99,pumps
8572,Women's Tiki Heel Pump,Sol Sana,19.99,pumps
8573,Women's Vegas Dress Pumps,,42.99,pumps
8574,Womens Rose Leather Pointed Toe Classic Pumps,ARRAY,51.99,pumps
8575,Womens Pointed Toe V-strap Satin Glitter Heels,Journee Collection,49.99,pumps
8576,Women's Milia-107x Dress Pump,,33.3,pumps
8577,Womens Lace-up Laser Cut Wedges,Journee Collection,49.99,pumps
8578,Women's Elegant Rhinestone Low Cut Pointed Toe High Heel Dress Slip On Heels Pumps Party Bridal Stiletto Shoes,,35.97,pumps
8579,Sasha-02 Pointed Toe Shiny Patent Stiletto Heel Slip On Pump Shoe Teal,Beast Fashion,29.99,pumps
8580,Women's Jenna02/r Dress Pump,,42.95,pumps
8581,"Women's The Lorenna-Circle Metallic Pump,",Katy Perry,95.99,pumps
8582,Women's Cutiepie-02/NB Mary Jane Pump,,55.95,pumps
8583,Women's Hey There Platform Pump,,54.95,pumps
8584,Women's Elegant Peep Toe Satin Ankle Strap Platform High Heels Bridal Wedding Pumps,Loslandifen,52.99,pumps
8585,Women's Elegant Embroidered Satin Wedding Party Evening Prom Shoes,Minishion,48.99,pumps
8586,Women's Sweet Flowers Fairy Pumps 7.5 cm Kitten Heels Outdoor Princess Bridal Sandals Size 4-12,HiEase,29.99,pumps
8587,Womens Retro Bows Patent Leather Pumps Shoes,AdeeSu,31.99,pumps
8588,Women's Comfort Faux Suede Low Top Block Medium Heels Pumps,SHOWHOW,31.98,pumps
8589,Women's Shoes Customized Fee,Mavirs,10.0,pumps
8590,Lady Pointed Toe Faux Leather High Heel Pump Shoes,BF Sole,19.99,pumps
8591,Women's Vibe Dress Sandal,,50.81,pumps
8592,Metallic Sparkle Mesh Overlay Special Occasion High Heel Round Toe Pump,Bella Marie,13.49,pumps
8593,Women's Closed Pointed Toe Knot Bow Stiletto High Heel Dress Pump,Wild Diva,31.57,pumps
8594,Women’s Evening Pointy Toe Ankle Strap Faux Suede High Heels Dress Pumps Shoes,Odetina,35.99,pumps
8595,Women's Fashion Faux Suede Closed Square Toe Dressy Block Mid Heel Slip On Slide Pumps Shoes,,31.99,pumps
8596,"Pumps Shoes, Women Ladies Elegant Nude Shallow Mouth High Heels Shoes",Hatop,16.0,pumps
8597,Women's CLAS20/W Dress Pump,,46.95,pumps
8598,Women's Comfy Round Toe Chunky Mid Heels Pumps Shoes With Ankle Strap,,32.97,pumps
8599,Women's High Heel Pointed Court Shoes Pumps Size,Ajvani,22.99,pumps
8600,Womens Isabelle Closed Toe Classic Pumps,Marc Fisher,63.2,pumps
8601,Women's Expedite Platform Sandal,,49.99,pumps
8602,Women Shimmer Studded Pointy Toe Stiletto Heel Classic Pump CD82 - Black,Vigo Fiore,19.95,pumps
8603,Women's Buckle High-Heels Frosted Solid Round-Toe Pumps-Shoes,WeenFashion,35.79,pumps
