,product_name,seller,price,category
5539,Womens Navy Blue and White Mary Jane Pumps with 4.5 Inch Platform Heels,Summitfashions,76.95,pumps
5540,Men's Women's Drag Queen Crossdresser High Heel Pointed Toe Large Sizes,Onlineshoe,35.5,pumps
5541,Womens Malina,,147.99,pumps
5542,Classic Elegant Womens Dress Low Kitten Stiletto Heels Pointed Toe Pumps Shoes,Melesh,15.99,pumps
5543,Women's Klover3 Heeled Sandal,,34.99,pumps
5544,PUMP-420 womens Pumps Shoes,,38.95,pumps
5545,Women's Fab425/r-b Dress Pump,,48.95,pumps
5546,Women Pointed Toe Fashion Kitten Heel Lady's Low Heel Pumps for Wedding Dress,UMEXI,49.99,pumps
5547,Women's Estrela Dress Pump,,64.99,pumps
5548,Girls Buckle Metal Chain High-Heels Polyurethane Pumps-Shoes,1TO9,36.99,pumps
5549,Women's Sexy Dressy Low Cut Burnished Pointed Toe Slip On Stiletto High Heel Platform Pumps Shoes,,35.97,pumps
5550,Womens Pull On High Heels Solid Pumps Shoes,BalaMasa,30.22,pumps
5551,Chunky Low Cute Scallop Pumps - Casual Block Heel Shoe - Party Vegan Work Dress Pumps - Cake by,J. Adams,20.0,pumps
5552,Women's Demi Pump,,27.53,pumps
5553,Women's Baina2 Pump,,32.99,pumps
5554,Women's Sabatay Metallic Dress Pump,,66.8,pumps
5555,Women's Escapade Dress Pump,,46.8,pumps
5556,Women's Sophia Dress Pump,,46.0,pumps
5557,Women's Lulu05/Mtpu Slide Pump,Pin Up Couture,29.99,pumps
5558,Women Classic High Heel Platform Pumps Hand Beading Rhinestones Bridal Wedding Shoes,ERIJUNOR,52.8,pumps
5559,"Women's Carlotta Pump,",,139.95,pumps
5560,Women's High Heel Wedge Platform Pumps with Bows Ankle Strap Cute Court Shoes,Vitalo,27.99,pumps
5561,Soft Goatskin Leather Women's Pointed Toe Slender Stiletto Heel Pumps Dress Shoes,Aodeno,72.99,pumps
5562,Womens Chunky Heels Platform Low-Cut Uppers Patent-Leather Pumps-Shoes,BalaMasa,38.99,pumps
5563,Women Kitten Low Heel Slip on Pumps Pointed Toe Casual Shoes with Buckle,YDN,59.98,pumps
5564,"Women's Ludlow Slingback Pumps, Black, 9 M US",,82.5,pumps
5565,Women's Lolita High Heel Multicolor Bows Pumps Shoes,Charm Foot,29.0,pumps
5566,Women's Patent Leather 14CM Fashion Sexy Ankle Strap Platform Pumps Stiletto Bridal Party Shoes,ZriEy,38.99,pumps
5567,Women's Classic Round Tow Low Top Mid Chunky Heels Oxfords Pumps,,33.96,pumps
5568,Women's Pull-on Closed Pointed Toe High-Heels PU Solid Pumps-Shoes,AllhqFashion,31.94,pumps
5569,Women's Caught Dress Pump,,31.65,pumps
5570,Women's Round Toe Waterproof Platform Patent Leather High Heels Shoes,Tanpell,9.99,pumps
5571,Women's Kitten-Heels Soft Material Pull-On Round Closed Toe Pumps-Shoes,VogueZone009,31.9,pumps
5572,Sport Women's Valicity Wedge Pump,,39.99,pumps
5573,Women Summer Flowers Low Heels Pointed Toe Pumps,Dear Time,12.21,pumps
5574,Hush Puppies Women's Pleats Be You Pump,,35.96,pumps
5575,Women's Kit Josie Kitten Heel Black 11 B(M) US,Vionic,139.95,pumps
5576,Women's Adult Halo II Pump synthetic,AngelSteps,32.99,pumps
5577,Womens Chloe,,29.99,pumps
5578,Women's Finnea-Pat Dress Pump,,20.46,pumps
5579,Women's Expert Fabric Dress Pump,,22.75,pumps
5580,Womens Katies,,80.99,pumps
5581,The Pixie Pump,Comfortview,50.97,pumps
5582,Women's Pointed Toe Slingback Rhinestone Ankle Strap Kitten Heels Pumps Wedding Bridal Dress Shoes,onlymaker,39.99,pumps
5583,Shoes Women's Realove-05 Nub Stiletto High Heel Pumps with Two Ankle Buckle Braclets,Anne Michelle,16.99,pumps
5584,Women's Edonia Heeled Sandal,,17.75,pumps
5585,Women's T-Strap Buckle Retro High Heels Mary Janes Shoes,Carolbar,28.0,pumps
5586,Women's Bexley Dress Pump,Athena Alexander,35.99,pumps
5587,Womens Enzo-01N Party Pumps Sandals,Anne Michelle,17.99,pumps
5588,Women's Buenos Pump,,25.49,pumps
5589,"City Classified Comfort Women's Dennis Mary Jane High Heel, Beige, 85 M US",Cityclassified,20.37,pumps
5590,"High Block Stack Heel Gladiator Horizon Strap w Zipper, Women Shoes",,9.6,pumps
5591,Women's Nubuck Platform High Chunky Heel Pumps Shoes Mary Jane Shoes,Show Shine,29.0,pumps
5592,Day & Night Women's Razzle 660Rs Pumps,,34.53,pumps
5593,Women Cute Bows Low Block Heel Pumps Pointed Toe D'Orsay Slip On Office Lady Dress Shoes,XYD,58.79,pumps
5594,Women Glitter Peep Toe Chunky High Heel Mules Slip on Pumps Slide Shoes with Buckle,YDN,56.98,pumps
5595,Women's Zella Pump,,29.97,pumps
5596,Women's Juliette Leather Dress Pump,,27.95,pumps
5597,Women's Tiara Dress Sandal,,39.99,pumps
5598,Women's Sam Dress Pump,,95.06,pumps
5599,Rose Petals Women's Branson Dress Pump,Rose Petals by Walking Cradles,69.91,pumps
5600,Women's Cosette Pump,SJP by Sarah Jessica Parker,214.2,pumps
5601,Women's Paiton Dress Pump,,76.99,pumps
5602,Women's Scarlet Stiletto Peep Toe Dress Ruched Satin Heeled Sandal Pump Shoe,Bonnibel,14.96,pumps
5603,Women's Class Sandy Pump,,69.9,pumps
5604,"Low Kitten Heel Pumps for Women 2"" Heel Black Pointed Toe Slip On Dress Pumps",Shevalues,17.99,pumps
5605,Women's Fashion Beaded Buckled Burnished Dressy Pointed Toe High Heel D'Orsay Wedge Pumps Shoes With Ankle Strap,,35.97,pumps
5606,Women Classic Pointy Toe Pumps Patent Slip On Kitten Low Heel Dress Shoes with Buckle Size 4-15 US,FSJ,52.99,pumps
5607,Women's Janesp-01 Pump,,110.99,pumps
5608,Women's Assorted Color Pu Kitten Heels Round Closed Toe Buckle Pumps-Shoes,WeenFashion,32.79,pumps
5609,Womens'Antique Epidemic Tie High Heel Matin Pumps Shoes,DecoStain,32.99,pumps
5610,Womens Fashion Faux Patent-leather Pointed-toe Mid Wedge Heel Dress Formal Pumps Shoes,Latasa,26.0,pumps
5611,"Women's QUEREDA Pump,",,88.22,pumps
5612,Women's Gem Dress Pump,,49.79,pumps
5613,"Low Kitten Heel Pumps for Women 2"" Heel Black Pointed Toe Slip On Dress Pumps",Shevalues,17.99,pumps
5614,Women's Fashion Beaded Buckled Burnished Dressy Pointed Toe High Heel D'Orsay Wedge Pumps Shoes With Ankle Strap,,35.97,pumps
5615,Women Classic Pointy Toe Pumps Patent Slip On Kitten Low Heel Dress Shoes with Buckle Size 4-15 US,FSJ,52.99,pumps
5616,Women's Janesp-01 Pump,,110.99,pumps
5617,Women's Assorted Color Pu Kitten Heels Round Closed Toe Buckle Pumps-Shoes,WeenFashion,32.79,pumps
5618,Womens'Antique Epidemic Tie High Heel Matin Pumps Shoes,DecoStain,32.99,pumps
5619,Womens Fashion Faux Patent-leather Pointed-toe Mid Wedge Heel Dress Formal Pumps Shoes,Latasa,26.0,pumps
5620,Fashion Dress Shoes Studded D'Orsay Peep Toe Ankle Strap High Heels Stilettos Pumps for Women,XYD,65.79,pumps
5621,Women's Angel Ii Dress Pump,,41.36,pumps
5622,"Women's Punk Black Red Zip Bow Pointed Toe Exquisite Pearl Heel Dress Pump,LF60401",SHOW STORY,34.99,pumps
5623,Women's MISS MOLLY Stiletto Pump,Luichiny,29.95,pumps
5624,Women's Michelle Platform Pump,,89.0,pumps
5625,Women's Bella Strass Mary Jane Pump,,238.36,pumps
5626,Women's High Heel Leather Open Toe Sandal Bootie,LE CHÂTEAU,49.97,pumps
5627,Womens - Presley,Söfft,60.99,pumps
5628,Women's Casual Pointed Toe Shoes Flock Patchwork Shallow High-Heeled Shoes,AOJIAN,15.99,pumps
5629,"Women's Guardianp Synthetic Pump,",,32.99,pumps
5630,Women's Ta-Monte Platform Pump,,49.44,pumps
5631,Women's Queen01/r-Rg Dress Pump,,53.95,pumps
5632,Womens Cammi Peep Toe Wedge Pumps,Alfani,27.8,pumps
5633,Women's Audora Leather,,50.01,pumps
5634,Women's Addison Pump,,20.98,pumps
5635,Women's Chloe01/Bpu Platform Pump,,55.95,pumps
5636,Women's Embellished Satin Peep Toe Dressy Pump,LE CHÂTEAU,49.97,pumps
5637,Bobcat Women's Slip On,Bellini,68.0,pumps
5638,Women's Ii Wedge Pump,,163.27,pumps
5639,Women's Blayke Smoke Lux Kid Suede 6.5 M US,,44.99,pumps
5640,Women's Glitter Pointy Toe Pump,LE CHÂTEAU,39.97,pumps
5641,Women's Alella Synt AF Silver/Rose Gold Pump,,67.96,pumps
5642,Women Silver Glitter Pumps Shoes with 5 Inch Heels and Rhinestone Embellishment,Summitfashions,67.95,pumps
5643,Women's Sexy-20/Bpu,,48.95,pumps
5644,Women's Sweet Bowtie Block High Heels Solid Pointed Toe Platform Party Dress Pumps,DecoStain,31.69,pumps
5645,5 Inch High Heel Dress Shoes Classic Pumps Women's Sexy Shoes,Devious,68.95,pumps
5646,Womens Shoes Mid Heel Round Toe Party Dress Pumps,Greatonu,19.99,pumps
5647,Women's Fadilla Fabric Dress Pump,,33.31,pumps
5648,Women's Classic Pointed Toe Genuine Leather High Heels Slip On Stiletto Pumps Dress Basic Shoes Size4.5-14,MissHeel,69.99,pumps
5649,Womens Ankle Strap Pumps High Heels Sandals Dress Party Pointed Toe Stilettos Patent Leather,Rongzhi,31.99,pumps
5650,Women's Ashdown Pump,,52.0,pumps
5651,Woman's Savina-01 Studded Stiletto High Heels Ankle Strap,Beast Fashion,25.0,pumps
5652,Women's Angelique Wedge Pump,,88.86,pumps
5653,Pleaser Women's Demon-11 Platform Pump,Demonia,54.95,pumps
5654,Nahla Pumps,Tamaris,72.9,pumps
5655,Women's Major Pump,,39.99,pumps
5656,Women's Odellia Slingback,,48.0,pumps
5657,Women's BP310-Cassie Dress Pump,Bettie Page,49.96,pumps
5658,Women's Doris Pearl Pump,,44.35,pumps
5659,Women's Eliree Pump 55mm Dress,,90.0,pumps
5660,Women's Dinah Kerr Pump,,95.99,pumps
5661,Womens Levin Pointed Toe Classic Pumps,,69.99,pumps
5662,Women's Smitten-01/RB Spectator Pump,,50.95,pumps
5663,Women Patent Leatherette Pointy Toe Single Sole Pump EI74,DbDk,13.05,pumps
5664,Women's Pointy Toe Slingback Low Kitten Heels Pumps Shoes,J'aime Aldo,24.99,pumps
5665,Women's Patna Dress Pump,,92.77,pumps
5666,Caitlynn Platinum Silk Nappa Dress Pump,,103.99,pumps
5667,Womens Round Toe Platform Chunky Heels Ankle Strap Mary Janes Pumps Shoes,Lucksender,37.99,pumps
5668,Women's Kacie Martina Wedge Pump,,40.99,pumps
5669,Women's Jeanie Pump,,112.99,pumps
5670,"Womens 40-7961 Closed Toe Classic Pumps, Silver, Size 8.5",,43.95,pumps
5671,Summer Simple Heeled Sandals Bridal Bridesmaid Shoes Women Open Toe Pumps Prime,DolphinBanana,64.99,pumps
5672,Women's Prenda Synthetic Dress Pump,,66.54,pumps
5673,Women's Trendy Rhinestone Square Buckle Pointed Toe Slip On Flats Pumps Shoes,SFNLD,30.99,pumps
5674,Rockport Cobb Hill Women's Revhex Wedge Pump,Cobb Hill,79.99,pumps
5675,Women's Zoey Dress Pump,,69.99,pumps
5676,Fashion Womens Platform Pumps Lace up Boots Ladies Sexy High Heeled Shoes,GATUXUS,32.99,pumps
5677,Womens Blaise 1-1-22468-20,Tamaris,34.99,pumps
5678,Women's Solid Patent Leather Low Heels Round Closed Toe Lace up Pumps-Shoes,AllhqFashion,32.95,pumps
5679,Women's Layla Dress Pump,,47.66,pumps
5680,Women's Harmon Dress Pump,,39.89,pumps
5681,"Women's Charles Suede,",,63.44,pumps
5682,Womens Low Heels Slide Sandals Pointed Toe Kitten Mules Slip on Pumps with Chic Bow,YDN,52.98,pumps
5683,Women's Kara K200557 Pump,,96.33,pumps
5684,Women's Juliette Suede Platform Pump,,63.9,pumps
5685,Women's Leather Peep Toe Half D'Orsay Pump,LE CHÂTEAU,49.99,pumps
5686,Women's Aubrey Dress Pump,,12.33,pumps
5687,Women's Zink Emma Mid Pump,UNITED NUDE,255.0,pumps
5688,Women's Count-81 Platform Pump,,39.96,pumps
5689,Women's 420/W Dress Pump,,18.16,pumps
5690,"Shoes A9437L Womens Platforms, Burgundy Velvet Strappy Spice Platform Heel",,44.99,pumps
5691,Women's 5 inch Heel Pump with Lock and Key,,38.82,pumps
5692,Women's Denton Suede Pump,,89.0,pumps
5693,Women Mavis Faux Suede Round Toe Low Heel Flower Simple Classic Formal Dress Pumps Shoes,JJF Shoes,9.99,pumps
5694,Women Shoes Round Toe Slip On Kitten Heels Dress Pumps,MaxMuxun,19.99,pumps
5695,Women's Trendy Comfort Block Mid Heel Low Cut Dressy Square Toe Slip On Ankle Strap Pumps Shoes,,32.97,pumps
5696,Women's Charese Dress Pump,,59.99,pumps
5697,Womens Super High Metal Heel Platform Party Shoes,OCHENTA,76.99,pumps
5698,Women's Lolita06 Platforms Fashion Pumps,Fabulicious,39.95,pumps
5699,Women's Grant Pump,,29.99,pumps
5700,Women's Tatiana Pony Dress Pump,,48.74,pumps
5701,Women's Sacred Nappa Dress Pump,,39.99,pumps
5702,Citi-7 Sexy Sparkle Glitter Embroidery Pumps *Round Toe Sky High Stiletto Heel Platform *Ankle Strap Anklet,Blossom,14.99,pumps
5703,Sandrah Nude Patent Platform Pump - Size 8.5,,64.99,pumps
5704,Women's Crystal Flower Formal Party Dress Wedding Shoes Slip On Thin High Heel Pumps,Hinyyrin,19.99,pumps
5705,Women's Whirlwind Pump,,94.99,pumps
5706,Women's Comfort Suede 5 cm Mid Heeled Pumps Sweet Bowknot Princess Dress Shoes OL Work Shoes Size 4-12,HiEase,24.99,pumps
5707,Womens Mid Heels Elegant Point Toe Pumps Wedding Lace Bridal Shoes,Loslandifen,53.99,pumps
5708,"Womens Kaylee-H Pumps Shoes,Beige,7",City Classified,29.95,pumps
5709,Women's Skinny Platform Pump,,59.99,pumps
5710,Sofft - Womens - Marilla,Söfft,74.9,pumps
5711,Women's Blanche Oleena Slip-On Loafer,,44.99,pumps
5712,Women's Hetty Dress Pump,Imagine Vince Camuto,40.99,pumps
5713,Chunky Heel Women's Pointed Pumps in Red,Mark and Maddux,32.0,pumps
5714,Ladies Bows Chunky Heels Low-Cut Uppers Suede Pumps-Shoes,BalaMasa,38.99,pumps
5715,Women's Elegant Faux Suede Rhinestone Buckle Round Toe Block Medium Heel Slip On Pumps Shoes,Mofri,33.99,pumps
5716,Womens Sexy Wedding Bride Bridesmaid OL Night Party Pointed Toe Wedge PU Pumps,Salabobo,29.9,pumps
5717,Women's Gina Two Tone Dress Shoes with Comfort Flex Soles,Rasolli,34.99,pumps
5718,Women's 'Shamu' Wedge Pump Shoes,Ann Creek,43.9,pumps
5719,Women Lucite Clear Pointed Toe Ankle T-Strap High Heels Stiletto Sandal Pumps,Joogo,59.99,pumps
5720,Women's Mother of Pearls Sandal,,24.5,pumps
5721,Women's Almond Toe Mary Jane Mid Heel Pump Shoes,HapHop,11.99,pumps
5722,Women Nubuck Peep Toe Platform Block Heel Pump FI99 - Fuchsia,,29.58,pumps
5723,Women's Cute Ankle-Strap Platform Chunky High-Heel Dress Pumps Shoes,Latasa,27.0,pumps
5724,Bordello by Women's Teeze-06 Pump,,65.95,pumps
5725,Women's Sexy Peep Toe Platform Stiletto Slip on Super High Heel Pumps Party Dress Shoes,onlymaker,32.0,pumps
5726,Womens Clear Sandals Treasure Chest Dancers Shoes Silver Ankle Strap Open Toe,Summitfashions,74.95,pumps
5727,Women's Fashion High Heel Dress Pump Shoes,InterestPrint,39.99,pumps
5728,Women's Beitris Slide Pump,,62.99,pumps
5729,"Glam Floral Print PeepToe Cone Heel Platform Pump,LF40811",SHOW STORY,34.99,pumps
5730,Women's Baani Dress Pump,,49.99,pumps
5731,Women's Camden Wedge Black 5 M,Vionic,97.97,pumps
5732,Women's Sb-Anina Dress Pump,Blue by Betsey Johnson,99.0,pumps
5733,Pinup Womens MONROE-01/WPU Sandals,Pin Up Couture,49.95,pumps
5734,Women's Pointy Toe Sheepskin Leather Stiletto Party Pumps,Themost,19.99,pumps
5735,Women's Monica Dress Pump,L.K. Bennett,267.85,pumps
5736,Women's Sexy Pointed Toe Slingback Sandals Ankle Strap Pump Bowknot Slip on Shoes Electroplate Stiletto High Heels,onlymaker,47.99,pumps
5737,Women's Aura Mary Jane Flatform Shoes,,98.95,pumps
5738,100120 Women's Round Toe Cone Heel Satin Lace Buckle Wedding Bridal Shoes,ElegantPark,48.95,pumps
5739,Women's Covet02/Sgfa Slide Pump,,35.28,pumps
5740,Allover Crystal Pumps Style CROBIN125,David's Bridal,59.95,pumps
5741,Women Studded Pointy Toe Caged Cut Out Stiletto Bootie Pump HF45,Alrisco,25.19,pumps
5742,Women's Talana Pump,Carlos by Carlos Santana,20.0,pumps
5743,Women’s Square Toe Pumps - Slip on Work Office Stacked Shoes - Simple Low Cut Middle Heel,,30.99,pumps
5744,Women's Malinda Ballet Flat,,27.99,pumps
5745,Women's Brigitte Dress Pump,,99.48,pumps
5746,Ros Hommerson Women's Grace Pump,Rose Petals by Walking Cradles,16.5,pumps
5747,Women Spring Retro Frosted Suede Pointed Toe Low Top Slip On Pump Chunky Stacked Block Heel Loafer Pump Dress Shoes For Business Occasion,SUKEQ,14.09,pumps
5748,Women's Teeze 06R GSA Platform Pump,,42.56,pumps
5749,Women's Luella 445291 Dress Pump,,35.99,pumps
5750,Women's Mika Pump,,52.3,pumps
5751,Women High Heel Pupms Fashion High Thin Heels Lace-up Stiltto Pointed Toe Sexy Shoes,JiaLuoWei,88.88,pumps
5752,Women's Sexy Assorted Color High Heel Stilettos Pumps Dress Shoes,Show Shine,28.5,pumps
5753,Ladies Slip-On Round-Toe Kitten-Heels Upper Leather Pumps-Shoes,BalaMasa,33.99,pumps
5754,Women's Royality492 T-strap Leather Shoes,Bellini,42.0,pumps
5755,Women's Mystery Dress Pump,Mojo Moxy,26.46,pumps
5756,Lucy Block-Heel Pumps,,12.04,pumps
5757,Sexy Women's Pearl Decorating A Word Buckle Pumps Patent Leather High Heels Sandals,MAKEGSI,29.99,pumps
5758,Women's Jenna06/w-b Dress Pump,,51.95,pumps
5759,Betsey Johnson Blue by Women's Gown Pump,Blue by Betsey Johnson,68.95,pumps
5760,Womens Donela,,44.55,pumps
5761,Women's Queen04/Bpt-Crsa Slide Pump,,59.95,pumps
5762,Women's Tee41w/Gpu-Mcg D'Orsay Pump,,61.95,pumps
5763,Women's Gandia 849-2531 Slip On,,102.0,pumps
5764,"FIC Elaine Women Wide Width Evening Dress Shoe for Wedding, Prom & Dinner (Size/Measurement Chart)",Floral,59.95,pumps
5765,Women's Breckelle's MARISA-34 Platform High Heel Stiletto Ankle Strap Pump,,11.89,pumps
5766,Nimo Shiny Pointy Toe Stiletto High Heel Slip On Pump Shoes Nude,Shoe Republic,31.99,pumps
5767,Women's Johnny Demi-D'Orsay Pump,,353.26,pumps
5768,Women's Lace Heel Dress Pump,Beaumens,22.0,pumps
5769,Women's Oana Platform Pump,Pelle Moda,81.32,pumps
5770,Women's Poco Dress Pump,,112.5,pumps
5771,Women's Classic Pointy Toe Pump,LE CHÂTEAU,19.97,pumps
5772,Womens dawne,,45.0,pumps
5773,Women Elegant Ankle Strap Block Heel Pumps with Flower Wedding Dress Shoes,TAOFFEN,29.99,pumps
5774,Womens Stage Monster Nude Patent leather Pumps,Marc Defang New York,69.0,pumps
5775,Women's Delsie Joy Dress Pump,,49.95,pumps
5776,Shoes Women's Danbury Dress Pump,Annie,16.31,pumps
5777,Women's Margot Fabric Dress Pump,,53.89,pumps
5778,Women's Jenna Pump,,109.0,pumps
5779,Sasha-02 Pointy Toe Slip On Shiny Patent Stiletto Heel Slip On Pump Red,Beast Fashion,29.98,pumps
5780,Women's SEXY08/B Dress Pump,,47.95,pumps
5781,Women's Lloret Pump,,98.04,pumps
5782,"Leather Pumps-Shoes,Women's Vintage Handmade Flower Mid Heel Soft Block Fashion Casual Pumps",gracosy,41.98,pumps
5783,Women's Fantabulus Dress Pump,Azura by Spring Step,42.99,pumps
5784,Women's Electric Pump,BZees,69.0,pumps
5785,Womens Double Strap Glitter Chunky High Heels,Journee Collection,49.99,pumps
5786,"FIC Emely Women Wide Width Evening Dress Shoe for Wedding, Prom, Dinner (Size & Measurement Guide)",Floral,59.95,pumps
5787,Women's Fab428/Bpu Dress Pump,,42.95,pumps
5788,Women's Ansley Dress Pump,Daya by Zendaya,22.97,pumps
5789,Women's Keesha Rosa Dress Pump,,54.99,pumps
5790,Unze Women “Lara”Sexy Sling Back Textured Stiletto Closed Toe Office Dress Courts UK Size 3-8 - SGC17481-04,Unze London,20.0,pumps
5791,Women's Aleani Dress Pump,ALDO,47.99,pumps
5792,Women's Note Dress Sandal,,41.98,pumps
5793,Women's Sexy Sequin Low Cut Pointed Toe Dress Slip On Heels High Heeled Pumps Party Bridal Stiletto Shoes,,29.97,pumps
5794,Women's Yannah Leather Pump,,33.43,pumps
5795,Women's Bp310-Heather Spectator Pump,Bettie Page,53.29,pumps
5796,Shoes Women's Define Dress Pump,Annie,17.62,pumps
5797,Women's Maye Dress Pump,,120.22,pumps
5798,Women's 511-Glitter Slide Pump,,23.48,pumps
5799,Womens Holda,,164.99,pumps
5800,Womens FLAMINGO-887FH Sandals,,72.95,pumps
5801,Women's Graffi Dress Pump,,23.1,pumps
5802,Women's Zita Polyurethane Fashion Pumps,Bellini,49.99,pumps
5803,Pleaser Demonia By Women's Charade-05 Pump,Demonia,51.95,pumps
5804,MW366 Women's Pumps Peep Toe Wedges Low Heel Lace and Satin Wedding Bridal Shoes,Wedopus,45.99,pumps
5805,Women's Enrollment Dress Pump,,59.99,pumps
5806,Women's Spring Mesh Platform High Heels Dress Pumps,Latasa,29.0,pumps
5807,Genuine Leather Women's Pointed Toe High Chunky Heel Slip On Handmade Gorgeous Metal Detail Pumps,Nine Seven,83.9,pumps
5808,"Women shoes, Women Fashion Sewing Peep Toe Thin Heel Wedges Zipper Super Heel Shoes",YJYdada,16.57,pumps
5809,Women's Closed Almond Toe Slip-On Flared Sculptural Heel Pump,Cambridge Select,9.12,pumps
5810,Women's Sweet Back Bows Kitten Heels Pumps,Charm Foot,24.0,pumps
5811,Women's Color Block Ankle Strappy Metallic Chunky Stacked Block Heel,SUNNY Store,39.99,pumps
5812,Women's Ronda Pump,Brinley Co,15.0,pumps
5813,Wee Collection: Women's Sequin Pump,Wee Collection,35.99,pumps
5814,Women's Doris Dress Pump,,35.4,pumps
5815,Women's Kassie Block Heel Pumps,,105.0,pumps
5816,Dorothy Shoes Red Ruby Sequined Women's Shoes Dorothy-01,,29.88,pumps
5817,Womens Sparkles High Heels Peep Toe Sexy Platform Slip-on Stilettos Thin Heel Shoes,DOTACOKO,26.99,pumps
5818,Women's Sandrah Dress Pump,,54.99,pumps
5819,Women's Bronwyn Wedge Pump,,44.99,pumps
5820,Women's Ullie 747091 Dress Pump,,42.29,pumps
5821,Women's Kassie Block Heel Pumps,,105.0,pumps
5822,Dorothy Shoes Red Ruby Sequined Women's Shoes Dorothy-01,,29.88,pumps
5823,Womens Sparkles High Heels Peep Toe Sexy Platform Slip-on Stilettos Thin Heel Shoes,DOTACOKO,26.99,pumps
5824,Women's Sandrah Dress Pump,,54.99,pumps
5825,Women's Bronwyn Wedge Pump,,44.99,pumps
5826,Women's Ullie 747091 Dress Pump,,42.29,pumps
5827,Women's Chartli Rose Dress Pump,,79.98,pumps
5828,Zoe Shootie,Comfortview,44.99,pumps
5829,Women Lilian Buckle Nude Patent Leather Square Toe Block Heel Pumps,Yonge & Finch,44.39,pumps
5830,Women's Callie Pump,Mark Lemp Classics,36.99,pumps
5831,Women's Chelsea PT Low Pump,,129.99,pumps
5832,Women Bow Ankle Strap Sandals High Heels Shoes Pointed-toe,Wotefusi,22.99,pumps
5833,Women's Closed Toe Crocodile Stiletto High Heels Slip On Dress Pumps Shoes,Loslandifen,32.99,pumps
5834,Women's Academy Lr Dress Pump,,55.33,pumps
5835,Women's Julija Leather Pump,,65.72,pumps
5836,Women's Seduce-317 Slingback Pump,,41.95,pumps
5837,"Women's Emory 40mm Bow Wedge Ii,",,79.99,pumps
5838,Womens Round Toe High Heels PU Frosted Solid Pumps,VogueZone009,26.99,pumps
5839,Women's Slip-On Pointed Toe Suede Low Kitten Heel Pumps,CALICO KIKI,28.99,pumps
5840,Cindy-01 Suede Knotted Slingback Shinny Cylindrical Heel Slip On Pump,Beast Fashion,26.99,pumps
5841,"Women's Bp412-lillian Spectator Pump,",Bettie Page,42.55,pumps
5842,Women's Whimsey Dress Pump,French Sole FS/NY,97.2,pumps
5843,Women's Pella Dress Pump,,27.77,pumps
5844,Women's Taylin Satin Pump,,67.1,pumps
5845,Women's Dagger-01/B Pump,,74.95,pumps
5846,"Women Pumps, Concise Shallow High Heels Buckle Pointed Toe Sandal Shoes",Owen Moll,41.99,pumps
5847,Women's Classic Round Toe Platform High Heel Pump,Cambridge Select,17.24,pumps
5848,Women's Cerys Suede Pump,,49.3,pumps
5849,Women's Almond Peep Toe Mary Jane Ankle Strap Platform Sexy Stiletto Breckelle's Pumps,,16.09,pumps
5850,Womens Vintage Oxfords Brogue Shoes Wingtip Lace up Chunky High Heel Shoes Dress Pumps Oxfords,Cachilryan Binnova,26.88,pumps
5851,Girls Chunky Heels Platform Low-Cut Uppers Imitated Suede Pumps-Shoes,BalaMasa,31.99,pumps
5852,Women's Pointed Toe Thin High Heels Patent Dress Party Pumps Shoes,MONICOCO,31.79,pumps
5853,"Donald Pliner Bari Suede Pump, 8.5",,67.48,pumps
5854,UOKNICE Women Pumps Boots Spring High Heels Zipper Stiletto Shoes Pointed Toe Strappy,UOKNICE WOMEN-SHOES,18.99,pumps
5855,Women's Epic Dress Pump,,294.84,pumps
5856,Women's Fresh,,39.99,pumps
5857,Strappy Bow Two-Piece Pumps Style Maja,David's Bridal,59.95,pumps
5858,Womens Peep Toe Pumps Platform Stiletto Sandals High Heels Slip On Dress Pumps 5-14 US,Caitlin Pan,49.89,pumps
5859,Women's Katie Mary Jane Flat,,145.0,pumps
5860,Women Mary Jane Pumps Mid Heel Peep Toe Ribbon Tie Lace Evening Prom Bridal Wedding Shoes,ElegantPark,48.95,pumps
5861,Women's Pointed Toe Slip-On Stiletto High Heel Pump,Cambridge Select,23.18,pumps
5862,Women's Hannley Patent Dress Pump,,39.93,pumps
5863,"Women's Strappy Chunky Block High Heel - Formal, Wedding, Party Simple Classic Pump",Premier Standard,24.99,pumps
5864,Jimmy-1 Slim Heel Ankle Strap Women's D'Orsay Pump Shoes,Chase & Chloe,18.6,pumps
5865,Women Mary Jane Closed Toe High Heel Pumps Lace Wedding Dress Shoes,ElegantPark,48.95,pumps
5866,Women's Sb-Lou Dress Pump,Blue by Betsey Johnson,39.99,pumps
5867,Women's Romance-313 Sandal,,37.14,pumps
5868,Womens Peep Toe Pumps Lace Up Shoes Hot Pink Black Patent 5 Inch Stiletto Heels,Summitfashions,57.95,pumps
5869,Cape Robbin Allure Black Clear Transparent Glass PVC Mule Open Toe Stiletto Pump,Michelle Parker,44.99,pumps
5870,Women's Pointed Toe Genuine Leather High Heels Slip-on Horsehair Leopard Dress Shoes,Sammitop,69.88,pumps
5871,Women's Farrel Pump,,69.99,pumps
5872,Women's Elegant Round Toe Low Cut High Block Heel Pumps Shoes,Easemax,27.99,pumps
5873,Women's Give Dress Pump,,31.82,pumps
5874,Delicious Women Formal Evening Dance Nice Hidden Platform Stiletto Pumps,ZriEy,36.99,pumps
5875,Kid's Maeva Mary Jane Flat (Toddler/Little Kid/Big Kid),,40.0,pumps
5876,Women's Morgan Pump,,89.0,pumps
5877,Womens Pointed Toe High Heel Pumps Slip-On Sequins Pumps Wedding Party Pumps Shoes,pit4tk,39.99,pumps
5878,Women's C-Janie Platform Sandal,,35.95,pumps
5879,Women's Kit Josie Kitten Heel Sand 8 W US,Vionic,151.59,pumps
5880,MW1600 Women's Evening Bridal Square Toe High Heel Platform Rhinestone Purple Satin Wedding Shoes,Wedopus,45.99,pumps
5881,Womens Buckle High Heels Solid Pumps Shoes,BalaMasa,27.71,pumps
5882,Women's Myriam 46796 Dress Pump,,112.14,pumps
5883,Womens ZITAHPNK Pointed Toe Classic Pumps,INC International Concepts,24.99,pumps
5884,Women's Premium Pump Classic Wedge Party Heel Shoes,HapHop,21.99,pumps
5885,"Women's Lulia Wedge Pump (37 M EU, Pewter)",,79.95,pumps
5886,Women's Elise D'Orsay Pump,,75.0,pumps
5887,Womens Round Toe Solid Color High Heel Pump Shoes for Female Ladies,King Ma,13.99,pumps
5888,Women's Juliana Low Sling 45 Dress Pump,,125.0,pumps
5889,Women's Laser Cut Slingback Stacked Heel Pump Bootie,Gs Shoes,39.0,pumps
5890,Women's Poise Dress Pump,,155.04,pumps
5891,Women's Pointed-toe High Heels Dress Pumps,Latasa,32.0,pumps
5892,"Ellie 8260 Womens Sexy Comfortable 6"" Heel Fetish Pump",,51.95,pumps
5893,Women's Classic Fashion High Heel Dress Pump Shoes,InterestPrint,39.99,pumps
5894,Concise Lady Dress Shoes Women Pumps Heels Wedding Shoes Stiletto High Heels Formal Pumps AMB022,AM-Bigtree,37.99,pumps
5895,Women's Moira Leather Dress Pump,,44.99,pumps
5896,Women's Keela Dress Pump,,69.32,pumps
5897,Women's Fond Dona Dress Pump,,34.95,pumps
5898,Aleani Women's Heels,ALDO,29.99,pumps
5899,Womens High Heels Pointy Toe Clear Lace Mesh Rhinestone Slip On 12cm Stiletto Wedding Pumps 6-10 US,Caitlin Pan,59.89,pumps
5900,Women's Finley Dress Pump,Nina Original,37.12,pumps
