,product_name,seller,price,category
0,Women's Carrson Dress Sandal,,34.07,pumps
1,Women's Gayle Pump,,40.17,pumps
2,Women's Michelle Dress Pump,,22.99,pumps
3,Women's Lowpointed Low Heel Dress Pump Shoes,DREAM PAIRS,21.99,pumps
4,Women's Total Motion 75mm Pointy Pump,,27.98,pumps
5,Comfort Plus Women's Karmen Pump,Predictions,15.0,pumps
6,"Women's Strappy Chunky Block High Heel - Formal, Wedding, Party Simple Classic Pump",Premier Standard,18.5,pumps
7,Women's Patti Dress Sandal,,39.99,pumps
8,LUVLY Women's Bridal Wedding Party Low Heel Pump Shoes,DREAM PAIRS,17.99,pumps
9,Women's Brady Dress Pump,,46.98,pumps
10,Women's Adriel Viola Dress Pump,,59.95,pumps
11,Women's Parigi Pump,,14.97,pumps
12,Rockport Women's Aubrey Dress Pump,Cobb Hill,59.03,pumps
13,Women's Vendra Bloom Wedge Pump,,34.9,pumps
14,Kimmy-21 Women's Round Toe Pierced Mid Heel Mary Jane Style Dress Pumps,Chase & Chloe,17.89,pumps
15,ARPEL/BERRY Women's Formal Evening Dance Rhinestones Classic Low Heel Pumps Shoes New,DREAM PAIRS,19.99,pumps
16,Women's Low Heel Pumps,DREAM PAIRS,25.99,pumps
17,Ankle Strap Kitten Heel - Adorable Low Block Heel - Daisy,J. Adams,21.0,pumps
18,Kimmy-36 Women's Teardrop Cut Out T-Strap Mid Heel Dress Pumps,Chase & Chloe,12.55,pumps
19,"Women's Emslie Lulin Pump,",,48.15,pumps
20,Women's SOHO9X9 Leather Pump,,51.98,pumps
21,Women's Natalie Dress Pump,,25.05,pumps
22,Women's Cash Wedge Pump,,31.91,pumps
23,Women's City_OT Fashion Stilettos Peep Toe Pumps Heels Shoes,DREAM PAIRS,24.99,pumps
24,"Women's Keesha Rosa Dress Pump,",,33.1,pumps
25,Womens Classic Pointy Toe Low Kitten Heel Office Dress Slip On Fashion Pump - 22 Colors,Guilty Shoes,11.91,pumps
26,Women's Wedge Open Toe Strap Chunky Heel Sandal Fashion Shoes,,23.99,pumps
27,Women's Angel II Pump,,12.47,pumps
28,Oppointed-Ankle Women's Pointed Toe Ankle Strap D'Orsay High Heel Stiletto Pumps Shoes.,DREAM PAIRS,17.99,pumps
29,Womens Slingback Dress Pump,Greatonu,17.99,pumps
30,Women's Marcie Wedge Pump,,21.51,pumps
31,Women's Oppointed-Mary Pump Shoe,DREAM PAIRS,24.99,pumps
32,Link Women's DORIS-22 Patent Round Toe Wedge Pumps,Forever,11.99,pumps
33,Womens PU Leather Oxfords Brogue Wingtip Lace up Chunky High Heel Shoes Dress Pumps Oxfords,Odema,23.99,pumps
34,Women's Emslie Warbler Pump,,43.28,pumps
35,Women's Habit Pointed Pump,Christian Siriano for Payless,10.0,pumps
36,Women's Eliana Mule,,19.99,pumps
37,Women's Daisie Dress Pump,,44.99,pumps
38,Women's Daisie Crystal Dress Closed 9.0 US,,99.95,pumps
39,Women's Boni7 Dress Pump,,47.33,pumps
40,Women's Comfortable Fashion Low Heels Round Toe Wedge Pumps Shoes,,18.99,pumps
41,"Women's Katy Pointed, Closed Toe Low, Kitten Heel Pumps",,16.99,pumps
42,Women's Oppointed-Lacey Pump Shoe,DREAM PAIRS,24.99,pumps
43,Women's Nima Wedge Pump,,20.23,pumps
44,Women's Seamless Dress Pump,,22.48,pumps
45,"Women's Gaby Pointed, Closed Toe Stiletto Pump Heels",,16.99,pumps
46,Women's Sadie Wedge 40MM Pump,,65.95,pumps
47,Women's Ankle Strap Platform Pump Party Dress High Heel,OCHENTA,23.99,pumps
48,Women's Seamless Dress Pump,,22.48,pumps
49,Women's Marcelle Clog,,116.73,pumps
50,"Women's Gaby Pointed, Closed Toe Stiletto Pump Heels",,16.99,pumps
51,Women's Sadie Wedge 40MM Pump,,65.95,pumps
52,Women's Ankle Strap Platform Pump Party Dress High Heel,OCHENTA,23.99,pumps
53,Rockport Women's Angelina Dress Pump,Cobb Hill,49.99,pumps
54,Women's Flores Tulip Wedge Pump,,28.16,pumps
55,Women's Kucci Classic Fashion Pointed Toe High Heel Dress Pumps Shoes,DREAM PAIRS,19.99,pumps
56,Milesline Fashion Vintage Womens Small Bowtie Platform Pumps Ladies Sexy High Heeled Shoes,Mostrin,19.99,pumps
57,Women's Ludlow Pump,,38.5,pumps
58,Women's Claudette Rubber Dress Pump,,34.99,pumps
59,"Women's Rainaa Pump,",,14.95,pumps
60,Women's Kayden4 Dress Pump,,48.38,pumps
61,"Stiletto High Heel Shoes for Women: Pointed, Closed Toe Classic Slip On Dress Pumps",JENN ARDOR,22.99,pumps
62,Women's Charleen Classic Fashion Closed Toe High Heel Dress Pumps Shoes,DREAM PAIRS,22.99,pumps
63,Women's Wedge Sandals Pearls Across The Top Platform High Heels,getmorebeauty,19.8,pumps
64,Women's Expert Dress Pump,,31.98,pumps
65,Women's Dreams Wedge Pump,,27.97,pumps
66,Women's Valentine Fashion Dress High Heel Peep Toe Wedding Pumps Shoes,DREAM PAIRS,29.99,pumps
67,MMJULY Women's Pointy Toe High Heel Stiletto Big Bow Pumps,Z&L Fashion,19.99,pumps
68,Women's Mercer Dress Pump,,17.77,pumps
69,Comfort Plus Women's Janine Pointy Toe Pump,Predictions,24.99,pumps
70,High Heels - Women's Pumps Stiletto Pointy Toed Dress Fashion Shoes JennaN,Yeviavy,19.99,pumps
71,Marco Republic Rome Memory Foam Cushion Womens Low Platform Heels Comfort Pumps,MARCOREPUBLIC,19.95,pumps
72,Women's Ashlyn Pump,,25.01,pumps
73,Women's Tatiana Dark Natural Suede Dress Pump,,38.0,pumps
74,Guilty Heart | Classic Office Comfortable Wedge | Soft Mid Low Heel Round Toe Walking Dress Pumps,Guilty Shoes,14.98,pumps
75,Women's Moda Low Heel D'Orsay Pointed Toe Pump Shoes,DREAM PAIRS,21.99,pumps
76,Women's Kristal Leather Dress Pump,,52.0,pumps
77,Round Toe Extra Cushioned Comfort Classic Dress Work Pumps,City Classified Comfort,21.0,pumps
78,Womens Round Toe Pump Shoes Black PU 6.5,City Classified,22.0,pumps
79,"Round Toe Extra Cushioned Comfort Classic Dress Work Pumps,Color:BlackNubA,Size:8.5",City Classified,21.99,pumps
80,"Sully's Round Toe Extra Cushioned Comfort Classic Dress Work Pumps (7 M US, Beige Pat)",City Classified,27.99,pumps
81,Women's Classic T-Strap Platform Mid-Heel Square Toe Oxfords Dress Shoes,DADAWEN,29.99,pumps
82,Women's Brier Dolly Dress Pump,,56.99,pumps
83,Womens Classic Retro Two Tone Embroidery - Wing Tip Lace Up Kitten Heel Oxford Pumps,Guilty Shoes,14.99,pumps
84,Women's Tali Grand Lace Wedge 40 Pump,,71.95,pumps
85,Women's Gabrianna Pump,,44.99,pumps
86,Women's Liliana Loafer Flat,,74.99,pumps
87,Women's Lace Bridal High Heel Platform Peep Toe Shootie,MVE Shoes,10.99,pumps
88,"Women's Lucy Pointed-Toe, Sling Back Pump Stiletto Heels",,19.99,pumps
89,Womens Eara,,34.99,pumps
90,Women's Tali Bow Pump,,28.01,pumps
91,Women's Samantha Pointed Toe Flat,,36.25,pumps
92,"Women's Wide Width Heel Pump Shoes - Ankle Buckle Strap Round Closed Toe Dressing Shoes. (Black 180320,8WW)",Luoika,39.99,pumps
93,Women's Solace Dress Pump,,25.49,pumps
94,Chase and Chloe Kimmy-21 Mary Jane Teardrop Cutout T-Strap Pump Heel,Chase & Chloe,9.99,pumps
95,Women's Saldana Pump,,33.99,pumps
96,Women's Saldana Pump,,33.99,pumps
97,Women's Flores Poppy Pump,,44.32,pumps
98,Mary Jane Pumps - Low Kitten Heels - Vintage Retro Round Toe Shoe With Ankle Strap - Pixie By J. Adams,,21.0,pumps
99,"Stiletto High Heel Shoes for Women: Pointed, Closed Toe Classic Slip On Pearl Dress Pumps",JENN ARDOR,20.99,pumps
100,Women's Calie Pump,,32.99,pumps
101,Women's Whitney Dress Pump,,25.11,pumps
102,Women's Patent Leather Pointed Toe Slingback Ankle Strap Kitten Heels Pumps Evening Stiletto Shoes 6.5CM,Modemoven,28.99,pumps
103,"Womens Superbendy Ballerinas Loafer Flat,",,48.9,pumps
104,Rockport Women's Salma-Ch Dress Pump,Cobb Hill,69.95,pumps
105,"Women's Stillson Pump,",,28.0,pumps
106,Women's Lina Wedge Pump,,21.6,pumps
107,Women's Sevyn Dress Pump,,15.98,pumps
108,Women's Crewso Wick Dress Pump,,33.95,pumps
109,Gloria Women's New Classic Elegant Versatile Stiletto Dress Platform Pumps Heels Shoes,DREAM PAIRS,19.99,pumps
110,Women's Stela Dress Pump,Blue by Betsey Johnson,64.83,pumps
111,Orthaheel Women's 'Mod Daphne' Slip On,Vionic,35.0,pumps
112,Women's Alicante Wedge Pump,,40.37,pumps
113,Women's Michelle Platform Pump,,31.14,pumps
114,Women's Astoria Pump,,49.99,pumps
115,| Womens Mary Jane Closed Toe Shoe | Mid Heel Retro Dressy Pumps,Guilty Heart,17.99,pumps
116,Girl's Mary Jane Pump…,Forever Link,7.83,pumps
117,Sport Women's Wisher Fabric Wedge Pump,,59.95,pumps
118,Women's Debbie Mid Wedge Heel Pump Shoes,DREAM PAIRS,21.99,pumps
119,"High Heels, Womens Pointed Toe Slip on Stilettos Party Wedding Pumps Basic Shoes",Elisabet Tang,29.99,pumps
120,Pointed Toe Studded Slingback Kitten Heel Leather Pumps,Kaitlyn Pan,109.99,pumps
121,Women's LILICA Mary-Jane Close Toe Stilleto Platform Heel Pump Shoes,DREAM PAIRS,19.99,pumps
122,Women's Hazel Dress Pump,,39.99,pumps
123,Dora-2 Women's Round Toe Two Tone Mary Jane Pumps,Chase & Chloe,17.73,pumps
124,Women's Demilee High Heel Chunky Pumps Shoes,DREAM PAIRS,21.99,pumps
125,Helena-13 Mary Jane Stiletto Pumps,Bella Marie,10.78,pumps
126,Height Womens Mary-Jane T-Strap Wedge Platform Pumps Shoes,DREAM PAIRS,25.99,pumps
127,Women's Genoveva Dress Pump,,49.99,pumps
128,Women's Juliana 75 Dress Pump,,73.2,pumps
129,Women's Cambredge Dress Pump,,36.99,pumps
130,Women's Sandra Wedge Pump,,73.92,pumps
131,Women's Flair Pump,,32.55,pumps
132,Women's Heel Pump Shoes,Premier Standard,18.68,pumps
133,Women's Telsa D'Orsay Pump,,29.99,pumps
134,"Women's Genoveva Pump, Black, 7.5 Medium US",,113.05,pumps
135,Women's Karma Round-Toe Pump,dexflex Comfort,29.99,pumps
136,Women's Closed Toe Ankle Strap Block Heel,City Classified,18.98,pumps
137,Women's Gella Dress Pump,,65.99,pumps
138,Skippy Mary Jane - Cute Round Toe Comfortable Chunky Block Pumps Heels,J. Adams,29.9,pumps
139,Women's FIFTH9X Fifth Pointy Toe Pumps,,30.99,pumps
140,Women's Nolan Tailored Slip-on Pump,,58.21,pumps
141,Women's Swan-30 High Heel Plaform Dress Pump Shoes,DREAM PAIRS,26.79,pumps
142,Women's Total Motion Kalila Dress Pump,,38.99,pumps
143,Women's Mila Low Chunky Heel Pump Shoes,DREAM PAIRS,19.99,pumps
144,Women Pumps Low Heel Shoes Ankle Strap Heels Shoes Women,VOSTEY,25.55,pumps
145,Women's Fashion Ankle Strap Chunky Heeled-Sandals,MVE Shoes,5.62,pumps
146,Women's See This Dress Pump,,30.0,pumps
147,"Women’s Classic Closed Toe Kitten Heel Pumps | Dress, Work, Party Low Heeled",OLIVIA K,17.99,pumps
148,"Women's Adorable Low Wedge Heel Shoe - Easy Low Pumps - Basic Slip On, Comfort",OLIVIA K,15.99,pumps
149,"Women's Mila Chunky, Mid Heel Mary Jane Pump Heels",,29.99,pumps
150,Women's Rumblers-Frilly-Wedge Heeled Dressy Casual Double Buckle Loafer Pump,,55.0,pumps
151,Women's Leah Mid Heel Round Toe Wedge Pumps,,29.99,pumps
152,Women's Round Toe Platform Slip on High Heel Dress Pumps,OCHENTA,19.99,pumps
153,Tiffany Women's New Classic Elegant Versatile Low Stiletto Heel Dress Platform Pumps Shoes,DREAM PAIRS,17.99,pumps
154,"Women's Kayden Pump,",,50.84,pumps
155,Women's Pointed Toe High Heel Ankle Strap D'Orsay Satin Dress Pumps,ElegantPark,29.99,pumps
156,Denise-1 Women's round toe wedge heel mary jane squeaky strap suede shoes,Bella Marie,10.34,pumps
157,Women's Pointed Toe Pumps Slip-on Office Business High Heels Sexy Stiletto Shoes 85mm,Modemoven,39.99,pumps
158,Women's Jaclyn Dress Pump Regular & Wide Sizes,Brinley Co,14.99,pumps
159,Women's Eryn Low Heel Square Toe Suede Dress Pump,,48.98,pumps
160,Women's Julia Slight Platform Open Toe High Heel Pumps,,29.99,pumps
161,"Women's Lydia Open, Peep Toe Kitten Heel Pumps",,29.99,pumps
162,Women's Fashion Patent Embellished Front Low Heel Pumps,Coshare,12.99,pumps
163,Women's Silver Star Pump,,22.27,pumps
164,Women's Fabulous Pump,,27.99,pumps
165,"Women's Strappy Chunky Block Low Heel - Formal, Wedding, Party Simple Classic Pump, TPS Heels-Naej Black Su Size 10",Premier Standard,24.99,pumps
166,Women's Flapointed-New Pump,DREAM PAIRS,7.88,pumps
167,Women's Slingback Pumps Stiletto High Heels Ladies Peep Toe Sandals Dress Party Platform Shoes,JENN ARDOR,22.99,pumps
168,Women's Lulia Wedge Pump,,32.48,pumps
169,Women's Kitten Heel Pumps Ladies Closed Pointed Toe D'Orsay Ankle Strap Dress Stiletto,JENN ARDOR,26.99,pumps
170,Women Closed Peep Toe Woven Platform Wedges Mary Jane Sandals Comfort Weave Shoes,HKR,29.98,pumps
171,Women's Margot Dress Pump,,27.99,pumps
172,Ankle Strap Dress Open Toe High Heel - Trinity by,J. Adams,29.9,pumps
173,Womens Pointy Toe High Heels Slip On Stiletto 12CM Leather Party Dress Pumps Shoes 5-14 US,Chris-T,37.98,pumps
174,Womens 36-MINA4 Closed Toe Mary Jane High Heel Shoes,V-Luxury,14.99,pumps
175,Women's Pointed Toe Studded Strappy High Heel Leather Pumps Stilettos Sandals,Premier Standard,18.68,pumps
176,Women's High Heel Pumps Stiletto Pointy Toed D'Orsay Dress Buckle Closure Ankle Strap Shoes,Yeviavy,19.99,pumps
177,Womens Pointed Toe High Heel Slip On Stiletto Pumps Wedding Party Basic Shoes,Lovirs,37.43,pumps
178,"Women's Ruby Round Toe, Kitten Low Height Pump Heels",,29.99,pumps
179,Women's Gloria Pump,,32.06,pumps
180,Women's Juliana Pump,,90.0,pumps
181,Women's Shore Thing Dress Pump,,27.32,pumps
182,Women Closed Toe Comfort Heel Rhinestone Satin Wedding Bridal Shoes,ElegantPark,39.95,pumps
183,Sport Women's Guardian Leather Dress Pump,,56.76,pumps
184,Women's Swan-10 High Heel Plaform Dress Pump Shoes,DREAM PAIRS,27.99,pumps
185,Women's Slingback Pumps,DREAM PAIRS,15.99,pumps
186,Women's Wide Width Wedge Shoes - Ankle Strap Mary Jane Dress Shoes Heel Pump,Luoika,22.99,pumps
187,Guilty Heart | Womens Classic Mary Jane Shoe | Comfortable Walking Round Toe Low Heel Wedge Pumps,Guilty Shoes,14.99,pumps
188,Women's Kiara Platform Pump,,89.99,pumps
189,Women's Linvale Jerica Pump,,59.5,pumps
190,Women's Hazel Pump,,58.9,pumps
191,Women's Closed Round Toe Low Kitten Heel Slip On Dress Pump,OCHENTA,19.99,pumps
192,"Women's Nora Pointed Toe, Slip On D'Orsay Pump Heels",,19.99,pumps
193,"Women's Classic D'Orsay Closed Toe Kitten Heel Pump - Casual, Comfort",OLIVIA K,14.99,pumps
194,Women's Olivia Wedge Pump,,44.55,pumps
195,Women's Peep Toe Slip on Wedge Pump,Forever Link,12.76,pumps
196,Women's Height-Ankle Elegant Ankle Strap Rear Zipper Closure Wedge Heel Platform Pumps Shoes,DREAM PAIRS,17.99,pumps
197,Women's IN2 Pedazo-C Mid Chunky Heels Ankle Strap D'Orsay Pumps,,35.99,pumps
198,Women's IN4 Classic Pointed Toe Stiletto High Heel Dress Pump,,29.99,pumps
199,Wonda-2 Womens Peep Toe Low Heel Glitter Dress Pumps,Bonnibel,19.23,pumps
200,Women's Gem Wedge Pump,,32.48,pumps
201,Women's Sexy Pointed Toe High Heel Slip On Stiletto Pumps Large Size Basic Shoes,onlymaker,28.0,pumps
202,Women's Sb-Adley Dress Pump,Blue by Betsey Johnson,64.13,pumps
203,Womens Mary Jane Wedges Pumps Ankle Strap Closed Toe Heeled Walking Work Shoes,Syktkmx,22.88,pumps
204,Women's Highest Dress Pump,,40.32,pumps
205,Women's Classic Fashion Stiletto Pointed Toe Paris-01 High Heel Dress Pump Shoes,,20.99,pumps
206,Mary Jane Kitten Heels - Vintage Retro Scallop Round Toe Shoe with an Adjustable Strap - Honey,J. Adams,21.0,pumps
207,Mary Jane Oxford Pumps - Cute Low Kitten Heels - Retro Round Toe Shoe with Ankle Strap - Kym by,J. Adams,23.0,pumps
208,Women's Liah Dress Pump,,66.54,pumps
209,Women's Satin Full Sole Diamonds Pointy Closed Toe High Heel Pumps,EKS,29.99,pumps
210,Women's Rosalyn Wren Pump,,69.0,pumps
211,Women's Lively Dress Pump,,26.38,pumps
212,Super Cushioned Memory Foam Inner Sole Comfort Coen-h Medium High Heel Pointy Toe Pump,City Classified,19.84,pumps
213,Women's Baleenda dress Pump,,36.99,pumps
214,Women's Karlie Wedge,dexflex Comfort,15.0,pumps
215,Women's Peep-Toe Stiletto High Heels Sandals Platform Pumps Shoes,fereshte,19.99,pumps
216,Fashion T Strap Bows Womens Platform High Heel Pumps Shoes,Lucksender,35.99,pumps
217,"Women's Grenow Pump,",,24.99,pumps
218,Rockport Cobb Hill Women's Shayla Dress Pump,Cobb Hill,50.13,pumps
219,Women's Round Toe Super High Heel Platform Stiletto Slip On Pumps for Wedding Party Shoes,onlymaker,32.0,pumps
220,Women's Christian Heel Pump Shoes,DREAM PAIRS,17.99,pumps
221,Women High Heel Bow Ankle Strap Evening Party Dance Wedding Satin Shoes,ERIJUNOR,39.99,pumps
222,Women's Gayle Pump,,74.99,pumps
223,"Women's Sexy Point Toe High Heels,Patent Leather Pumps,Wedding Dress Shoes,Cute Evening Stilettos",Modemoven,28.99,pumps
224,Women's Genuine Leather Comfort Low-Heeled Wedge Pump(up to 66% Off),Sketo,19.99,pumps
225,Women Peep Toe Side Open Rhinestones Comfortable Platform Satin Bridal Wedding Party Shoese,ERIJUNOR,52.99,pumps
226,Women's Stylish Round Toe Dressy Mid Heel Pump,MVE Shoes,15.99,pumps
227,Women's Wide Width Wedge Shoes - Mary Jane Heel Pump T-Strap.,Luoika,39.99,pumps
228,Women's Janie Pump,,45.63,pumps
229,Women's Juliana Pump,,90.0,pumps
230,Women's FIFTH9X9 LE Leather Pump,,39.99,pumps
231,Women's High Heels Sexy Stiletto Shoes Pointy Toe Slip-On Office Pumps,June in Love,37.99,pumps
232,Women Low Heels Office Pumps Comfort Closed Toe Slip on Formal Kitten Shoes,YDN,9.98,pumps
233,Women's Caddell Dash Wedge Pump,,17.5,pumps
234,Women Peep Toe Rhinestones Pumps High Heel Satin Evening Prom Wedding Shoes,ElegantPark,39.95,pumps
235,Women's Jenner Dress Pump,DREAM PAIRS,20.75,pumps
236,Classic Pointed Toe Pumps - Slip On Comfortable Work High Heel - Wide Fit Stiletto Heel Dress Pumps Shoes,MVE Shoes,10.99,pumps
237,Vivi Fashion High Heel Pointed Nude Clear Pumps Heels Slip on Dress Shoes for Women,VI&VI,35.49,pumps
238,Women's Mickie Dress Pump,,24.99,pumps
239,Women's Stevie Sling,dexflex Comfort,15.0,pumps
240,Women's Stevie Sling,dexflex Comfort,15.0,pumps
241,Women's Low Heels Mary Jane Pumps - Adorable Vintage Shoes- Unique Round Toe Design With An Adjustable T Strap,OLIVIA K,16.99,pumps
242,Women's Vintage Retro Black and White Ankle Strappy Buckle Dress High Heels,getmorebeauty,19.9,pumps
243,Women's Classic Low Heel Day Pump Shoes for Work/Casual wear/Party/Wedding/Bridal,STELLE,16.99,pumps
244,Women's Cobb Hill Angelina Dress Pump,,83.17,pumps
245,Women's Electric Pump,BZees,55.2,pumps
246,Women's Classic Dress Pump W Extra Cushioned In Sole Round Toe & Platform,City Classified,7.82,pumps
247,Womens Mia Pump,Vionic,138.54,pumps
248,Women's Hazel Pump,,39.99,pumps
249,Women's Metal Studs Strappy Buckle Pointy Toe Flats Comfortable Dress Pumps Shoes,CAMSSOO,42.99,pumps
250,Women's Rocha Leather Dress Pump,,36.99,pumps
251,Women's Juliana Stretch Wedge Pump,,22.49,pumps
252,Women's Canvas High-Heeled Fashion Sneaker Pump Shoes,JiYe,35.99,pumps
253,Women's Patent Leather Pointed Toe Kitten Heels Gorgeous Pumps Evening Stiletto Shoes 5.5CM,Modemoven,28.99,pumps
254,Women's Fabulist Leather Dress Pump,,56.0,pumps
255,Women's Tad Wedge Pump,,33.99,pumps
256,Women's Juliana Wedge Pump,,19.9,pumps
257,Women's Peep Toe Platform High Heel Rhinestones Satin Evening Prom Wedding Shoes,ElegantPark,49.99,pumps
258,Hush Puppies Women's Deanna Dress Pump,,27.48,pumps
259,Women's Hastings Pump,,54.0,pumps
260,Women's Farrow Wedge Pump,,18.0,pumps
261,Women's Princess Glitz Wedge,Fioni,19.99,pumps
262,Women Low Kitten Heel Pumps Pointed Toe Dress Shoes for Office Lady Soft Suede,YDN,19.98,pumps
263,Women's T-Strap Wingtip Style Closed Toe Cut Out Mid Heel Dress Pump,Cambridge Select,30.39,pumps
264,Women's Sadie Ot 65mm Wedge Pump,,125.98,pumps
265,HC1521 Women's Mary Jane Closed Toe Low Heel Pumps Lace Wedding Dress Shoes,ElegantPark,29.99,pumps
266,Women's Merritt Round Toe Block Heel Pump - Low,,80.0,pumps
267,"Classic Pointed Toe Pumps – Comfortable Closed Toe Chunky Block Heels – Party, Office, Special Occasion - Jolie",J. Adams,29.0,pumps
268,Wonda-1 Womens Round Toe Low Heel Glitter Dress Pumps,Bonnibel,13.67,pumps
269,Women's Wings Slingback Kitten Heel Pointed Toe Dress Pump Shoes,DREAM PAIRS,22.99,pumps
270,Women's Chartli Diva Pump,,69.95,pumps
271,Link Women's DORIS-23 Faux Leather Mid Heel Round Toe Wedge Pumps,Forever,13.78,pumps
272,Women's Thick High Heel Shoes Sexy Straps Pumps,PRETTODAY,23.99,pumps
273,Women's Yasi682fly Wedge Pump,,69.95,pumps
274,Women's Justine Pump 55MM,,38.54,pumps
275,Women's Pointed Toe Ankle T-Strap Party High Heel Pumps Shoes,,17.99,pumps
276,Women's Calla Rose Pump,,31.48,pumps
277,Women's Holliston Pump,,35.11,pumps
278,Women's Kaydenly Dress Pump,,49.44,pumps
279,Comfort Women's Dennis Mary Jane High Heel,City Classified,14.88,pumps
280,Women's Exquisite Dress Pump,,9.99,pumps
281,Women's 203-Judy Dress Sandal,,21.65,pumps
282,Women's Battelle Closed-Toe Covered Wedge Pump,,75.0,pumps
283,Ankle Strap Pump Heel -Comfortable Round Toe Dress Block Shoe - Darling,J. Adams,28.0,pumps
284,Women's Hazel Pump,,70.0,pumps
285,Women's Dea Slingback Pump,,27.12,pumps
286,Women's Bethani Wedge Pump,,29.95,pumps
287,Women Comfortable Mid Heel Ankle Strappy Dress Pumps Pointed Toe Satin Wedding Evening Party Shoes,ERIJUNOR,38.9,pumps
288,Womens Nine-5 Classic Almond Toe Mid Wedge Pump Slip On Shoes,Bella Marie,13.58,pumps
289,Women's Carra Dress Pump,,64.05,pumps
290,Women's Total Motion Salima Dress Pump,,42.99,pumps
291,Women's Alice Low-Height Round Toe Wedge Pumps,,29.99,pumps
292,| Womens Classic Pointy Toe Sexy High Heel | Formal Dress Party Office Slip On Pump,Guilty Heart,19.98,pumps
293,Women's Chic Sweet Round Toe T-Strap Bows Adorable Buckle High Cone Heel Mary Janes Dress Pumps,Susanny,26.5,pumps
294,Womens Flaggship,,26.99,pumps
295,Footwear Women Sampson Wedge Pump,,40.99,pumps
296,Kimmy-58 Women's Mary Jane T-Strap Round Toe Pump,Chase & Chloe,20.84,pumps
297,Women's Hansen Pump,,105.99,pumps
298,Women's Cassel,,44.99,pumps
299,Women's IN2 Maxine Sequins Mid Kitten Heels D-Orsay Party Pump,,33.99,pumps
300,Women's Comodo Low Heel Stiletto Pump Shoes,DREAM PAIRS,19.99,pumps
301,Women's Cirrus Dress-Pump,,26.99,pumps
302,Women's Pats801fly Wedge Sandal,,67.99,pumps
303,Women's Susan Fashion Stilettos Peep Toe Pumps Heels Shoes,DREAM PAIRS,27.99,pumps
304,Women's Elegantee Dress Pump,DREAM PAIRS,16.31,pumps
305,Womens Kaleesi,,34.99,pumps
306,Women's Closed Pointed Toe Pumps Stiletto High Heels Office Lady Wedding Party Dress Heeded Shoes,JENN ARDOR,22.99,pumps
307,Comfort Plus by Women's Peggy Strappy Sling,Predictions,24.99,pumps
308,"Women¡¯s Classic Closed Toe D'Orsay Bow Kitten Heel Pump | Dress, Work, Party Mid Heeled Pumps",OLIVIA K,19.99,pumps
309,Womens Shoe Faux Suede Basic Chunky Mid Heel Ankle Strap Pumps,Ollio,29.99,pumps
310,Women Pumps Rivet High Heels T-Strap Pumps Women,VOSTEY,16.99,pumps
311,Women's Janice Pump,,34.99,pumps
312,Women's Lively 2 Pump,,18.73,pumps
313,Women's Michelle Kilty Toe Dress Suede Pump,,41.74,pumps
314,Women's Total Motion Pump,,140.0,pumps
315,Women's Comfortable Elegant high Cushioned Casual Low Heels Formal Office Lady Round Toe Stiletto Pumps Shoes,,17.99,pumps
316,Women's Gianna Pump,,33.66,pumps
317,Women's Sexy High Heels Peep Toe Slip On Platform Pumps Stiletto Dress Party Wedding Shoes,onlymaker,32.0,pumps
318,Women's Rosalyn Belle Dress Pump,,29.98,pumps
319,Women's I-Loyal Flat,,19.98,pumps
320,Womens Low Heel Dress Pumps Rhinestone Open Toe Wedding Shoes,,22.99,pumps
321,Women's Cleopatra Wedge Pump,,44.74,pumps
322,Women's Noreen Wedge Pump,,32.42,pumps
323,Women's Comfortable Elegant high Cushioned Office Low Heels Pointy Close Toe Stiletto Pumps Shoes,,20.99,pumps
324,Women's Classic Ankle Strap Platform Low Heels Round Toe Party Dress Pumps Shoes,,17.99,pumps
325,"Women's Pearla Pump,",,22.89,pumps
326,Women's Melanie Ankle Strap Sandal,,29.62,pumps
327,Women High Heel Strappy Dress Pumps Pointy Toe Satin Wedding Party Shoes,ElegantPark,42.99,pumps
328,Women's Waive Dress Pump,,16.63,pumps
329,Women's Pointy Toe High Heels Slip On Stilettos Large Size Wedding Party Evening Pumps Shoes,Modemoven,22.99,pumps
330,Women's Dori Pump,,119.95,pumps
331,Womens Classic Low Mid Heels Mary Jane Pumps - Adorable Round Toe Vintage Retro Shoes,OLIVIA K,17.99,pumps
332,Women's Subway Dress Pump,,24.31,pumps
333,Women's IN3 D'Orsay Pointed Toe Ankle Strap Mid Heel Pump,,35.99,pumps
334,Women's Betina 2 Pump,,37.35,pumps
335,Women's Darlis Dress Pump,,32.99,pumps
336,Women's Darlis Dress Pump,,32.99,pumps
337,Womens Chesca Pump,,36.86,pumps
338,Women's Sina 78 Pump,,73.0,pumps
339,Women's Bold Buckles Studded Wedge Sandal,,24.99,pumps
340,Women's High Heels Pumps Red Blood Printing Slip on Shoes,YCG,29.99,pumps
341,Womens IKE,,34.99,pumps
342,Womens Ike,,34.99,pumps
343,Women's Bristol Pleated Wedge,dexflex Comfort,29.99,pumps
344,"Women's Viga Pump,",,34.99,pumps
345,Mid Kitten Heels Stiletto Pumps Pointed Toe Slingback Dress Sandals Low Heels Ankle Strap Wedding Party Pumps,JENN ARDOR,29.99,pumps
346,Women's Wide Width Heel Sandals - Ankle Buckle T-Strap Mid Heel Close Toe Platform Summer Heel Pump.,Luoika,39.99,pumps
347,Women's Athyna Dress Pump,,51.56,pumps
348,Women's Waive Pump Red 7 M,,18.73,pumps
349,Women's Glitter Sequins Strappy Closed Toes Dress Wedding Shoes,getmorebeauty,20.98,pumps
350,"Women's Cirrus Dress-Pump,",,44.99,pumps
351,Women's Oria Pump,Brinley Co,19.99,pumps
352,Women's Rubie Dress Sandal,,33.23,pumps
353,Women's Slingbacks Peep Toe High Heels Shoes Platform Pumps Gradient Wedding Party,MERUMOTE,29.99,pumps
354,Women's Halle Wedge Pump,,19.98,pumps
355,Mirjam 11 Women's Pump,,53.25,pumps
356,Women's Marty Janes T-Strappy Lace Women Dress Wedding Shoes,getmorebeauty,29.5,pumps
357,Women's Wide Width Wedge Shoes - Mary Jane Ankle Buckle Double Strap Round Closed Toe Heel Pump,Luoika,39.99,pumps
358,Women's High Heel for Wedding Party Pumps Fashion Rivet Studded Stiletto Pointed Toe Dress Shoes,Jiu du,43.93,pumps
359,Women's Stiletto High Heel Pumps Pointy Toe Bowknot Slip On Bridal Wedding Shoes,JENN ARDOR,22.99,pumps
360,Women's Tarah Brae Dress Pump,,54.95,pumps
361,Womens Masterone,,32.99,pumps
362,"Women's, Roman Low Heel Pumps",Earth Origins,49.95,pumps
363,"Women's Emmala Leather Pump,",,40.05,pumps
364,Women's Linvale Vena Pump,,72.95,pumps
365,Women's Suki Pump,,34.99,pumps
366,Women's Vyixin Pump,,89.78,pumps
367,Women's Groovy Wedge Pump,,15.99,pumps
368,Women's Comfor Classic Slip On Pointed Toe Dress Shoes Low Heel Pump Wedding Shoe,CAMSSOO,22.99,pumps
369,Women Sexy Suede Pointed Toe Pumps 12 cm High Heels Stilettos Prom Shoes Size 4-15 US,FSJ,19.99,pumps
370,Chase & Chloe Kona-2 Mary Jane Pumps,Guilty Heart,16.99,pumps
371,Coco-22 Mary Jane T-Strap Dress Platform Pumps,RF ROOM OF FASHION,24.5,pumps
372,"Women's Sexy D'Orsay Pointed Toe Heel Pump - Classic, Comfortable",OLIVIA K,18.99,pumps
