,product_name,seller,price,category
5020,VAIL-01 Womens Pointed Toe Flat W/Glittery Bat Bow & Bat Charm Detail,Demonia,35.95,flats
5021,Sporto174; Janie Water-Repellant Suede Bootie 571-592,,28.97,flats
5022,Womens Stacey,,49.95,flats
5023,Tatiana Women's Pointed Toe Casual Ballet Flat,Via Pinky,23.99,flats
5024,Womens Round-Toe Low-Cut Uppers Assorted Color Patent-Leather Flats-Shoes,BalaMasa,38.99,flats
5025,Women's Vivienne Ballet Flat,Butterfly Twists,24.99,flats
5026,Womens Faux Suede Pointed Toe Flats,Journee Collection,34.99,flats
5027,Flat Round Toe D'Orsay Open Shank Flats w/ X Cross Ankle Straps,Sully's,17.71,flats
5028,Women's Classic Casual Dressy Comfort Soft Slip on Pointed Toe Ballet Flats,RF ROOM OF FASHION,14.99,flats
5029,"Womens BOC Born Concept, Zita (7 B(M) US, Ocean Blue)",B.O.C.,43.99,flats
5030,Women's Cece Ballet Flat,Butterfly Twists,24.99,flats
5031,Open Back Pointed Toe Flats with Ankle Wrap & Low Metallic Block Heel,Bamboo,25.0,flats
5032,Shoes Women's Esteppe Flat,Annie,10.15,flats
5033,Women's truwalk Zero Mary Jane Walking Shoe,,59.99,flats
5034,Women's Cella,,328.95,flats
5035,Women's Nova Flat,Bellini,44.44,flats
5036,Women's Backpacking Ballet Flat,,37.99,flats
5037,Women's Crissy Ballet Flat,,98.98,flats
5038,Dainzuy Women's Comfort Flex Casual Outdoor Walking Flats Lace up Shoes,Dainzuy Women's Shoes,15.89,flats
5039,Women's Regina Ballet Flat,,145.97,flats
5040,Women Faux Suede Pointy Caged Lace Up Flat HH91,Alrisco,22.19,flats
5041,"T.U.K... Shoes A9282L Womens Mary Janes, Emerald Velvet Kitty VLK Mary Jane",,40.41,flats
5042,Women's NIRO Diamonds Mary Jane Flat,Allrounder by Mephisto,160.99,flats
5043,Women's Whole Number Ballet Flat,Unlisted,12.79,flats
5044,Women's Designer Alice Ballet Flats,Michael Kors,191.7,flats
5045,Patent Leather Flats Nude Trim & Gold Studs,,34.99,flats
5046,"Women's Zulian Ballet Flat, Bone, 6.5 B US",ALDO,65.0,flats
5047,Rockport Women's Tori-Ch Flat,Cobb Hill,49.99,flats
5048,Women's Rupert Ballet Flat,,74.02,flats
5049,Women's Kessa Grace Slip-On,,47.18,flats
5050,Womens EMMARI Pointed Toe Ankle Wrap Ballet Flats,,45.0,flats
5051,Women's Pointed Toe Ballet Loafer-Flats Classic Slip On Bowtie Comfortable Casual Walking Shoe,Sammitop,52.99,flats
5052,Women's Azure Mule,French Sole FS/NY,47.39,flats
5053,Women's Tizola Mule,,46.64,flats
5054,Women's Elegant Patent Leather Poninted Toe Bowknot Floral Flats Shoes,CHFSO,23.98,flats
5055,Women's Munchkin Suede Ballet Flat,,55.49,flats
5056,Women's Shay Suede Pointed Toe Flat,,69.0,flats
5057,Women's Intrecciato Woven Ballet Flat,Refresh Footwear,7.36,flats
5058,Women's Carlyn Ballet Flat,,16.89,flats
5059,Women's Dahlia Embellished Beaded Dress/Casual Ballet Flat,Faye + Valerie,38.88,flats
5060,Women's Lilina Platform,,23.3,flats
5061,Women's Heartbreaker Ballet Flat,,24.98,flats
5062,Women's Scamper Ballet Flats,,78.95,flats
5063,Minnie Leather Women's Ballet Flat Shoes (Symphony Blue),,239.99,flats
5064,"Women's The Bella Ballet Flat,",Katy Perry,102.99,flats
5065,Propet Women's Stephanie Lace-Up,,19.99,flats
5066,Women's Pipelopez Pointed Toe Flat,,333.04,flats
5067,Pointy Toe Slip On Flats Patent Hidden Low Heel Office Daily Walking Shoes for Women Size 9 Nude,XYD,9.79,flats
5068,Women's Flamenco Flat,,22.66,flats
5069,Women's Washington Seattle Slip-On Loafer,,39.0,flats
5070,Womens Manda 2 Leather Square Toe Espadrille Flats,Marc Fisher,60.99,flats
5071,Women Mixed Media Aztec Capped Toe Flat GG34,Nature Breeze,28.79,flats
5072,Women's Baila Ballet Flat,,15.98,flats
5073,Womens Glow,,42.99,flats
5074,"Women's, London Slip on Shoes Black 8 W",Earth Origins,39.95,flats
5075,Los Angeles Womens in Black/Black by Adidas,,34.96,flats
5076,Casual Glitter Lady Adjustable Strap Buckle Womens Dress Shoes Ballet Flats,weyoh,15.99,flats
5077,Women's Dina Ballet Flat,,54.99,flats
5078,Women's Chrissy Flat,Jellypop,18.73,flats
5079,Women's Martine Sling Back Perforated Shoe Flat Sandal,,24.7,flats
5080,Women's RARANO Ballet Flat,Call It Spring,24.25,flats
5081,Standard Dress Shoe,,34.89,flats
5082,Women's PARK AVENUE Lace Peep Toe Ballet Flats by Dessy,Dessy,36.5,flats
5083,Womens aricia Cap Toe Ballet Flats,,21.38,flats
5084,Women's Criss Cross Comfort Elastic & Buckle Ankle Strap Round Toe Ballet Flat,SNJ,14.99,flats
5085,Wyoming Women US 6.5 Gray Walking Shoe,,36.97,flats
5086,"Women's Baldy,",,48.6,flats
5087,Women's Adult Kelsie Flat Synthetic Complements Exclusives,AmeriMark,12.99,flats
5088,"Women's A301w Janice Mary Jane Flat,",Apex,49.99,flats
5089,Elegant Women's Classic Faux Suede Black Stylish Ballet Flat Slip-Ons,J.J.,0.98,flats
5090,Women Shoes Walking Dancing Embroidery Vintage Mary Jane Flats Size US 4.5-US 9,Royal Victory,9.99,flats
5091,Womens Khussa Silk Beaded Flats Shoes,Beachcombers,40.99,flats
5092,Mio Marino Comfortable Flat Dress Shoes for Women - Square Toe Satin Flats - Black Noir - Size 10 B(M) US,,52.99,flats
5093,BOBS Women's Bobs B-Loved-Liquid Sparkle Flat,,43.48,flats
5094,Women's Gylda Snake Flat,,89.9,flats
5095,Women's 3324-Padu Ballet Flat,,295.0,flats
5096,Women's Marie Suede Ballet Flat,,35.55,flats
5097,"Women's Why NOT Pointed Toe Flat,",,78.39,flats
5098,Women's Hey You Guys Court Shoe,,38.53,flats
5099,"Womens Lux Camden Wedge, Tan, Size 8 Wide",Vionic,119.99,flats
5100,Newton Womens Shoes Red,PUBLIC DESIRE,49.95,flats
5101,Women's Elegant Sequins Flats Pionted Toe Wedding Ballet Bridal Shoes,Loslandifen,50.99,flats
5102,F'TASMAW Womens MERMAID-21/SHGPU Flats,,24.65,flats
5103,Women's Joan Ballet Flat,Frances Valentine,247.47,flats
5104,Women's Stella Suede Ballet Flat,,39.99,flats
5105,London Women's Almond 9 US,Earth Origins,37.47,flats
5106,Women's Cessole 216 1 Ballet Flat,,95.21,flats
5107,Womens Slip On Round Toe Flat Comfort Shoes With Spiked Back Teal Size 5.5-10,KSC,19.95,flats
5108,Women's Candra Glare Flat,,57.72,flats
5109,Comfort Mary Janes Seamy Cross,Wolky,40.0,flats
5110,Women's Zumara Flat,,43.09,flats
5111,Heidi Women's Pump,,98.95,flats
5112,Womens Faux Suede Zipper Flats,Journee Collection,49.99,flats
5113,Women's Amalia Skimmer Ballet Flat,,116.0,flats
5114,Women's Fresco Espadrille Wedge Sandal,,44.99,flats
5115,Women's A200WM095 Loafer Flat,Apex,19.99,flats
5116,Glitter Ballet Flats With String Bow Great For Costumes Womens Shoes,,39.39,flats
5117,Women's - Mesh Flats,,14.9,flats
5118,Shoes Allegro,,70.0,flats
5119,Women Flats Platform Flat Shoes Slip on Flats Creepers Footwear 2855,New-Loft-women flat platform sandals shoes,42.7,flats
5120,Womens Joni Cap Toe Ballet Flats,MICHAEL Michael Kors,98.98,flats
5121,Sodi Womens Zuly Peep Toe Loafers,Thalia,14.99,flats
5122,Women's Vesper Ballet Flat,,44.99,flats
5123,Masha,Azura,19.95,flats
5124,Women's Spring/Fall Leather Strap Buckles Handmade Flat Shoes,Mordenmiss,59.99,flats
5125,Womens Canvas Slip on Mesh Shoes (Adults),Kali Footwear,12.95,flats
5126,Women's Ladera Espadrille Flat,Wild Pair,14.99,flats
5127,BOBS from Women's Plush-Robochic Flat,,28.36,flats
5128,Women Gem Yael Flats,,69.95,flats
5129,Womens Foldable Bow Slip On Ballet Flats Dress Shoes,FLourishing,35.99,flats
5130,"Women Flats, Ballet Low Heels Wedding Slip on Patent Leather Dress Shoes",Owen Moll,25.99,flats
5131,Kylie Shoe,,89.95,flats
5132,Women Bowtie Ballet Flats Sweet Slip On Folding Shoe Round Toe Soft Driving Casual Shoes,Cosmagic,23.25,flats
5133,Women's Vivid Pointed Toe Flat,French Sole FS/NY,38.69,flats
5134,BOBS from Women's Bliss Spring Step Flat,,28.36,flats
5135,Women's Shoe Ballet Round Toe Mary Jane Flat,Ollio,23.99,flats
5136,Women Leatherette Round Toe Bow Slip On Ballet Flat DF44,Wild Diva,16.73,flats
5137,Womens Patent Round Toe Flats,Journee Collection,29.99,flats
5138,Women's Brushed Jersey Sknit Milly,,20.4,flats
5139,Women's Edeille Pointed Toe Flat,Call It Spring,19.04,flats
5140,Women's Annabella,,18.18,flats
5141,Women's 421 Jane Maryjane Pump,,28.36,flats
5142,Flower Embroidery Flats Rubber Sole Casual Slip On Shoes for Women,AvaCostume,17.99,flats
5143,New York & Co. Women's Pointed-Toe Flat,New York & Company,18.0,flats
5144,Womens Rivera,,22.99,flats
5145,"Mary Janes Women's Shoes, Best Foldable & Flexible Flats, Slipper Socks, Travel Slippers & Exercise Shoes, Dance Shoes, Yoga Socks, House Shoes, Indoor Slippers, Gray, Medium",Nufoot,11.36,flats
5146,Womens Pointed Toe Bow Ballet Flats Soft Comfort Ballerina Slip On Dress Shoes,Meeshine,14.99,flats
5147,Jadina- Espadrilles - Metal Beige,,30.0,flats
5148,Womens Foldable Ballet Flats w/ Carrying Case,Sidekicks,10.95,flats
5149,"Women's Neoprene Beachcomber Eyelet Espadrille Flat, Water-Friendly and Quick Drying",Sea Star Beachwear,96.0,flats
5150,Women's Annora Ballet Flat,Athena Alexander,20.0,flats
5151,Women's Classic Ballet Flat Pointed Toe Slip On Ballerina D'Orsay Flat Shoes,DeerYou,17.99,flats
5152,The Final SaleBrieten Women's Rhinestones Pointed Toe Flat Shoes,Brieten,16.95,flats
5153,Womens Soft Manmade PU Slip On Flats,Magone,34.99,flats
5154,Womens marykate,,68.95,flats
5155,Women's Arabesque Shoe,,34.48,flats
5156,Women's Jodi Ballet Flat,,78.26,flats
5157,Women's Heather,La Plume,94.95,flats
5158,Women's Studio Point Toe Mules,Matt Bernson,161.0,flats
5159,Women's Lario,Wanted,31.01,flats
5160,BOBS Women's Luxe Bobs-Sparkle Dot Ballet Flat,,30.49,flats
5161,Javie Womens Summer Maternity Shoes Comfortable for Pregnancy Every Day Wear,JA VIE,88.0,flats
5162,London Women's Almond 8.5 US,Earth Origins,47.0,flats
5163,"Womens Lux Camden Wedge (7 B(M) US, Merlot)",Vionic,49.92,flats
5164,Women's Sienna Ballet Flat,,178.0,flats
5165,Women Slip On Bowknot Patent Leather Flats,Dear Time,14.26,flats
5166,Women's Laura Graphic Flat Ankle-High Shoe,,35.99,flats
5167,Women's Mocassin Flats (Available in 2 Colors),Bella Marie,19.99,flats
5168,Women's Sante Ballet Flat,,31.18,flats
5169,BCBGeneration Womens Nikkola Suede Pointed Toe Loafers,,19.97,flats
5170,"BCBGeneration NIKKOLA Suede Flat Wheat,10",,19.97,flats
5171,"BCBGeneration NIKKOLA Suede Flat Wheat,8",,19.97,flats
5172,Women Casual Flat Shoes Fashion Lady Sexy Candy Colors Pointed Toe Footwear,TAOFFEN,18.86,flats
5173,Women's Comfort Mary Jane Flats Casual Walking Shoes,InterestPrint,39.99,flats
5174,Women's Zaela Pointed Toe Flat,,39.99,flats
5175,Women's Kayo Ballet Flat,,28.21,flats
5176,Women's Whitney Slip-On,Aravon,109.95,flats
5177,Women's Pink Canvas Split-sole Ballet Shoes Slippers,Fashion Every Day,12.99,flats
5178,Women's Rounded Toe Ballet Flats,,16.54,flats
5179,Women's Jones T-Strap Sandal,,13.35,flats
5180,Propet Women's Travelwalker Lo Pro Shoe,,30.36,flats
5181,Womens Bridal Flats Satin Ballerina Pumps Shoes,ESSEX GLAM,16.99,flats
5182,Womens Tippy Leather Closed Toe Loafers,,159.95,flats
5183,Women's Comfy Hidden Wedge Ballet Flat,Bella Marie,8.27,flats
5184,De Blossom Collection Justin-10 Peep Toe Low Wedge Ballet Flats,David's Bridal,9.99,flats
5185,Women's Edyna Pointed Toe Flat,,47.14,flats
5186,Women's Colorful Lace Crochet Cut-Out Ballet Flats,Orly Shoes,7.95,flats
5187,Women's Flower Embroidery Ankle Straps Dancing Mary Jane Shoes,AvaCostume,22.99,flats
5188,Women's Crocband Airy Flat,,26.99,flats
5189,Unisex Sk8-Hi Reissue Li (Throwback) Skate Shoe 11,,64.0,flats
5190,Womens Foldable Ballet Flats Rhinestone Comfort Wedding Shoes,Believed,35.99,flats
5191,Women's Chill Cat Canvas Ballet Flats,HOT POLKA DOT,19.99,flats
5192,Women's Slip on Wedge Ballet Flats Low Mid Wedge Heel Boat Shoes Bellarina Flat Shoes,Shobeautiful,18.09,flats
5193,Comfortable Shoes for Women Cute Flats for Every Day Wear Driving Walking,JA VIE,49.0,flats
5194,Women's Anastasia Loafer,,28.56,flats
5195,Women's Wave.Cruise Mary Jane,,59.99,flats
5196,Shoes Women's Chantel-30V Round Toe Faux Suede Mary-Jane Flats With Buckle Closure,Bamboo,13.99,flats
5197,Imogen - White Mary-Jane Flat,,129.99,flats
5198,Womens Hanneli Driver 7.5 Marine Blue With White Stripe-gum,,76.61,flats
5199,Women's Eve (Soft Patent) Loafer Flat,,209.87,flats
5200,Women's PU Patent Leather Court Ballet Flat,Loslandifen,32.99,flats
5201,Footwear Women's Gilsa Ballet Flat,,29.31,flats
5202,Women's 'Crissy' Mary Jane Flat,,59.99,flats
5203,Leslie,Oka-B,50.69,flats
5204,Summit Kieran Women's Flat,,76.05,flats
5205,"Harlyn' Women's Flat, Stone - 8.5 M",CLIFFS BY WHITE MOUNTAIN,24.99,flats
5206,Women's Satin Slippers with Puffs,Jenni Kayne,79.0,flats
5207,"Ivory Satin Wedding Flats Peep Toe,RS-9804-IVORY",LUXVEER,46.89,flats
5208,Women's N5300 Dolce Black/Coral Ballet Flat,El Naturalista,112.99,flats
5209,"Women's 2766-illite Ballet Flat,",,107.99,flats
5210,Women's Comfort Mary Jane Flats Casual Walking Shoes,InterestPrint,39.99,flats
5211,Women's Talia Faux Leather Pointed Toe Ballet Flats,,14.99,flats
5212,Women's Adra Fz Flat,Flossy,21.77,flats
5213,Women's Giande Bow Ballet Flat,,39.0,flats
5214,Round Toe Ballerina Ballet Flats w Soft Foam Padding,City Classified,23.0,flats
5215,Women's Sandrine Striped Jute Flats,,44.99,flats
5216,Women's Signature Rehearsal Comfort Ballet Flats,,84.95,flats
5217,Women's Genuine Leather Comfort Glove Shoes Ballet Flats(UP to 58% Off),Sketo,19.99,flats
5218,Women Metallic Pointy Toe Dorsay Wrap Gladiator Flat EA64 - Gold,,18.53,flats
5219,Neo Sunlina Jqd,,24.96,flats
5220,Women's A301w Janice Mary Jane Flat,Apex,49.99,flats
5221,Shoes For Womens -Clearance Sale ，Farjing Women Hollow Round Head Flat Breathable Leisure Sports Shoes Shake Shoes,Farjing,19.99,flats
5222,Women's Soleil Flat,,49.99,flats
5223,Women's Antonio Ballet Flat,,78.88,flats
5224,Women's Harlowe Pointed Toe Flat,,85.67,flats
5225,"A7099L Womens Heels, Piano Platinum Heel",T.U.K. Rewind,39.99,flats
5226,Women's Abby-10 Vegan Leather Pointed Toe Slip-On Fashion Dress Flats Shoes,Pierre Dumas,16.46,flats
5227,Scalloped Leather Flats,Kaitlyn Pan,69.99,flats
5228,Women's Spirit,Academie Gear,30.99,flats
5229,Women's Ellen Grommet Flat,Brash,29.99,flats
5230,"Women's Dream Slip on, Brown, 8 W",SAS,93.0,flats
5231,"Classic Handmade Women's Soft Comfort Slip On Flat Shoes, Leather Insole, Matching Mommy and me Shoes",MADAME CHLOE,54.99,flats
5232,Women's Kull Buckle Flat With Eyelet Detailing,Demonia,46.95,flats
5233,Womens Studs Flat Strappy Buckle Shoes Pointy Toe Slingback Dress Pumps Flats 6-14 US,Chris-T,47.99,flats
5234,Womens Point Toe T-Strap Mary Janes Shoes w Hidden Wedge,Sweet Holic,32.9,flats
5235,Women's Olive-03 Ballet Flat,Pin Up Couture,44.95,flats
5236,Womens Alexis Ballet,MICHAEL Michael Kors,39.99,flats
5237,Women's Samara Star Perforated Leather Ballet Flat,,49.99,flats
5238,Women's Primrose Ballet Flat,,44.99,flats
5239,Women's How to Dance Flat,,52.99,flats
5240,Women's Gema Flat,,80.31,flats
5241,BOBS from Women's World-Daisy and Dot Flat,,44.64,flats
5242,Women's Olivia Ii Graphic W Flat,,16.5,flats
5243,Nohea Nubuck Shoe - Women's Black/Tan 11,,109.95,flats
5244,Women's Ordell Flat,,26.62,flats
5245,Womens Mason Ballet,,82.99,flats
5246,Womens Azika,,105.63,flats
5247,Women's Beau Flat,,29.99,flats
5248,Womens Lux Camden Wedge Dark Grey Size 7.5,Vionic,74.78,flats
5249,Women's Leather Casual Walking Flat Slippers,Z.SUO,25.99,flats
5250,"BOBS Women's Super Plush - Rhinestone Flat,",,33.69,flats
5251,Women's Sting-26 Ballet Flat,,32.0,flats
5252,Women's Sterling Flat,,7.99,flats
5253,Women's Patent Superballerina Ballet Flat,,124.95,flats
5254,Women's Fink Ankle-High Canvas Flat Shoe,,27.99,flats
5255,Women's Lunar Boxed in Pu Flat,,15.98,flats
5256,Women's Recipe Olive 40 EU,,40.0,flats
5257,Women's Opal Taupe 7.5 W US,Vionic,39.99,flats
5258,Best Buds Suede Tassle Shoes,Diba True,83.27,flats
5259,Womens Ariel Closed Toe Slide Flats,,67.99,flats
5260,Womens Flower Embroidery Chinese Style Flats Cheongsam Dress Shoes,AvaCostume,19.99,flats
5261,"Clearance! Women Shoes,Solid Color Suede Flat Heel Pearl Flat Heel Pointed Casual Shoes",Fitfulvan,5.49,flats
5262,Women's Lolita Cosplay Bow Flat Mary Jane Shoes,Charm Foot,28.0,flats
5263,Men's Vulc N Vent Casual Shoe,,25.85,flats
5264,Womens Madeira Leather Almond Toe,Comfortiva,44.99,flats
5265,"TZ Flat Fluorescent 3/16"" 5mm Laces For Shoes/Boots/Trainers/Plimsols",TZ Laces,3.0,flats
5266,"Color Block Chain Ballet Flat Black,Green,Red,Blue",ONE,20.99,flats
5267,Women's Pippa 27 Flats Shoes,Josef Seibel,39.98,flats
5268,Women's Candra Glow Ballet Flat,,59.95,flats
5269,Women's Socute Ballet Flat,,17.21,flats
5270,Cadwell Womens Strappy Flats,Jellypop,41.88,flats
5271,Women's Sd Mary Jane,Nautilus,37.4,flats
5272,Women's Starship Metallic,,25.5,flats
5273,Women's Classic Pointy Toe Slip On Ballet Flats Casual Comfortable Shoes,BEYARNE,23.99,flats
5274,FIC Andie Women Wide Width Slip On Ballet Dress Flats for Any Occasion (Size & Measurement Guides),Fuzzy,59.95,flats
5275,"Ballet Flats Women, Round Toe Solid Metal Dedign Slip on Dressy Shoes",York Zhu,39.99,flats
5276,Womens Sofie Closed Toe Ballet Flats,RIALTO,26.11,flats
5277,Women's Velvet Mary Jane Shoes Black Ballerina Cloth Flats Yoga Exercise Dance Shoes,Maybest,0.98,flats
5278,Women's Ceoze,,325.0,flats
5279,Women's Cailan Flat,Musse & Cloud,69.9,flats
5280,Women's Slip-On Round Toe Laser Cutout Ballet Flat,Cambridge Select,7.58,flats
5281,Gem Posey Ballet Flat Caramel 9W,Vionic,68.39,flats
5282,W0S-4681 Brandy,,169.95,flats
5283,Gold Trimmed Outsole Flat w Double Open Shank D'Orsay & Ankle Strap,Bamboo,25.0,flats
5284,"Rockport Women's Petra Mary Jane Flat, Pewter, 8 W US",Cobb Hill,100.0,flats
5285,Women's Bows Patent Leather Sweet Cute Lolita Elegance Party Dress Flats Shoes,Carolbar,24.0,flats
5286,MIA Women's Anamarie Pointed Toe Flat,MIA Amore,17.83,flats
5287,Showstopper Grey Ladies Casual Shoes,,24.9,flats
5288,MICHAEL Michael Kors Womens Kendrick Closed Toe Espadrille Flats,Michael Kors,84.99,flats
5289,Women's Avril Flat,ara,80.99,flats
5290,Women's Ankle Strap Butterfly Embroidery Casual Party Dance Dress Shoes,AvaCostume,17.99,flats
5291,Terri Women's Slip On,Beacon,28.99,flats
5292,"Terri Women's Slip On, Beige, Size 9.5",Beacon,28.99,flats
5293,Women's Boa Flat,French Sole FS/NY,99.99,flats
5294,"'Harlyn' Women's Flat, Stone - 7.5 M",CLIFFS BY WHITE MOUNTAIN,24.99,flats
5295,Women's Easy Spa-Ballet Flat,,23.96,flats
5296,"Women Flats, Women Black White Ballet Snake Print Slip-On Work Shallow Shoes",Owen Moll,37.99,flats
5297,Women Lace Up Cut Out Ankle Cuff Dress Ballet Flats,JJF Shoes,14.5,flats
5298,Women's Closed Pointed Toe Buckled Ankle Strap Studded Ballet Flat,Cambridge Select,5.99,flats
5299,Women's Awaken Pump,SJP by Sarah Jessica Parker,103.5,flats
5300,Women's Marieta Ballet Flat,ALDO,27.99,flats
5301,Women Pointy Toe Bowknot Slip-on Ballet Flats,JACKY LUYI,11.99,flats
5302,Summer Sale!! All New Style Ballet Flats,shoewhatever,9.99,flats
5303,Women's L14 Flat Loafers Shoes,,71.21,flats
5304,Women's TREAT06/NUGFA Ballet Flat,Fabulicious,27.36,flats
5305,Women's Rio Leopard Fade W Flat,,75.0,flats
5306,Gee Whiz,,19.99,flats
5307,Rose Petals Women's Brooklyn Flat,,24.12,flats
5308,Gem Posey Ballet Flat Taupe 10W,Vionic,73.7,flats
5309,Women's Dark Blue Double Bow Arrow Slip On Flat Shoes US 8.5 B (M),BF Sole,19.99,flats
5310,Women's Anna01/Bp Ballet Flat,,40.95,flats
5311,Patent Leather Women's Flat Heels Big D Buckle Handmade Fashion Flats Shoes,Nine Seven,84.9,flats
5312,Women's Cutout Rhinestone Pointy Toe Low Cut Dress Driving Wear To Work Office Slip On Flats Shoes,,31.97,flats
5313,Women's Pleat Ballet Flat With Leopard Insole,Charles Albert,12.95,flats
5314,Women's Bows Hounds-Tooth Assorted Colors Flats Shoes,Carolbar,24.0,flats
5315,"Agacci Womens Shoes Slip On Patent PU Open Toe Flats, (Not True to Size)",Millan-44,19.99,flats
5316,Fashion Slip On Only Met Suede Cute Narrow Wedding Womens Ballet Flats Shoes Without Box,weyoh,11.99,flats
5317,Wolky Passion,Wolky North America Inc.,99.9,flats
5318,Afar Simple Ballet Flat Rounded Toe Casual Comfort Womens,,9.97,flats
5319,Women's Trippy Karl Lagerfeld Flat,,80.73,flats
5320,Women's Pleather Mule Flat Shoes Pointed Toe Footwear,TONGPU,29.99,flats
5321,Women's Volume Pointed Toe Flat,French Sole FS/NY,40.0,flats
5322,Mesh Flat Shoes For Women Ballet Lace Mesh Flat Slip On Shoes,Walstar,15.99,flats
5323,Leather Flat Lace up,Bruno Menegatti,49.9,flats
5324,Women's Leighton Embellished Crystal Beaded Bridal Dress/Casual Ballet Flat,Faye + Valerie,37.46,flats
5325,Fashion Casual Slip on Only Lace Style Cute Narrow Women Ballet Flats Shoes New Without Box,Unknown,12.99,flats
5326,"Earthies Women's Bremen: Flat (Patent Leather/Black, 5)",,55.99,flats
5327,Women's Felicity Ballet Flat,,24.9,flats
5328,Lux Camden - Women's Supportive Wedge Black/black - 7.5 Wide,Vionic,105.0,flats
5329,KAZAKOVA (6 B(M) US),,49.18,flats
5330,Women's Ballet Flat Shoes Round Toe with jewlery Rhinestone Accent,zi brasil,32.0,flats
5331,Gem Posey Ballet Flat Teal 7.5W,Vionic,54.99,flats
5332,Flower,,134.95,flats
5333,City Classified Shoes Women Formal Basic Casual Ballet Flats Slip on Round Toe Thesis,,16.99,flats
5334,BOBS Women's Luxe Bobs-Fleetwood Flat,,27.16,flats
5335,Women's Delphine Crystal & Suede Ballet Flats,,159.99,flats
5336,"Women's Origine Slim Espadrille Coral,",,19.99,flats
5337,Women's SPL-Akron Ballet Flat,Splendid,34.79,flats
5338,"Women's Pearl (Metallic LeatherGrosgrain) Ballet Flat,",,94.71,flats
5339,UltraStepInz by Cherokee Uniforms Textile Woven Step-In Shoes (Assorted Colors),Stepinz,18.99,flats
5340,Dora Flats,Comfortview,34.99,flats
5341,Womens AKAppeal,,29.99,flats
5342,Womens Nabila,,40.5,flats
5343,"Women's Pointy Toe Slingback Flats - Handmade Plain Comfortable Shoes - Fashion, Gracef",Nine Seven,87.9,flats
5344,Women's Sasha Embellished Crystal Beaded Bridal Dress/Casual Ballet Flat,Faye + Valerie,36.99,flats
5345,Women's Rhinestone Studded Slip on Ballet Flat,Elegant Footwear,24.94,flats
5346,Women's Vienna Leather Ballet Flat,,59.99,flats
5347,Women's Gilmore Mary Jane Flat,,72.5,flats
5348,Women Flat Shoes HGWXX7 Casual Low Heel Shallow Mouth Single Shoes Pointed Toe Ladies Shoes Flat Shoes,HGWXX7's Shoes,6.49,flats
5349,Women's Solid Sequins Round Toe Slip On Low Cut No Heels Flats Pumps Shoes,Plaid&Plain,19.99,flats
5350,Women's Moguer Microfiber Comfort Slip On Shoe,UIN,72.0,flats
5351,Women's Abay Patent Pointed Toe Flat,,47.4,flats
5352,Women's Speakup Mettalic Ballet Flat,,27.45,flats
5353,"Women's, London Slip on Shoes Black 10 W",Earth Origins,39.95,flats
5354,"Women's Loop2-td Pointed Toe Flat,",,33.49,flats
5355,Women's Classic Patent Pointed Toe Slip On Flat,Bella Marie,24.13,flats
5356,Women Suede Pointy Toe Hollow Out Gilly Tie Wrap Flat EB03 - Black,,15.78,flats
5357,Women's Dark Java/Tan Nohea Nubuck 9.5 B(M) Us,,109.95,flats
5358,Women's Cicely Flats Shoes,,49.75,flats
5359,Women's Kitty Flats,charlotte olympia,415.0,flats
5360,Beam Women's Slip On,Bellini,62.0,flats
5361,Women's Pika-132 Ballet Flat,,7.6,flats
5362,Women's Camden Black 9.5 M US,Vionic,94.4,flats
5363,Women's Adelia Pointed Toe Flat,Nanette Nanette Lepore,26.7,flats
5364,Women's Jewel-embellished Shoes Pointed Toe Ballet Low Heels Slip On Flats,Comfity,54.89,flats
5365,Women's My Joy,,345.0,flats
5366,Women's Korari Mary Jane Flat,,165.99,flats
5367,Rose Petals Women's Butter 2 Ballet Flat,Rose Petals by Walking Cradles,19.99,flats
5368,Women's Dava Point Toe Mules,,118.5,flats
5369,Women's London Ante Slip-On Flat,Sabrinas,159.95,flats
5370,"Women's Kittycat Loafer,",,21.18,flats
5371,Women's Tanner Penny Loafer,Circus by Sam Edelman,24.99,flats
5372,Court + (Pig Suede) Midnight Navy SZ 7.0M/8.5W,,49.99,flats
5373,"Women Ballerina Flats, Bows Accents Slip On Shoes",ONE,14.99,flats
5374,Women's Meila Callies Black Slip On Loafer Ballet Flats,,14.97,flats
5375,Unisex Lenny Mid (Little Kid/Big Kid),TOMS Kids,48.95,flats
5376,Womens Wide Width Bow Ballet Flats,Journee Collection,39.99,flats
5377,Women's Neroli Ballet Flat,ALDO,44.88,flats
5378,Embroidered Chinese Style Flats Ballet Embroidery Crafts Comfortable Slip on Women's Shoes,LYZ,8.99,flats
5379,Women's Palmyre Ballet Flat,ALDO,70.0,flats
5380,Women Scalloped Round Toe Faux Pearl Ballet Flat HH89,Alrisco,22.19,flats
5381,Florrie' Women's Flat,CLIFFS BY WHITE MOUNTAIN,14.64,flats
5382,Earth Tayberry Women's Slip On 8 B(M) US Denim,Kalso Earth Shoes,39.95,flats
5383,"Womens Lux Camden Wedge, Tan, Size 8.5",Vionic,107.99,flats
5384,Glenn01 Women's D'Orsay Flats in Blush,Mark and Maddux,25.0,flats
5385,Women's Geometric Laser Cutout Closed Round Toe Bow Slip-On Ballet Flat,Cambridge Select,6.89,flats
5386,Women's BT Alyson Flat,BareTraps,19.99,flats
5387,"BOBS Women's B-Loved - Speed Read Flat,",,23.32,flats
5388,Women's Medora Elie Mary Jane Flat,,42.99,flats
5389,Womens Pointy Toe Patchwork Ballerina Ballet Flat Slip On Causal Shoes,Bamboo,15.99,flats
5390,Women's Faeth Flat,,24.99,flats
5391,Girls Closed Toe School Uniform Mary Jane Flats Shoes for Little Kid/Big Kid,RAZAMAZA,28.99,flats
5392,Womens Boat Shoes Casual Ballet Slip On Flats Loafers Amanda 03 by Footware,ANNA,14.99,flats
5393,"Women's Zulian Ballet Flat, Bone, 7 B US",ALDO,65.0,flats
5394,The Celine Flat,Comfortview,45.97,flats
5395,Ballerinas Shoes NYB101,Goby,74.99,flats
5396,Womens/Ladies Extra Wide Fitting Mary Jane Shoes,Boulevard,31.95,flats
5397,Women Casual Flat Shoe Basic Pointy Toe Gel Insole REDBUD,,15.99,flats
5398,"Women Flats, Soft Solid Buckle Slip On Women Square Toe Single Shoes",Owen Moll,39.89,flats
5399,Women's Xalan Fabric Ballet Flat,,19.75,flats
5400,Women's Olivia Slip On,Eric Michael,55.99,flats
5401,JSport Women's Mermaid Monk Strap Flat Black,,36.97,flats
5402,Women's Estee Ballet Flat,,34.06,flats
5403,Women's Flats Comfort Ballet Flat Breathable Floral Embroidery Shoes Woman,VINTAGE EMBROIDERY V.E.,12.99,flats
5404,"Women's ALELLA LTHR AF Black Ballet Flat,",,130.0,flats
5405,Women's Bow Round Toe Slip-On Ballet Flat,Cambridge Select,15.38,flats
5406,Women's Giraffe Smoking Slipper Flat,Soludos,45.15,flats
5407,Women's Lite Step-Helium Mary Jane Flat,,28.59,flats
