,product_name,seller,price,category
2552,Women's Depan-Nu Flat,,131.85,flats
2553,"BOBS Women's Plush - Sit Stay Flat,",,50.0,flats
2554,Women's Jane Fashion Boot,,380.69,flats
2555,Women's Alessandra Studded Flat Ballet,,74.95,flats
2556,Women's Whole Sparkle Ballet Flat Glitzy,Unlisted by Kenneth Cole,25.59,flats
2557,Women's Faeth Flat,,16.58,flats
2558,Canvas Alpargata Flat (Womens)-Black-7.5 M US,TOMS,42.99,flats
2559,Women's Aroha Mary Jane Flat,,69.29,flats
2560,Women's Estee Ballet Flat,,32.11,flats
2561,Women's Cr Pixels Flat,,50.24,flats
2562,Womens Currant Slip-On,,39.99,flats
2563,"Rockport Women's, Pia Mary Jane Shoes",Cobb Hill,45.0,flats
2564,Michael Kids Womens Faye Ria (Little Kid/Big Kid),Michael Kors,39.99,flats
2565,"Up & Go Ballet Flats Shoes Imitation Leather Rubber Soles Women AA/N, B/M Vietnam B01-375",GOUP,24.85,flats
2566,Women's Watt Ballet Flat,Brinley Co,15.0,flats
2567,Women's Laci Ballet Flat,Brinley Co,13.09,flats
2568,Women's Camden Black 8.5 M US,Vionic,99.93,flats
2569,Women's Eloy Ballet Flat,,25.0,flats
2570,Cliffs Hedda Women's Flat,CLIFFS BY WHITE MOUNTAIN,31.4,flats
2571,Emma Abigail Ankle Strap Ballet Flat Slip On Shoes,Emma Fashion,13.99,flats
2572,Women's Bette Ballet Flat,,50.99,flats
2573,Women's Bt Janine Flat,BareTraps,26.0,flats
2574,Women's Sienna Ballet Flat,,177.9,flats
2575,Women's Galway - 2188 Slip-On,,334.9,flats
2576,"Sport Women's Breathe Easy Lucky Lady Mary Jane Flat,Black Knit Mesh/Charcoal Trim,6.5 M US",,48.05,flats
2577,Women's - Microsuede Cut Out Slip-ONS,,14.9,flats
2578,Women's Calichill Flat,,21.17,flats
2579,Women's Round Toe Ballet Flats with Iridescent Rhinestone Studs on Glitter Vamp,Bamboo,22.63,flats
2580,Women's Shoe Faux Suede Flower Ribbon Ballet Flat,Ollio,24.99,flats
2581,Nautilus Shell Women Flats Shoes,,189.95,flats
2582,BOBS from Women's Plush Lite Sox Hop Flat,,24.95,flats
2583,Women's Dimitria Flat,ALDO,33.99,flats
2584,Walking Shoes for Women Ballet Flats Style for Every Day Wear Driving Walking,JA VIE,49.0,flats
2585,Women's Anice Suede Ballet Flat,,36.44,flats
2586,Verona II Women's Slip On,Auditions,53.99,flats
2587,Women's Cobb Hill Revchi,,44.99,flats
2588,"Women’s Nita Skimmer Flat, Slip On Pointed Toe Fashion Dress Shoe Fashion Shoe",,39.98,flats
2589,"Lowell 2 Driver, Tumbled Leather, Black",,249.99,flats
2590,Women's Crisscross D'Orsay Buckle Accent Zip Back Ballet Flat,Lovmark,7.5600000000000005,flats
2591,Women's Sizzle Ballet Flat,,29.69,flats
2592,Women's Greely Harper Flat,,24.99,flats
2593,Women's Josie Mary Jane Flat,,21.71,flats
2594,Women's Low Wedge Pump Slip On Shoes (HESTER02),Greens,29.99,flats
2595,L15D,,58.95,flats
2596,Women's Albany Babydoll Flat,,40.99,flats
2597,Chinese Traditional Phoenix Pattern Womens Embroidered Walking Shoes,AvaCostume,17.99,flats
2598,Women's Beechmer Ballet Flat,,22.99,flats
2599,A2 Women's Trend Book Ballet Flat,,21.3,flats
2600,"BOBS Women's Pureflex3 - Wonderer Mary Jane Flat,",,37.59,flats
2601,Chocolaticas Space Women's Mary Jane Flat,Hot Chocolate Design,69.99,flats
2602,Women's Sebeka Piper Flat,,24.99,flats
2603,NAOT Men's Wisdom Flat,,156.21,flats
2604,Women's Savannah Ballet Flat,L.K. Bennett,295.0,flats
2605,Women's Peep Toe Glitter Rhinestone Crystal Faux Pearl Slip-On Dress Flat,Cambridge Select,8.1,flats
2606,Women's Fedra Ballet Flat,,32.99,flats
2607,Hallie Women Wide Width Open Shank Pointed Toe Buckle Ankle Strap Flats (Size & Measurement),Fuzzy,59.95,flats
2608,Womens Dress Flats Casual Shoes for Women for Every Day Wear Driving Walking,JA VIE,49.0,flats
2609,Women's Soft Real Leather Comfortable Round Toe Mid Heel Mary Jane Shoes,Duberess,42.0,flats
2610,Womens Zarina,,42.99,flats
2611,Women's Zarina Pointed Toe Flat,,42.99,flats
2612,Women's Giddy Ballet Flat,,8.65,flats
2613,Betty Black Mesh Embroidery Sparkle Embellished Ballet Flat,Lauren Lorraine,39.99,flats
2614,Breeze Women's Slip On,ARRAY,49.99,flats
2615,Breeze Women's Slip On 9.5 B(M) US Tan,ARRAY,79.95,flats
2616,Breeze Women's Slip On 10 B(M) US Champagne,ARRAY,79.95,flats
2617,Breeze Women's Slip On 8.5 B(M) US Black,ARRAY,79.95,flats
2618,Women's Shimmy Ballet Flat,,35.99,flats
2619,Carter-05 Women D'Orsay Slip On Pointy Cap Toe Extreme Cut Out Ankle Flat Bootie,Beast Fashion,32.99,flats
2620,Women's Pristina Pump,,98.0,flats
2621,Women's Venti Ballet Flat,,14.05,flats
2622,Women's WEF07BK,Aravon,36.87,flats
2623,Women's Closed Round Toe Bow Knot Slip-On Comfort Ballet Flat,Cambridge Select,25.29,flats
2624,Women's Murellia Ballet Flat,,62.55,flats
2625,Women's Aisley Pointed Toe Flat Slip Mule,,52.99,flats
2626,Women's Liz Ballet Flat,,62.41,flats
2627,Women's Mary Janes Flats Pearls Flower Dress Wedding Shoes,getmorebeauty,29.5,flats
2628,Women's Skyler Ballet Flat,,47.99,flats
2629,Jessa Slingback Flat,Comfortview,34.99,flats
2630,Women's Earth Fest Sustainability Mary Jane Flat,,39.99,flats
2631,Ballet Flat Womens Walking Casual Leather Shoes,Pinpochyaw,47.99,flats
2632,Women's Glory Flat,Dr. Scholl's Shoes,24.99,flats
2633,Women's Closed Pointed Toe D'Orsay Buckled Ankle Strap Ballet Flat,Cambridge Select,18.5,flats
2634,Women's Yunus Flat,,41.99,flats
2635,Lotus-01 Women D'Orsay Slip on Open Toe Extreme Cut Out Ankle Flat Bootie Black,Beast Fashion,35.0,flats
2636,Women's Olyvia 2 Flat,,39.6,flats
2637,Women's Waverly Mary Jane Flat,SoftWalk,68.39,flats
2638,Women's Thalia Ballet Flats,MICHAEL Michael Kors,39.99,flats
2639,Women's Anikka Espadrille Wedge Sandal,,31.49,flats
2640,Gem Posey Ballet Flat Caramel 10M,Vionic,60.93,flats
2641,Women's Closed Pointed Toe Slip-On Side Cutout Ballet Flat,Cambridge Select,10.3,flats
2642,Women's Trend Right Flat,,33.67,flats
2643,Chickasaw Orthopedic Diabetic Women's Stretchable Mary Jane Shoes,Orthofeet,126.95,flats
2644,by Kenneth Cole Women's Gabby Mary Jane Flat,,95.22,flats
2645,BOBS from Women's Lotopia Pleasantville Flat,,54.98,flats
2646,Marina Women Wide Width Round Toe Casual Dress Skimmer Flats (Size & Measurement Chart Available),Peerage,54.95,flats
2647,Women's Amp Flat,,27.99,flats
2648,Women's Shoe Faux Suede Ribbon Ballet Flat,Ollio,24.99,flats
2649,Catwalk Navy Shimmer,,52.94,flats
2650,Women's Erica Round-Toe Sequin Ballet Flat,,9.63,flats
2651,Womens Tali Modern Bow Ballet,,85.0,flats
2652,Genoa 14316 Women's Casual Shoe Leather Velcro,Drew Shoe,103.99,flats
2653,"Women's RITE Now Ballet Flat,",,24.18,flats
2654,Women's Danville2 Espidrille,,49.99,flats
2655,Women's Odell Leather Ballet Flat,,44.99,flats
2656,"BOBS Women's Plush - Hot Spot Ballet Flat,",,21.24,flats
2657,Women's Paulette Shoe,,80.75,flats
2658,Women's Career First Impression Ballet Flat,,31.41,flats
2659,Women's Zavala Structured Bow Ballet Flat,,13.5,flats
2660,Women's Closed Pointed Toe Side Cutout Slip-On Ballet Flat,Cambridge Select,18.49,flats
2661,Women's Nance Ballet Flat,Brinley Co,11.06,flats
2662,Kids' Tiler,Body Wrappers,16.48,flats
2663,Women's Spin Class Ballet Flat,,22.14,flats
2664,Women's Butterfly Ballet Flat,,35.09,flats
2665,Womens Erin,,22.99,flats
2666,Women's Women's Shape Pointy Ballerina Ballet Flat,,58.96,flats
2667,Women's Thea Ballet Flat,L.K. Bennett,157.5,flats
2668,Espadrilles for Women - Sandals - Canvas Shoes - Slip On Shoes - Alpargatas for Women - Unisex Shoes - Vegan Shoes,A&A,9.99,flats
2669,"Women's Flats, Pointed Toe Flats Pumps, Patent Leather Flats Pumps, Walking Dress Office Classic Comfortable Flats",Eldof,48.99,flats
2670,Women's Augustine,,39.99,flats
2671,Women's Semi Pointed Almond Toe Ballet Comfort Soft Slip On Flats Shoes,Charles Albert,13.25,flats
2672,Women's Maya,Aravon,149.51,flats
2673,Women's Rosa Ballet Flat,,80.03,flats
2674,Aravon Women's Briana-AR Mary Jane Flat,Aravon By New Balance,49.99,flats
2675,Sidney Women Wide Width Pointed Toe Casual Dress Step in Flats (Size/Measurement Chart Available),Peerage,54.95,flats
2676,Women's Eleanorr Pointed Toe Flat,,40.0,flats
2677,MIA Women's Beth Ballet Flat,MIA Amore,14.98,flats
2678,Women's Domain Ballet Flat,,89.99,flats
2679,Women's Azalea Flat,,14.99,flats
2680,Footwear Womens Women's Dayla Tie,,35.75,flats
2681,Chocolaticas Cherry Women's Mary Jane Flat,Hot Chocolate Design,69.99,flats
2682,Women's Emma Ballet Flat,Kate Spade New York,69.99,flats
2683,Women's Euma Ballet Flat,,18.0,flats
2684,Snakeskin Textured Folding Portable Flats That fit in a Bag,Fit in Clouds,17.24,flats
2685,Women's D'Orsay Ballerina Ballet Flat,,16.75,flats
2686,Nella Ballet Flat,Kate Spade New York,90.27,flats
2687,Marion Quilted Ballet Flat Women's Leather Shoes,,224.99,flats
2688,"Take Time Women's Leather Shoes, Black",SAS,162.95,flats
2689,Women's Almond Toe Skimmer With Ankle Strap,Bamboo,23.98,flats
2690,Women's Danna Mules,,250.0,flats
2691,Brooklyn Women's Deandra Ballet Flat,,18.56,flats
2692,Women's Dellora Skimmer Ballet Flat,,80.27,flats
2693,Womens Adrina Open Toe Slip On Flat Shoes,,28.99,flats
2694,Geinee Women's Slip On 8 C/D US Shell-Taupe,,34.49,flats
2695,Women's FZXJ071,,13.99,flats
2696,Womens Touch Ballerina 2.0 Perforated Ballet Flat,,51.49,flats
2697,Women's Cleo-Wham Ballet Flat,,27.67,flats
2698,"Women's Pro-time Ballet Flat with Elastic Ankle Strap, Back Zip- Satin",,27.95,flats
2699,Womens Fayette,,54.99,flats
2700,Women's Emmie Ballet Flat,,36.99,flats
2701,Women's Closed Pointed Toe D'Orsay Buckled Ankle Strap Ballet Flat,Cambridge Select,14.53,flats
2702,Women's Upper Level Flat,,15.1,flats
2703,Women's Closed Round Toe Slip-On Low Comfort Wedge,Cambridge Select,27.07,flats
2704,Laila 2 Perfect Black Leather Driver Ballet Flat,,188.95,flats
2705,Women's Hayden Loafer,,24.5,flats
2706,Women's Honor Roll Oxford,Academie Gear,53.99,flats
2707,Womens Cami,Sbicca,34.99,flats
2708,Women's LC Adventure Flat,,134.95,flats
2709,Women's Starship Patent Ballet Flat,,31.05,flats
2710,Women's Shoes Slip-on Ballet Basic Light Comfort Low Hidden Heel Flats,Ollio,14.99,flats
2711,Silver Wedding Flats for Women Jeweled Shoes Handmade Khussa Jutti Mojari,Mimi,35.0,flats
2712,Freedom-F Women's Slip On,MIA Amore,16.99,flats
2713,Womens Geonna,,34.65,flats
2714,L’Artiste by Spring Step Women's Loleta Flat,L'Artiste by Spring Step,54.85,flats
2715,Women's 001001b07-Red Red Canvas Wm CLSC Alpargata Flat,TOMS,37.08,flats
2716,Strappy Crisscross Mary Jane Pump,Elegant Footwear,30.68,flats
2717,Women's Connect Ballet Flat,Dr. Scholl's Shoes,26.6,flats
2718,Women's Ambulator Biomechanical,Apex,39.99,flats
2719,Women's Shoe Ballet Weave Pointed Toe Dress Flat,Ollio,24.99,flats
2720,Women's Classics Canvas Core Colors,TOMS,39.0,flats
2721,Women's Guardian Pointed Toe Flat,,37.2,flats
2722,Dr. Scholl's Women's Reply Flat,Dr. Scholl's Shoes,34.99,flats
2723,Women's Blanche Nora Ballet Flat,,52.78,flats
2724,Women's Camden Black 7.5 M US,Vionic,92.26,flats
2725,Womens Wide Width D'orsay Ankle Strap Round Toe Flats,Journee Collection,44.99,flats
2726,Womens Peep Toe Flats Elegant Satin Wedding Bridal Ballet,MarHermoso,43.99,flats
2727,"Women's Bluegill Mary Jane Flat,",,185.95,flats
2728,Footwear Women's Angela Ballet Flat,,14.69,flats
2729,Womens Nadine Closed Toe Mules,,29.39,flats
2730,"Women's Nadine Perforated Espadrille,Sky Naked Calfskin,US 9.5 M",,29.99,flats
2731,"Women's Nadine Perforated Espadrille,Natural Naked Calfskin,US 9 M",,29.99,flats
2732,"Women's Nadine Perforated Espadrille,Black Calfskin,US 8 M",,44.99,flats
2733,Women's Annytah 6 Ballet Round Toe Flats Bow- Arch Support and Cushioning,,130.0,flats
2734,Women's Alen Mary Jane Flat,Marc Fisher,22.49,flats
2735,Women's Chella Crush Fabric Ballet Flat,,16.36,flats
2736,Women's Josie Mary Jane Flat,,44.23,flats
2737,Gem Posey Ballet Flat Black 11M,Vionic,74.95,flats
2738,Women's GEN-ERATION POM Ballet Flat,,24.99,flats
2739,Women's Classic Closed Pointed Toe Slip On Ballet Flat,Cambridge Select,19.38,flats
2740,Women's Annabella Flat,,373.36,flats
2741,Women's Sydney Ii,RIALTO,19.99,flats
2742,Women's Ballet Flats Comfort Slip On Fashion Dress Shoes,Beaumens,18.99,flats
2743,Women's Skimmer Flat,,34.99,flats
2744,Fresh Womens Slip On Ballet Flats,Jellypop,16.99,flats
2745,Women's Slip-On Knotted Closed Round Toe Ballet Flat,Cambridge Select,5.99,flats
2746,Womens Vignola,,375.0,flats
2747,Women's Jessie Ballet Flat,,11.78,flats
2748,Lady¡¯s Full Brogue Derby Shoes Assorted Colours Classic Flats Shoes,Smilun,37.5,flats
2749,Women's Lady's Open Toe Wrap Flat,,69.5,flats
2750,Stacy-13 Women's round toe faux leather slip on boat ballet flat shoes,Bella Marie,4.8100000000000005,flats
2751,Women's Ladia Platform,,34.99,flats
2752,Shoes For Womens -Clearance Sale ，Farjing Fashion Women Flat Casual Shoes Vintage Board Shoes Student Canvas Shoes,Farjing,11.99,flats
2753,Sport Abandoned Women Black Flats,,49.99,flats
2754,"Women's Nash Ballet Flat,",Kate Spade New York,152.1,flats
2755,Women's Round Toe Caged Laser Cutout Buckled Strappy Ankle Ballet Flat,Cambridge Select,7.5600000000000005,flats
2756,Women's Shoes Faux Suede Round Toe Low Heel Comfortable Pumps,Ollio,16.99,flats
2757,Women Flat Ballerina Punjabi Jutti Khussa Shoes Ethnic Phulkari Shoes,Step n Style,38.95,flats
2758,Women's Colt Ballet Flat,,118.89,flats
2759,"Women's Pleats Be with You Pump,",,29.74,flats
2760,Women's Grande Square Toe Mules,,33.75,flats
2761,Women's Samara Ballet Flat,,35.99,flats
2762,Casey Flat,Carol Wright Gifts,14.99,flats
2763,"Women's Lambrate Ballet Flat,",ALDO,53.88,flats
2764,Women's Peony Boot,,44.99,flats
2765,Womens Mattie,,21.99,flats
2766,Adelia Women's Flats - Pointy Toe Flat,PIC/PAY,29.97,flats
2767,Women's Fiana Ballet Flat,,30.68,flats
2768,Women's Astoria Open-Toe Ballet Flat,,129.78,flats
2769,Boyce Shoe,,24.12,flats
2770,"BCBG Generation Women's Justine Crystal MCRS/CRYS Loafer Flat,",,27.99,flats
2771,Women's Dolly Buckle Ballerina Ballet Flat,,58.49,flats
2772,Women's Comfort Sheepskin Slip On Shallow Mouth Low Heel Pump Shoes,KANGNAI,27.0,flats
2773,REVcraze Skimmer Slip-On Shoes,Cobb Hill,76.97,flats
2774,Women's Han Slipper Mules,Dorateymur,129.0,flats
2775,Women's Cleo-Blitz Ballet Flat,,35.82,flats
2776,Women's Sarina Ballet Flat,,25.49,flats
2777,Women's Rockwell Ballet Flat,,41.47,flats
2778,Shoes8teen Womens Sequin Ballet Flat,Shoes 18,12.99,flats
2779,Womens Classics Black Canvas 001001B07-BLK,TOMS,31.44,flats
2780,Women's Fanciful Ballet Flat,,68.95,flats
2781,Women's Owen Flat,,44.99,flats
2782,Women's Classic Canvas Black Ankle-High Flat Shoe - 7.5M,TOMS,36.99,flats
2783,Women's 10009756 Naturl Metallic Linen Alpargata Flat,TOMS,40.94,flats
2784,Women's Madeline Scrunch Ballet Flat,,34.99,flats
2785,Women's Erica Ballet Flat,,73.61,flats
2786,Women's Rexley Mary Jane Flat,,79.97,flats
2787,Women's Stargazer Ballet Flat,,18.15,flats
2788,Yvonne Fashion Elastic Crossing Ankle Straps Slip On Point Toe Flat Shoes.,Ashley A Collection,19.99,flats
2789,Womens Buckle Faux Patent Strappy Flats,Brinley Co,14.99,flats
2790,Chocolaticas Hippie Women's Mary Jane Flat,Hot Chocolate Design,69.99,flats
2791,Antistress Women's 41730 Slip-On,,54.99,flats
2792,Gem Posey Ballet Flat Taupe 8.5W,Vionic,69.0,flats
2793,Women's Paloma Flat,,79.95,flats
2794,LIBRY Black,Sole Society,49.97,flats
2795,Rain Women's Flats - Pointy Toe Ballet Flat,PIC/PAY,35.4,flats
2796,Indian Ethnic Embroidered Jutti Mojari Ballet Flats Traditional Pink Pump Shoes for Women,Womens flats,34.95,flats
2797,Women's Mallorie Slip-on Flat Ballet,,74.95,flats
2798,Women's Addy Ballet Flat,,11.48,flats
2799,Women's Ashland Glow Flat,,23.99,flats
2800,Women's Striped Tall (90mm) Wedge Sandal,Soludos,38.69,flats
2801,Women's Carol Loafers,,31.57,flats
2802,Women's Bess Dress Pump,,89.95,flats
2803,"Women's Revsavor Flat,",Aravon By New Balance,54.99,flats
2804,Shoes Violet,,79.85,flats
2805,Women's Mali Flat,,15.98,flats
2806,Women's Flat Slip On Suede Leather Yemeni Shoes,Atlantis Handmade,99.99,flats
2807,Women's Marianne Flat,,150.0,flats
2808,Women's Zariel Nubuck,,42.38,flats
2809,Women's Water Shoes Men's Water Footwear Quick-Dry Water Sports Beach Swim Shoes Barefoot Aqua Footwear Black Zip Medium,JOINFREE,9.99,flats
2810,Women's Concert Jazz Ballet Flat,,54.99,flats
2811,Ros Hommerson Women's Cowboy Ballet Flat,,21.28,flats
2812,Women's Verazino Heeled Sandal,,82.99,flats
2813,Women's Mary Jane Buckled Strap Platform Closed Round Toe Wedge,Cambridge Select,14.72,flats
2814,Women's Wilhelmina Ballet Flat,,24.69,flats
2815,Original Classic,TOMS,41.97,flats
2816,Women's Classic Slip-On Closed Round Toe Ballet Flat,Bella Marie,10.65,flats
2817,Women's Hadley Mary Jane Flat,SoftWalk,23.46,flats
2818,Women's MEGS210FLY Mary Jane Flat,,83.25,flats
2819,Women's Buggy Ballet Flat,French Sole FS/NY,105.26,flats
2820,Womens Arianne,,79.5,flats
2821,MW759 Women's Peep Toe Flower Ballet Flat Bridal Shoes Wedding,Wedopus,32.99,flats
2822,Women's Primrose Mary Jane Flat,,154.95,flats
2823,Women's Topeka Flat,SoftWalk,27.77,flats
2824,Women's Raissa Fabric Slipper,,22.47,flats
2825,Women's Mikaela Ballet Flat,,28.0,flats
2826,Women's Torri Ballet Flat,The FLEXX,33.33,flats
2827,Women's Adriatic Mary Jane Flat,,184.0,flats
2828,Women's Felicia Ballet Flat,,40.0,flats
2829,Propet Balance Women's Bilite Walker Mary Jane,,36.0,flats
2830,Women's Solana Ballet Flats-Casual Walking Shoes,,24.98,flats
2831,Womens Faux Leather D'Orsay Pointed Toe Flats,,12.99,flats
2832,Women's Shoe Enamel Patent Slip on Basic Light Comfort Low Hidden Heel Flats,Ollio,14.99,flats
2833,Autumn Shoes for Women Flat Shoes Foldable Female Ballet Flats Soft Casual Ladies Shoes,PRETTYHOMEL,37.99,flats
2834,Women's Closed Round Toe Side Cutout Slip-On Ballet Flat,Cambridge Select,14.36,flats
2835,Women's Slip On Comfy Pointed Toe Ballet Flat,Bella Marie,11.81,flats
2836,Klogs Women's Charleston Clog Leather Buckle,Klogs Footwear,100.0,flats
2837,Women's Charleston Mary Jane Shoe Ruby Tintoretto,Klogs Footwear,109.95,flats
2838,Women's Charleston Mary Jane Shoe Nutmeg Tintoretto,Klogs Footwear,109.95,flats
2839,Crescent Women's Slip On,Auditions,49.99,flats
2840,Crescent N/S Round Toe Leather Mary Janes,Auditions,79.95,flats
2841,"Women's Wmns Flex Adapt TR, R TEAL/WHITE-ANTHRACITE-HYPER TURQUOISE, 10 US",,85.0,flats
2842,Sport Women's Oksie Fabric Ballet Flat,,39.46,flats
2843,Women's Dallas White 11 B(M) US,Jellypop,28.74,flats
2844,Womens Onely,,335.0,flats
2845,Women's Zanza Pointed Toe Flat,,39.99,flats
2846,Womens Ali,Trask,90.99,flats
2847,Women's Bluebell Ballet Flat,French Sole FS/NY,102.07,flats
2848,Women's Bahia Mary Jane,,87.99,flats
2849,Women's Pennington Print Flat,,15.49,flats
2850,Demi-10 Womens Canvas Classic Ballet,Refresh,8.67,flats
2851,Women's Shoe Ballet Basic Light Comfort Round Toe Flat,Ollio,18.99,flats
2852,Women's Sage Ballet Flat,,29.99,flats
2853,Women's Apala Ballet Flat,Marc Fisher,21.7,flats
2854,"Women's Apala Ballet Flat,",Marc Fisher,14.99,flats
2855,Women's Lacuna Jersey Quilt Ballet Flat,,44.99,flats
2856,Women's Shoes Ballet Comfort Glitter Light Pointed Toe Flats,Ollio,16.99,flats
2857,Chocolaticas Nova & Orion Women's Mary Jane Flat,Hot Chocolate Design,69.99,flats
2858,Women's Bikers Skimmer Flat,,28.8,flats
2859,City Classified Women Ballet Flats Mary Jane Shoes Ankle T-Strap Duffel-H,,16.99,flats
2860,Women's Tali Bow Ballet Flat,,81.0,flats
2861,Women's Closed Pointed Toe Slip-On Dome Studded Heel Strap Ballet Flat,Cambridge Select,5.99,flats
2862,Women's Enight Pointed Toe Flat,Topline,10.18,flats
2863,Women's Myla Ballet Flat,ara,30.93,flats
2864,Women's Ambulator Biomechanical,Apex,39.99,flats
2865,Propet Women's Shannon Loafer,,15.63,flats
2866,Women's Casi Tiptap K200449 Ballet Flat,,69.89,flats
2867,Shoes Women's Redbud Pointy Toe Flat Memory Foam,,14.99,flats
2868,Audrey Foldable Ballet Flats With Bow Design Easy Travel,Avanti,27.99,flats
2869,by Chinese Laundry Women's Kicked Out Flat,,27.99,flats
2870,BOBS from Women's Chill Slip-On Flat,,23.36,flats
2871,Women's Slip-On Classic Closed Round Toe Bow Ballet Flat,Cambridge Select,5.99,flats
2872,Demonia By Women's Kera-08 Mary Jane,,54.95,flats
2873,Women's Flower Ballet Flats Outdoor Driving Slip On Moccasins,Mordenmiss,29.99,flats
2874,Propet Women's Dagny Flat,,20.59,flats
2875,Women's Badu Ballet Flat,,20.99,flats
2876,"Women's Right Nina K400123 Ballet Flat,",,150.0,flats
2877,Women's Brighton Ballet Flat,,18.62,flats
2878,Women's Un Hearth Flat,,94.44,flats
2879,"Women's Ulisa Synthetic Ballet Flat,",,64.74,flats
2880,Women's Luisa Ballet Flat,L.K. Bennett,119.99,flats
2881,Women's Norman Ballet Flat,Kate Spade New York,228.0,flats
2882,Jerez Perforated Women's Slip On,,99.99,flats
2883,Chocolaticas Shanthi Women's Mary Jane Flat,Hot Chocolate Design,55.99,flats
2884,"Shoes V9308 Unisex-Adult Vegan Friendly Creepers, Black Velvet Creeper",,74.99,flats
2885,Womens Pointy Toe Flats Comfort Slip On Buckle Plaid Dress Ballet Flat Shoes,Wollanlily,14.99,flats
2886,Women's Lina Shiny Ballet Flat,,23.13,flats
2887,Lola Mules,Comfortview,41.39,flats
2888,Women's Stelli Loafer Flat,Kate Spade New York,133.16,flats
2889,Womens Ellie Closed Toe Ballet Flats,American Rag,24.99,flats
2890,Women's Dockside Penny Loafer,,29.99,flats
2891,Women's Black Trudy Patent Leather Ballet Flats Shoes,,249.99,flats
2892,Women's Total Motion Adelyn Ghillie Ballet Flat,,42.99,flats
2893,Women¡¯s Ballet Flats Elastic Dance Shoes Pointy Toe Cross Strap Yoga Slippers Slip-ONS SN01,ShoBeautiful,17.49,flats
2894,Women's Ogden Mary Jane Flat,,169.98,flats
2895,Women's Paolina Loafer Flat,,24.99,flats
2896,Nashville-2054,,100.0,flats
2897,"Women's Blanchette Ballet Flat,",ALDO,69.95,flats
2898,Women's Shelley Ballet Flat,,14.38,flats
2899,Women's Kristen Loafer,,29.07,flats
2900,Women's Speakup Synthetic Ballet Flat,,21.55,flats
2901,"Womens Lux Camden Wedge (8 B(M) US, Merlot)",Vionic,59.96,flats
2902,Chocolaticas Lemon Women's Mary Jane Flat,Hot Chocolate Design,69.99,flats
2903,Women's Sb-Joy Ballet Flat,Blue by Betsey Johnson,30.99,flats
2904,Women's - Embroidered Slip-ONS,,14.9,flats
2905,Women's Closed Round Toe Slip-On Quilted Ballet Flat,Cambridge Select,5.99,flats
2906,"Women's Pro-Time Elastic Ankle Strap, Back Zip-Fabric Ballet Flat",,26.45,flats
2907,The Diana Flat,Comfortview,45.97,flats
2908,Womens Lux Camden Wedge Black Size 7.5 Wide,Vionic,139.95,flats
2909,Women's Metallic Heel Flats,charlotte olympia,510.0,flats
2910,Women's Pointed Toe Bow Cutout Slip-On Ballet Flat,Cambridge Select,16.07,flats
2911,Women's Cassie 07 Flat,Romika,62.61,flats
2912,Womens Foldable Soft Ballet Flats Comfort Slip on Dance Shoe by,Meeshine,17.99,flats
2913,Women's The Skool Boy Ballet Flat,Katy Perry,128.95,flats
2914,by Hush Puppies Women's Daly Loafer,,22.99,flats
2915,Women's Maple Mary Jane Flat,,67.44,flats
2916,MIA Women's Cecilia Ballet Flat,MIA Amore,10.83,flats
2917,Women's Closed Pointed Toe Crisscross Ballerina Ankle Straps Ballet Flat,Cambridge Select,12.04,flats
2918,Women's Queen Vi Ballet Flat,,49.95,flats
2919,Women's Intrinsic Karma Flat Sporty Lifestyle,,59.57,flats
2920,Womens Julianne,,44.99,flats
2921,Women's Peu Summer Senda 22614 Flat,,71.61,flats
2922,Women's Classic Slip on Leatherette Round Toe Ballet Flat,Bella Marie,7.65,flats
2923,"Women's, Beatrix Flats",B.O.C.,31.47,flats
2924,Women's Pointy Toe Ballerina Ballet Flat,,10.96,flats
2925,Womens Mara Slip-On,,39.99,flats
2926,Women's Cobra Basic Comfort Ballet Flats,Charles Albert,9.95,flats
2927,Women's Classic Slip-On Closed Round Toe Ballet Flat,Cambridge Select,8.09,flats
2928,Women's Closed Pointed Toe D'Orsay Crisscross Strap Ballet Flat,Cambridge Select,17.08,flats
2929,Leila Ballet Flats - Closed Toe Womens Flats - Classic Ballet Flat,LIUID,9.99,flats
2930,"Women's Chaste Ballet Flat,",,27.99,flats
2931,Women's Slip On Casual Satin Ballet Flats Shoes,Chatties,9.99,flats
2932,Women's Livi Heather Ballet Flat,,28.78,flats
2933,"Vinnly Slip On Flats, Medium Blue",,54.99,flats
2934,Women's Drastic 2 Flat,,47.65,flats
2935,BOBS Women's Chill Luxe-Autumn Crush. Canvas Slip on W Memory Foam Ballet Flat,,47.45,flats
2936,Women's Arabella Ballet Flat,,55.0,flats
2937,Women's Row-ing 2 Slip on Skimmer Flat Bow Detail Ballet,,24.99,flats
2938,Women's Jolie Ballet Flat,,182.83,flats
2939,Women's Olivia II Leopard Print W Flat,,20.75,flats
2940,Women's Birdie Flat,,14.71,flats
2941,Womens Retro Mary Jane Slip On Shoes,,19.99,flats
2942,"Women's Renee Ballet Flat,",Splendid,37.99,flats
2943,Women's Lynsey Ballet Flat,,28.0,flats
2944,Women's Kitty Flats,charlotte olympia,415.0,flats
2945,Artisan Felicia Plum,,84.9,flats
2946,Women Object Flats-Shoes,,15.99,flats
2947,Shoes 18 Womens Foldable Ballet Flat Shoes with Draw String Pouch,Shoes8teen,8.99,flats
2948,Sport Women's Beathe Easy Our Song Fashion Sneaker,,49.9,flats
2949,Women's Via Flat,French Sole FS/NY,98.99,flats
2950,Women's N5300 Dolce Ocean/Coral Ballet Flat,El Naturalista,112.99,flats
2951,by MTNG Womens 55387 Cap Toe Flat Shoes,Mustang,39.99,flats
2952,Women's Slingback Abby-14 Vegan Leather Pointed Toe Slingback Fashion Dress Flats Shoes,Pierre Dumas,12.95,flats
2953,Women's Classic Slip-On Closed Round Toe Ballet Flat,Cambridge Select,5.99,flats
2954,"KS35 Ralleigh Studded Ballet Flats, Black",Karen Scott,38.99,flats
2955,Women's Ode Flat,,17.55,flats
2956,Women's Talisman Ballet Flat,French Sole FS/NY,134.99,flats
2957,Women Peacock Sandle Flipflops Punjabi Us Indian Mojari Khussa Jutti,Step n Style,38.95,flats
2958,New Women's Lux Camden Wedge Black Suede 6.5,Vionic,44.99,flats
2959,Women's Fallon Ballet Flat,,49.99,flats
2960,Womens Sienna Embroidery Ballet Flat,,64.5,flats
2961,Womens Mary Jane Neoprene Flats,Pedors,117.8,flats
2962,PANAPANA,,50.95,flats
2963,Chocolaticas Cupid Women's Mary Jane Flat,Hot Chocolate Design,69.99,flats
2964,Womens Astrella,,44.99,flats
2965,Women's Anastasia Ballet Flat,,23.5,flats
2966,Women's Evana Ballet Flat,,30.81,flats
2967,Women's Marian Ballet Flat,Avec Les Filles,40.99,flats
2968,Womens 84.167,Gabor,90.99,flats
