,product_name,seller,price,category
0,"BOBS Women's Plush - Peace and Love,",,18.82,flats
1,Womens Classics Black/Black Canvas 10002472,TOMS,30.0,flats
2,Women's Classics,TOMS,21.99,flats
3,Dana-20 Women's Classic Ballerina Flats Elastic Crossing Straps,ANNA,1.99,flats
4,Classic Women's Shoes,TOMS,19.99,flats
5,Women's Lucky Emmie Ballet Flat,,15.74,flats
6,Seasonal Classics Women's Slip on Shoes,TOMS,17.81,flats
7,Men's Classic Canvas Slip-On,TOMS,19.99,flats
8,Shoes Women's Tracer Slip On White Sole Shoes,,11.02,flats
9,Gem Posey Ballet Flat Black 5M,Vionic,94.95,flats
10,Women's Rest BellaII Toepost Sandal,Vionic,37.99,flats
11,Women's Microburst One up Fashion Sneaker,,29.95,flats
12,"Women's Sillian Bella Mary Jane Flat,",,24.9,flats
13,Unisex Crocband Clog,,15.99,flats
14,Performance Women's Go Step Challenge Walking Shoe,,29.95,flats
15,Women's Kadee Flat,,18.99,flats
16,Women's Windham Slip-On Flat,,19.99,flats
17,Women's Spark Minna Ballet Flat,Vionic,29.99,flats
18,Sport Women's Breathe Easy Lovestory Mary Jane Flat,,38.58,flats
19,Women's Classic Renaissance Sneaker,,45.72,flats
20,Women's Donna Hemp Flat,,32.97,flats
21,BOBS from Women's Plush Fashion Slip-On Flat,,20.79,flats
22,Women's Cheyn Madi Loafer,,29.99,flats
23,Women's Keli Professional Shoe,,34.99,flats
24,Women's Wildflower Too Mary Jane Flat,,13.81,flats
25,Women's Chaste Ballet Flat Lambskin Loafers Casual Ladies Shoes Leather,Xielong,12.99,flats
26,Women's Sole-Fina Solid Plain Ballet Flats Shoes,DREAM PAIRS,13.99,flats
27,Women's Marley Sneaker,,23.45,flats
28,Shoes 18 Womens Classic Round Toe Ballerina Ballet Flat Shoes,Shoes8teen,6.99,flats
29,Angie-28 Women's Classic Pointy Toe Ballet Flat Shoes,Bella Marie,9.0,flats
30,Angie-53 Women's Classic Pointy Toe Ballet Slip On Flats Shoes,Bella Marie,9.0,flats
31,Women's Paloma Flat,,34.95,flats
32,Women's Chaste Ballet Flat,,31.96,flats
33,unisex-adult 8053 5 Eye Padded Collar Boot,,59.19,flats
34,Women's Pair O Dice Flat,,11.08,flats
35,BOBS from Women's Highlights Flexpadrille Wedge,,19.95,flats
36,Women's Isabella Jelly Flat,,13.2,flats
37,Performance Women's Go Step Lite-Solace Walking Shoe,,19.99,flats
38,Women's Bikers -Fiesta Mary Jane Flat,,26.05,flats
39,Sole Classic Fancy Women's Casual Pointed Toe Ballet Comfort Soft Slip On Flats Shoes,DREAM PAIRS,10.99,flats
40,Old Skool Unisex Adults' Low-Top Trainers,,28.98,flats
41,Women's Lina Ballet Flat,,16.97,flats
42,Kimmy-21 Women's Round Toe Pierced Mid Heel Mary Jane Style Dress Pumps,Chase & Chloe,17.89,flats
43,Women's Cleo Bewitch Ballet Flat,,32.97,flats
44,BOBS from Women's Chill Luxe Flat,,21.66,flats
45,Women's Sole_Vogue Flats Shoes,DREAM PAIRS,17.99,flats
46,Women's Fawna Mary Jane Flat,,77.89,flats
47,BOBS Women's Plush-Wag Party Flat,,25.49,flats
48,BOBS Women's Plush-Wag Party Flat,,25.49,flats
49,Sport Women's EZ Flex Flighty Majesty Slip-on Flat,,15.51,flats
50,Women's Wide Width Flat Shoes - Comfortable Slip On Round Toe Ballet Flats,Luoika,26.99,flats
51,Women's Sole-Flex Ballerina Walking Flats Shoes,DREAM PAIRS,12.99,flats
52,Women's Fiesta Flat,Flojos,16.86,flats
53,Women's Foldable Portable Travel Ballet Flat Roll Up Slipper Shoes,Silky Toes,9.99,flats
54,"Kids' 10009918 Alpargata - K,",TOMS,13.99,flats
55,Women's Felicia Ballet Flat,,34.99,flats
56,Women's Claire Scrunch Flat,dexflex Comfort,29.99,flats
57,Women's Bird Nest Jelly Ballet Flats (up to 50% Off),Kunsto,9.99,flats
58,Women's Classic II Penny Loafer,,41.59,flats
59,Women's Diamond Jutti Pointed Toe Flat,TOMS,49.35,flats
60,Propet Women's TravelActiv Mary Jane Fashion Sneaker,,16.8,flats
61,New Balance Women's W840V3 Running Shoe,,64.99,flats
62,Dr. Scholl's Women's Really Flat,Dr. Scholl's Shoes,32.99,flats
63,Dr. Scholl's Women's Sand Patent Flat Shoes - 9 C/D US,Dr. Scholl's Shoes,65.0,flats
64,Dr. Scholl's Women's Black Patent Flat Shoes - 9 C/D US,Dr. Scholl's Shoes,39.95,flats
65,Women's Rodney Ballet Flat,,30.02,flats
66,"Women's Kinzie Light Loafer Flat,",,29.98,flats
67,Women's Citilane Roka Court Sneaker,,21.32,flats
68,"Women's Keesha Rosa Dress Pump,",,33.1,flats
69,Womens Ennore,,34.99,flats
70,Women's Angel II Pump,,12.47,flats
71,Women's Cally Faux Fur Slipper,,36.95,flats
72,Women's Wide Width Flat Shoes - Comfortable Slip On Round Toe Ballet Flats,Luoika,19.99,flats
73,Women's Knotted Front Canvas Round Toe Ballet Flats,Charles Albert,9.88,flats
74,Women's Knotted Front Loafer Leather Round Toe Ballet Flats,Charles Albert,13.88,flats
75,Ultimate 81 Fashion Sneaker,,28.01,flats
76,Women's Go Walk Lite Ballet Flat,,13.07,flats
77,Women's Mandalaye Ballet Flat,,22.93,flats
78,Womens D'Orsay Pointy Toe Ankle Strap Buckle Comfort Ballerina Ballet Flats Shoes,Meeshine,19.99,flats
79,Womens Pehuea Slip on,,47.98,flats
80,Women's Kilty Suede Moccasin,,29.99,flats
81,Women's Blanche West Flat,,43.77,flats
82,BOBS Women's Bobs Plush-Dream Doodle Ballet Flat,,19.99,flats
83,Women's Reggae Fest Willows Flat,,31.99,flats
84,Women's Shoes Faux Suede Slip on Comfort Light Pointed Toe Ballet Flat,Ollio,24.99,flats
85,Women's Swiftwater Wave Sandal,,16.0,flats
86,Women's Bocca Loafer,,34.38,flats
87,Womens Foldable Soft Pointed Toe Ballet Flats Rhinestone Comfort Slip on Flat Shoes,Meeshine,15.99,flats
88,Women Ballet Flats Classy Girls Simple Casual Slip-on Comfort Walking Shoes from Merence,,14.91,flats
89,"Women Ballet Flats Classy Girls Simple Casual Slip-on Comfort Walking Shoes,VPDA1，BlackPu,234",,21.99,flats
90,UGG Men's Scuff Slipper,SoftWalk,79.95,flats
91,Women's Spark Caroll Ballet Flat,Vionic,99.89,flats
92,Women's Abigail Ballet Flat,,17.79,flats
93,Shoes 18 Women's Foldable Portable Travel Ballet Flat Shoes w/Matching Carrying Case,Shoes8teen,8.99,flats
94,Women's Brittany Ballet Flat,,29.93,flats
95,Women's Tali Bow Ballet Flat,,63.0,flats
96,"Women's, Kristen Slip on Flats",,114.95,flats
97,Performance Women's On-The-Go Flagship Slip-On Boat Shoe,,18.88,flats
98,Women's Wide Width Flat Shoes - Comfortable Slip On Round Toe Ballet Flats,Luoika,19.99,flats
99,Women's KSO Evo Cross Training Shoe,,42.95,flats
100,Women's Samara 2.0 Ballet Flat,,44.68,flats
101,Women's Ballet Comfort Light Faux Suede Multi Color Shoe Flat,Ollio,24.99,flats
102,Dr. Scholl's Women's Friendly Ballet Flat,Dr. Scholl's Shoes,24.99,flats
103,Women's Keesha Luca Slip-On Loafer,,39.98,flats
104,Women's Sole_Stretchy Fashion Elastic Ankle Straps Flats Shoes,DREAM PAIRS,15.99,flats
105,Women's Sole-Strappy Ankle Straps Flats Shoes,DREAM PAIRS,11.99,flats
106,Women's Florence Ballet Flat,,48.24,flats
107,Women's Hazel Flat,,49.95,flats
108,Women's Sienna MJ Canvas Shoe,,49.96,flats
109,Women's Sole_Elle Fashion Low Stacked Slip On Flats Shoes,DREAM PAIRS,15.99,flats
110,"Women's Jutti Ballet Flat,",TOMS,84.95,flats
111,Dr. Scholl's Women's Frankie Ballet Flat,Dr. Scholl's Shoes,24.95,flats
112,Women's Mandayss Ballet Flat,,13.58,flats
113,Women's Caroline String Tie Flat,dexflex Comfort,24.99,flats
114,Women's Jocolin Vista Boat Shoe,,39.97,flats
115,Women's Wide Width Ballet Flat - Comfortable Sandals Slip On Pointed Toe Summer Casual Shoes.,Aukusor,27.99,flats
116,Women's Loralie Mary Jane Flat,,104.24,flats
117,Women Shoes Cut Out Slip On Synthetic Lace Ballet Flats,Greatonu,13.99,flats
118,Women's Jessica Flat,,64.99,flats
119,Women's Pierina Ballet Flats,,11.99,flats
120,Flats Shoes Women– Slip-on Ballet Comfort Walking Classic Round Toe Shoes,CINAK,17.99,flats
121,Women's Aliza Flat,,14.99,flats
122,Women's Dories Flats Shoes Low Wedge Heel Peep Toe,DREAM PAIRS,10.99,flats
123,Women's P-Heaven,,14.92,flats
124,Womens Foldable Bow Slip On Ballet Flats Dress Shoes,Meeshine,17.99,flats
125,Women's Sole-Nice Ankle Strap Walking Flats Shoes,DREAM PAIRS,13.99,flats
126,Lucky Women's Emmie Ballet Flat,,17.63,flats
127,Women's Neenah Garden Ballet Flat,,24.9,flats
128,Women's Sb-Leah Ballet Flat,Blue by Betsey Johnson,26.7,flats
129,Women's Dream Slip-On,Airwalk,24.99,flats
130,Women's Carson Ballet Flat,,51.53,flats
131,"Thea Women Ballet Flat,",,20.93,flats
132,Women's Dig Flat,,21.0,flats
133,Women's Gracelin Mara Flat,,41.99,flats
134,Women's Ballet Shoe Cute Casual Comfort Flat,Ollio,24.99,flats
135,Women's Kadee Slingback Flat,,20.62,flats
136,BOBS Women's Plush-Peace and Love Ballet Flat,,23.27,flats
137,Women's Pointy Toe Flats D'Orsay Buckle Ankle Strap Casual Comfort Ballerina Ballet Flat Shoes,,13.99,flats
138,Women's Vega Mesh Ballet Flat,,29.06,flats
139,Women's Missy Mary Jane Flat,,84.82,flats
140,Women's Ballet Shoe Floral Lace Breathable Flat,Ollio,25.99,flats
141,Footwear Indoor Slipper Yoga Sock Shoes Comfort Water Shoes for Men Women,VIFUUR,6.99,flats
142,Laurel Womens Pointed Toe Ankle Wrap D'Orsay Dress Flats,Mila Lady,17.44,flats
143,Women's Champion Original Leather Slip-On Sneaker,,22.99,flats
144,Women Flat Shoes Comfortable Slip On Pointed Toe Ballet Flats,Dear Time,7.97,flats
145,Women Flat Shoes Comfortable Slip on Pointed Toe Ballet Flats US 4,Dear Time,7.97,flats
146,Womens Water Shoes House Office Shoes Mens Quick Drying Barefoot Footwear Aqua Sock,Centipede Demon,7.99,flats
147,Women's Wide Width Flat Shoes - Elastic Cross Straps Slip On Round Toe Ballet Flats.,Luoika,29.99,flats
148,Women's Wildflower Mary Jane Flat,,28.0,flats
149,BOBS from Women's Luxe Fashion Slip-On Flat,,23.98,flats
150,Women's Blossom Encore Mary Jane Flat,,39.97,flats
151,Womens Shoe Ballet Light Faux Suede Low Heels Flat,Ollio,24.99,flats
152,"Women's Cleo - Ray of Sunshine - Engineered Knit Skimmer Ballet Flat,",,39.99,flats
153,Women's Everlay Kennon Mary Jane Flat,,45.68,flats
154,Women's Samantha Pointed Toe Flat,,37.31,flats
155,"Women's, Samantha Flats",,79.95,flats
156,Women's Samantha Black Lthrsuede W,,67.84,flats
157,Chase and Chloe Kimmy-21 Mary Jane Teardrop Cutout T-Strap Pump Heel,Chase & Chloe,9.99,flats
158,Women's Bluma Slip On Ballerina Flat,,41.27,flats
159,Women's Bellarina Shoes Half Toe Grip Non-Slip for Ballet Yoga Pilates Barre,Barerun,12.99,flats
160,"Women's Aria Closed, Round Toe Ballet Flat Slip On Shoes",,12.99,flats
161,Women's Revona Low Wedge Ankle Strap Flats Shoes,DREAM PAIRS,12.99,flats
162,"Women's Naree3 Ballet Flat,",,25.3,flats
163,Chocolaticas Notebook Women's Mary Jane Flat,Hot Chocolate Design,48.99,flats
164,Women's Wildflower Encore Mary Jane Flat,,22.48,flats
165,Women's CloudSteppers Sillian Jetay Flat,,17.69,flats
166,Women's Danelly Adira Ballet Flat,,59.78,flats
167,Studded Strappy Ballerina Leather Flats,Kaitlyn Pan,109.0,flats
168,"Women's Gracelin Lola Ballet Flat,",,49.95,flats
169,Women's Belle Mary Jane Flat,,36.49,flats
170,Womens Classic Pointy Toe Ballet Slip On - Casual Comfortable Flats,Guilty Shoes,6.99,flats
171,Women's Jilian Low Wedge Flats Shoes,DREAM PAIRS,12.99,flats
172,Women's Close Round Toe Low Wedge Glitter Rhinestone Comfort,OLIVIA K,17.99,flats
173,Women's Diverse Flat,,14.99,flats
174,Unstructured Women's Un.Loop Slip-On Shoe,,36.9,flats
175,Chocolaticas Habana Women's Mary Jane Flat,Hot Chocolate Design,48.99,flats
176,Women's Giorgie Flat,Dr. Scholl's Shoes,15.76,flats
177,Women's Flurry Moc,Airwalk,29.99,flats
178,Women's Ballet Flat D'Orsay Comfort Light Pointed Toe Slip On Casual Shoes,ShoBeautiful,14.79,flats
179,Womens Square Toe Bowknot Ballet Comfort Slip on Flats Shoes,Meeshine,15.99,flats
180,"Women's Riley Pointed Toe, D'Orsay Open Side Flat",,19.99,flats
181,Women’s Eve Slingback Ballet Flat,,19.38,flats
182,Flapointed Women's Casual D'Orsay Pointed Plain Ballet Comfort Soft Slip On Flats Shoes New,DREAM PAIRS,12.99,flats
183,Women's Core Canvas Classics,TOMS,38.38,flats
184,Women's Sole-Fina-Straps Ankle Straps Ballet Flats Shoes,DREAM PAIRS,11.04,flats
185,Women's Fiona Flat,,29.96,flats
186,"Women's Fiona Flat (6 B(M) US, Natural 2)",,69.95,flats
187,Women's Hazel Dress Pump,,39.99,flats
188,Foldable Travel Portable Flat Comfort Shoes with Pouch,Silky Toes,12.99,flats
189,Women's Microburst Topnotch Sneaker,,34.27,flats
190,Women's Mugara Ballet Flat,,22.95,flats
191,Women's Cotton Mary Jane Shoes Ballerina Ballet Flats Shoes,Easy USA,7.99,flats
192,H95 Women's Uberknit™ Slip-On Ballerinas,,53.86,flats
193,Women's Bree Pleated Flat,Lower East Side,24.99,flats
194,Womens Odette,,47.99,flats
195,Womens Chelsea Cap Toe Slide Flats,,39.99,flats
196,Forever Women's Diana-81 Ballet Loafer-Flats Shoes,Forever Link,12.98,flats
197,Women's Wide Casual Flat Shoes - Comfortable Classic Pointy Toe Slip On Basic Ballet Flat.,Aukusor,29.99,flats
198,Women's Emmie Ballet Flat,,19.95,flats
199,Women's Medora Nina Flat,,30.4,flats
200,Women's Shoes Faux Suede Comfort Ballet Flat,Ollio,24.99,flats
201,BOBS Women's Plush-Peace and Love Flat,,19.22,flats
202,Women's Flair Pump,,33.28,flats
203,Spark Surin Ballet Flat,Vionic,25.0,flats
204,Women's Sole-Shine Rhinestone Ballet Flats Shoes,DREAM PAIRS,12.99,flats
205,BOBS Women's Bobs Plush-Cat Attack Flat,,29.99,flats
206,Women's Edition Leather Ballet Flat,,20.98,flats
207,"BOBS Women's Plush - Studious Cats Ballet Flat,",,33.43,flats
208,Women's Sandra Wedge Pump,,76.05,flats
209,Propet Women's Mary Jane,,31.97,flats
210,Women's Sole Simple Ballerina Walking Flats Shoes,DREAM PAIRS,15.99,flats
211,BOBS Women's Luxe Bobs-Big Dreamer Flat,,30.79,flats
212,Women's Neenah Vine Ballet Flat,,42.75,flats
213,"BOBS Women's Plush - Breeds Ballet Flat,",,28.76,flats
214,Women's Donna Distressed Flat,,39.95,flats
215,Womens BALLET Flats Slip On Shoes Ballerina Slippers,,4.44,flats
216,Women's Melon Flat,,31.96,flats
217,Women's Everlay Uma Platform,,44.95,flats
218,Womens Classic Pointy Toe Ballet Flats Slip On Plaid Dress Flat Shoes,Meeshine,9.99,flats
219,Women's Cleo-Sherlock-Engineered Knit Loafer Skimmer Ballet Flat,,25.05,flats
220,Women's Kelli Ballet Flat,,19.99,flats
221,Shoes 18 Womens Cotton China Doll Mary Jane Shoes Ballerina Ballet Flats Shoes,Shoes8teen,10.99,flats
222,Women's 8065 Mary Jane,,70.45,flats
223,Womens D'Orsay Almond Pointed Toe Slip On Casual Flats,Guilty Heart,12.99,flats
224,Women's Seasonal Classics Flat,TOMS,18.0,flats
225,Women's Giorgie Ballet Flat,Dr. Scholl's Shoes,29.96,flats
226,Women's Lina Embellished Dorsay Ballet Flat,,18.0,flats
227,Women's Louise Oxford,,67.21,flats
228,Kourtney Women's Slip On,,62.99,flats
229,"Women's Rumbler Wave - Filigree - Laser-Cut Strap Mary Jane Wedge Pump,",,49.99,flats
230,Women's Janey Mae Oxford,,49.95,flats
231,"Women's Zerogrand Ballet Ii Flat,",,55.99,flats
232,Women's Blossom Vegan Mary Jane Flat,,30.47,flats
233,Women Cute Slip-On Ballet Shoes Soft Solid Classic Pointed Toe Flats by,Stunner,9.99,flats
234,Mio Marino D'Orsay Pointed Toe Flats - Womens Ankle Strap Dress Shoes - Quick Release Buckle,,34.99,flats
235,Latte Women's Casual Solid Plain Ballet Comfort Soft Slip On Flats Shoes,DREAM PAIRS,15.72,flats
236,Womens Flats Jersey Soft Faux Vegan Leather Comfortable Basic Canvas Slip On Ballet Shoes Dress Shoes,Shop Pretty Girl,9.99,flats
237,Women's Cleo-Wham Ballet Flat,,27.99,flats
238,Women's Busy Day Stretch Asymmetrical Wedge,,40.41,flats
239,Guilty Heart | Womens Classic Comfortable Round Toe Slip On Ballet Everyday Flats,Guilty Shoes,6.99,flats
240,"Women's Catniss,",,19.98,flats
241,Women's Lulia Wedge Pump,,27.92,flats
242,Women's Velvet Mary Jane Shoes Ballerina Ballet Flats Yoga Exercise Dance Shoes,pestor,12.99,flats
243,Rockport Women's Petra Mary Jane Flat,Cobb Hill,64.95,flats
244,"Rockport Women's Petra Mary Jane Flat, Bordeaux, 8 W US",Cobb Hill,99.95,flats
245,"Rockport Women's Petra Mary Jane Flat, Bordeaux, 6.5 M US",Cobb Hill,99.95,flats
246,Womens Adette,,34.99,flats
247,Women's Cleo-Dots-Scalloped Collar Engineered Knit Skimmer Ballet Flat,,28.44,flats
248,Women's Shoes Faux Suede Decorative Flower Slip On Comfort Light Ballet Flat,Ollio,26.99,flats
249,Women's Seville Professional Shoe,,104.95,flats
250,Women's Bridget Flat,,34.37,flats
251,Women's Comfort Leather Ballet Flats Shoes,Kunsto,16.99,flats
252,"BOBS Women's Plush - Cartoons Forever Ballet Flat,",,23.56,flats
253,Floral Flats Shoes for Women Classic Black Walking Comfortable Slip On Ballet Casual Round Toe Flats,CINAK,15.99,flats
254,Women's Girly Ballet Flat,NATURAL SOUL,22.99,flats
255,Women's Ella Basic Closed Pointed Toe Ballet Flat Slip On Shoe,,12.99,flats
256,BOBS Women's Plush-Clear View Ballet Flat,,19.99,flats
257,Walking Flats Women's Shoes Black Comfortable Ballet Soles Simple Ballerina Flats,CINAK,15.99,flats
258,Women's Closed Toe Elastic Side White Rubber Sole Loafer Slip On,MVE Shoes,5.75,flats
259,Womens Flats Casual Comfortable and Chic Canvas Flat Detachable Ankle Strap Shoe Ballet Flat,Shop Pretty Girl,8.99,flats
260,Sport Women's EZ Flex Sweetpea Slip-On Flat,,34.95,flats
261,Unisex Checkerboard Slip-On Black/Off White Check VN000EYEBWW Skate Shoes,,48.43,flats
262,Women's Penfield Zip Flat,Cobb Hill,23.97,flats
263,Women's Jocolin Myla Flat,,22.95,flats
264,Womens Delilah Flat Shoe,Vionic,119.95,flats
265,"Women Delilah Ballet Flat, Navy, 6.5 M US",Vionic,119.95,flats
266,Women's Spin Cycle Ballet Flat,,35.46,flats
267,Women's Busy Day Strappy Flat,,54.95,flats
268,Women's Cleo Sass Ballet Flat,,44.99,flats
269,Women's Samara 2.0 Ballet Flat,,77.25,flats
270,Women's Friendly2 Ballet Flat,Dr. Scholl's Shoes,15.61,flats
271,Womens Faux Suede Loafer Smoking Shoes Flats 3 Colors,Shoes8teen,7.99,flats
272,Pointed Toe Studded Ballerina Leather Flats,Kaitlyn Pan,99.99,flats
273,Womens Shoe Lace Ballet Breathable Flat,Ollio,24.99,flats
274,Women's Cleo Sincere Ballet Flat,,32.76,flats
275,Women's Leather/Suede Foldable Sandals Shoes,ABUSA,19.99,flats
276,Women's Josie Mary Jane Flat,,100.99,flats
277,Comfortable Basic Shoes Women Ballet Flat Round Toe Gel Insole Kreme,,12.99,flats
278,Women's Liah Dress Pump,,66.94,flats
279,"Amber Womens Comfortable Memory Foam Work Shoe,Dressy Ballet Flat,Business Casual Office Shoes for Women",,39.99,flats
280,Women's Go Walk Lite-15395 Ballet Flat,,42.49,flats
281,Women's Cleo-Wham Ballet Flat,,26.61,flats
282,Women's Alice Work Flat,,23.55,flats
283,Women's Classic Pointy Toe Ballet Flat Shoes,Bella Marie,5.99,flats
284,Women's Waterproof Ballet Flat,,27.82,flats
285,Stacy-12 Women's Round Toe Slip On Ballet Flat Shoes,Bella Marie,4.18,flats
286,BOBS from Women's Pureflex Supastar Flat,,26.46,flats
287,Women's Breathable Crochet Lace Ballet Flat,Charles Albert,17.95,flats
288,Women’s Ballerina Flats Side Slingback Casual Round Toe Comfort Shoes,CALICO KIKI,16.99,flats
289,Women's Gem Wedge Pump,,32.48,flats
290,"Women's WOOLWICH Mary Jane Flat,",,43.88,flats
291,Womens Free TR 8 Running Shoes,,88.25,flats
292,"Anabel Women Comfort Flats - Memory Foam Insole, Flex A Lite Outsole",Harborsides,18.99,flats
293,Women's Cherry Blossom Mary Jane Flat,,49.95,flats
294,Women's Rest Joan Mule,Vionic,39.99,flats
295,Angie-52 Women's Classic Pointy Toe Ballet PU Slip on Flats,Bella Marie,6.83,flats
296,Women's Marcie Mary Jane Flat,,19.99,flats
297,BOBS from Women's Plush Lite-Be Cool Flat,,25.49,flats
298,Women's Betunia Loafer,,10.35,flats
299,Women's Laura Flat,,16.38,flats
300,Women's Wide Ballet Flat Shoes - Sandals T-Strap Comfort Light Pointed Toe Slip on Casual Summer Shoes,Aukusor,19.99,flats
301,Women's Ballet Shoe Comfort Basic Light Multi Color Flat,Ollio,24.99,flats
302,"Gwen Women Comfort Flats, Memory Foam Insole, Flex A Lite Outsole",Harborsides,18.99,flats
303,Women's Lucy Flat,Blue by Betsey Johnson,66.92,flats
304,Women's Flats Comfortable Walking Driving Breath Pointed Ballerina Black Perforated Shoes,CINAK,15.99,flats
305,Women's Sole_Silky Low Stacked Ankle Straps Flats Shoes,DREAM PAIRS,15.99,flats
306,Women's Canvas Slip-On,TOMS,30.0,flats
307,Women Ballet Flats Pointed Toe Slip On Closed Toe Shoes,SOBEYO,22.95,flats
308,Simple Women's Slip On Leather Loafer,SAS,59.49,flats
309,Women's Sela Mule,,29.99,flats
310,Women's Classic Rivets Pointy Toe Slip On Comfort Flats Dress Pumps Shoes,CAMSSOO,50.99,flats
311,Women's Camdyn Platform,Circus by Sam Edelman,25.99,flats
312,Womens Foldable Ballet Flats,Talaria Flats,38.0,flats
313,"Women's Cleo - Bam - Engineered Knit Skimmer Ballet Flat,",,50.0,flats
314,Women's Halle Flat,,49.99,flats
315,Women's Gigi Pointed Toe Flat,,102.99,flats
316,Women's Newport,,49.36,flats
317,Women's Total Motion 20mm Bow Ballet,,27.98,flats
318,Alaska1 Layered Lines Jelly Ballet Flats Clear 10 B(M) US,Major-Q,15.97,flats
319,Womens Chelsea,,44.99,flats
320,CLIFFS BY WHITE MOUNTAIN Cliffs HILT Women's Flat,,14.98,flats
321,"Cliffs 'HILT' Women's Flat, Black - 9.5 M",CLIFFS BY WHITE MOUNTAIN,17.49,flats
322,Guilty Heart | Womens Elastic Straps Shoe | Stretchy Comfortable Ballerina Ballet Flats,Guilty Shoes,6.99,flats
323,Womens Linette,,69.98,flats
324,Comfort Plus by Women's Geanette Mary Jane,Predictions,34.99,flats
325,Women's Sneakers Slip-on Walking Memory Foam Shoes,,16.99,flats
326,Women's Ayla Low Ballet Flat,,57.04,flats
327,Women's Slip On By Ballet Flat,,20.99,flats
328,Women's Catwalk Flat,,32.74,flats
329,Womens Faux Leather D'Orsay Pointed Toe Flats,,9.99,flats
330,Women's Haven Mary Jane Flat,,43.01,flats
331,Women's Kadee Graphic Ballet Flat,,20.33,flats
332,BOBS Women's Plush-Go Fetch Ballet Flat,,33.99,flats
333,Women's Vega Mesh Ballet Flat,,21.54,flats
334,DEMI-07 Women's Glitter Shinny Ballerina Ballet Slip On Flats,Refresh,6.99,flats
335,Women's Liz Loafer,,30.44,flats
336,Women's Hazel Pump,,39.99,flats
337,Women's Cleo-Wham Ballet Flat,,27.89,flats
338,Womens Sandals Flat Jelly Shoes Slip On Hollow Out Loafers,Domucos,9.99,flats
339,Womens D'Orsay Pointy Toe Ankle Strap Wrap Ballet Flats Lace Up Flat Shoes,Meeshine,20.99,flats
340,Women's Genuine Leather Comfort Glove Shoes Ballet Flat(up to 55% Off),Kunsto,23.99,flats
341,Women's Slip-Resistant Dani Mary Jane Pump,safeTstep,34.99,flats
342,Women's Tad Wedge Pump,,33.99,flats
343,BOBS Women's Bobs Plush-Dream Doodle Ballet Flat,,31.96,flats
344,Women's Shoe Collar Shoe Pull Tab Comfort Ballet Flat,Ollio,24.99,flats
345,Women's Pristine Mary Jane Flat,,30.74,flats
346,"BOBS Women's Plush - Posh Pup Flat,",,25.49,flats
347,Women's Farrow Wedge Pump,,18.0,flats
348,Women's Madison Ballet Flat,,12.09,flats
349,Women's Shelborne Slip-On Flat,,23.46,flats
350,"BOBS Women's Highlights - Ocean Spell Ballet Flat,",,29.99,flats
351,Women's Ballet Flat,,16.97,flats
352,Women's Bear's Hug Travel Canvas Slip-on Shoe Grayish-Green,UIN,59.99,flats
353,Women's Bikers-Witty Knit Ballet Flat,,21.99,flats
354,Women's Comfortable Bow Point Toe Flat Pumps Slip On Shoes,Meeshine,18.99,flats
355,Purse Pals Foldable Travel Ballet Flats for Women with Compact Carrying Tote Bag,,10.04,flats
356,A2 Women's in Between Ballet Flat,,25.99,flats
357,Women's Jaye Flat,,19.74,flats
358,Women's Shoes Velvet Faux Suede Mary Jane Ballet Flat,Ollio,26.99,flats
359,Women's Kadee Minnie Mouse Slingback,,20.34,flats
360,Women's Corey Hardware Flat,dexflex Comfort,34.99,flats
361,Women's Jenna Flat,,62.99,flats
362,Comfortable Classic Flats Women's Shoes Black Walking Ballet Elastic Crossing Straps,CINAK,15.99,flats
363,Women's Julianne,,44.99,flats
364,Women's Cuddly Mary Jane Flat,,39.8,flats
365,Women's Edition Fabric Ballet Flat,,12.95,flats
366,Women's Slip On Comfortable Pointy Closed Toe Shoe | Ankle Strap Dorsay Ballet Flat,Guilty Heart,9.99,flats
367,Women's Right Nina 21595 Ballet Flat,,79.95,flats
368,Women's Eve Ballet Flat,,22.99,flats
369,Women's Aria Mary Jane Flat,,30.62,flats
370,Women's Fulton Moccasin,MICHAEL Michael Kors,84.99,flats
371,Women's Cobb Hill Janet Wedge Pump,,44.99,flats
372,Women's Oalise Ballet Flat,,52.73,flats
373,Women's Chrissy Driving Moc,dexflex Comfort,29.99,flats
374,Women's Dea Slingback Pump,,28.34,flats
375,Women's Regina Ballet Flat,,59.95,flats
376,Women's Meree Madrine Mary Jane Flat,,33.7,flats
377,Women's Audrey Mary Jane Flat,,47.99,flats
378,Women's Memories Ballet Flat,,12.99,flats
379,Women's Shoe Ballet Basic Light Comfort Low Heel Flat,Ollio,24.99,flats
380,Women's Dari Flat,,14.96,flats
381,Women's Lisanne Ballet Flat,,57.99,flats
382,Nova Utopia Women's Mary Jane Style Ballet Flats,Nova Footwear,9.99,flats
383,Womens Classic Pointy Toe Ballet Flats Slip On Suede Flat Shoes,Meeshine,14.99,flats
384,Women's Shoe Ballet Faux Suede Flat,Ollio,24.99,flats
385,Womens Kaleesi,,34.99,flats
386,Women's Starship Nubuck D'Orsay Flat,,39.0,flats
387,BOBS from Women's Plush Lite Custom Built Flat,,24.99,flats
388,Fashion Lace up Ankle Straps Pointed Toe Ballet Flat Shoes with Comfortable Padded Insole,Mila Lady,16.99,flats
389,"Women's Dee Ballet Flat,",,14.75,flats
390,Peony Womens Ballet Flats Elastic Ankle Strap Shoes Slip On Loafers,,11.99,flats
391,"Women's Bikers-Provocative Laced Upper Detail, a Relaxed Fit Mary Jane Flat",,33.8,flats
392,Proven Pain Relief Orthopedic Diabetic Chelsea Womens Slip On Shoes,Orthofeet,129.95,flats
393,Women's Emma-Ch,Cobb Hill,33.57,flats
394,Women's Bikers-Step-up Mary Jane Slip-On Flat No Memory Foam,,35.53,flats
395,"Propet TravelFit Flex Ballet Flat,",,20.62,flats
396,Women's Faux Suede Comfort Slip-on Penny Loafer Flat Shoes,Greatonu,23.99,flats
397,Women's Edition Ballet Flat,,32.69,flats
398,Women's Knotted Pattern Round Toe Ballet Flats,Charles Albert,13.88,flats
399,Women's Paloma,,77.29,flats
400,"Women's Chaste Ballet Flat,",,25.16,flats
401,Women's Bird Nest Layered Lines Jelly Ballet Flats,Sketo,9.99,flats
402,Women's Sillian Holly Flat,,16.99,flats
403,Women's Shoe Ballet Basic Pointed Toe Comfort Enamel Flat,Ollio,24.99,flats
404,Womens Taylor Ballet Flat,Oka-B,25.32,flats
405,Women's Speakup Ballet Flat,,32.93,flats
406,Women's Blakely Flat,,34.99,flats
407,Women's Pippa 07 Flat,Josef Seibel,80.5,flats
408,"Malorie Womens Comfortable Memory Foam Ballet Flat Shoe,Work Comfort Dress Flats Low Wedge Pump for Women",,19.99,flats
409,Women's Gilly Flat,,42.29,flats
410,Women's Audriana Ballet Flat,,39.99,flats
